2011-02-01,"Shijiazhuang Wulong Brake reseraches, develops, manufactures, and distributes electromagnetic brakes for elevators and lifting equipment.",Shijiazhuang Wulong Brake,https://www.crunchbase.com/organization/shijiazhuang-wulong-brake,"Industrial Manufacturing, Machinery Manufacturing, Mechanical Engineering","Shijiazhuang, Hebei, China, Asia",Venture Round - Shijiazhuang Wulong Brake,https://www.crunchbase.com/funding_round/shijiazhuang-wulong-brake-series-unknown--7309523b,1,Hebei Technology Investment Group,,,Venture - Series Unknown,1,,,,,,,,,,Yes,,,,,,"378,088"
2011-09-25,"Zonerich is a manufacturer of POS terminals, mini thermal printers, and electronic cash registers.",Zonerich,https://www.crunchbase.com/organization/zonerich,"Hardware, Manufacturing, Point of Sale","Guangzhou, Guangdong, China, Asia",Angel Round - Zonerich,https://www.crunchbase.com/funding_round/zonerich-angel--f7518234,1,Hiway Capital,Seed,Hiway Capital,Angel,2,25760000,CNY,4030855,,,,36260000,CNY,5680538,Yes,,http://www.zonerich.com/,,IPO,,"378,312"
2012-04-25,Uzise sells beauty products.,Uzise,https://www.crunchbase.com/organization/uzise,"Consumer, Health Care, Manufacturing, Organic","Guanzhou, Guangdong, China, Asia",Angel Round - Uzise,https://www.crunchbase.com/funding_round/uzise-angel--15c45ba3,3,"Guangdong Technology Financial Group, Guangzhou Yuanjian Xinchuang Touzi Guanli Hehuo Qiye (Youxian Hehuo), Shenzhen Capital Group",Seed,,Angel,1,3000000,CNY,475778,,,,3000000,CNY,475778,Yes,,http://www.uzise.com/,,Seed,,"378,420"
2012-01-01,Uoko.com is a long-term apartment leasing start-up based in China.,Uoko.com,https://www.crunchbase.com/organization/uoko-com,"Leasing, Real Estate","Chengdu, Sichuan, China, Asia",Seed Round - Uoko.com,https://www.crunchbase.com/funding_round/uoko-com-seed--ae5e3cde,1,Ferry Venture Capital,Seed,Ferry Venture Capital,Seed,4,3000000,CNY,475877,,,,183963632,USD,183963632,Yes,,http://uoko.com/,$1M to $10M,Late Stage Venture,,"378,463"
2011-04-28,G-bits is a online gaming company,G-bits,https://www.crunchbase.com/organization/g-bits,Online Games,"Xiamen, Fujian, China, Asia",Series B - G-bits,https://www.crunchbase.com/funding_round/g-bits-series-b--4d7d280a,3,"Fortune Venture Capital, IDG Capital, Ping An Ventures",Early Stage Venture,,Series B,2,160000000,CNY,24613207,,,,180000000,CNY,27200907,Yes,,http://www.g-bits.com/,,IPO,,"378,524"
2011-09-01,WineNice is an e-commerce website offering imported wines.,WineNice,https://www.crunchbase.com/organization/winenice,"E-Commerce, Retail, Shopping","Beijing, Beijing, China, Asia",Series A - WineNice,https://www.crunchbase.com/funding_round/winenice-series-a--58fb7089,1,Shenzhen Capital Group,Early Stage Venture,Shenzhen Capital Group,Series A,2,80000000,CNY,12536945,,,,180000000,CNY,28553592,Yes,,http://www.winenice.com,,Early Stage Venture,,"379,065"
2011-10-01,DIGIONE Company is a Chinese service provider that promotes the terminal channel reform with an internet perspective.,DIGIONE Company,https://www.crunchbase.com/organization/digione-company,"Advertising, Service Industry","Shenzhen, Guangdong, China, Asia",Series A - DIGIONE Company,https://www.crunchbase.com/funding_round/digione-company-series-a--e65121a1,1,Shenzhen Capital Group,Early Stage Venture,Shenzhen Capital Group,Series A,2,10000000,CNY,1566252,,,,20000000,CNY,3204688,Yes,,http://www.digione.cn,,Early Stage Venture,,"379,075"
2012-06-01,"iHandle, a Chinese campus-oriented and event-based mobile social application, enables its users to record user information and footprints.",iHandle,https://www.crunchbase.com/organization/ihandle,"Apps, Mobile, Mobile Apps","Hubei, Fujian, China, Asia",Series A - iHandle,https://www.crunchbase.com/funding_round/ihandle-series-a--da1a6c17,1,Shenzhen Capital Group,Early Stage Venture,Shenzhen Capital Group,Series A,2,5000000,CNY,784941,,,,10000000,CNY,1598897,Yes,,http://www.ihandle.cn,,,,"379,085"
2012-03-01,KuGou is a Chinese company providing interactive digital music-related and innovative internet technology-based services.,KuGou,https://www.crunchbase.com/organization/kugou,"Digital Entertainment, Internet, Music","Guangdong, Jilin, China, Asia",Series A - KuGou,https://www.crunchbase.com/funding_round/kugou-series-a--b2138b9d,1,Shenzhen Capital Group,Early Stage Venture,Shenzhen Capital Group,Series A,2,100000000,CNY,15876204,,,,100000000,CNY,15876204,Yes,,https://www.kugou.com/,,Early Stage Venture,,"379,111"
2011-07-01,VANCL is a privately held e-commerce company that operates as an online label fashion retailer.,VANCL,https://www.crunchbase.com/organization/vancl,"E-Commerce, Fashion, Sales","Dongchen, Jiangsu, China, Asia",Series F - VANCL,https://www.crunchbase.com/funding_round/vancl-series-f--46828541,8,"Ceyuan Ventures, CPE, Hotung Venture Capital, IDG Capital, Jun Lei, Qiming Venture Partners, Temasek Holdings, Tiger Global Management",Late Stage Venture,,Series F,7,230000000,USD,230000000,,,,522000000,USD,522000000,Yes,,http://www.vancl.com/,,Late Stage Venture,,"379,636"
2011-05-06,"Ganji.com is a Chinese domestic classifieds website where users publish and exchange local information such as used cars, jobs, and more.",Ganji,https://www.crunchbase.com/organization/ganji,"Classifieds, E-Commerce, Information Services, Internet, News, Retail","Beijing, Beijing, China, Asia",Series C - Ganji,https://www.crunchbase.com/funding_round/ganji-series-c--67da318b,4,"BlueRun Ventures, Capital Today, HSG, NGP Capital",Late Stage Venture,,Series C,5,70000000,USD,70000000,,,,710200000,USD,710200000,Yes,,http://bj.ganji.com,$1M to $10M,,4,"380,004"
2011-09-20,"Hua Medicine is a clinical-stage, innovative drug development company in China.",Hua Medicine,https://www.crunchbase.com/organization/hua-medicine,"Biotechnology, Health Care, Life Science, Medical, Pharmaceutical","Shanghai, Shanghai, China, Asia",Series A - Hua Medicine,https://www.crunchbase.com/funding_round/hua-medicine-series-a--0c83d843,6,"ARCH Venture Partners, Eight Roads Ventures, F-Prime Capital, Sino-Alliance International Ltd, Venrock, WuXi Healthcare Ventures",Early Stage Venture,,Series A,6,50000000,USD,50000000,,,,242400000,USD,242400000,Yes,,https://www.huamedicine.com,$10M to $50M,IPO,2,"380,045"
2011-11-01,"MiiOW engages in the R&D, production, and sales of fashion products.",MiiOW,https://www.crunchbase.com/organization/miiow,"Fashion, Manufacturing, Sales","Wuhan, Hubei, China, Asia",Angel Round - MiiOW,https://www.crunchbase.com/funding_round/miiow-angel--43e19f80,3,"Chenlong Guquan Touzi Jijin, JD Capital, Shijie Hesheng Management Consulting",Seed,,Angel,1,3000000,CNY,472058,,,,3000000,CNY,472058,Yes,,http://www.maoren.com.cn/,,Seed,,"380,940"
2011-10-10,iPreCare is a remote health monitoring platform.,iPreCare,https://www.crunchbase.com/organization/iprecare,"Hardware, Health Care, Medical Device","Jiaxing, Zhejiang, China, Asia",Angel Round - iPreCare,https://www.crunchbase.com/funding_round/iprecare-angel--2c879fe2,3,"Binhu Ketou, Tianjin JXJ Technologies, Wuxi Venture Capital Group",Seed,,Angel,1,3000000,CNY,471969,,,,3000000,CNY,471969,Yes,,http://www.iprecare.com/,,Seed,,"380,973"
2011-12-01,entertainment,91.COM,https://www.crunchbase.com/organization/91-com,,"Fujiang, Sichuan, China, Asia",Series A - 91.COM,https://www.crunchbase.com/funding_round/91-com-series-a--11c3ea31,3,"DT Capital Partners, IDG Capital, Vertex Ventures China",Early Stage Venture,,Series A,1,30000000,USD,30000000,,,,30000000,USD,30000000,Yes,,,,Early Stage Venture,,"381,080"
2011-09-15,"RunCore is a company specialized in electrical engineering, computer science and automation of defence technology.",RunCore,https://www.crunchbase.com/organization/runcore,"Computer, Electronics, Manufacturing","Changshahsien, Hunan, China, Asia",Series A - RunCore,https://www.crunchbase.com/funding_round/runcore-series-a--d1ea2be4,3,"Hangzhou Yongyuan, Hochane, Oriental Fortune Capital",Early Stage Venture,,Series A,2,10000000,CNY,1564772,,,,13000000,CNY,2003987,Yes,,http://www.runcore.com/,,Early Stage Venture,,"381,162"
2011-04-01,"Diandian is a simplified light blog social community that enables users to post words, pictures, videos, and various forms of content.",DianDian,https://www.crunchbase.com/organization/diandian,"Gaming, Social Media, Software, Video","Beijing, Beijing, China, Asia",Series A - DianDian,https://www.crunchbase.com/funding_round/diandian-series-a--0ddddc50,3,"Ceyuan Ventures, Sequoia Capital, Sinovation Ventures",Early Stage Venture,,Series A,1,10000000,USD,10000000,,,,10000000,USD,10000000,Yes,,http://www.diandian.com,Less than $1M,Early Stage Venture,,"381,529"
2012-01-19,Wisdom provides vehicle management solutions services.,Wisdom,https://www.crunchbase.com/organization/wisdom-075c,"Automotive, GPS, Navigation","Luohu, Guangdong, China, Asia",Series A - Wisdom,https://www.crunchbase.com/funding_round/wisdom-075c-series-a--9f545104,3,"Hidragon Capital, Timesbole, Wuyue Shengtai",Early Stage Venture,,Series A,2,9900000,CNY,1567500,,,,12900000,CNY,2006841,Yes,,http://www.wisdom-gps.com/,,Early Stage Venture,,"381,812"
2012-01-01,Didatuan.com is a Chinese boutique flash and group sale website.,Didatuan,https://www.crunchbase.com/organization/didatuan,E-Commerce,"Beijing, Beijing, China, Asia",Series B - Didatuan,https://www.crunchbase.com/funding_round/didatuan-series-b--6dc11b22,3,"IDG Capital, KPCB Edge, Northern Light Venture Capital",Early Stage Venture,,Series B,2,,,,,,,,,,Yes,,http://www.didatuan.com,,Early Stage Venture,,"382,214"
2011-09-01,Teamsun Technology offers IT applications and services for the development of computer information systems.,Teamsun Technology Co.,https://www.crunchbase.com/organization/teamsun-technology-co,"Cloud Computing, Information Services, Internet of Things, Mobile","Beijing, Beijing, China, Asia",Post-IPO Equity - Teamsun Technology Co.,https://www.crunchbase.com/funding_round/teamsun-technology-co-post-ipo-equity--29951bb3,3,"China SDIC Gaoxin, Haitong International Securities Group, Platinum Venture Capital",,,Post-IPO Equity,1,470000000,CNY,73654551,,,,470000000,CNY,73654551,Yes,,http://www.teamsun.com.cn/,$500M to $1B,IPO,,"382,062"
2012-03-15,Gofu Gold is a gold jewelry enterprise that engages in the comprehensive development of cultural inheritance and precious metals.,Gofu Gold,https://www.crunchbase.com/organization/gofu-gold,"Jewelry, Precious Metals","Shenzhen, Guangdong, China, Asia",Series A - Gofu Gold,https://www.crunchbase.com/funding_round/gofu-gold-series-a--11d845ac,3,"Fortune Venture Capital, Shenzhenshi Haozhousheng Touzi, Tsing-Yuan Capital",Early Stage Venture,,Series A,2,10000000,CNY,1579630,,,,13000000,CNY,2049771,Yes,,http://www.fulijewelry.com/,,Early Stage Venture,,"382,349"
2011-03-01,Aigou.com is a pet website offering information and characteristic content for pet lovers.,Aigou,https://www.crunchbase.com/organization/aigou,"Content, E-Commerce, Internet, News, Pet","Beijing, Beijing, China, Asia",Series B - Aigou,https://www.crunchbase.com/funding_round/aigou-series-b--6430d195,3,"Alibaba Capital Partners, IDG Capital, SAIF Partners",Early Stage Venture,,Series B,2,10000000,USD,10000000,,,,20000000,USD,20000000,Yes,,http://www.aigou.com,,Early Stage Venture,,"383,050"
2011-08-22,Xiao Long Auto is a manufacturer of all-terrain vehicles that provides advanced off-road mobility.,Xiao Long Auto,https://www.crunchbase.com/organization/xiao-long-auto,"Automotive, Manufacturing, Sales","Wuhan, Hubei, China, Asia",Angel Round - Xiao Long Auto,https://www.crunchbase.com/funding_round/xiao-long-auto-angel--77ad2c52,3,"Delta Capital, East-Lake Venture Capital, Wuhan Xuancheng Investment Development",Seed,,Angel,1,3000000,CNY,468702,,,,3000000,CNY,468702,Yes,,http://www.xiaolongauto.com/,,Seed,,"383,264"
2011-07-31,"Haoxiang Gouwu is an e-commerce company for TV shopping, digital, home appliances, clothing, beauty skincare, baby, and bedding, jewelry.",Haoxiang Gouwu,https://www.crunchbase.com/organization/haoxiang-gouwu,"Beauty, E-Commerce, Electronics, Home Appliances","Nanjing, Jiangsu, China, Asia",Angel Round - Haoxiang Gouwu,https://www.crunchbase.com/funding_round/haoxiang-gouwu-angel--2eac660e,3,"Addor Capital, Jiangsu Guangdian Chuang Tou, JSTV.com",Seed,,Angel,1,3000000,CNY,465927,,,,3000000,CNY,465927,Yes,,http://www.hao24.cn,,Seed,,"383,412"
2011-09-01,"Douban is a Chinese social networking service that offers ""lifestyle and culture"" products and services for urbanites and college students.",Douban,https://www.crunchbase.com/organization/douban,"Social Media, Social Network","Beijing, Beijing, China, Asia",Series C - Douban,https://www.crunchbase.com/funding_round/douban-series-c--fbf3ecee,3,"BAI capital, Sequoia Capital, Trustbridge Partners",Late Stage Venture,,Series C,3,50000000,USD,50000000,,,,59000000,USD,59000000,Yes,,https://m.douban.com/,$1M to $10M,Late Stage Venture,,"382,470"
2012-06-28,"BroadTech is a national high-tech enterprise that focuses on big data mining, processing, and application.",BroadTech,https://www.crunchbase.com/organization/broadtech-1dde,"Big Data, Data Mining, Enterprise","Shenzhen, Guangdong, China, Asia",Series B - BroadTech,https://www.crunchbase.com/funding_round/broadtech-1dde-series-b--36a71143,3,"Co-Power Capital Management, Green Pine Capital Partners, Shenzhen Yuexiang Capital Management",Early Stage Venture,,Series B,3,20000100,CNY,3145684,,,,33000100,CNY,5089543,Yes,,http://www.broadtech.com.cn,,M&A,,"383,070"
2011-06-01,Anyang Phoenix Photovoltaic Technology is a company focused on research and development of high-performance photovoltaic products.,Anyang Phoenix Photovoltaic Technology,https://www.crunchbase.com/organization/anyang-phoenix-photovoltaic-technology,"Information Technology, Product Research, Service Industry","Anyang, Henan, China, Asia",Venture Round - Anyang Phoenix Photovoltaic Technology,https://www.crunchbase.com/funding_round/anyang-phoenix-photovoltaic-technology-series-unknown--d2cb413a,3,"Cowin Capital, Ivy Capital, OFC",,,Venture - Series Unknown,1,,,,,,,,,,Yes,,http://www.pvphoenix.com/,,,,"383,513"
2011-09-30,WHFAE is a financial assets trading platform company.,WHFAE,https://www.crunchbase.com/organization/whfae,"Finance, Financial Services, Trading Platform","Wuhan, Hubei, China, Asia",Angel Round - WHFAE,https://www.crunchbase.com/funding_round/whfae-angel--162593bc,3,"Liantou Jituan, Wuhan Guoyou Zichan Jingying Gongsi, Wuhan Jinrong Konggu",Seed,,Angel,1,3000000,CNY,470049,,,,3000000,CNY,470049,Yes,,http://www.whfae.com/,,Seed,,"384,071"
2012-05-24,Richfuture is an IT company that provides digital marketing and IoT monitoring systems for the agriculture sector.,Richfuture,https://www.crunchbase.com/organization/richfuture,"Advertising, Agriculture, Digital Marketing, Information Technology, Internet of Things","Yangzhou, Jiangsu, China, Asia",Venture Round - Richfuture,https://www.crunchbase.com/funding_round/richfuture-series-unknown--d91d8804,1,Zibolan,,Zibolan,Venture - Series Unknown,6,50000000,CNY,7886555,,,,157500000,CNY,24061483,Yes,,http://www.rui-feng.cn/,,IPO,,"392,710"
2011-08-08,Yixiao Keji develops domestic mobile communication technology.,Yixiao Keji,https://www.crunchbase.com/organization/yixiao-keji,"Information Technology, Mobile, Telecommunications","Putuo, Shanghai, China, Asia",Angel Round - Yixiao Keji,https://www.crunchbase.com/funding_round/yixiao-keji-angel--daf78c67,1,Zan Capital,Seed,Zan Capital,Angel,5,4500000,CNY,699095,,,,111000000,CNY,17834048,Yes,,http://www.517eshop.com,,IPO,,"394,284"
2011-01-01,"ZuzuChe.com is an online taxi search website offering rental information for designated driving, car chartering, and wedding celebrations.",ZuzuChe,https://www.crunchbase.com/organization/zuzuche,"E-Commerce, Internet, Online Portals, Trading Platform","Guangzhou, Guangdong, China, Asia",Series A - ZuzuChe,https://www.crunchbase.com/funding_round/zuzuche-series-a--cb560b4a,1,Matrix Partners China,Early Stage Venture,Matrix Partners China,Series A,4,10000000,CNY,1515461,,,,27605461,USD,27605461,Yes,,http://www.zuzuche.com,,Late Stage Venture,,"394,770"
2012-05-14,LY.com is a travel platform that helps users book tickets and travel accommodations without any hassle.,LY.com,https://www.crunchbase.com/organization/ly-com,"Internet, Leisure, Tourism, Travel, Travel Accommodations, Travel Agency","Suzhou, Jiangsu, China, Asia",Series B - LY.com,https://www.crunchbase.com/funding_round/ly-com-series-b--c25a775b,1,Tencent,Early Stage Venture,Tencent,Series B,7,,,,500000000,CNY,79082654,1718408590,USD,1718408590,Yes,,http://ly.com,$1M to $10M,,,"398,293"
2012-02-21,CNLive.COM is a media and entertainment platform.,CNLive.COM,https://www.crunchbase.com/organization/cnlive-com,"Audio, Media and Entertainment, Music, Video","Haidian, Beijing, China, Asia",Series B - CNLive.COM,https://www.crunchbase.com/funding_round/cnlive-com-series-b--42b7bd19,1,China Culture Industrial Investment Fund,Early Stage Venture,China Culture Industrial Investment Fund,Series B,6,20000000,CNY,3176285,,,,210000000,CNY,33862182,Yes,,http://live.cnlive.com/,,Late Stage Venture,,"398,414"
2012-04-01,Lefeng is a Chinese large-scale online shopping website that provides solutions related to female fashion.,LAFASO,https://www.crunchbase.com/organization/lafaso,"Dietary Supplements, E-Commerce, Fashion, Shopping, Women's","Beijing, Beijing, China, Asia",Private Equity Round - LAFASO,https://www.crunchbase.com/funding_round/lafaso-private-equity--c7395472,1,CBC Capital,Private Equity,CBC Capital,Private Equity,3,40000000,USD,40000000,,,,40000000,USD,40000000,Yes,,http://www.lefeng.com,$1M to $10M,Private Equity,,"398,528"
2011-06-10,Toone is a smart city construction and operation solutions provider company.,Toone,https://www.crunchbase.com/organization/toone,"Construction, Information Services, Smart Cities","Zhuhai, Guangdong, China, Asia",Series B - Toone,https://www.crunchbase.com/funding_round/toone-series-b--0dfb38a0,1,Jiu Gua Gua,Early Stage Venture,Jiu Gua Gua,Series B,4,20000000,CNY,3086276,,,,44000000,CNY,6647861,Yes,,http://www.toone.com.cn/,,IPO,,"399,968"
2012-04-10,Fotor is a multi-platform photo editing tool.,Fotor,https://www.crunchbase.com/organization/fotor,"Computer, Mobile Apps, Photo Editing, Photography, Social Media Marketing, Software, Web Apps","Chengdu, Sichuan, China, Asia",Series A - Fotor,https://www.crunchbase.com/funding_round/fotor-series-a--138421de,1,Lenovo,Early Stage Venture,Lenovo,Series A,2,3000000,USD,3000000,,,,10600000,USD,10600000,Yes,,http://www.fotor.com,$10M to $50M,Early Stage Venture,,"400,047"
2011-01-01,Panshi is an online and mobile advertising firm that offers online advertising services to small and medium enterprises.,Panshi,https://www.crunchbase.com/organization/panshi,"Advertising, Advertising Platforms, Affiliate Marketing","Hangzhou, Zhejiang, China, Asia",Series A - Panshi,https://www.crunchbase.com/funding_round/panshi-series-a--874a691a,1,NewMargin Ventures,Early Stage Venture,NewMargin Ventures,Series A,4,20000000,USD,20000000,,,,655181114,USD,655181114,Yes,,https://www.adyun.com/zh-cn/index.html,,Late Stage Venture,,"400,556"
2011-01-24,"Shanghai Qihang Sky Technology serves banks by providing banking training, financial education, and business services.",Shanghai Qihang Sky Technology,https://www.crunchbase.com/organization/qihang,"Banking, Education, Financial Services","Shanghai, Shanghai, China, Asia",Angel Round - Shanghai Qihang Sky Technology,https://www.crunchbase.com/funding_round/qihang-angel--13134ea3,1,KPCB China,Seed,KPCB China,Angel,3,3000000,CNY,455797,,,,88280000,CNY,14098676,Yes,,http://www.qihangedu.com/,,IPO,,"401,519"
2011-12-31,"BR-Robot engages in the R&D, design, production and sales of industrial automation.",BR-Robot,https://www.crunchbase.com/organization/br-robot,"Industrial Automation, Manufacturing, Sales","Suzhou, Jiangsu, China, Asia",Series A - BR-Robot,https://www.crunchbase.com/funding_round/br-robot-series-a--755a408a,1,Oriza Seed Capital (Oriza Yuandian),Early Stage Venture,Oriza Seed Capital (Oriza Yuandian),Series A,10,5000000,CNY,793129,,,,340625000,CNY,50560982,Yes,,https://www.beiren-tech.com/,,IPO,,"401,616"
2011-03-28,NetBank is the operator of commercial data center services.,NetBank,https://www.crunchbase.com/organization/netbank-b457,"Commercial, Data Center, Telecommunications","Hangzhou, Zhejiang, China, Asia",Series A - NetBank,https://www.crunchbase.com/funding_round/netbank-b457-series-a--54d42ad5,1,Quandefu VC,Early Stage Venture,Quandefu VC,Series A,5,18000000,CNY,2742366,,,,131680000,CNY,19645112,Yes,,http://www.netbank.cn/,$100M to $500M,M&A,,"402,051"
2011-11-10,AutoAI is an intelligent networked system developer and operator for a new generation of self-driving cars.,AutoAI,https://www.crunchbase.com/organization/autoai-66b7,Automotive,"Beijing, Beijing, China, Asia",Series C - AutoAI,https://www.crunchbase.com/funding_round/autoai-66b7-series-c--6d83bda0,1,IDG Capital,Late Stage Venture,IDG Capital,Series C,4,30000000,USD,30000000,,,,238031129,USD,238031129,Yes,,https://www.autoai.com,$10M to $50M,,,"402,314"
2011-06-10,FALAB is an industrial company that provides laboratory design planning and automotive components testing services.,FALAB,https://www.crunchbase.com/organization/falab,"Automotive, Consulting, Electronics, Industrial, Manufacturing","Suzhou, Jiangsu, China, Asia",Angel Round - FALAB,https://www.crunchbase.com/funding_round/falab-angel--ca7c8598,1,Suzhou Industrial Park Nankai Venture Capital,Seed,Suzhou Industrial Park Nankai Venture Capital,Angel,4,3000000,CNY,462941,,,,63000000,CNY,9563345,Yes,,http://www.falab.com,,Late Stage Venture,,"402,512"
2011-07-01,Limei Advertising is a provider of mobile marketing solutions with a large domestic revenue and financing scale in China.,Limei Advertising,https://www.crunchbase.com/organization/limei-advertising,"Advertising, Marketing, Mobile","Beijing, Beijing, China, Asia",Series A - Limei Advertising,https://www.crunchbase.com/funding_round/limei-advertising-series-a--3b98555e,1,IDG Capital,Early Stage Venture,IDG Capital,Series A,4,10000000,USD,10000000,,,,30000000,USD,30000000,Yes,,http://www.limei.com,$10M to $50M,IPO,,"402,650"
2011-12-13,PPM Solution is a manufacturer of automotive parts and components.,PPM Solution,https://www.crunchbase.com/organization/ppm-solution,"Automotive, Manufacturing, Mining","Shenzhen, Guangdong, China, Asia",Series B - PPM Solution,https://www.crunchbase.com/funding_round/ppm-solution-series-b--c19d6498,1,Pingxiang Huafeng Touzi Hehuo Qiye,Early Stage Venture,Pingxiang Huafeng Touzi Hehuo Qiye,Series B,5,30000000,CNY,4713827,,,,223930000,CNY,34110017,Yes,,http://www.ppmsolution.com/,,IPO,,"402,914"
2011-03-01,"iceason is a food company that provides milk, snow bar, and yogurt ice-creams.",iceason,https://www.crunchbase.com/organization/iceason,"Food and Beverage, Retail, Service Industry","Huangpu, Shanghai, China, Asia",Angel Round - iceason,https://www.crunchbase.com/funding_round/iceason-angel--c3e45baa,1,Zero2IPO,Seed,Zero2IPO,Angel,3,3000000,CNY,456599,,,,33000000,CNY,5311487,Yes,,http://www.iceason.com,,Early Stage Venture,,"411,282"
2011-06-25,Kingday is an electric vehicle manufacturer.,Kingday,https://www.crunchbase.com/organization/kingday,"Automotive, Electric Vehicle, Manufacturing","Jinhua, Zhejiang, China, Asia",Angel Round - Kingday,https://www.crunchbase.com/funding_round/kingday-angel--cbff9d84,1,Shinaite Investment,Seed,Shinaite Investment,Angel,4,4800000,CNY,741378,,,,119600000,CNY,19291316,Yes,,http://www.kingdaychina.com,,IPO,,"411,446"
2012-01-01,Tian Tian Express is Hangzhou based company.,Tian Tian Express,https://www.crunchbase.com/organization/tian-tian-express,"Customer Service, Hotel, Resorts","Hangzhou, Zhejiang, China, Asia",Secondary Market - Tian Tian Express,https://www.crunchbase.com/funding_round/tian-tian-express-secondary-market--62b571b2,1,STO Express,,STO Express,Secondary Market,3,160000000,CNY,25380131,106666667,CNY,16920087,840000000,CNY,128871808,No,,https://www.ttkdex.com/,,M&A,,"411,499"
2011-02-01,Daishu.com is focused on education vertical services for parents of 0 to 6 year olds.,Daishu.com,https://www.crunchbase.com/organization/daishu-com,"Education, Family, Parenting","Haidian, Beijing, China, Asia",Series A - Daishu.com,https://www.crunchbase.com/funding_round/daishu-com-series-a--94fdd78c,1,SIG China (SIG Asia Investments),Early Stage Venture,SIG China (SIG Asia Investments),Series A,2,5000000,USD,5000000,,,,7700000,USD,7700000,Yes,,http://www.daishu.com,,Early Stage Venture,,"411,512"
2011-11-28,PPM Solution is a manufacturer of automotive parts and components.,PPM Solution,https://www.crunchbase.com/organization/ppm-solution,"Automotive, Manufacturing, Mining","Shenzhen, Guangdong, China, Asia",Series A - PPM Solution,https://www.crunchbase.com/funding_round/ppm-solution-series-a--ff845d19,1,Zhongqihui Venture Capital,Early Stage Venture,Zhongqihui Venture Capital,Series A,5,3080000,CNY,482442,,,,223930000,CNY,34110017,Yes,,http://www.ppmsolution.com/,,IPO,,"403,407"
2012-03-05,TIANJIN EQUITY EXCHANGE specializes in carrying out equity financing and listing transactions of non-listed companies.,TIANJIN EQUITY EXCHANGE,https://www.crunchbase.com/organization/tianjin-equity-exchange,"Finance, Financial Services, Small and Medium Businesses","Nankai, Tianjin, China, Asia",Angel Round - TIANJIN EQUITY EXCHANGE,https://www.crunchbase.com/funding_round/tianjin-equity-exchange-angel--0923dded,1,Guo Ding Pu Hui Investment,Seed,Guo Ding Pu Hui Investment,Angel,3,3000000,CNY,475615,,,,33000000,CNY,5285950,Yes,,http://www.tjsoc.com,,Early Stage Venture,,"404,287"
