2011-08-01,Yuren Zhizao is a film and television production company.,Yuren Zhizao,https://www.crunchbase.com/organization/yuren-zhizao,"Film Production, Media and Entertainment, TV Production","Shenzhen, Guangdong, China, Asia",Angel Round - Yuren Zhizao,https://www.crunchbase.com/funding_round/yuren-zhizao-angel--75aee579,1,Shenzhen Esaif-Capital Investment,Seed,,Angel,1,3000000,CNY,466226,,,,3000000,CNY,466226,Yes,,http://www.yurenzhizao.cn/,,Seed,,"459,654"
2012-01-12,07073 is an online gaming and game review platform.,07073.com,https://www.crunchbase.com/organization/07073-com,"Gaming, Online Games, Online Portals","Shenyang, Liaoning, China, Asia",Angel Round - 07073.com,https://www.crunchbase.com/funding_round/07073-com-angel--5951aa18,1,Baidu,Seed,,Angel,1,3000000,CNY,474892,,,,3000000,CNY,474892,Yes,,http://www.07073.com/,,Seed,,"459,744"
2012-01-01,"Dianjoy is integrated mobile marketing service provider,mobile advertising platform.",Dianjoy,https://www.crunchbase.com/organization/dianjoy,"Advertising, Advertising Platforms, Internet of Things, Marketing, Mobile","Beijing, Beijing, China, Asia",Seed Round - Dianjoy,https://www.crunchbase.com/funding_round/dianjoy-seed--b995bbab,1,Legend Star,Seed,,Seed,1,,,,,,,,,,Yes,,http://www.dianjoy.com,$1M to $10M,Seed,,"470,859"
2011-05-01,Huayi Bros. Media Group is a Chinese comprehensive entertainment group focused on the media industry.,Huayi Brothers Media Group,https://www.crunchbase.com/organization/huayi-brothers-media-group,"Film Distribution, Film Production, Media and Entertainment, Music","Beijing, Beijing, China, Asia",Post-IPO Equity - Huayi Brothers Media Group,https://www.crunchbase.com/funding_round/huayi-brothers-media-group-post-ipo-equity--74f08130,1,Tencent Industry Win-Win Fund,,,Post-IPO Equity,2,450000000,CNY,69326579,,,,450000000,CNY,69326579,Yes,,http://www.huayimedia.com,$100M to $500M,IPO,,"471,000"
2011-01-01,99taojin,99taojin,https://www.crunchbase.com/organization/99taojin-com,"Commercial, E-Commerce, Fashion, Internet, Manufacturing, Precious Metals, Shopping","Shanghai, Shanghai, China, Asia",Angel Round - 99taojin,https://www.crunchbase.com/funding_round/99taojin-com-angel--e5185c19,1,YF Capital,Seed,,Angel,1,50000000,CNY,7577304,,,,50000000,CNY,7577304,Yes,,http://www.99taojin.com,,Seed,,"460,152"
2011-06-01,"Nashine provide subtitle, language recognition, voice recognition and picture recognition services.",Nashine,https://www.crunchbase.com/organization/nashine,"Artificial Intelligence (AI), Image Recognition, Software","Haidian, Beijing, China, Asia",Series A - Nashine,https://www.crunchbase.com/funding_round/nashine-series-a--11db3ff4,1,Green Pine Capital Partners,Early Stage Venture,,Series A,2,3000000,CNY,463092,,,,4000000,CNY,614638,Yes,,http://www.nashine.com,,Early Stage Venture,,"482,855"
2011-06-01,MOYO Game is a mobile social gaming development company based in China.,Moyo Game,https://www.crunchbase.com/organization/moyo-games,Enterprise Software,"Beijing, Beijing, China, Asia",Venture Round - Moyo Game,https://www.crunchbase.com/funding_round/moyo-games-series-unknown--d305c10e,1,SIG China (SIG Asia Investments),,,Venture - Series Unknown,1,10000000,USD,10000000,,,,10000000,USD,10000000,Yes,,http://www.moyogame.com,,,,"460,240"
2011-11-11,China's leading Web Application Developer,Sinoyuan (Beijing) Ltd.,https://www.crunchbase.com/organization/sinoyuan-beijing-ltd,"Apps, Internet","Haidian, Beijing, China, Asia",Series A - Sinoyuan (Beijing) Ltd.,https://www.crunchbase.com/funding_round/sinoyuan-beijing-ltd-series-a--b1af0ed5,1,Chambroad Holding Group,Early Stage Venture,,Series A,2,3000000,USD,3000000,,,,4000000,USD,4000000,Yes,,http://yuanapps.com/,,Early Stage Venture,,"483,729"
2011-10-24,Tianjian Zixun provides financial consulting and management services for IPO companies and investment institutions.,Tianjian Zixun,https://www.crunchbase.com/organization/tianjian-zixun,"Consulting, Finance, Financial Services","Xiamen, Fujian, China, Asia",Angel Round - Tianjian Zixun,https://www.crunchbase.com/funding_round/tianjian-zixun-angel--2a005c10,1,Oriental Fortune Capital,Seed,,Angel,1,3000000,CNY,470522,,,,3000000,CNY,470522,Yes,,http://www.xmtjzx.com/,,Seed,,"460,355"
2011-02-01,Nanjing Sky Tech is a professional Chinese company engaged in the independent R&D and sale of software products and application software.,SkyTech,https://www.crunchbase.com/organization/nanjing-sky-tech-co-ltd,"Application Performance Management, Sales, Software","Nanjing, Jiangsu, China, Asia",Venture Round - SkyTech,https://www.crunchbase.com/funding_round/nanjing-sky-tech-co-ltd-series-unknown--22cf7b8b,1,Alibaba Capital Partners,,,Venture - Series Unknown,1,170000000,CNY,25792184,,,,170000000,CNY,25792184,Yes,,http://www.skynj.com,$10M to $50M,,,"484,403"
2012-06-11,"Guosheng specializes in the production of pickles, vegetarian dishes, and raw materials.",Guosheng,https://www.crunchbase.com/organization/guosheng,"Food and Beverage, Manufacturing, Service Industry","Putian, Fujian, China, Asia",Angel Round - Guosheng,https://www.crunchbase.com/funding_round/guosheng-angel--befbaafe,1,Hiway Capital,Seed,,Angel,1,3000000,CNY,472056,,,,3000000,CNY,472056,Yes,,http://www.fj-redsun.com,,Seed,,"460,769"
2011-11-01,"GWQM specializes in new car sales, used car transactions and car rental services.",GWQM,https://www.crunchbase.com/organization/gwqm,"Automotive, Rental, Sales","Baiyun, Guangdong, China, Asia",Angel Round - GWQM,https://www.crunchbase.com/funding_round/gwqm-angel--3f8a9365,1,Hengjian Holding,Seed,,Angel,1,3000000,CNY,472058,,,,3000000,CNY,472058,Yes,,http://www.gwqm.com/,,Seed,,"484,740"
2011-11-01,Wiyun Inc. operates as a mobile game/application publisher.,Wiyun Inc.,https://www.crunchbase.com/organization/wiyun-inc,"Internet, Wireless","Beijing, Beijing, China, Asia",Venture Round - Wiyun Inc.,https://www.crunchbase.com/funding_round/wiyun-inc-series-unknown--2e43caa7,1,Legend Capital,,,Venture - Series Unknown,1,,,,,,,,,,Yes,,http://www.wiyun.com,,,,"460,967"
2011-07-04,Adayougame is a mobile game developer and publisher.,Adayougame,https://www.crunchbase.com/organization/adayougame,"Gaming, Media and Entertainment, Software","Wuxi Shi, Jiangsu, China, Asia",Angel Round - Adayougame,https://www.crunchbase.com/funding_round/adayougame-angel--6b30aaf8,1,K2VC,Seed,,Angel,1,2000000,CNY,309387,,,,2000000,CNY,309387,Yes,,http://www.adagame.com,,Seed,,"460,981"
2011-08-05,"Yuya is a retailer of gold, jade, diamond, platinum, and other jewelry products.",Yuya,https://www.crunchbase.com/organization/yuya,"Jewelry, Retail, Wholesale","Shenzhen, Guangdong, China, Asia",Angel Round - Yuya,https://www.crunchbase.com/funding_round/yuya-angel--2868f41d,1,Readysun Group,Seed,,Angel,1,3000000,CNY,465761,,,,3000000,CNY,465761,Yes,,http://www.yuyajade.com.cn,,Seed,,"461,417"
2012-02-01,Homevv.com is an e-commerce platform providing lifestyle consumption services.,Homevv.com,https://www.crunchbase.com/organization/homevv-com,"E-Commerce, Lifestyle","Baoshan, Shanghai, China, Asia",Venture Round - Homevv.com,https://www.crunchbase.com/funding_round/homevv-com-series-unknown--f9c982e7,1,PreIPO,,,Venture - Series Unknown,1,30000000,CNY,4756825,,,,30000000,CNY,4756825,Yes,,http://homevv.com,,,,"472,246"
2012-06-08,"Signalway provides the development, production, sales, and service of video surveillance products and solutions.",Signalway,https://www.crunchbase.com/organization/signalway,"Hardware, Information Technology, Security","Haidian, Beijing, China, Asia",Angel Round - Signalway,https://www.crunchbase.com/funding_round/signalway-angel--6818b29e,1,Zhongguancun Xingye Investment,Seed,,Angel,1,3000000,CNY,470922,,,,3000000,CNY,470922,Yes,,http://www.signalway.com.cn/,,Seed,,"472,528"
2011-02-16,Harvest Festival Group is a supplier of catering services.,Harvest Festival Group,https://www.crunchbase.com/organization/harvest-festival-group,"Catering, Food and Beverage, Hospitality","Huangpu, Shanghai, China, Asia",Angel Round - Harvest Festival Group,https://www.crunchbase.com/funding_round/harvest-festival-group-angel--dbc6d282,1,Fosun International,Seed,,Angel,1,3000000,CNY,455428,,,,3000000,CNY,455428,Yes,,http://www.fsrjt.com/,,IPO,,"476,382"
2012-05-10,BOCONG is a surveillance product supplier and solution provider.,BOCONG,https://www.crunchbase.com/organization/bocong,"Electronics, Hardware, Information Technology, Software","Xiamen, Fujian, China, Asia",Angel Round - BOCONG,https://www.crunchbase.com/funding_round/bocong-angel--48854cb4,1,Silan Ventures,Seed,,Angel,1,3000000,CNY,475107,,,,3000000,CNY,475107,Yes,,http://www.smartvision.com.cn/,,Seed,,"472,687"
2011-01-01,NibiruTech is engaged in the development of applications for iOS platforms.,NibiruTech Limited,https://www.crunchbase.com/organization/nibirutech-limited,"Apps, Mobile","Chengdu, Sichuan, China, Asia",Series A - NibiruTech Limited,https://www.crunchbase.com/funding_round/nibirutech-limited-series-a--7303ccd3,1,Matrix Partners China,Early Stage Venture,,Series A,1,,,,,,,,,,Yes,,http://www.nibirutech.com,$1M to $10M,Early Stage Venture,,"472,702"
2011-12-01,Sichuan Xinding New Material Co is a producer of industrial steel used in the production of bridges and high speed rails.,Sichuan Xinding New Material Co,https://www.crunchbase.com/organization/sichuan-xinding-new-material-co,"Manufacturing, Precious Metals","Sichuan, Gansu, China, Asia",Private Equity Round - Sichuan Xinding New Material Co,https://www.crunchbase.com/funding_round/sichuan-xinding-new-material-co-private-equity--639cd519,1,Tripod Capital,Private Equity,,Private Equity,1,,,,,,,,,,Yes,,,,Private Equity,,"463,667"
2011-09-11,Timing is a learning community social app.,Timing,https://www.crunchbase.com/organization/timing-2166,"Apps, E-Learning, Social Media","Wuhan, Hubei, China, Asia",Angel Round - Timing,https://www.crunchbase.com/funding_round/timing-2166-angel--94d45d0d,1,Blue Elephant Capital,Seed,,Angel,1,3000000,CNY,469612,,,,3000000,CNY,469612,Yes,,http://www.huiian.com/,,Seed,,"464,192"
2011-02-01,Topone provides car rental services.,Topone,https://www.crunchbase.com/organization/topone,"Automotive, Car Sharing, Rental","Shenzhen, Guangdong, China, Asia",Series D - Topone,https://www.crunchbase.com/funding_round/topone-series-d--1f49151f,1,SIG China (SIG Asia Investments),Late Stage Venture,,Series D,4,,,,,,,55000000,USD,55000000,Yes,,http://www.top1.cn/,$1M to $10M,Late Stage Venture,,"472,997"
2012-01-01,GTE Global is a natural gas energy equipment and system supplier integrating technology research and development.,GTE Global,https://www.crunchbase.com/organization/gte-global,"Energy, Natural Resources, Oil and Gas","Tianjin, Guangdong, China, Asia",Venture Round - GTE Global,https://www.crunchbase.com/funding_round/gte-global-series-unknown--bfb80ec8,1,Tianjin Venture Capital,,,Venture - Series Unknown,1,,,,,,,,,,Yes,,http://www.gte-global.com,,,,"473,052"
2011-01-01,"TIANJIN JIURI manufactures and sells photoinitiator monomers, oligomers, and ultraviolet absorbers.",TIANJIN JIURI NEW MATERIALS,https://www.crunchbase.com/organization/tianjin-jiuri-new-materials-co-ltd,Manufacturing,"Tianjing, Tianjin, China, Asia",Venture Round - TIANJIN JIURI NEW MATERIALS,https://www.crunchbase.com/funding_round/tianjin-jiuri-new-materials-co-ltd-series-unknown--591d00c3,1,Tianjin Venture Capital,,,Venture - Series Unknown,1,,,,,,,,,,Yes,,http://www.jiuri.cc,$100M to $500M,IPO,,"476,748"
2012-01-01,Landetao.com is an online shopping platform that offers articles and guides on choosing gift.,Landetao.com,https://www.crunchbase.com/organization/landetao-com,"Consulting, E-Commerce, Gift","Haidian, Beijing, China, Asia",Angel Round - Landetao.com,https://www.crunchbase.com/funding_round/landetao-com-angel--25f302eb,1,CDF-Capital,Seed,,Angel,1,3000000,CNY,475877,,,,3000000,CNY,475877,Yes,,http://www.landetao.com/,,Seed,,"469,515"
2011-06-20,ZhongTuo Petroleum engages in pipeline special technical services.,ZhongTuo Petroleum,https://www.crunchbase.com/organization/zhongtuo-petroleum,"Chemical, Construction, Oil and Gas, Service Industry","Puyang, Henan, China, Asia",Series A - ZhongTuo Petroleum,https://www.crunchbase.com/funding_round/zhongtuo-petroleum-series-a--fa5de645,1,Shanghai Capital,Early Stage Venture,,Series A,2,1600000,CNY,247070,,,,3600000,CNY,552013,Yes,,http://www.ztxf.com.cn/,,IPO,,"469,588"
2012-06-18,BAIXIANG NEW TECHNOLOGY is a global supplier of equipment and systems in the field of infection control & prevention.,BAIXIANG NEW TECHNOLOGY,https://www.crunchbase.com/organization/baixiang-new-technology,"Hospital, Medical Device, Pharmaceutical, Sales","Pinggu, Beijing, China, Asia",Series A - BAIXIANG NEW TECHNOLOGY,https://www.crunchbase.com/funding_round/baixiang-new-technology-series-a--98daa6ae,1,Addor Capital,Early Stage Venture,,Series A,1,10000000,CNY,1573073,,,,10000000,CNY,1573073,Yes,,http://www.baix.com.cn,$50M to $100M,Early Stage Venture,,"465,197"
2011-01-01,Shengyang Keji is a smart hotel service platform operator in China.,Shengyang Keji,https://www.crunchbase.com/organization/shengyang-keji,Hotel,"Shenzhen, Guangdong, China, Asia",Venture Round - Shengyang Keji,https://www.crunchbase.com/funding_round/shengyang-keji-series-unknown--6a9915fd,1,CrestValue,,,Venture - Series Unknown,1,,,,,,,,,,Yes,,http://www.sunlight-tech.com,,,,"473,766"
2011-11-18,Xinchuanqi is a food products manufacturing company.,Xinchuanqi,https://www.crunchbase.com/organization/xinchuanqi,"Food and Beverage, Food Processing, Manufacturing","Shanghai, Shanghai, China, Asia",Angel Round - Xinchuanqi,https://www.crunchbase.com/funding_round/xinchuanqi-angel--ad331785,1,Timesbole,Seed,,Angel,1,3000000,CNY,472019,,,,3000000,CNY,472019,Yes,,http://www.xcqfood.com.cn,,Seed,,"465,636"
2012-01-01,Agribot develops artificial intelligence technology for agriculture.,Agribot,https://www.crunchbase.com/organization/agribot-a3e9,"Agriculture, AgTech, Artificial Intelligence (AI), Robotics","Suzhou, Jiangsu, China, Asia",Funding Round - Agribot,https://www.crunchbase.com/funding_round/agribot-a3e9-undisclosed--f88b927b,1,Oriza Seed Capital (Oriza Yuandian),,,Funding Round,1,50000000,CNY,7931291,,,,50000000,CNY,7931291,Yes,,http://www.szbotian.com/,,,,"465,667"
2011-09-01,Shanghai Shipping Freight Exchange is a trading and e-commerce platform focused on international shipping freight trading and pricing.,Shanghai Shipping Freight Exchange,https://www.crunchbase.com/organization/shanghai-shipping-freight-exchange-co-ltd,E-Commerce,"Shanghai, Shanghai, China, Asia",Venture Round - Shanghai Shipping Freight Exchange,https://www.crunchbase.com/funding_round/shanghai-shipping-freight-exchange-co-ltd-series-unknown--51cf62eb,1,Tiantu Capital,,,Venture - Series Unknown,1,,,,,,,,,,Yes,,http://www.ssefc.com,Less than $1M,,,"474,441"
2011-12-01,L99 is a location-based service that provides with photo sharing options and other social features located in China.,L99.com,https://www.crunchbase.com/organization/l99-com,"Information Technology, Photo Sharing, Social Media","Beijing, Beijing, China, Asia",Series B - L99.com,https://www.crunchbase.com/funding_round/l99-com-series-b--2b4bc475,1,Tencent Industry Win-Win Fund,Early Stage Venture,,Series B,2,2270000,USD,2270000,,,,2270000,USD,2270000,Yes,,http://www.l99.com/update.php,,Early Stage Venture,,"470,209"
2011-09-02,YILANG Corporation is an online advertising and marketing services provider.,YILANG Corporation,https://www.crunchbase.com/organization/yilang-corporation,"Advertising, Digital Marketing, Marketing","Haidian, Beijing, China, Asia",Angel Round - YILANG Corporation,https://www.crunchbase.com/funding_round/yilang-corporation-angel--841c2481,1,Wei Venture Capital,Seed,,Angel,1,3000000,CNY,470004,,,,3000000,CNY,470004,Yes,,http://www.ylunion.com,,Seed,,"470,507"
2011-07-01,"Guangdong Hengxing Group is focused on feed products, aquatic products, seedling breeding, and domestic and international trade.",Guangdong Hengxing Group,https://www.crunchbase.com/organization/guangdong-hengxing-group,Manufacturing,"Zhanjiang, Guangxi, China, Asia",Venture Round - Guangdong Hengxing Group,https://www.crunchbase.com/funding_round/guangdong-hengxing-group-series-unknown--50d1c9c7,1,Legend Capital,,,Venture - Series Unknown,1,,,,,,,,,,Yes,,http://www.hx888.com,,,,"475,432"
2011-01-01,Diaochapai is an online survey questionnaire design and publishing platform.,Diaochapai,https://www.crunchbase.com/organization/diaochapai,"Internet, Product Design, Publishing","Chongqing Shi, Chongqing, China, Asia",Series A - Diaochapai,https://www.crunchbase.com/funding_round/diaochapai-series-a--80b4dda1,1,Shanda Interactive Entertainment Limited,Early Stage Venture,,Series A,1,3000000,CNY,454638,,,,3000000,CNY,454638,Yes,,https://www.diaochapai.com/,,Early Stage Venture,,"475,630"
2012-05-16,LEONIS Cinema is a national high-tech enterprise focusing on digital audio and video technology research and related product development.,LEONIS Cinema,https://www.crunchbase.com/organization/leonis-cinema,"Audio, Digital Entertainment, Video","Beijing, Beijing, China, Asia",Angel Round - LEONIS Cinema,https://www.crunchbase.com/funding_round/leonis-cinema-angel--d7bfd4e9,1,CSC Group,Seed,,Angel,1,3000000,CNY,474514,,,,3000000,CNY,474514,Yes,,http://www.leoniscinema.com/,,Seed,,"475,760"
2011-06-16,Phoenix Metropolis Media is an outdoor LED media operator company.,Phoenix Metropolis Media,https://www.crunchbase.com/organization/phoenix-metropolis-media,"Broadcasting, Digital Media, Outdoors","Beijing, Beijing, China, Asia",Venture Round - Phoenix Metropolis Media,https://www.crunchbase.com/funding_round/phoenix-metropolis-media-series-unknown--30d05403,1,Envision Capital,,,Venture - Series Unknown,1,194000100,CNY,29960420,,,,194000100,CNY,29960420,Yes,,https://www.pmm.cn/,,,,"480,584"
2011-09-01,Slanissue is a Chinese company that creates cartoon image brands to contribute for the children’s growth in China.,Slanissue,https://www.crunchbase.com/organization/beijing-slanissue-science-and-technology-co-ltd,"EdTech, Education, Internet","Beijing, Beijing, China, Asia",Venture Round - Slanissue,https://www.crunchbase.com/funding_round/beijing-slanissue-science-and-technology-co-ltd-series-unknown--09337e8e,1,Qiming Venture Partners,,,Venture - Series Unknown,1,10000000,USD,10000000,,,,10000000,USD,10000000,Yes,,http://www.slanissue.com/,$10M to $50M,,,"480,664"
2012-01-01,Chanyouji.com is a travelogue application that helps users make offline records throughout their entire trip and broadcast in on the web.,Chanyouji,https://www.crunchbase.com/organization/chanyouji,"Broadcasting, Travel, Video","Shanghai, Shanghai, China, Asia",Series A - Chanyouji,https://www.crunchbase.com/funding_round/chanyouji-series-a--7f3b11c8,1,Matrix Partners China,Early Stage Venture,,Series A,1,1000000,CNY,158626,,,,1000000,CNY,158626,Yes,,http://chanyouji.com,,Early Stage Venture,,"477,036"
2011-07-01,Gongkong is a news online platform.,Gongkong,https://www.crunchbase.com/organization/gongkong,"Information Services, Media and Entertainment, News","Haidian, Beijing, China, Asia",Post-IPO Equity - Gongkong,https://www.crunchbase.com/funding_round/gongkong-post-ipo-equity--7764c4e3,1,Zhejiang Paradise,,,Post-IPO Equity,1,20000000,CNY,3093413,,,,20000000,CNY,3093413,Yes,,http://www.gongkong.com,,IPO,,"477,125"
2011-11-29,Maslong is an information technology service provider in China.,Maslong,https://www.crunchbase.com/organization/maslong,"Information and Communications Technology (ICT), Information Technology, IT Infrastructure, Technical Support","Shenzhen, Guangdong, China, Asia",Series B - Maslong,https://www.crunchbase.com/funding_round/maslong-series-b--ab9dd4b4,1,Cowin Capital,Early Stage Venture,,Series B,2,20000000,CNY,3141175,,,,30000000,CNY,4605945,Yes,,https://www.maslong.com,,Early Stage Venture,,"477,244"
2011-05-01,CNZZ is a provider of online statistical analysis services in China.,CNZZ,https://www.crunchbase.com/organization/cnzz,"Analytics, Enterprise Software, Information Technology, Internet, Location Based Services, Online Auctions, Software","Chaoyang, Liaoning, China, Asia",Venture Round - CNZZ,https://www.crunchbase.com/funding_round/cnzz-series-unknown--f4966ea6,1,Alibaba Capital Partners,,,Venture - Series Unknown,2,15000000,USD,15000000,,,,15000000,USD,15000000,Yes,,http://cnzz.com,$1M to $10M,M&A,,"471,868"
2012-01-01,iRay Technology has a specialized focus on the R&D and production of amorphous silicon flat panel detectors.,iRay Technology,https://www.crunchbase.com/organization/iray-technology,"Manufacturing, Medical Device","Shanghai, Shanghai, China, Asia",Venture Round - iRay Technology,https://www.crunchbase.com/funding_round/iray-technology-series-unknown--1bf3ac88,1,Northern Light Venture Capital,,,Venture - Series Unknown,1,,,,,,,,,,Yes,,http://en.iraychina.com/,$10M to $50M,,,"471,970"
2012-01-01,Creditcard.com.cn is a credit card and financial service provider.,Creditcard.com.cn,https://www.crunchbase.com/organization/creditcard-com-cn,"Credit Cards, Financial Services, Payments","Jiading, Shanghai, China, Asia",Angel Round - Creditcard.com.cn,https://www.crunchbase.com/funding_round/creditcard-com-cn-angel--18282493,1,Ameba Capital,Seed,,Angel,1,3000000,CNY,475877,,,,3000000,CNY,475877,Yes,,http://www.creditcard.com.cn/,,M&A,,"482,503"
2011-03-01,Zhuhai OmeSoft is a Chinese company engaged in the development of mobile medical health-related products.,Zhuhai OmeSoft,https://www.crunchbase.com/organization/zhuhai-omesoft,"Hospitality, Information Technology, Medical, Mobile, Software","Zhuhai, Guangdong, China, Asia",Angel Round - Zhuhai OmeSoft,https://www.crunchbase.com/funding_round/zhuhai-omesoft-angel--754fbccc,1,Shanda Capital,Seed,,Angel,1,2000000,CNY,304399,,,,2000000,CNY,304399,Yes,,http://www.omesoft.com/,,Seed,,"482,540"
2011-08-19,"HUA YE LONG TU specializes in services of location service content, POI data and in-depth business information.",HUA YE LONG TU,https://www.crunchbase.com/organization/hua-ye-long-tu,"Big Data, Information Services, Location Based Services","Shenzhen, Guangdong, China, Asia",Series A - HUA YE LONG TU,https://www.crunchbase.com/funding_round/hua-ye-long-tu-series-a--53e6ddfb,1,Zhongda Venture Capital,Early Stage Venture,,Series A,1,10000000,CNY,1563889,,,,10000000,CNY,1563889,Yes,,http://china-map.cn/,,Early Stage Venture,,"472,338"
2011-12-01,Job1001 website is a Chinese recruitment network platform with an integrated consultative service for job hunting and recruitment.,Job1001,https://www.crunchbase.com/organization/job1001,"Internet, Recruiting, Social Network","Shenzhen, Guangdong, China, Asia",Venture Round - Job1001,https://www.crunchbase.com/funding_round/job1001-series-unknown--fe0d72fb,1,CDF-Capital,,,Venture - Series Unknown,1,4090000,CNY,642447,,,,4090000,CNY,642447,Yes,,http://www.job1001.com,,,,"469,671"
2011-09-01,Guangzhou ACG Life Technology Company Ltd manufactures and supplies home furniture products to children.,Guangzhou ACG Life Technology Company Ltd,https://www.crunchbase.com/organization/guangzhou-acg-life-technology-company-ltd,"Consumer Goods, Furniture, Manufacturing, Real Estate","Beijing, Beijing, China, Asia",Venture Round - Guangzhou ACG Life Technology Company Ltd,https://www.crunchbase.com/funding_round/guangzhou-acg-life-technology-company-ltd-series-unknown--a6b487ee,1,Tripod Capital,,,Venture - Series Unknown,1,,,,,,,,,,Yes,,,,,,"472,454"
2011-11-21,NANLING is an online used car transaction platform company.,NANLING,https://www.crunchbase.com/organization/nanling,"Automotive, Service Industry, Travel","Guangzhou, Guangdong, China, Asia",Series B - NANLING,https://www.crunchbase.com/funding_round/nanling-series-b--cb1bda0e,1,JD Capital,Early Stage Venture,,Series B,2,120000000,CNY,18864508,,,,194800000,CNY,29908311,Yes,,http://www.nanling.com.cn/,,IPO,,"472,467"
2012-03-06,Red Taste is a Sichuan flavored instant food e-commerce platform.,Red Taste,https://www.crunchbase.com/organization/red-taste,"E-Commerce, E-Commerce Platforms, Food and Beverage","Chengdu, Sichuan, China, Asia",Angel Round - Red Taste,https://www.crunchbase.com/funding_round/red-taste-angel--b9a1bfa0,1,Wei Venture Capital,Seed,,Angel,1,3000000,CNY,475325,,,,3000000,CNY,475325,Yes,,http://shop1512.vicp.net,,Seed,,"472,893"
2011-10-01,"Yikeyinpin provides printing, photo book production, photo storage, and photo sharing services.",Yikeyinpin,https://www.crunchbase.com/organization/yikeyinpin,"Photo Sharing, Photography, Printing","Guangzhou, Guangdong, China, Asia",Angel Round - Yikeyinpin,https://www.crunchbase.com/funding_round/yikeyinpin-angel--9fda1f6d,1,Hiway Capital,Seed,,Angel,1,3000000,CNY,469876,,,,3000000,CNY,469876,Yes,,http://www.ikefoto.com/,,Seed,,"473,376"
2011-09-01,"Neimonggu Saifeiya is focused on breeding ducks for flesh, cooked food production, chain catering trade, and more.",Neimonggu Saifeiya Group,https://www.crunchbase.com/organization/neimonggu-saifeiya-group,"Agriculture, Food and Beverage, Manufacturing","Chifeng, Nei Mongol, China, Asia",Venture Round - Neimonggu Saifeiya Group,https://www.crunchbase.com/funding_round/neimonggu-saifeiya-group-series-unknown--08ce7e22,1,PreIPO,,,Venture - Series Unknown,1,,,,,,,,,,Yes,,http://www.saifeiya.com,,,,"484,041"
2011-03-14,6hgame.com is an online game company that creates internet games.,6hgame.com,https://www.crunchbase.com/organization/6hgame-com,"Gaming, Internet, Online Games","Zhuhai, Guangdong, China, Asia",Angel Round - 6hgame.com,https://www.crunchbase.com/funding_round/6hgame-com-angel--a7930d82,1,Xunlei,Seed,,Angel,1,3000000,CNY,456718,,,,3000000,CNY,456718,Yes,,http://www.6hgame.com/,,Seed,,"479,145"
