2012-06-08,Robstep is a robotics research and development company.,Robstep,https://www.crunchbase.com/organization/robstep,"Electronics, Hardware, Robotics","Dongguang, Guangdong, China, Asia",Angel Round - Robstep,https://www.crunchbase.com/funding_round/robstep-angel--5ca096e8,2,"Dongguanshi Huake Zhizao Gongcheng Yanjiu Yuan Co., Ltd., Wuhan Ruobite Jiqiren Co., Ltd.",Seed,,Angel,2,3000000,CNY,470922,,,,13000000,CNY,2111398,Yes,,http://www.robstep.com,,Early Stage Venture,,"578,123"
2011-10-01,Yirendai is the consumer finance arm of Chinese peer-to-peer (P2P) lender CreditEase.,Yirendai,https://www.crunchbase.com/organization/yirendai,"Finance, Financial Services, FinTech, Lending","Beijing, Beijing, China, Asia",Series B - Yirendai,https://www.crunchbase.com/funding_round/yirendai-series-b--103a041f,2,"IDG Capital, KPCB China",Early Stage Venture,,Series B,2,,,,,,,324000000,CNY,49935654,Yes,,http://www.yirendai.com/,$1B to $10B,IPO,,"578,281"
2011-11-30,Mandala provides medical software and information technology services.,Mandala,https://www.crunchbase.com/organization/mandala-9d34,"Information Technology, Medical, Software","Wuxi Shi, Jiangsu, China, Asia",Series C - Mandala,https://www.crunchbase.com/funding_round/mandala-9d34-series-c--a35b97b1,2,"Changzhou Defengjie, Huatai Zijin Investment",Late Stage Venture,,Series C,9,1800000,CNY,282272,,,,119047800,CNY,18822638,Yes,,http://www.mandalat.com.cn/,$1M to $10M,IPO,,"578,303"
2011-12-01,"Gewara is a Chinese domestic life network platform that combines information, user communities, and business interactions.",Gewara,https://www.crunchbase.com/organization/gewara,"Business Development, Film, Internet, Sports","Shanghai, Shanghai, China, Asia",Angel Round - Gewara,https://www.crunchbase.com/funding_round/gewara-angel--e96e9e5f,2,"CDH Investments, Shanda Capital",Seed,,Angel,3,,,,,,,52000000,USD,52000000,Yes,,http://www.gewara.com,$500M to $1B,Late Stage Venture,,"567,858"
2012-01-01,"AI Speech Ltd is a high-tech start up specialized in computer speech recognition, analysis.",AISpeech,https://www.crunchbase.com/organization/aispeech,"Analytics, Artificial Intelligence (AI), Computer, Enterprise Software, Generative AI","Jiangshan, Zhejiang, China, Asia",Series A - AISpeech,https://www.crunchbase.com/funding_round/aispeech-series-a--e85147e6,2,"Legend Star, Lotus Lake Ventures",Early Stage Venture,,Series A,9,,,,,,,275259944,USD,275259944,Yes,,http://www.aispeech.com,$50M to $100M,Private Equity,,"567,987"
2011-04-18,Dalian Dacheng Car Rental is a car rental company that helps solve emergency needs.,"Dalian Dacheng Car Rental Co., Ltd",https://www.crunchbase.com/organization/dalian-dacheng-car-rental-co-ltd,"Automotive, Rental, Retail","Dalian Shi, Liaoning, China, Asia","Angel Round - Dalian Dacheng Car Rental Co., Ltd",https://www.crunchbase.com/funding_round/dalian-dacheng-car-rental-co-ltd-angel--7953f788,2,"Dalian Jialian Keji, Dalian Zhongyu Maoyi",Seed,,Angel,3,3000000,CNY,459503,,,,33000000,CNY,5031807,Yes,,http://www.dldacheng.cn/,,Early Stage Venture,,"575,166"
2012-01-01,enterprise service,Kkeye,https://www.crunchbase.com/organization/kkeye,,"Beijing, Beijing, China, Asia",Series B - Kkeye,https://www.crunchbase.com/funding_round/kkeye-series-b--7855bc6b,2,"Headline Asia (formerly Infinity Ventures), IDG Capital",Early Stage Venture,,Series B,4,,,,,,,,,,Yes,,https://www.kkeye.com,,Late Stage Venture,,"575,404"
2011-05-01,Guidance Education provides research and development services for internet education software products.,Guidance Education,https://www.crunchbase.com/organization/guidance-education,"Education, Industrial, Information Technology","Xian Shi, Shaanxi, China, Asia",Series A - Guidance Education,https://www.crunchbase.com/funding_round/guidance-education-series-a--5e6a4733,2,"Baifuyuan Investment, Tiantu Capital",Early Stage Venture,,Series A,3,22500000,CNY,3466329,,,,72500000,CNY,11272410,Yes,,http://daoxueedu.com/,,Late Stage Venture,,"579,480"
2012-05-29,reLife is an online store for second-hand mobile phones.,reLife,https://www.crunchbase.com/organization/relife,"Consumer Electronics, E-Commerce, Mobile","Haidian, Beijing, China, Asia",Angel Round - reLife,https://www.crunchbase.com/funding_round/relife-angel--bc7eeeac,2,"Shunwei Capital, Sinovation Ventures",Seed,,Angel,4,3000000,CNY,473161,,,,29000000,CNY,4365069,Yes,,http://www.fview.cn,,Early Stage Venture,,"579,571"
2011-09-30,Bale.cn is an entertainment company that specializes in film distribution and television production.,Bale.cn,https://www.crunchbase.com/organization/bale-cn,"Film Distribution, Media and Entertainment, TV Production","Beijing, Beijing, China, Asia",Angel Round - Bale.cn,https://www.crunchbase.com/funding_round/bale-cn-angel--c4df539d,2,"Ku6, Shanda Interactive Entertainment Limited",Seed,,Angel,3,20000000,CNY,3133658,,,,130000000,CNY,20989483,Yes,,http://www.bale.cn,,Early Stage Venture,,"580,160"
2011-10-01,Gaopeng.com is a group-buying website that offers discounts to customers at local merchants in China via daily emails.,Gaopeng,https://www.crunchbase.com/organization/gaopeng,"E-Commerce, Internet, Local","Beijing, Beijing, China, Asia",Series C - Gaopeng,https://www.crunchbase.com/funding_round/gaopeng-series-c--f2df096e,2,"Legend Capital, Tencent Industry Win-Win Fund",Late Stage Venture,,Series C,4,15000000,USD,15000000,,,,50000000,USD,50000000,Yes,,http://www.gaopeng.com/,$1M to $10M,Late Stage Venture,,"580,211"
2011-12-01,Shenzhen Belter Health is a Chinese technology service provider focused on the development of intelligent medical health products.,Belter Health,https://www.crunchbase.com/organization/shenzhen-belter-health,"Health Care, Hospital, Medical, Sports","Shenzhen, Guangdong, China, Asia",Series B - Belter Health,https://www.crunchbase.com/funding_round/shenzhen-belter-health-series-b--6790d12d,1,Fosun International,Early Stage Venture,,Series B,2,,,,,,,18000000,CNY,2749161,Yes,,http://www.belter.com.cn,Less than $1M,Early Stage Venture,,"570,001"
2011-06-24,Haiwan Hoisting is a lifting equipment manufacturer company.,Haiwan Hoisting,https://www.crunchbase.com/organization/haiwan-hoisting,"Industrial, Machinery Manufacturing, Manufacturing","Zibo, Shandong, China, Asia",Angel Round - Haiwan Hoisting,https://www.crunchbase.com/funding_round/haiwan-hoisting-angel--a0813f7d,2,"Baidawei Jinchukou, Rongxi Venture",Seed,,Angel,3,3000000,CNY,463391,,,,33000000,CNY,4938557,Yes,,http://www.hwlifting.com/,,Early Stage Venture,,"580,277"
2011-03-18,Sichuan Business Easy provides gift card design and application for shopping online and offline.,Sichuan Business Easy,https://www.crunchbase.com/organization/sichuan-business-easy-co-ltd,"E-Commerce, Gift Card, Payments, Shopping","Chengdu, Sichuan, China, Asia",Angel Round - Sichuan Business Easy,https://www.crunchbase.com/funding_round/sichuan-business-easy-co-ltd-angel--037fe636,2,"Chengdu Mengting Electronic Commerce, Shenzhen Yihuayi Furniture Industry",Seed,,Angel,3,3000000,CNY,456627,,,,106000000,CNY,16582871,Yes,,https://www.scshangtong.com/,,Early Stage Venture,,"580,461"
2011-07-25,SECWORLD provides information and network security solutions.,SECWORLD,https://www.crunchbase.com/organization/secworld,"Cloud Management, Information Technology, Network Security","Haidian, Beijing, China, Asia",Series A - SECWORLD,https://www.crunchbase.com/funding_round/secworld-series-a--6b24bf3f,1,Oriental Fortune Capital,Early Stage Venture,,Series A,1,230000,USD,230000,,,,230000,USD,230000,Yes,,https://www.legendsec.com/,$1M to $10M,Early Stage Venture,,"570,507"
2012-06-01,YOHO.CN provides integrated multiple cross-media communication services for trendy brands and resources.,YOHO,https://www.crunchbase.com/organization/yoho,"Internet, Shopping","Nanjing, Jiangsu, China, Asia",Series B - YOHO,https://www.crunchbase.com/funding_round/yoho-series-b--f7ff7f92,2,"BAI capital, CDH Investments",Early Stage Venture,,Series B,7,10000000,USD,10000000,,,,165000000,USD,165000000,Yes,,http://yoho.cn,$1M to $10M,Late Stage Venture,,"570,709"
2011-11-01,OneSmart International Education Group is the largest premium K-12 after-school education service provider in China.,OneSmart International Education Group,https://www.crunchbase.com/organization/onesmart-international-education-group-ltd,"Education, Higher Education, Secondary Education","Putuo, Shanghai, China, Asia",Series C - OneSmart International Education Group,https://www.crunchbase.com/funding_round/onesmart-international-education-group-ltd-series-c--5d288ad6,1,5Y Capital,Late Stage Venture,,Series C,5,,,,,,,25000000,CNY,3575566,Yes,,http://www.onesmart.org/,Less than $1M,IPO,1,"571,777"
2011-01-17,happypingpang.com is an online interactive community for sports that provides skills and knowledge discussion.,happypingpang.com,https://www.crunchbase.com/organization/happypingpang-com,"Information Services, Social Network, Sports","Suzhou, Jiangsu, China, Asia",Angel Round - happypingpang.com,https://www.crunchbase.com/funding_round/happypingpang-com-angel--b464f000,2,"Gusu Fenghui Touzi, JiangSu QianRong Assets Management",Seed,,Angel,2,3000000,CNY,455004,,,,13000000,CNY,2072434,Yes,,http://www.happypingpang.com/,,Early Stage Venture,,"571,905"
2011-07-27,Bluestar Technology engages in the field of computer graphics systems.,Bluestar Technology,https://www.crunchbase.com/organization/bluestar-technology,"Computer, Information Technology, Software","Wuhan, Hubei, China, Asia",Angel Round - Bluestar Technology,https://www.crunchbase.com/funding_round/bluestar-technology-angel--b5486cce,2,"Huahong Jingkai Investment, Qianxi Taihe Chuangtou",Seed,,Angel,3,3000000,CNY,465604,,,,38300000,CNY,6092949,Yes,,http://www.hiinfo.cn/,,IPO,,"581,134"
2012-01-01,Rong 360 is a Chinese provider of customized financing and loan services.,Rong360,https://www.crunchbase.com/organization/rong360,"Credit, Finance, Financial Services","Beijing, Beijing, China, Asia",Seed Round - Rong360,https://www.crunchbase.com/funding_round/rong360-seed--17b04e34,2,"Chenchao Zhuang, Qunar.com",Seed,,Seed,5,,,,,,,222000000,USD,222000000,Yes,,http://rong360.com,$100M to $500M,Late Stage Venture,,"581,329"
2011-04-18,"Chongde Dongman is an animation company that offers animation works, character education products, and services.",Chongde Dongman,https://www.crunchbase.com/organization/chongde-dongman,"Animation, Education, Media and Entertainment","Shenzhen, Guangdong, China, Asia",Angel Round - Chongde Dongman,https://www.crunchbase.com/funding_round/chongde-dongman-angel--efd955e5,2,"Qingdao Chuban Touzi Youxian Gongsi, Shandong Xueye Wenhua Chuangyiyuan Youxian Gongsi",Seed,,Angel,5,12000000,CNY,1838013,,,,111350000,CNY,17204261,Yes,,http://www.kz928.com,,IPO,,"572,611"
2011-07-25,Percent specializes in providing Big Data and AI products and solutions.,Percent,https://www.crunchbase.com/organization/percent-04f1,"Analytics, Artificial Intelligence (AI), Big Data, Information Technology, Machine Learning","Beijing, Beijing, China, Asia",Series A - Percent,https://www.crunchbase.com/funding_round/percent-04f1-series-a--2be862cc,2,"IDG Capital, Mingxin China Growth Fund",Early Stage Venture,,Series A,2,7200000,USD,7200000,,,,17200000,USD,17200000,Yes,,https://www.percent.cn/,,Early Stage Venture,,"574,267"
2012-01-01,GMobile is a mobile advertising and marketing platform.,GMobile,https://www.crunchbase.com/organization/gmobile,"Advertising, Information Technology, Marketing, Mobile Advertising","Xian Shi, Shaanxi, China, Asia",Series A - GMobile,https://www.crunchbase.com/funding_round/gmobile-series-a--2f70ec07,2,"Eagles Fund, Ferry Venture Capital",Early Stage Venture,,Series A,5,9600000,CNY,1522808,,,,71100000,CNY,11206106,Yes,,http://www.gmgm.io/,,Late Stage Venture,,"574,367"
2011-10-10,"SOUL offers information security and storage, data calculation and application services.",SOUL,https://www.crunchbase.com/organization/soul-com,"Big Data, Information Technology, Security","Wuxi Shi, Jiangsu, China, Asia",Angel Round - SOUL,https://www.crunchbase.com/funding_round/soul-com-angel--d6cc8b43,2,"Leading Capital, Wuxi Huishan Tianfu Zengzhi Touzi Qiye",Seed,,Angel,2,3000000,CNY,471969,,,,12999900,CNY,1877298,Yes,,http://www.soul.com.cn/,,IPO,,"574,434"
2011-04-01,"Youbei Game is a children network game company in China, that is focused on children and teenagers.",Youbei Game,https://www.crunchbase.com/organization/youbei-game,"Children, Enterprise Software, Gaming, Internet, Online Games","Shanghai, Shanghai, China, Asia",Angel Round - Youbei Game,https://www.crunchbase.com/funding_round/youbei-game-angel--0b851b7b,2,"Green Pine Capital Partners, Zero2IPO Ventures",Seed,,Angel,2,,,,,,,1000000,USD,1000000,Yes,,http://company.2121.com,,Early Stage Venture,,"574,501"
2012-05-04,Shenzhen Guanglian News is a digital operation service provider in the automobile circulation industry.,Guang Liansai Xun,https://www.crunchbase.com/organization/guang-liansai-xun,Automotive,"Shenzhen, Guangdong, China, Asia",Seed Round - Guang Liansai Xun,https://www.crunchbase.com/funding_round/guang-liansai-xun-seed--82186df4,2,"Xinhongyou Guquan Touzi, Zhenghe Fangda Investment",Seed,,Seed,3,1000000,CNY,158574,,,,154000000,CNY,23522517,Yes,,http://www.glsx.com.cn/,,Early Stage Venture,,"574,520"
2011-02-28,MNCHIP is a provider of microfluidics devices in in-vitro diagnostics.,MNCHIP,https://www.crunchbase.com/organization/mnchip,"Biotechnology, Health Care, Medical, Medical Device","Wuqing, Tianjin, China, Asia",Angel Round - MNCHIP,https://www.crunchbase.com/funding_round/mnchip-angel--7e83af07,2,"Fortune Venture Capital, Legend Star",Seed,,Angel,3,3000000,CNY,456465,,,,33000000,CNY,5311015,Yes,,https://en.mnchip.com/,,Early Stage Venture,,"574,713"
2011-06-07,Beijing Centaur Technology Development is an ERP software company providing e-commerce solutions of information management.,Centaur,https://www.crunchbase.com/organization/centaur,"E-Commerce, Enterprise Resource Planning (ERP), Enterprise Software, Information Technology, Software","Beijing, Beijing, China, Asia",Series A - Centaur,https://www.crunchbase.com/funding_round/centaur-series-a--0d217e94,2,"K2VC, Sequoia Capital",Early Stage Venture,,Series A,8,4200000,USD,4200000,,,,30506854,USD,30506854,Yes,,http://www.centaur.cn,$50M to $100M,,,"576,143"
2012-01-01,QingCloud is a cloud computing platform that provides IaaS-based flexible cloud services.,QingCloud,https://www.crunchbase.com/organization/qingcloud,"Cloud Computing, IaaS, SaaS, Software, Web Hosting","Beijing, Beijing, China, Asia",Series A - QingCloud,https://www.crunchbase.com/funding_round/qingcloud-series-a--c094c11d,1,UnityVC,Early Stage Venture,,Series A,4,2000000,USD,2000000,,,,280832709,USD,280832709,Yes,,http://qingcloud.com,$50M to $100M,IPO,,"576,216"
2012-01-20,1cloud operates as a music application service provider.,1cloud,https://www.crunchbase.com/organization/1cloud,"Media and Entertainment, Mobile Apps, Music","Minghang, Shanghai, China, Asia",Angel Round - 1cloud,https://www.crunchbase.com/funding_round/1cloud-angel--de92ba24,2,"TOUCH WOOD, Xinwang Wangluo",Seed,,Angel,5,3000000,CNY,473684,,,,113000000,CNY,17303010,Yes,,http://www.1cloud.cn/,,Late Stage Venture,,"576,312"
2012-04-09,Techbridge provides audio and video services.,Techbridge,https://www.crunchbase.com/organization/techbridge-f412,"Software, Video Conferencing","Xiaoshan, Zhejiang, China, Asia",Series A - Techbridge,https://www.crunchbase.com/funding_round/techbridge-f412-series-a--59b4ffcc,2,"Tonghui Equity Investment Fund Management, Xiaoshan International Venture Capital Development",Early Stage Venture,,Series A,5,10000000,CNY,1585004,,,,113000000,CNY,17442216,Yes,,https://www.techbridge-inc.com/,,Late Stage Venture,,"576,522"
2012-03-01,BCY Pharm is a drugs research and development company.,"BCY Pharm Co., Ltd",https://www.crunchbase.com/organization/bcy-pharm-co-ltd,"Biotechnology, Pharmaceutical, Sales","Suzhou, Jiangsu, China, Asia","Angel Round - BCY Pharm Co., Ltd",https://www.crunchbase.com/funding_round/bcy-pharm-co-ltd-angel--460fde8c,2,"Oriza Holdings, Suzhou Gongyeyuan Chuangtou Yindao Jijin",Seed,,Angel,2,3000000,CNY,476286,,,,13000000,CNY,2040213,Yes,,http://bcypharm.com,,M&A,,"576,565"
2011-11-01,Nanda Wuwei is a sensor imaging equipment development company.,Nanda Wuwei,https://www.crunchbase.com/organization/nanda-wuwei,"Information Services, Internet of Things, Sensor","Nanjing, Jiangsu, China, Asia",Angel Round - Nanda Wuwei,https://www.crunchbase.com/funding_round/nanda-wuwei-angel--968837c8,2,"Nanjing Xincheng Kejiyuan Jianshe Fazhan, Qianxi Taihe Chuangtou",Seed,,Angel,4,3000000,CNY,472058,,,,63000000,CNY,9449508,Yes,,http://www.tech-5d.com/,,Late Stage Venture,,"576,583"
2011-01-01,Teewon is an internet education platform that provides education information system integration services.,Teewon,https://www.crunchbase.com/organization/teewon,"Education, Information Services, Information Technology","Beijing, Beijing, China, Asia",Venture Round - Teewon,https://www.crunchbase.com/funding_round/teewon-series-unknown--9a216d33,2,"China South Publishing & Media Group, Huawei",,,Venture - Series Unknown,3,320000000,CNY,48494746,,,,380000000,CNY,58117429,Yes,,http://www.twsm.com.cn/,,Early Stage Venture,,"577,047"
2011-05-26,"Jilin Zhongke Bio-Engineering engages in stem cell collection, stem cell preparation of production, transplantation, and other services.",Jilin Zhongke Bio-Engineering,https://www.crunchbase.com/organization/jilin-zhongke-bio-engineering,"Biotechnology, Health Care, Medical","Changchun, Jilin, China, Asia",Series A - Jilin Zhongke Bio-Engineering,https://www.crunchbase.com/funding_round/jilin-zhongke-bio-engineering-series-a--7fbadc11,2,"Chengpu Touzi, Shanghai Xinhu Venture Capital",Early Stage Venture,,Series A,3,13000000,CNY,2002606,,,,19000000,CNY,2905163,Yes,,http://www.stemcellcn.com/,,IPO,,"577,139"
2011-01-30,ZlinePay provides mobile payment solutions.,ZlinePay,https://www.crunchbase.com/organization/zlinepay,"FinTech, Mobile Payments, Payments","Chengdu Shi, Sichuan, China, Asia",Series B - ZlinePay,https://www.crunchbase.com/funding_round/zlinepay-series-b--d2e48a5e,2,"ABC Capital, China Investment LuckyStone Management",Early Stage Venture,,Series B,8,20000000,CNY,3034674,,,,213000000,CNY,33532389,Yes,,http://www.zlinepay.com,,IPO,,"569,256"
2011-12-19,XYWY.COM is an internet medical service platform based in China.,XYWY.COM,https://www.crunchbase.com/organization/xywy-com,"Health Care, Internet, Medical","Shunyi, Beijing, China, Asia",Series A - XYWY.COM,https://www.crunchbase.com/funding_round/xywy-com-series-a--cb95bd42,2,"Danen Capital, YF Capital",Early Stage Venture,,Series A,3,20000000,CNY,3157998,,,,43000000,CNY,6854833,Yes,,http://www.xywy.com/,,Early Stage Venture,,"569,403"
2012-01-01,"Shanghai Nouriz Dairy Co., Ltd. is a professional health food business enterprise.",Shanghai Nouriz Dairy,https://www.crunchbase.com/organization/shanghai-nouriz-dairy,"Agriculture, Food and Beverage, Health Care, Manufacturing, Therapeutics","Shanghai, Shanghai, China, Asia",Venture Round - Shanghai Nouriz Dairy,https://www.crunchbase.com/funding_round/shanghai-nouriz-dairy-series-unknown--ebb53f62,1,Legend Capital,,,Venture - Series Unknown,1,,,,,,,,,,Yes,,https://www.nouriz.com/,,,,"569,671"
2011-10-12,PrizExpress is a public redeem and shopping platform.,PrizExpress,https://www.crunchbase.com/organization/prizexpress,"E-Commerce, Retail, Shopping","Chengdu, Sichuan, China, Asia",Angel Round - PrizExpress,https://www.crunchbase.com/funding_round/prizexpress-angel--1fc40dee,1,Lang Sheng Investment,Seed,,Angel,2,3000000,CNY,471758,,,,13000000,CNY,1925204,Yes,,http://www.prizexpress.com,,Early Stage Venture,,"581,573"
2012-03-01,"Zapya is an application for cross-platform file transfer, enabling high-speed mass data transfer between smartphone users.",Zapya,https://www.crunchbase.com/organization/zapya,"File Sharing, Peer to Peer, Wireless","Beijing, Beijing, China, Asia",Angel Round - Zapya,https://www.crunchbase.com/funding_round/zapya-angel--e17c3008,1,Ferry Venture Capital,Seed,,Angel,3,,,,,,,20000000,USD,20000000,Yes,,http://kuaiya.cn,Less than $1M,Early Stage Venture,,"581,641"
2011-08-01,Eayun is a cloud computing service provider offering products such as the Eayun private cloud system.,Eayun,https://www.crunchbase.com/organization/eayun,Mobile,"Beijing, Beijing, China, Asia",Series A - Eayun,https://www.crunchbase.com/funding_round/eayun-series-a--cf3b3339,1,China Equity,Early Stage Venture,,Series A,3,,,,,,,,,,Yes,,http://www.eayun.cn,$1M to $10M,Early Stage Venture,,"581,654"
2011-10-01,Eayun is a cloud computing service provider offering products such as the Eayun private cloud system.,Eayun,https://www.crunchbase.com/organization/eayun,Mobile,"Beijing, Beijing, China, Asia",Venture Round - Eayun,https://www.crunchbase.com/funding_round/eayun-series-unknown--9f973fce,1,China Equity,,,Venture - Series Unknown,3,,,,,,,,,,Yes,,http://www.eayun.cn,$1M to $10M,Early Stage Venture,,"581,664"
2011-01-01,Sinobpo is a Chinese high-tech enterprise specialized in providing city information services.,Sinobpo,https://www.crunchbase.com/organization/sinobpo,"Apps, Enterprise Software, Information Services","Beijing, Beijing, China, Asia",Venture Round - Sinobpo,https://www.crunchbase.com/funding_round/sinobpo-series-unknown--4ddd9a23,1,Shenzhen Capital Group,,,Venture - Series Unknown,3,,,,,,,2713742,USD,2713742,Yes,,http://www.sinobpo.com/,$50M to $100M,,,"581,834"
2011-03-01,Secco Century Digital Technology is a high-tech enterprise providing advanced solutions for the digital TV and new media sectors.,Secco Century Digital Technology,https://www.crunchbase.com/organization/beijing-secco-century-digital-technology-co-ltd,"Information Technology, News","Shenzhen, Guangdong, China, Asia",Series A - Secco Century Digital Technology,https://www.crunchbase.com/funding_round/beijing-secco-century-digital-technology-co-ltd-series-a--9ce70a19,1,Shenzhen Capital Group,Early Stage Venture,,Series A,2,,,,,,,,,,Yes,,http://www.cyclecentury.com,$1M to $10M,Early Stage Venture,,"581,848"
2011-01-17,PPM Solution is a manufacturer of automotive parts and components.,PPM Solution,https://www.crunchbase.com/organization/ppm-solution,"Automotive, Manufacturing, Mining","Shenzhen, Guangdong, China, Asia",Angel Round - PPM Solution,https://www.crunchbase.com/funding_round/ppm-solution-angel--f01354c7,1,Shenzhen Capital Group,Seed,,Angel,5,30000000,CNY,4550038,,,,223930000,CNY,34110017,Yes,,http://www.ppmsolution.com/,,IPO,,"581,863"
2012-03-22,Aukey operates as a cross-border electronic commerce company that develops and manufactures portable energy storage power.,Aukey,https://www.crunchbase.com/organization/aukey-b11f,"Consumer Goods, E-Commerce, Electronics","Longgang, Guangdong, China, Asia",Angel Round - Aukey,https://www.crunchbase.com/funding_round/aukey-b11f-angel--227d0566,1,Shenzhen Capital Group,Seed,,Angel,6,30000000,CNY,4759613,,,,381480000,CNY,57042886,Yes,,https://www.aukeys.com,$1M to $10M,IPO,,"581,857"
2011-03-08,MINGYA INSURANCE BROKERS is a personal insurance marketing company.,MINGYA INSURANCE BROKERS,https://www.crunchbase.com/organization/mingya-insurance-brokers,"Financial Services, Insurance, Marketing","Beijing, Beijing, China, Asia",Angel Round - MINGYA INSURANCE BROKERS,https://www.crunchbase.com/funding_round/mingya-insurance-brokers-angel--f3636e49,1,Ruiye Touzi,Seed,,Angel,4,3000000,CNY,456666,,,,63000000,CNY,9649260,Yes,,http://www.mingya.com.cn/,,Late Stage Venture,,"587,154"
2012-01-01,"Gotion High-tech researches, develops, manufacture and markets lithium batteries.",Gotion High-tech,https://www.crunchbase.com/organization/guoxuan-high-tech,"Automotive, Battery, Manufacturing","Hefei, Anhui, China, Asia",Private Equity Round - Gotion High-tech,https://www.crunchbase.com/funding_round/guoxuan-high-tech-private-equity--4d64f2a4,1,Kingdom Capital,Private Equity,,Private Equity,2,,,,,,,300000000,EUR,315838346,Yes,,http://www.gotion.com.cn,$1B to $10B,IPO,,"588,960"
2012-01-01,"GigaDevice, the leading provider of Non-Volatile Memory (NVM) devices. ",GigaDevice,https://www.crunchbase.com/organization/gigadevice,"Consumer Electronics, Electronics, Semiconductor","Haidian, Beijing, China, Asia",Venture Round - GigaDevice,https://www.crunchbase.com/funding_round/gigadevice-series-unknown--96d16f9e,1,Tengye Ventures,,,Venture - Series Unknown,4,,,,,,,30000000,CNY,4708802,Yes,,http://www.gigadevice.com,,IPO,,"584,711"
2011-09-22,FRONWARE SOFTWARE focuses on independent research and the development of virtualization technology.,FRONWARE SOFTWARE,https://www.crunchbase.com/organization/fronware-software,"Information Services, Information Technology, Software, Virtualization","Haidian, Beijing, China, Asia",Angel Round - FRONWARE SOFTWARE,https://www.crunchbase.com/funding_round/fronware-software-angel--90cfdde5,1,Venustech,Seed,,Angel,2,3000000,CNY,469212,,,,13000000,CNY,2037898,Yes,,http://www.fronware.com/,,Early Stage Venture,,"585,414"
2012-05-10,WINHONG provides cloud computing key technology services.,WINHONG,https://www.crunchbase.com/organization/winhong,"Big Data, Cloud Computing, Information Technology","Guangzhou, Guangdong, China, Asia",Angel Round - WINHONG,https://www.crunchbase.com/funding_round/winhong-angel--ba78269a,1,Yueshang Chuangtou,Seed,,Angel,5,3000000,CNY,475107,,,,73360000,CNY,11799241,Yes,,http://winhong.com,,IPO,,"594,116"
