2013-08-27,"JIANGSU KAITOP is an IT company that provides cloud computing, internet of things and information asset management services.",JIANGSU KAITOP,https://www.crunchbase.com/organization/jiangsu-kaitop,"Asset Management, Cloud Computing, Information Services, Information Technology, Internet of Things","Wuxi Shi, Jiangsu, China, Asia",Angel Round - JIANGSU KAITOP,https://www.crunchbase.com/funding_round/jiangsu-kaitop-angel--da3bef8a,1,Jiangsu HopeRun Software,Seed,,Angel,1,3000000,CNY,489568,,,,3000000,CNY,489568,Yes,,http://www.kaituo.com.cn/,,Seed,,"453,806"
2014-03-06,Lewanduo is a distributor and operator of mobile games.,Lewanduo,https://www.crunchbase.com/organization/lewanduo,"Casual Games, Information Technology, Online Games","Beijing, Beijing, China, Asia",Angel Round - Lewanduo,https://www.crunchbase.com/funding_round/lewanduo-angel--42133eaf,1,Ping An Ventures,Seed,,Angel,1,3000000,CNY,490113,,,,3000000,CNY,490113,Yes,,http://www.lewanba.com,,Seed,,"447,486"
2014-01-01,PapayaMobile connects games to people through social platforms globally.,PapayaMobile,https://www.crunchbase.com/organization/papayamobile,"Android, Enterprise Software, Mobile, Wireless","Beijing, Beijing, China, Asia",Venture Round - PapayaMobile,https://www.crunchbase.com/funding_round/papayamobile-series-unknown--9d44ad79,1,Tengye Ventures,,,Venture - Series Unknown,3,,,,,,,22000000,USD,22000000,Yes,,https://www.papayamobile.com,$10M to $50M,,,"447,872"
2014-01-01,China International Travel Service is a travel company specialiszng in servicing all travel needs for local and foreign visitors alike.,China International Travel Service,https://www.crunchbase.com/organization/china-international-travel-service-limited-head-office,"Leisure, Tourism, Travel","Beijing, Beijing, China, Asia",Post-IPO Equity - China International Travel Service,https://www.crunchbase.com/funding_round/china-international-travel-service-limited-head-office-post-ipo-equity--bf83114f,1,Zhonghe Capital,,,Post-IPO Equity,1,,,,,,,,,,Yes,,http://www.cits.net,Less than $1M,IPO,,"447,668"
2014-01-01,Thumb Reading is a social-sharing application that enables readers to discuss facts with others having similar interests.,Thumb Reading,https://www.crunchbase.com/organization/thumb-reading,"Photography, Video","Shanghai, Shanghai, China, Asia",Angel Round - Thumb Reading,https://www.crunchbase.com/funding_round/thumb-reading-angel--08122f65,1,Matrix Partners China,Seed,,Angel,1,1000000,CNY,164870,,,,1000000,CNY,164870,Yes,,http://www.mzread.com,,Seed,,"448,907"
2014-01-01,Ankeyunda Air Service is a third-party air travel service operation platform building a convenient cooperation channel for travel agencies.,Ankeyunda Air Service,https://www.crunchbase.com/organization/ankeyunda-air-service,"Air Transportation, Travel","Beijing, Beijing, China, Asia",Venture Round - Ankeyunda Air Service,https://www.crunchbase.com/funding_round/ankeyunda-air-service-series-unknown--f8235f9a,1,Tianjin Venture Capital,,,Venture - Series Unknown,1,,,,,,,,,,Yes,,http://www.ankeyunda.com,$1M to $10M,,,"449,711"
2014-01-01,"Beijing Worldia Diamond Tools is involved in the production, sales, and service of diamond-cutting tools.",Beijing Worldia Diamond Tools,https://www.crunchbase.com/organization/beijing-worldia-diamond-tools,"Manufacturing, Retail","Chaoyang, Liaoning, China, Asia",Venture Round - Beijing Worldia Diamond Tools,https://www.crunchbase.com/funding_round/beijing-worldia-diamond-tools-series-unknown--8a44607f,1,Northern Light Venture Capital,,,Venture - Series Unknown,1,,,,,,,,,,Yes,,http://www.worldiatools.com,$50M to $100M,IPO,,"449,829"
2013-09-12,syyx.com is an online game development company.,syyx.com,https://www.crunchbase.com/organization/syyx-com,"Information Technology, Online Games, Publishing, Software","Shenzhen, Guangdong, China, Asia",Angel Round - syyx.com,https://www.crunchbase.com/funding_round/syyx-com-angel--919475e2,1,IDG Capital,Seed,,Angel,1,3000000,CNY,489826,,,,3000000,CNY,489826,Yes,,https://www.syyx.com/,,Seed,,"450,128"
2013-12-18,Diyibo is an online game development company.,Diyibo,https://www.crunchbase.com/organization/diyibo,"Animation, Gaming, PC Games","Shenzhen, Guangdong, China, Asia",Series A - Diyibo,https://www.crunchbase.com/funding_round/diyibo-series-a--cb7ca0ae,1,Dinglong Culture,Early Stage Venture,,Series A,1,50000000,CNY,8213071,,,,50000000,CNY,8213071,Yes,,http://www.szdiyibo.com,,M&A,,"453,220"
2014-01-01,DouWu is a developer of mobile MOBA.,DouWu,https://www.crunchbase.com/organization/douwu,"Gaming, Information Technology, Internet, Mobile","Shanghai, Shanghai, China, Asia",Venture Round - DouWu,https://www.crunchbase.com/funding_round/douwu-series-unknown--39d69d0b,1,Northern Light Venture Capital,,,Venture - Series Unknown,1,,,,,,,,,,Yes,,,,,,"448,549"
2013-07-07,Kinect base education solution for pre-school kids from 3-6,Heyha,https://www.crunchbase.com/organization/heyha,EdTech,"Beijing, Beijing, China, Asia",Non Equity Assistance - Heyha,https://www.crunchbase.com/funding_round/heyha-non-equity-assistance--f932806e,1,Microsoft Accelerator,,,Non-equity Assistance,1,,,,,,,,,,No,,http://www.heyha.com,,,,"451,503"
2013-10-01,Fengfan is a car battery manufacturer producing15 million pieces of batteries each year.,Fengfan,https://www.crunchbase.com/organization/fengfan,"Battery, Manufacturing","Hebei, Hebei, China, Asia",Venture Round - Fengfan,https://www.crunchbase.com/funding_round/fengfan-series-unknown--4c18f169,1,Zhonghe Capital,,,Venture - Series Unknown,1,,,,,,,,,,Yes,,http://en.sail-yz.com/,,,,"449,228"
2013-12-06,Shenzhen United Property Rights Exchange is a property rights trading platform.,Shenzhen United Property Rights Exchange,https://www.crunchbase.com/organization/shenzhen-united-property-rights-exchange,"Asset Management, Finance, Trading Platform","Shenzhen, Guangdong, China, Asia",Series B - Shenzhen United Property Rights Exchange,https://www.crunchbase.com/funding_round/shenzhen-united-property-rights-exchange-series-b--db037a36,1,HFT Capital,Early Stage Venture,,Series B,3,20000000,CNY,3283348,,,,33000000,CNY,5255203,Yes,,https://www.sotcbb.com,,Early Stage Venture,,"449,623"
2014-02-01,Knewbi.com is a service community for developers who are focused on creative hardware.,Knewbi.com,https://www.crunchbase.com/organization/knewbi-com,"Hardware, Mobile, Software","Nanshan, Hunan, China, Asia",Angel Round - Knewbi.com,https://www.crunchbase.com/funding_round/knewbi-com-angel--37b550fc,1,ZhenFund,Seed,,Angel,1,1000000,CNY,164734,,,,1000000,CNY,164734,Yes,,http://www.knewbi.com,,Seed,,"450,440"
2014-01-01,"Tianzhihang designs, manufactures, and applies orthopaedic robotic systems in clinical settings.",Tianzhihang,https://www.crunchbase.com/organization/tinavi,"Health Care, Information Technology, Manufacturing, Medical, Medical Device","Beijing, Beijing, China, Asia",Venture Round - Tianzhihang,https://www.crunchbase.com/funding_round/tinavi-series-unknown--38bd6dbf,1,Tsinghua Innovation Ventures,,,Venture - Series Unknown,1,,,,,,,,,,Yes,,http://www.tinavi.com/,,,,"450,481"
2014-02-28,"Dading City Group specializes in the development and management of the cultural real estate, tourism real estate and health real estate.",Dading City Group,https://www.crunchbase.com/organization/dading-city-group,"Construction, Property Development, Real Estate","Beijing, Beijing, China, Asia",Angel Round - Dading City Group,https://www.crunchbase.com/funding_round/dading-city-group-angel--97b650f1,1,Dahong Touzi,Seed,,Angel,1,3000000,CNY,488436,,,,3000000,CNY,488436,Yes,,http://dadingcity.com/,,Seed,,"454,048"
2014-03-04,MA Entertainment is a mobile game developer.,MA Entertainment,https://www.crunchbase.com/organization/ma-entertainment,"Gaming, Media and Entertainment, Mobile Apps","Beijing Shi, Beijing, China, Asia",Angel Round - MA Entertainment,https://www.crunchbase.com/funding_round/ma-entertainment-angel--9be71a21,1,Tencent,Seed,,Angel,1,3000000,CNY,488581,,,,3000000,CNY,488581,Yes,,http://www.mobartsgame.com,,M&A,,"454,051"
2014-02-11,"Tianxingjian International Tendering (Beijing) Co., Ltd is a tendering and project management company.","Tianxingjian International Tendering (Beijing) Co., Ltd",https://www.crunchbase.com/organization/tianxingjian-international-tendering-beijing-co-ltd,"Finance, Outsourcing, Project Management","Haidian, Beijing, China, Asia","Angel Round - Tianxingjian International Tendering (Beijing) Co., Ltd",https://www.crunchbase.com/funding_round/tianxingjian-international-tendering-beijing-co-ltd-angel--68530729,1,Shenyuan Ruizhi,Seed,,Angel,1,3000000,CNY,494320,,,,3000000,CNY,494320,Yes,,http://www.txjbidding.com/,,Seed,,"454,209"
2014-03-19,"Knoala is an intelligent resource connecting parents to the right information, products, and services, at the right time.",Knoala,https://www.crunchbase.com/organization/knoala,"Charter Schools, Parenting, Video","Shanghai, Shanghai, China, Asia",Seed Round - Knoala,https://www.crunchbase.com/funding_round/knoala-seed--98b81a10,1,ZhenFund,Seed,,Seed,1,50000,CNY,8084,,,,50000,CNY,8084,Yes,,http://knoala.com,,Seed,,"454,233"
2013-07-07,Voice base app that enable visual impaired people to use smart phones.,Protection & EASE,https://www.crunchbase.com/organization/protection-ease,iOS,"Beijing, Beijing, China, Asia",Non Equity Assistance - Protection & EASE,https://www.crunchbase.com/funding_round/protection-ease-non-equity-assistance--a3b2866e,1,Microsoft Accelerator,,,Non-equity Assistance,1,,,,,,,,,,No,,http://www.bjbyhd.com,,,,"454,513"
2013-09-01,WeiBond,WeiBond,https://www.crunchbase.com/organization/weibond,,"Shengdong, Guangdong, China, Asia",Angel Round - WeiBond,https://www.crunchbase.com/funding_round/weibond-angel--9645e359,1,Empower Investment,Seed,,Angel,1,,,,,,,,,,Yes,,http://www.weibond.com/,,Seed,,"454,882"
2013-07-25,Deman is a wireless transmission solution provider and manufacturing company.,Deman,https://www.crunchbase.com/organization/deman,"Hardware, Manufacturing, Wireless","Minhang, Shanghai, China, Asia",Angel Round - Deman,https://www.crunchbase.com/funding_round/deman-angel--faa43cbf,1,Shenzhen Sunlord Electronics,Seed,,Angel,1,3000000,CNY,488293,,,,3000000,CNY,488293,Yes,,http://www.deman-china.com,,Seed,,"454,999"
2013-09-01,HRG Technology is a 3D online games development studio.,HRG Technology,https://www.crunchbase.com/organization/hrg-technology,"3D Technology, Information Technology, Online Games","Shanghai, Shanghai, China, Asia",Series A - HRG Technology,https://www.crunchbase.com/funding_round/hrg-technology-series-a--a6abe73b,1,Talkweb,Early Stage Venture,,Series A,2,80000000,USD,80000000,,,,80157017,USD,80157017,Yes,,https://www.hrgame.com.cn/,,M&A,,"455,440"
2014-03-01,37mhealth is a Chinese health service platform that mainly focuses on the management of chronic diseases.,37mhealth,https://www.crunchbase.com/organization/37mhealth,"Health Care, Medical, Mobile","Haidian, Beijing, China, Asia",Angel Round - 37mhealth,https://www.crunchbase.com/funding_round/37mhealth-angel--96656fad,1,Broadhi Capital,Seed,,Angel,2,10000000,CNY,1628014,,,,10000000,CNY,1628014,Yes,,http://www.37mhealth.com/,,Seed,,"455,518"
2014-03-15,Pin Yidian is an e-commerce and SaaS platform.,Pin Yidian,https://www.crunchbase.com/organization/pin-yidian,"E-Commerce, E-Commerce Platforms, SaaS, Social","Guangzhou, Guangdong, China, Asia",Angel Round - Pin Yidian,https://www.crunchbase.com/funding_round/pin-yidian-angel--badae429,1,Qixun Xin You,Seed,,Angel,1,3000000,CNY,487935,,,,3000000,CNY,487935,Yes,,https://www.apphao123.com/,,Seed,,"456,272"
2013-07-01,DaoliCloud Provides Blockchain.,DaoliCloud,https://www.crunchbase.com/organization/daolicloud-information-technology-beijing-co-ltd,"Blockchain, Network Security, Security, Service Industry","Haidian, Beijing, China, Asia",Series A - DaoliCloud,https://www.crunchbase.com/funding_round/daolicloud-information-technology-beijing-co-ltd-series-a--0f6f302b,1,Zhonglu Capital,Early Stage Venture,,Series A,1,811820,USD,811820,,,,811820,USD,811820,Yes,,http://www.daolicloud.com,,Early Stage Venture,,"457,026"
2013-11-01,"Seafile is a next-generation office document platform, functioning as a company’s document center that can improve work.",Seafile,https://www.crunchbase.com/organization/seafile,"Document Management, Internet, Software","Beijing, Beijing, China, Asia",Angel Round - Seafile,https://www.crunchbase.com/funding_round/seafile-angel--6a1a335f,1,Matrix Partners China,Seed,,Angel,1,1000000,CNY,163844,,,,1000000,CNY,163844,Yes,,http://seafile.com/home,Less than $1M,Seed,,"457,152"
2014-01-01,"EasyTek develops and sells products on desktop, application and server virtualization.",EasyTek,https://www.crunchbase.com/organization/easytek,"Customer Service, Information Technology, Software, Virtualization","Beijing, Beijing, China, Asia",Series A - EasyTek,https://www.crunchbase.com/funding_round/easytek-series-a--bca4b9b4,1,ZTEVC,Early Stage Venture,,Series A,2,,,,,,,,,,Yes,,http://easytek.com.cn/index.html,Less than $1M,Early Stage Venture,,"457,520"
2013-11-14,Sungy Mobile is a global mobile app and mobile platform development firm.,Sungy Mobile,https://www.crunchbase.com/organization/sungy-mobile,"Apps, Developer Tools, Mobile, Mobile Apps, Search Engine, Software, Wireless","Guangzhou, Guangdong, China, Asia",Venture Round - Sungy Mobile,https://www.crunchbase.com/funding_round/sungy-mobile-series-unknown--775020d4,1,Kingsoft,,,Venture - Series Unknown,4,20000000,USD,20000000,,,,42000000,USD,42000000,Yes,,http://sungymobile.com,$50M to $100M,IPO,,"457,751"
2014-03-12,Chuangyi Jiahe is a software development company for corporate office software and online game tools.,Chuangyi Jiahe,https://www.crunchbase.com/organization/chuang-yi-jia-he,"Information Services, Online Games, Software","Foochow, Fujian, China, Asia",Angel Round - Chuangyi Jiahe,https://www.crunchbase.com/funding_round/chuang-yi-jia-he-angel--c818a6e2,1,Wei Venture Capital,Seed,,Angel,1,3000000,CNY,488239,,,,3000000,CNY,488239,Yes,,http://www.fzcyjh.com/,,Seed,,"457,963"
2013-10-01,"Dajiabao is a insurance company that offers insurance claim, policy verification, and brokerage services.",Dajiabao,https://www.crunchbase.com/organization/dajiabao,"Financial Services, Insurance, InsurTech","Shanghai, Shanghai, China, Asia",Series A - Dajiabao,https://www.crunchbase.com/funding_round/dajiabao-series-a--6b1f53b1,1,Qiming Venture Partners,Early Stage Venture,,Series A,1,,,,,,,,,,Yes,,http://www.dajiabao.com,$10M to $50M,Early Stage Venture,,"458,437"
2013-12-09,Siyanhui provides caricature avatar design services.,Siyanhui,https://www.crunchbase.com/organization/siyanhui,"Product Design, Product Search, Service Industry","Shanghai, Shanghai, China, Asia",Seed Round - Siyanhui,https://www.crunchbase.com/funding_round/siyanhui-seed--f8ec5dc2,1,ZhenFund,Seed,,Seed,1,,,,,,,,,,Yes,,http://siyanhui.com,,Seed,,"458,481"
2014-01-01,Jiacheng Environmental Protection is a brand in the environmental protection industry.,Jiacheng Environmental Protection,https://www.crunchbase.com/organization/jiacheng-environmental-protection,"Environmental Consulting, Waste Management, Water Purification","Shijiazhuang, Hebei, China, Asia",Venture Round - Jiacheng Environmental Protection,https://www.crunchbase.com/funding_round/jiacheng-environmental-protection-series-unknown--ee7b503a,1,Tianjin Venture Capital,,,Venture - Series Unknown,1,,,,,,,,,,Yes,,http://www.jchb.cn,,,,"478,464"
2014-02-21,Unandu is an e-commerce platform for men's fashion apparel.,Unandu,https://www.crunchbase.com/organization/unandu,"Apparel, E-Commerce, Fashion, Men's","Beijing, Beijing, China, Asia",Angel Round - Unandu,https://www.crunchbase.com/funding_round/unandu-angel--7a01e9f5,1,Stone Capital,Seed,,Angel,1,3000000,CNY,492143,,,,3000000,CNY,492143,Yes,,http://www.unandu.com,,Seed,,"459,374"
2013-11-01,Script Information Technology is focused on creating information systems with more commercial values in China.,Scrip-t,https://www.crunchbase.com/organization/script-information-technology-co-ltd,"Business Intelligence, Enterprise Software","Ürümqi, Jiangsu, China, Asia",Venture Round - Scrip-t,https://www.crunchbase.com/funding_round/script-information-technology-co-ltd-series-unknown--08211e41,1,Zhonglu Capital,,,Venture - Series Unknown,1,162364,USD,162364,,,,162364,USD,162364,Yes,,http://www.scrip-t.com,,,,"470,815"
2013-07-01,Huosu,Huosu,https://www.crunchbase.com/organization/huosu,,"Shenzhen, Guangdong, China, Asia",Angel Round - Huosu,https://www.crunchbase.com/funding_round/huosu-angel--033d2530,1,Empower Investment,Seed,,Angel,1,,,,,,,,,,Yes,,http://huosu56.com,,Seed,,"479,678"
2014-01-13,Recruitment SAAS for labor intensive industries to build a high-quality workforce.,xiaolaoyiguan.com,https://www.crunchbase.com/organization/xiaolaoyiguan-com,"Human Resources, Staffing Agency","Chedaogou, Beijing, China, Asia",Non Equity Assistance - xiaolaoyiguan.com,https://www.crunchbase.com/funding_round/xiaolaoyiguan-com-non-equity-assistance--5e0d5546,1,Microsoft Accelerator,,,Non-equity Assistance,1,,,,,,,,,,No,,http://xiaolaoyiguan.com,,,,"479,712"
2013-11-01,Yoostay combines distinctive apartments and villas in Chinese cities with on-demand 5-star hotel services for travellers.,Yoostay,https://www.crunchbase.com/organization/yoostay,"Hotel, Travel","Beijing, Beijing, China, Asia",Angel Round - Yoostay,https://www.crunchbase.com/funding_round/yoostay-angel--a047dd8f,1,Yopark Investment Management,Seed,,Angel,1,2000000,USD,2000000,,,,2000000,USD,2000000,Yes,,http://www.yoostay.com,,Seed,,"479,737"
2014-01-16,Weizhen Jizhi is a medical and hospital patient service solutions platform.,Weizhen Jizhi,https://www.crunchbase.com/organization/weizhen-jizhi,"Health Care, Information Technology, Medical","Haidian, Beijing, China, Asia",Angel Round - Weizhen Jizhi,https://www.crunchbase.com/funding_round/weizhen-jizhi-angel--c063e021,1,GeekFounders,Seed,,Angel,1,3000000,CNY,494014,,,,3000000,CNY,494014,Yes,,http://www.vzhen.com/,,Seed,,"459,963"
2013-07-07,Niting provides users with scenario-aware mobile music sharing and recommendation services.,Niting,https://www.crunchbase.com/organization/niting,Music,"Beijing, Beijing, China, Asia",Non Equity Assistance - Niting,https://www.crunchbase.com/funding_round/niting-non-equity-assistance--da643129,1,Microsoft Accelerator,,,Non-equity Assistance,1,,,,,,,,,,No,,http://www.niting.com,,,,"460,147"
2014-01-23,PosPal is a new generation of free cash register software.,Pospal,https://www.crunchbase.com/organization/pospal,"Enterprise Software, Online Portals, Service Industry, Software","Xiamen, Fujian, China, Asia",Series A - Pospal,https://www.crunchbase.com/funding_round/pospal-series-a--cbaaa236,1,Sinovation Ventures,Early Stage Venture,,Series A,1,,,,,,,,,,Yes,,https://www.pospal.cn/,,Early Stage Venture,,"482,755"
2014-01-01,7cool is a real-time mobile phone game developer.,7cool,https://www.crunchbase.com/organization/7cool,"Gaming, Mobile, Mobile Apps","Wuxi Shi, Jiangsu, China, Asia",Venture Round - 7cool,https://www.crunchbase.com/funding_round/7cool-series-unknown--da9f0924,1,Baidu,,,Venture - Series Unknown,1,,,,,,,,,,Yes,,http://www.7cool.cn,,M&A,,"483,746"
2014-03-01,Lianzhong Medical is a medical cloud computing company with medical imaging.,Lianzhong Medical,https://www.crunchbase.com/organization/lianzhong-medical,Computer,"Hangzhou, Zhejiang, China, Asia",Series B - Lianzhong Medical,https://www.crunchbase.com/funding_round/lianzhong-medical-series-b--829965fe,1,CrestValue,Early Stage Venture,,Series B,2,,,,,,,,,,Yes,,http://www.lzimc.com/,,Early Stage Venture,,"460,576"
2014-01-13,Likeshow,Likeshow,https://www.crunchbase.com/organization/likeshow,,"Shanghai, Shanghai, China, Asia",Non Equity Assistance - Likeshow,https://www.crunchbase.com/funding_round/likeshow-non-equity-assistance--69f3c4bd,1,Microsoft Accelerator,,,Non-equity Assistance,1,,,,,,,,,,No,,http://www.likeshow.cn,,,,"460,735"
2014-03-01,"Qingguo.im is a mobile internet application developer that has developed products such as Qingguo bookkeeping, uxian.com, and more.",Qingguo,https://www.crunchbase.com/organization/qingguo,Mobile,"Beijing, Beijing, China, Asia",Angel Round - Qingguo,https://www.crunchbase.com/funding_round/qingguo-angel--9fec9b39,1,K2VC,Seed,,Angel,1,1000000,CNY,162801,,,,1000000,CNY,162801,Yes,,http://www.qingguo.im/,,Seed,,"461,084"
2013-08-01,Chehui is the provider of an online car buying marketplace.,Chehui,https://www.crunchbase.com/organization/chehui,"Automotive, Car Sharing, E-Commerce, Retail","Nanjing, Jiangsu, China, Asia",Angel Round - Chehui,https://www.crunchbase.com/funding_round/chehui-angel--12ca4548,1,Ping An Ventures,Seed,,Angel,1,3000000,CNY,488512,,,,3000000,CNY,488512,Yes,,http://www.chehui.com,,Seed,,"471,229"
2014-03-01,WayRise provides production testing and intelligent manufacturing solutions.,WayRise,https://www.crunchbase.com/organization/wayrise,"Electronics, Industrial Automation, Manufacturing","Shanghai, Shanghai, China, Asia",Angel Round - WayRise,https://www.crunchbase.com/funding_round/wayrise-angel--b8bdeee1,1,Chenhui Venture Partners,Seed,,Angel,1,3000000,CNY,488404,,,,3000000,CNY,488404,Yes,,http://www.wayrise.com,,Seed,,"472,223"
2013-09-01,Moji Weather offers software capable of tracking weather information through smartphones.,Moji Fengyun (Beijing) Software Technology Development Co.,https://www.crunchbase.com/organization/moji-fengyun-beijing-software-technology-development-co,"Mobile, Software","Beijing, Beijing, China, Asia",Series A - Moji Fengyun (Beijing) Software Technology Development Co.,https://www.crunchbase.com/funding_round/moji-fengyun-beijing-software-technology-development-co-series-a--de7c80f8,1,Empower Investment,Early Stage Venture,,Series A,3,,,,,,,,,,Yes,,http://www.mojichina.com/,$10M to $50M,Early Stage Venture,,"484,943"
2013-10-30,"Weiju is a location-based, instant messaging application that enables users to chat with nearby strangers.",Weiju,https://www.crunchbase.com/organization/weiju,"Apps, Messaging, Mobile Apps, Social Media","Beijing, Beijing, China, Asia",Angel Round - Weiju,https://www.crunchbase.com/funding_round/weiju-angel--e4ec3ff4,1,Shunwei Capital,Seed,,Angel,1,1000000,CNY,163755,,,,1000000,CNY,163755,Yes,,http://www.aggso.com,,Seed,,"472,984"
2014-03-13,Instantly Share Dash Cam Videos with Goluk,Goluk,https://www.crunchbase.com/organization/goluk,"Digital Media, Social Media, Video","Beijing, Beijing, China, Asia",Seed Round - Goluk,https://www.crunchbase.com/funding_round/goluk-seed--1bf96a96,1,Sinovation Ventures,Seed,,Seed,1,,,,,,,,,,Yes,,http://en.goluk.com/,,Seed,,"476,721"
2013-08-01,"Rent Here, a domestic daily rental service promotion platform, allows landlords to post information about short-term renting houses.",Rent Here,https://www.crunchbase.com/organization/rent-here,"E-Commerce Platforms, Internet, Real Estate","Beijing, Beijing, China, Asia",Angel Round - Rent Here,https://www.crunchbase.com/funding_round/rent-here-angel--f3b3adec,1,Zhonglu Capital,Seed,,Angel,2,324728,USD,324728,,,,340430,USD,340430,Yes,,http://www.zuzher.com,Less than $1M,Seed,,"468,993"
2013-10-08,Artron provides art and printing solutions.,Artron,https://www.crunchbase.com/organization/artron-d3ab,"Art, Internet, Printing","Shenzhen, Guangdong, China, Asia",Angel Round - Artron,https://www.crunchbase.com/funding_round/artron-d3ab-angel--07b7de64,1,China Culture Industrial Investment Fund,Seed,,Angel,1,3000000,CNY,489900,,,,3000000,CNY,489900,Yes,,http://www.artron.com.cn/,,Seed,,"464,957"
2014-03-01,Haowj.com is an oral English training service platform allowing users to obtain one-on-one teaching services from real foreign teachers.,Haowj.com,https://www.crunchbase.com/organization/www-haowj-com,"EdTech, Education","Beijing, Beijing, China, Asia",Angel Round - Haowj.com,https://www.crunchbase.com/funding_round/www-haowj-com-angel--9cd83381,1,Legend Star,Seed,,Angel,1,1000000,CNY,162801,,,,1000000,CNY,162801,Yes,,http://www.haowj.com/,,Seed,,"469,561"
2014-01-01,YIDIAN is an online learning platform for primary school.,YIDIAN,https://www.crunchbase.com/organization/yidian-40a3,"E-Learning, Education, Internet","Hefei, Anhui, China, Asia",Angel Round - YIDIAN,https://www.crunchbase.com/funding_round/yidian-40a3-angel--4ab170ef,1,Baotuan Venture,Seed,,Angel,1,3000000,CNY,494609,,,,3000000,CNY,494609,Yes,,http://www.iaixue.cn/,,Seed,,"473,752"
2013-09-01,Shanghai Aunt Kitchen Network is an e-commerce platform and mobile application that provides home entrepreneurship services.,Aunt Kitchen,https://www.crunchbase.com/organization/shanghai-aunt-kitchen-network,"Commercial, E-Commerce, Mobile Apps","Shanghai, Shanghai, China, Asia",Series A - Aunt Kitchen,https://www.crunchbase.com/funding_round/shanghai-aunt-kitchen-network-series-a--a9c02494,1,Zhonglu Capital,Early Stage Venture,,Series A,1,162364,USD,162364,,,,162364,USD,162364,Yes,,http://www.ayicf.com,,Early Stage Venture,,"473,874"
2014-01-28,"Shandong Visual Observation Information Technology Co., Ltd is a geographic information software development service company.","Shandong Visual Observation Information Technology Co., Ltd",https://www.crunchbase.com/organization/shandong-visual-observation-information-technology-co-ltd,"Information Services, Information Technology, Software","Jinan, Shandong, China, Asia","Series A - Shandong Visual Observation Information Technology Co., Ltd",https://www.crunchbase.com/funding_round/shandong-visual-observation-information-technology-co-ltd-series-a--0d0517e9,1,Horus Capital,Early Stage Venture,,Series A,2,10000000,CNY,1646825,,,,13000000,CNY,2133084,Yes,,http://www.sgcgis.com/,,IPO,,"476,815"
