2013-10-25,Qing Youyile is a mobile game development company.,Qing Youyile,https://www.crunchbase.com/organization/qing-youyile,"Digital Entertainment, Mobile, Online Games, Software","Haidian, Beijing, China, Asia",Series A - Qing Youyile,https://www.crunchbase.com/funding_round/qing-youyile-series-a--cfbfec03,2,"Bewinner, Zhongguancun Xingye Investment",Early Stage Venture,,Series A,3,500000,CNY,82097,,,,50500000,CNY,8003098,Yes,,http://www.qingyou.cn/,,IPO,,"571,807"
2014-03-03,Huafoun.com is a manufacturer of Internet of Things network boundary security products.,HUAFOUN.COM,https://www.crunchbase.com/organization/huafoun-com,"Internet of Things, Network Hardware, Security","Haidian, Beijing, China, Asia",Angel Round - HUAFOUN.COM,https://www.crunchbase.com/funding_round/huafoun-com-angel--989204c2,2,"Challenjers Capital, Elex Technology",Seed,,Angel,3,3000000,CNY,488353,,,,33000000,CNY,5232423,Yes,,http://www.huafoun.com/,,Early Stage Venture,,"571,900"
2014-01-31,"Kerel Robot is a robotics, industrial automation, and manufacturing company.",Kerel Robot,https://www.crunchbase.com/organization/kerel-robot,"Industrial Automation, Manufacturing, Robotics","Shiqi, Guangdong, China, Asia",Angel Round - Kerel Robot,https://www.crunchbase.com/funding_round/kerel-robot-angel--85dd664e,2,"London Stock Exchange Group, Pengshi (Beijing) Touzi Co., Ltd.",Seed,,Angel,3,3000000,CNY,494245,,,,33000000,CNY,5179542,Yes,,http://www.kjlrobot.com/,$1M to $10M,Early Stage Venture,,"581,002"
2014-03-12,Mengguo Game is a mobile game developer.,Mengguo Game,https://www.crunchbase.com/organization/mngo-game,"Gaming, Leisure, Mobile Apps","Shanghai, Shanghai, China, Asia",Angel Round - Mengguo Game,https://www.crunchbase.com/funding_round/mngo-game-angel--9c7baf75,2,"Shanghai Hongli Guquan Touzi Co., Ltd., Window of the World",Seed,,Angel,2,20000000,CNY,3254927,,,,30000000,CNY,4759413,Yes,,http://www.gamed9.com,,Early Stage Venture,,"571,989"
2013-12-20,Epticore Microelectronics is a photoelectric sensor company.,Epticore Microelectronics,https://www.crunchbase.com/organization/epticore-microelectronics,"Electronics, Hardware, Sensor","Shanghai, Shanghai, China, Asia",Venture Round - Epticore Microelectronics,https://www.crunchbase.com/funding_round/epticore-microelectronics-series-unknown--0fa2524b,2,"DFJ DragonFund, Fenda",,,Venture - Series Unknown,2,50000000,CNY,8198393,,,,100000000,CNY,16286108,Yes,,http://www.epticore.com/,,,,"572,009"
2014-02-01,SAINTI is an IT company for developing websites and mobile applications.,SAINTI,https://www.crunchbase.com/organization/sainti,"Information Technology, Mobile Apps, Web Development","Dalian Shi, Liaoning, China, Asia",Angel Round - SAINTI,https://www.crunchbase.com/funding_round/sainti-angel--d3355371,1,Venture Workshop,Seed,,Angel,1,1000000,CNY,164734,,,,1000000,CNY,164734,Yes,,http://www.sainti.cn,,Seed,,"572,098"
2014-01-02,"Didi is a mobility technology platform that offers ride hailing, taxi hailing, food delivery, and financial services.",Didi,https://www.crunchbase.com/organization/didi-dache,"Artificial Intelligence (AI), InsurTech, Mobile Apps, Public Transportation, Ride Sharing, Transportation","Haidian, Beijing, China, Asia",Series C - Didi,https://www.crunchbase.com/funding_round/didi-dache-series-c--f9fe13c7,2,"CITIC Capital Holdings, Tencent Industry Win-Win Fund",Late Stage Venture,,Series C,24,100000000,USD,100000000,,,,23397719538,USD,23397719538,Yes,,https://www.didiglobal.com,$10B+,IPO,,"572,147"
2014-03-24,You Yaoqi is an original comics and animation firm that uses Internet platforms to create celebrity comic products.,U17,https://www.crunchbase.com/organization/u17,"Animation, Gaming, Mobile","Beijing, Beijing, China, Asia",Series A - U17,https://www.crunchbase.com/funding_round/u17-series-a--4136ca27,1,Sinovation Ventures,Early Stage Venture,,Series A,2,,,,,,,,,,Yes,,http://www.u17.com,$1M to $10M,M&A,,"581,290"
2013-10-01,Liulishuo is an AI-driven educational technology company that helps users to learn English more efficiently and communicate with the world.,Liulishuo,https://www.crunchbase.com/organization/liulishuo,"Apps, Artificial Intelligence (AI), Education, Language Learning, Software","Shanghai, Shanghai, China, Asia",Series A - Liulishuo,https://www.crunchbase.com/funding_round/liulishuo-series-a--aa5a497f,2,"GGV Capital, IDG Capital",Early Stage Venture,,Series A,6,,,,,,,128900000,USD,128900000,Yes,,https://www.liulishuo.com/,$100M to $500M,IPO,,"572,597"
2013-07-01,Mocha.com is a Chinese cosmetic guide application with barcode-scanning features.,Mocha.cn,https://www.crunchbase.com/organization/mocha-cn,"E-Commerce, Media and Entertainment, Software","Chaoyang, Liaoning, China, Asia",Seed Round - Mocha.cn,https://www.crunchbase.com/funding_round/mocha-cn-seed--377ec4ce,2,"N5Capital, PreAngel",Seed,,Seed,3,,,,,,,7600000,USD,7600000,Yes,,http://mochameizhuang.com,,Early Stage Venture,,"572,673"
2014-02-01,Kuchuan is a mobile application that provides publishing and monitoring services.,Kuchuan,https://www.crunchbase.com/organization/kuchuan,"Business Development, Marketing, Mobile Apps","Haidian, Beijing, China, Asia",Series A - Kuchuan,https://www.crunchbase.com/funding_round/kuchuan-series-a--c5e4968c,1,Source Code Capital,Early Stage Venture,,Series A,1,428600,USD,428600,,,,428600,USD,428600,Yes,,http://www.kuchuan.com,$1M to $10M,Early Stage Venture,,"572,830"
2014-01-13,Next generation email app/mail client.,Jademail,https://www.crunchbase.com/organization/jademail,"Apps, Information Technology, Messaging, Mobile Apps","Beijing, Beijing, China, Asia",Non Equity Assistance - Jademail,https://www.crunchbase.com/funding_round/jademail-non-equity-assistance--0b89dc5e,1,Microsoft Accelerator,,,Non-equity Assistance,1,,,,,,,,,,No,,http://www.jadenine.cn,,,,"574,257"
2013-10-28,9ask.cn provides online lawyer consultation services.,9ask.cn,https://www.crunchbase.com/organization/9ask-cn,"Law Enforcement, Legal, Professional Services","Jinan, Shandong, China, Asia",Series A - 9ask.cn,https://www.crunchbase.com/funding_round/9ask-cn-series-a--f044aa0e,1,Qingsong Fund,Early Stage Venture,,Series A,2,10000000,CNY,1641601,,,,13000000,CNY,2080997,Yes,,http://www.9ask.cn/,$1M to $10M,IPO,,"574,397"
2013-10-01,AA Carpooling Website is an automobile sharing platform for carpooling information.,AA Carpooling Website,https://www.crunchbase.com/organization/aa-carpooling-website,"Automotive, Car Sharing, Ride Sharing","Chongqing, Heilongjiang, China, Asia",Venture Round - AA Carpooling Website,https://www.crunchbase.com/funding_round/aa-carpooling-website-series-unknown--3ee1b49d,1,Zhonglu Capital,,,Venture - Series Unknown,2,,,,,,,1623640,USD,1623640,Yes,,http://www.aapinche.cn,,,,"574,409"
2014-01-07,PIESAT is a satellite operation and application service company.,PIESAT,https://www.crunchbase.com/organization/piesat,"Information Technology, Satellite Communication, Sensor","Haidian, Beijing, China, Asia",Series A - PIESAT,https://www.crunchbase.com/funding_round/piesat-series-a--6ed528af,2,"Bridge Capital China, Greem Consulting",Early Stage Venture,,Series A,4,10000000,CNY,1649568,,,,83000000,CNY,12757172,Yes,,http://www.piesat.com.cn/,,IPO,,"576,156"
2013-11-21,Zhuzhe is an information technology company that develops hotel management system.,Zhuzhe,https://www.crunchbase.com/organization/zhuzhe,"Hotel, Information Technology, Software","Haidian, Beijing, China, Asia",Angel Round - Zhuzhe,https://www.crunchbase.com/funding_round/zhuzhe-angel--200e1ab4,1,eLong.com,Seed,,Angel,1,3000000,CNY,491274,,,,3000000,CNY,491274,Yes,,http://www.zhuzher.com,,Seed,,"576,231"
2013-11-20,"Sage Microelectronique provides data storage, information integrated circuit chips, and technical solutions in the field of security.",Sage Microelectronique,https://www.crunchbase.com/organization/sage-microelectronique,"Electronics, Information Technology, Network Security","Xiaoshan, Zhejiang, China, Asia",Angel Round - Sage Microelectronique,https://www.crunchbase.com/funding_round/sage-microelectronique-angel--1464cde8,2,"Enjoyor Group, Jinchang Shiye Jituan",Seed,,Angel,8,3000000,CNY,491262,,,,650700000,CNY,96819193,Yes,,http://sage-micro.com.cn/,,IPO,,"576,327"
2013-10-08,"BSC specializing in the development, construction and operation of telemedicine.",BSC,https://www.crunchbase.com/organization/bsc-641a,"Health Care, Information Services, Medical","Haidian, Beijing, China, Asia",Series A - BSC,https://www.crunchbase.com/funding_round/bsc-641a-series-a--49920c6a,2,"Fosun Pharma, Qiming Venture Partners",Early Stage Venture,,Series A,5,10000000,CNY,1633001,,,,113000000,CNY,17529311,Yes,,http://www.chinabsc.com/,,Late Stage Venture,,"577,734"
2013-11-18,Juhuiwan is a mobile game that can play with friends.,Juhuiwan,https://www.crunchbase.com/organization/juhuiwan,"Gaming, Media and Entertainment, Mobile","Fengxian, Shanghai, China, Asia",Angel Round - Juhuiwan,https://www.crunchbase.com/funding_round/juhuiwan-angel--7fd06d7a,2,"InnoValley China, K2VC",Seed,,Angel,3,3000000,CNY,491222,,,,33000000,CNY,5192221,Yes,,http://www.juhuiwan.cn,,Early Stage Venture,,"568,237"
2013-10-01,Kuaidi is the largest global car service app and is rapidly transforming the concept of moving people - starting in China.,Kuaidi Dache,https://www.crunchbase.com/organization/kuaidi-dache,"Apps, Public Transportation, Transportation","Hangzhou, Zhejiang, China, Asia",Series B - Kuaidi Dache,https://www.crunchbase.com/funding_round/kuaidi-dache-series-b--ddc1c8e6,2,"Alibaba Capital Partners, New Horizon Capital",Early Stage Venture,,Series B,4,100000000,USD,100000000,,,,725000000,USD,725000000,Yes,,http://www.vvipone.com/en/,,M&A,,"568,290"
2013-09-01,Kelaile is a Chinese big data marketing service provider.,Kelaile,https://www.crunchbase.com/organization/kelaile,"Marketing, Mobile Payments","Beijing, Beijing, China, Asia",Angel Round - Kelaile,https://www.crunchbase.com/funding_round/kelaile-angel--a95f037f,2,"Innoangel Fund, Perfect World",Seed,,Angel,3,5000000,CNY,816019,,,,17416019,USD,17416019,Yes,,http://www.kelaile.cn/,$10M to $50M,Early Stage Venture,,"569,245"
2013-09-04,SEEYOO is a commercial display equipment and solutions supplier.,SEEYOO,https://www.crunchbase.com/organization/seeyoo,"Commercial, Hardware","Songjiang, Shanghai, China, Asia",Series A - SEEYOO,https://www.crunchbase.com/funding_round/seeyoo-series-a--0fd1e828,2,"Shanghai Chengli Venture Capital, Shikong Wuxing",Early Stage Venture,,Series A,3,10000000,CNY,1631971,,,,33000000,CNY,5405190,Yes,,http://www.seeyoo.cn,,Early Stage Venture,,"569,613"
2014-03-31,Inlaylink is a RFID technology manufacturer that provides antenna products.,Inlaylink,https://www.crunchbase.com/organization/inlaylink,"Manufacturing, RFID, Satellite Communication","Shanghai, Shanghai, China, Asia",Series B - Inlaylink,https://www.crunchbase.com/funding_round/inlaylink-series-b--a2381613,2,"Bosheng Asset Management, Juntan Investment",Early Stage Venture,,Series B,6,21600000,CNY,3480244,,,,234000000,CNY,35317328,Yes,,http://www.inlaylink.com,$1M to $10M,IPO,,"569,659"
2013-12-30,SCIENTOP is a manufacturer of automation equipment.,SCIENTOP,https://www.crunchbase.com/organization/scientop,"Hardware, Industrial Automation, Manufacturing","Changshahsien, Hunan, China, Asia",Venture Round - SCIENTOP,https://www.crunchbase.com/funding_round/scientop-series-unknown--b19bc526,1,Zoy Capital,,,Venture - Series Unknown,2,50000000,USD,50000000,,,,58077816,USD,58077816,Yes,,http://www.scientop.com/znsb,$1M to $10M,IPO,,"581,470"
2013-10-31,"evecom is an IT service provider with cloud computing, IoT & big data technologies for government and finance sectors.",evecom,https://www.crunchbase.com/organization/evecom,"Cloud Computing, Government, Information Technology","Foochow, Fujian, China, Asia",Angel Round - evecom,https://www.crunchbase.com/funding_round/evecom-angel--78da882c,1,Shenzhen Capital Group,Seed,,Angel,2,3000000,CNY,491130,,,,13000000,CNY,2032303,Yes,,http://www.evecom.net/,$10M to $50M,Early Stage Venture,,"581,835"
2013-08-01,Blue Focus PR Consulting is a Chinese professional organization providing public relations services.,Blue Focus PR Consulting,https://www.crunchbase.com/organization/blue-focus-pr-consulting,"Advertising, Aerospace, Consulting, Information Technology, Internet, ISP, Marketing, Professional Services","Beijing, Beijing, China, Asia",Post-IPO Equity - Blue Focus PR Consulting,https://www.crunchbase.com/funding_round/blue-focus-pr-consulting-post-ipo-equity--73de8c5d,1,Shenzhen Capital Group,,,Post-IPO Equity,3,54000000,CNY,8793207,,,,124000000,CNY,19795153,Yes,,http://www.bluefocusgroup.com,$1B to $10B,IPO,,"581,825"
2013-10-01,Mlito is a graphic design and architecture company.,Mlito,https://www.crunchbase.com/organization/mlito,"Creative Agency, Online Portals, Photography","Songjiang, Shanghai, China, Asia",Angel Round - Mlito,https://www.crunchbase.com/funding_round/mlito-angel--324acde0,1,Zhonglu Capital,Seed,,Angel,2,1000000,CNY,163257,,,,11000000,CNY,1735819,Yes,,https://www.mlito.com/,,Early Stage Venture,,"593,727"
2013-07-23,Le Chongci is developing mobile apps for searching questions on the web through a photo.,Le Chongci,https://www.crunchbase.com/organization/le-chongci,"Android, Education, iOS, Mobile Apps","Haidian, Beijing, China, Asia",Angel Round - Le Chongci,https://www.crunchbase.com/funding_round/le-chongci-angel--1c281a63,1,Xiaoan Network Technology,Seed,,Angel,3,3000000,CNY,488174,,,,33000000,CNY,5061382,Yes,,http://shfd.51sprint.com,,Early Stage Venture,,"585,710"
2013-07-18,Richfuture is an IT company that provides digital marketing and IoT monitoring systems for the agriculture sector.,Richfuture,https://www.crunchbase.com/organization/richfuture,"Advertising, Agriculture, Digital Marketing, Information Technology, Internet of Things","Yangzhou, Jiangsu, China, Asia",Series A - Richfuture,https://www.crunchbase.com/funding_round/richfuture-series-a--bba20afc,1,Zibolan,Early Stage Venture,,Series A,6,10000000,CNY,1627139,,,,157500000,CNY,24061483,Yes,,http://www.rui-feng.cn/,,IPO,,"586,741"
2014-02-01,"Niugu Wang is a financial technology retail platform integrating information, market and transactions.",Niugu Wang,https://www.crunchbase.com/organization/niugu-wang,"Finance, FinTech, Retail","Beijing, Beijing, China, Asia",Angel Round - Niugu Wang,https://www.crunchbase.com/funding_round/niugu-wang-angel--bae28ff0,1,K2VC,Seed,,Angel,5,3000000,CNY,494203,,,,17237201,USD,17237201,Yes,,https://www.niuguwang.com/,,Late Stage Venture,,"594,647"
2014-01-01,Soltrium is a manufacturer of solar cell front conductive silver paste and PERC silver paste.,Soltrium,https://www.crunchbase.com/organization/soltrium,"Advanced Materials, Commercial, Manufacturing, Renewable Energy, Solar","Shenzhen, Guangdong, China, Asia",Series A - Soltrium,https://www.crunchbase.com/funding_round/soltrium-series-a--a3635cde,1,Deepshire Investment Management,Early Stage Venture,,Series A,4,,,,,,,,,,Yes,,http://www.soltriumcorp.cn,,Early Stage Venture,,"594,712"
2013-12-30,Xuele Zhongguo is an online learning platform for children of primary school.,Xuele Zhongguo,https://www.crunchbase.com/organization/xuele-zhongguo,"Children, E-Learning, Education","Hangzhou, Zhejiang, China, Asia",Angel Round - Xuele Zhongguo,https://www.crunchbase.com/funding_round/xuele-zhongguo-angel--03f27fd0,1,ShenZhen GTJA Investment Group,Seed,,Angel,4,9000000,CNY,1482102,,,,220905159,USD,220905159,Yes,,http://ab.xuelecn.com/,,Late Stage Venture,,"594,817"
2013-08-30,Nihaozhiwu is a producer of honey products.,Nihaozhiwu,https://www.crunchbase.com/organization/nihaozhiwu,"Food and Beverage, Food Processing, Manufacturing","Chengdu, Sichuan, China, Asia",Seed Round - Nihaozhiwu,https://www.crunchbase.com/funding_round/nihaozhiwu-seed--f95ef57e,1,Haifeng Partners,Seed,,Seed,5,1000000,CNY,163216,,,,67000000,CNY,9795356,Yes,,http://www.nihaozhiwu.com/,,,,"594,933"
2013-11-12,"Youxituoluo.com develops mobile, TV, and AR games.",Youxituoluo.com,https://www.crunchbase.com/organization/youxituoluo-com,"Apps, Gaming, PC Games","Shenzhen, Guangdong, China, Asia",Angel Round - Youxituoluo.com,https://www.crunchbase.com/funding_round/youxituoluo-com-angel--1514ee66,1,Hangzhou Bierdaofu Keji Youxian Gongsi,Seed,,Angel,2,3000000,CNY,491067,,,,13000000,CNY,2120099,Yes,,http://www.youxituoluo.com,,Early Stage Venture,,"591,955"
2014-02-01,"Dongqiudi provides news, commentaries, league rankings as well as video streams of football matches across the world.",Dongqiudi,https://www.crunchbase.com/organization/dongqiudi,"Internet, News, Publishing, Sports","Beijing, Beijing, China, Asia",Angel Round - Dongqiudi,https://www.crunchbase.com/funding_round/dongqiudi-angel--ebeb9db4,1,K2VC,Seed,,Angel,4,,,,,,,66442502,USD,66442502,Yes,,https://www.dongqiudi.com,,Late Stage Venture,,"592,140"
2013-08-23,WelinkData is a supply chain financial technology company that builds a digital management tool and platform for brand companies.,WelinkData,https://www.crunchbase.com/organization/welinkdata,"Finance, Financial Services, FinTech, Supply Chain Management","Putuo, Shanghai, China, Asia",Angel Round - WelinkData,https://www.crunchbase.com/funding_round/welinkdata-angel--1a518df7,1,Ningbo Xinrongji Touzi Youxian Gongsi,Seed,,Angel,4,3000000,CNY,489546,,,,63000000,CNY,9624317,Yes,,http://www.welinkdata.com/,,Late Stage Venture,,"589,328"
2014-01-06,Touch is a social communication software.,Touch,https://www.crunchbase.com/organization/touch-a02d,"Fashion, Mobile Apps, Wearables","Xiamen, Fujian, China, Asia",Angel Round - Touch,https://www.crunchbase.com/funding_round/touch-a02d-angel--203b055a,1,Zhonglu Capital,Seed,,Angel,4,10000000,CNY,1646506,,,,181800000,CNY,28856483,Yes,,https://app.taqu.cn/,,IPO,,"590,577"
2014-02-19,Lvkon.com develops driving products and vehicle power system solutions for the new energy vehicle industry.,Lvkon.com,https://www.crunchbase.com/organization/lvkon-com,"Automotive, Electric Vehicle, Energy, Sales","Suzhou, Jiangsu, China, Asia",Series A - Lvkon.com,https://www.crunchbase.com/funding_round/lvkon-com-series-a--8c602376,1,Huachuangyingda Fund,Early Stage Venture,,Series A,3,10000000,CNY,1644191,,,,33000000,CNY,5257995,Yes,,http://www.lvkon.com/,,Early Stage Venture,,"592,632"
2014-01-01,"ClinChoice is a Reaserch and Deveiopment platform, It develops a innovative drugs and devices.",ClinChoice昆翎,https://www.crunchbase.com/organization/fountain-medical-development,"Biotechnology, Consulting, Health Care, Pharmaceutical","Shanghai, Shanghai, China, Asia",Series B - ClinChoice昆翎,https://www.crunchbase.com/funding_round/fountain-medical-development-series-b--dc05fd1d,1,Lilly Asia Ventures,Early Stage Venture,,Series B,7,,,,,,,212000000,USD,212000000,Yes,,https://www.clinchoice.com.cn,$10M to $50M,Late Stage Venture,,"582,410"
2014-01-01,You Yaoqi is an original comics and animation firm that uses Internet platforms to create celebrity comic products.,U17,https://www.crunchbase.com/organization/u17,"Animation, Gaming, Mobile","Beijing, Beijing, China, Asia",Venture Round - U17,https://www.crunchbase.com/funding_round/u17-series-unknown--34795ceb,1,Northern Light Venture Capital,,,Venture - Series Unknown,2,,,,,,,,,,Yes,,http://www.u17.com,$1M to $10M,M&A,,"582,504"
2014-03-01,"Gongyingshi is a B2B procurement platform for laboratory reagents, consumables, instruments, and scientific research services.",Gongyingshi,https://www.crunchbase.com/organization/gongyingshi,"B2B, Commercial, Medical, Procurement","Beijing, Beijing, China, Asia",Seed Round - Gongyingshi,https://www.crunchbase.com/funding_round/gongyingshi-seed--4aec3e9c,1,Kaiwu Capital,Seed,,Seed,2,,,,,,,1570000,USD,1570000,Yes,,http://www.gongyingshi.com,,Early Stage Venture,,"584,027"
2014-03-04,Youhuoyun is an O2O e-commerce smart application platform that provides operation solutions for catering and retail industries.,Youhuoyun,https://www.crunchbase.com/organization/youhuoyun,"Catering, E-Commerce, Retail","Nantong, Jiangsu, China, Asia",Series A - Youhuoyun,https://www.crunchbase.com/funding_round/youhuoyun-series-a--2bc146ab,1,Nantong Keji Chuangye Touzi,Early Stage Venture,,Series A,3,10000000,CNY,1628603,,,,33000000,CNY,5300437,Yes,,http://www.uhuocn.com,,Early Stage Venture,,"584,093"
2014-01-01,"Beijing Datsing Bio-Tech is a high-tech enterprise that focuses on developing, manufacturing, and serving products for wound management.",Beijing Datsing Bio-Tech,https://www.crunchbase.com/organization/beijing-datsing-bio-tech,"Biotechnology, Health Care, Manufacturing, Medical","Haidian, Beijing, China, Asia",Venture Round - Beijing Datsing Bio-Tech,https://www.crunchbase.com/funding_round/beijing-datsing-bio-tech-series-unknown--cf5c2dfe,1,Northern Light Venture Capital,,,Venture - Series Unknown,3,,,,,,,,,,Yes,,http://www.datsing.net/,,,,"584,399"
2013-12-31,Tuanzi Travel is a bus ticket inquiry and online booking platform.,Tuanzi Chuxing,https://www.crunchbase.com/organization/tuanzi-chuxing,"Public Transportation, Travel, Travel Accommodations, Travel Agency","Chengdu, Sichuan, China, Asia",Angel Round - Tuanzi Chuxing,https://www.crunchbase.com/funding_round/tuanzi-chuxing-angel--830af012,1,Empower Investment,Seed,,Angel,2,3000000,CNY,494578,,,,13000000,CNY,2069079,Yes,,https://www.tz12306.com/,,Early Stage Venture,,"585,543"
2014-01-28,"HTX is a blockchain asset financial services provider, including exchange, trade, wallet, and storage.",HTX,https://www.crunchbase.com/organization/huobi,"Bitcoin, Blockchain, Cryptocurrency, Financial Services, FinTech","Beijing, Beijing, China, Asia",Seed Round - HTX,https://www.crunchbase.com/funding_round/huobi-seed--78bc68a2,1,ZhenFund,Seed,,Seed,5,,,,3610388,USD,3610388,2000000,USD,2000000,Yes,,https://www.huobi.com,$1M to $10M,M&A,,"585,574"
2013-07-07,China's onenotes-like personal knowledge management and group collaboration sysgtem.,Wiz,https://www.crunchbase.com/organization/wiz,"Information Technology, Robotics","Beijing, Beijing, China, Asia",Non Equity Assistance - Wiz,https://www.crunchbase.com/funding_round/wiz-non-equity-assistance--feac8ffa,1,Microsoft Accelerator,,,Non-equity Assistance,2,,,,,,,2000000,USD,2000000,No,,http://www.wiz.cn,$1M to $10M,Seed,,"629,856"
2013-11-05,Avitalent is a provider of aviation services.,Avitalent Group,https://www.crunchbase.com/organization/avitalent-group,"Aerospace, Professional Services, Service Industry","Beijing, Beijing, China, Asia",Angel Round - Avitalent Group,https://www.crunchbase.com/funding_round/avitalent-group-angel--2793b7ae,1,PurpleSky Capital,Seed,,Angel,2,3000000,CNY,490600,,,,13000000,CNY,2105033,Yes,,http://www.avitalent.net/,$1M to $10M,Early Stage Venture,,"611,549"
2013-12-30,Tongxuebuluo.com is an early childhood education course recommendation platform.,Tongxuebuluo.com,https://www.crunchbase.com/organization/tongxuebuluo-com,"E-Learning, Education, Internet","Shanghai, Shanghai, China, Asia",Angel Round - Tongxuebuluo.com,https://www.crunchbase.com/funding_round/tongxuebuluo-com-angel--adfcd3a2,1,TAL Education Group,Seed,,Angel,3,3000000,CNY,494034,,,,33000000,CNY,4974679,Yes,,http://www.tongxuebuluo.com/,,Early Stage Venture,,"595,452"
2013-09-12,111.com.cn operates as an online portal for selling pharmaceutical products.,Yiyao,https://www.crunchbase.com/organization/yiyao,"E-Commerce, Online Portals, Pharmaceutical","Guangdong, Jilin, China, Asia",Series A - Yiyao,https://www.crunchbase.com/funding_round/yiyao-series-a--b088c23a,1,Ivy Capital,Early Stage Venture,,Series A,6,,,,,,,279325715,USD,279325715,Yes,,http://www.111.com.cn/,,Late Stage Venture,,"595,454"
2013-12-01,VIPKid connects teachers in North America with children around the world for real-time English immersion learning online,VIPKID,https://www.crunchbase.com/organization/vipkid,"E-Learning, Education, Internet, Online Portals, Primary Education","Beijing, Beijing, China, Asia",Seed Round - VIPKID,https://www.crunchbase.com/funding_round/vipkid-seed--b1cb9730,1,Sinovation Ventures,Seed,,Seed,10,,,,,,,1055077215,USD,1055077215,Yes,,https://www.vipkid.com.cn,$500M to $1B,Late Stage Venture,,"595,457"
2013-07-05,QiCloud is an inlet flow channel and cloud services platform.,QiCloud,https://www.crunchbase.com/organization/qicloud,"Cloud Storage, Gaming, Software","Futian, Guangdong, China, Asia",Angel Round - QiCloud,https://www.crunchbase.com/funding_round/qicloud-angel--cb4a844d,1,Xunlei,Seed,,Angel,3,3000000,CNY,486896,,,,33000000,CNY,4998826,Yes,,http://qicloud.com/,,Early Stage Venture,,"595,468"
2013-12-19,KOTEI is an integrated software solution for intelligent and connected vehicles.,KOTEI,https://www.crunchbase.com/organization/kotei,"Automotive, Smart Cities, Software","Wuhan, Hubei, China, Asia",Angel Round - KOTEI,https://www.crunchbase.com/funding_round/kotei-angel--555530f0,1,China Galaxy Investment Management,Seed,,Angel,4,27000000,CNY,4441025,,,,73240000,CNY,11752872,Yes,,http://www.kotei-info.com/,$1M to $10M,M&A,,"611,794"
2013-09-01,1jiajie APP is a Chinese provider of hourly workers for housekeeping services.,1jiajie,https://www.crunchbase.com/organization/1jiajie,"E-Commerce, Housekeeping Service","Beijing, Beijing, China, Asia",Series A - 1jiajie,https://www.crunchbase.com/funding_round/1jiajie-series-a--466a72b8,1,Tencent Industry Win-Win Fund,Early Stage Venture,,Series A,2,1000000,CNY,163204,,,,4163204,USD,4163204,Yes,,http://www.1jiajie.com,,Early Stage Venture,,"630,020"
