2015-11-01,H-Grace develops and promotes city-level mutual assistance and first aid solutions.,H-Grace,https://www.crunchbase.com/organization/h-grace,"Artificial Intelligence (AI), First Aid, Health Care, Internet of Things","Xuhui, Shanghai, China, Asia",Angel Round - H-Grace,https://www.crunchbase.com/funding_round/h-grace-angel--fc6c0bf1,1,RIC Capital Management,Seed,,Angel,1,5000000,CNY,791470,,,,5000000,CNY,791470,Yes,,http://www.hegrace.cn/,,Seed,,"449,507"
2015-11-01,UEC Group provides IT solutions and service.,UEC Group,https://www.crunchbase.com/organization/united-electronic-industries,Information Technology,"Beijing, Beijing, China, Asia",Post-IPO Equity - UEC Group,https://www.crunchbase.com/funding_round/united-electronic-industries-post-ipo-equity--52e3263e,1,Zhonghe Capital,,,Post-IPO Equity,1,,,,,,,,,,Yes,,http://www.ronglian.com/,,IPO,,"453,014"
2015-12-01,Kehui Technology provides manufacturing and technical services for intelligent welding equipment.,Kehui Technology,https://www.crunchbase.com/organization/kehui-technology,"Industrial, Machinery Manufacturing, Manufacturing, Robotics","Zhengzhou, Henan, China, Asia",Post-IPO Equity - Kehui Technology,https://www.crunchbase.com/funding_round/kehui-technology-post-ipo-equity--c71942a9,1,Fortune Venture Capital,,,Post-IPO Equity,4,15970000,CNY,2495663,,,,49470000,CNY,7832456,Yes,,http://www.zzkehui.cn,,IPO,,"453,022"
2015-10-01,51daifu.com is an online portal for medical and health services.,51daifu.com,https://www.crunchbase.com/organization/51daifu-com,"E-Commerce, Health Care, Medical, Online Portals","Xuhui, Shanghai, China, Asia",Series A - 51daifu.com,https://www.crunchbase.com/funding_round/51daifu-com-series-a--32785676,1,Aiyun Ventures,Early Stage Venture,,Series A,1,,,,,,,,,,Yes,,http://www.51daifu.com/,,IPO,,"452,571"
2015-12-01,"Xianghe is a production and sales company for rail fasteners, electronic components, and accessories.",Xianghe,https://www.crunchbase.com/organization/xianghe,"Industrial, Railroad","Tiantai, Zhejiang, China, Asia",Venture Round - Xianghe,https://www.crunchbase.com/funding_round/xianghe-series-unknown--c6546139,1,Zhejiang Paradise,,,Venture - Series Unknown,1,,,,,,,,,,Yes,,http://www.ttxh.com.cn,,IPO,,"453,290"
2015-11-06,LiLaiYiPi offers various financial services for small business owners at a low cost.,LiLaiYiPi,https://www.crunchbase.com/organization/lilaiyipi,"Finance, Financial Services","Changshan, Hunan, China, Asia",Venture Round - LiLaiYiPi,https://www.crunchbase.com/funding_round/lilaiyipi-series-unknown--1f05fe1a,1,Tunlan Investment,,,Venture - Series Unknown,1,,,,,,,,,,Yes,,,,,,"452,903"
2015-11-01,BiSanJia is an e-commerce platform where users can buy building materials and furniture.,BiSanJia,https://www.crunchbase.com/organization/bisanjia,"Building Material, E-Commerce, Furniture","Beijing, Beijing, China, Asia",Seed Round - BiSanJia,https://www.crunchbase.com/funding_round/bisanjia-seed--fb702b14,1,Knight Team,Seed,,Seed,1,,,,,,,,,,Yes,,,,Seed,,"453,464"
2015-10-08,Xifangge is mainly engaged in the design and construction of roof greening and wall greening.,Xifangge,https://www.crunchbase.com/organization/xifangge,"Building Maintenance, Building Material, Construction, Green Building","Zhengzhou, Henan, China, Asia",Venture Round - Xifangge,https://www.crunchbase.com/funding_round/xifangge-series-unknown--88723c8c,1,Huaxia Haina Touzi,,,Venture - Series Unknown,1,,,,,,,,,,Yes,,http://www.xifange.com,,,,"451,522"
2015-11-01,"Transfar Chemicals develops, produces and markets a broad portfolio of specialty chemicals.",Transfar Chemicals,https://www.crunchbase.com/organization/transfar-chemicals,Chemical,"Hangzhou, Zhejiang, China, Asia",Venture Round - Transfar Chemicals,https://www.crunchbase.com/funding_round/transfar-chemicals-series-unknown--dc5d074c,1,Yunyi Investment,,,Venture - Series Unknown,1,,,,,,,,,,Yes,,http://transfarchem.com,,,,"451,525"
2015-10-27,Xinqitian E-commerce Group provides data banking and e-commerce services.,new7.com,https://www.crunchbase.com/organization/new7-com,"Banking, E-Commerce, Retail","Shijingshan, Beijing, China, Asia",Venture Round - new7.com,https://www.crunchbase.com/funding_round/new7-com-series-unknown--fdfa46cf,1,Spearhead Integrated Marketing Communication,,,Venture - Series Unknown,1,24000000,CNY,3777801,,,,24000000,CNY,3777801,Yes,,http://www.new7.com/,,,,"451,551"
2015-11-22,Shenjian.io is a cloud operating system for big data and artificial intelligence.,shenjian.io,https://www.crunchbase.com/organization/shenjian-io,"Apps, Artificial Intelligence (AI), Big Data, Machine Learning","Hangzhou, Zhejiang, China, Asia",Angel Round - shenjian.io,https://www.crunchbase.com/funding_round/shenjian-io-angel--090e0385,1,Zhonglu Capital,Seed,,Angel,2,3000000,CNY,469798,,,,3800000,CNY,600052,Yes,,https://www.shenjian.io/,,Seed,,"449,508"
2015-11-01,"Sinosteel Engineering & Technology provides energy conservation, environmental protection, and sustainable development services.",Sinosteel Engineering & Technology,https://www.crunchbase.com/organization/sinosteel-engineering-technology,"Civil Engineering, Consulting, Manufacturing, Mechanical Engineering","Jilin, Jilin, China, Asia",Post-IPO Equity - Sinosteel Engineering & Technology,https://www.crunchbase.com/funding_round/sinosteel-engineering-technology-post-ipo-equity--462f70ac,1,Zhonghe Capital,,,Post-IPO Equity,1,,,,,,,,,,Yes,,http://mecc.sinosteel.com,,IPO,,"450,482"
2015-12-01,EVERYOO provides industrial IoT applications and big data for the internet of things.,EVERYOO,https://www.crunchbase.com/organization/everyoo,"Cloud Infrastructure, Internet, Internet of Things","Chifu, Shandong, China, Asia",Angel Round - EVERYOO,https://www.crunchbase.com/funding_round/everyoo-angel--9b30b866,1,Yantai Dingyi Venture Capital,Seed,,Angel,1,10000000,CNY,1562720,,,,10000000,CNY,1562720,Yes,,http://www.everyoo.com/,,Seed,,"450,488"
2015-11-03,Ralinwi provides embedded wireless technology for the underlying integration of things like core modules and systems products.,Ralinwi,https://www.crunchbase.com/organization/ralinwi,"Cloud Management, Manufacturing, Semiconductor, Wireless","Nanjing, Jiangsu, China, Asia",Series A - Ralinwi,https://www.crunchbase.com/funding_round/ralinwi-series-a--0ae527f4,1,Haining China Leather Market,Early Stage Venture,,Series A,2,10000000,CNY,1578174,,,,13000000,CNY,2058804,Yes,,http://www.ralinwi.com,$1M to $10M,Early Stage Venture,,"450,542"
2015-10-31,A company which provides O2O on-demand manicure service.,dudumeijia.com,https://www.crunchbase.com/organization/dudumeijia-com-嘟嘟美甲,"Beauty, Internet, Lifestyle, Service Industry","Beijing, Beijing, China, Asia",Series A - dudumeijia.com,https://www.crunchbase.com/funding_round/dudumeijia-com-嘟嘟美甲-series-a--f0c3413d,1,Source Code Capital,Early Stage Venture,,Series A,1,,,,,,,,,,Yes,,https://www.dudumeijia.com,,M&A,,"451,317"
2015-12-11,Blade Games is a mobile game developer and operator in China.,Pianfeng Wangluo,https://www.crunchbase.com/organization/pianfeng-wangluo,"Console Games, Mobile Apps, Video Games","Guangzhou, Guangdong, China, Asia",Angel Round - Pianfeng Wangluo,https://www.crunchbase.com/funding_round/pianfeng-wangluo-angel--6f78d168,1,Yihua Enterprise (Group),Seed,,Angel,1,3000000,CNY,464978,,,,3000000,CNY,464978,Yes,,http://www.xfour.cn,,Seed,,"454,212"
2015-12-03,"Wzhouhui.com is an online marketplace that provides baby products, beauty makeup, and home care products.",Wzhouhui.com,https://www.crunchbase.com/organization/wzhouhui-com,"Baby, Beauty, Consumer, E-Commerce, Health Care","Shenzhen, Guangdong, China, Asia",Series B - Wzhouhui.com,https://www.crunchbase.com/funding_round/wzhouhui-com-series-b--67e0c885,1,Shenzhen Globalegrow E-Commerce,Early Stage Venture,,Series B,2,1570000000,CNY,245373997,,,,1770000000,CNY,276747707,Yes,,http://www.wzhouhui.com/,,Early Stage Venture,,"454,650"
2015-10-13,Nova Film Technology is a film and television technology and visual arts creative service company.,Nova Film Technology,https://www.crunchbase.com/organization/nova-film-technology,"Film, Metaverse, TV, Virtual Reality","Haidian, Beijing, China, Asia",Series A - Nova Film Technology,https://www.crunchbase.com/funding_round/nova-film-technology-series-a--ac35dd74,1,Tsing-Yuan Capital,Early Stage Venture,,Series A,1,3000000,CNY,473353,,,,3000000,CNY,473353,Yes,,http://www.novafilm.com.cn/,,Early Stage Venture,,"456,074"
2015-11-23,"Beijing Qiqi Technology is a developer and promoter of development tools, modeling tools, and business basic platforms.",Justep,https://www.crunchbase.com/organization/justep,"Big Data, PaaS","Beijing, Beijing, China, Asia",Angel Round - Justep,https://www.crunchbase.com/funding_round/justep-angel--661e5859,1,Hezhi Capital,Seed,,Angel,1,3000000,CNY,469550,,,,3000000,CNY,469550,Yes,,http://www.WeX5.com,,Seed,,"456,244"
2015-11-19,"Dynamiker Biotechnology engages in research, clinical application, and technical service of invasive fungal disease diagnosis.",DNK,https://www.crunchbase.com/organization/dnk,"Biotechnology, Health Care, Medical","Tanggu, Tianjin, China, Asia",Series A - DNK,https://www.crunchbase.com/funding_round/dnk-series-a--a3eb7d69,1,Teke Touzi,Early Stage Venture,,Series A,2,10000000,CNY,1566562,,,,13000000,CNY,2050904,Yes,,http://en.dynamiker.com/,,Early Stage Venture,,"456,261"
2015-12-17,Goodluck China is a sports lottery service provider company.,Goodluck China,https://www.crunchbase.com/organization/goodluck-china,"Consumer, Service Industry, Sports","Xiamen, Fujian, China, Asia",Angel Round - Goodluck China,https://www.crunchbase.com/funding_round/goodluck-china-angel--04a2c95c,1,HONGXIN BUSINESS INCUBATOR,Seed,,Angel,1,10000000,CNY,1543389,,,,10000000,CNY,1543389,Yes,,http://www.goodluckchina.com.cn/,,Seed,,"456,567"
2015-12-14,"Shenzhen Honglue Enterprise Culture Management Consultation Co., Ltd is a corporate culture management consulting company.","Shenzhen Honglue Enterprise Culture Management Consultation Co., Ltd",https://www.crunchbase.com/organization/shenzhen-honglue-enterprise-culture-management-consultation-co-ltd,"Management Consulting, Recruiting, Service Industry","Nanshanqu, Guangdong, China, Asia","Angel Round - Shenzhen Honglue Enterprise Culture Management Consultation Co., Ltd",https://www.crunchbase.com/funding_round/shenzhen-honglue-enterprise-culture-management-consultation-co-ltd-angel--d232afb1,1,Leaguer Group,Seed,,Angel,1,3000000,CNY,464831,,,,3000000,CNY,464831,Yes,,http://www.honglue.com/,,Seed,,"457,096"
2015-11-25,Aladin Interactive is a game development company.,"Aladin Interactive Co.,Ltd",https://www.crunchbase.com/organization/aladin-interactive-co-ltd,"Developer Platform, Gaming, Information Technology","Shenzhen, Guangdong, China, Asia","Angel Round - Aladin Interactive Co.,Ltd",https://www.crunchbase.com/funding_round/aladin-interactive-co-ltd-angel--b46739c8,1,Welight Capital,Seed,,Angel,1,3000000,CNY,469622,,,,3000000,CNY,469622,Yes,,http://www.boomegg.cn/,,Seed,,"457,178"
2015-11-01,A Chinese mobile app that provides cosmetics reviews.,Cosmeapp,https://www.crunchbase.com/organization/cosmeapp,Apps,"Hangzhou, Zhejiang, China, Asia",Series A - Cosmeapp,https://www.crunchbase.com/funding_round/cosmeapp-series-a--1ffbb014,1,Empower Investment,Early Stage Venture,,Series A,2,,,,,,,,,,Yes,,http://www.cosmeapp.com/,,Early Stage Venture,,"457,470"
2015-10-12,"Bingfan is a B2C e-commerce website that offers clothing, shoes, bags, skincare and beauty products.",BINGFAN.COM,https://www.crunchbase.com/organization/bingfan-com,"B2C, E-Commerce, Fashion","Chengdu, Sichuan, China, Asia",Angel Round - BINGFAN.COM,https://www.crunchbase.com/funding_round/bingfan-com-angel--9ce97f1e,1,Beijing Jiashang,Seed,,Angel,1,3000000,CNY,474169,,,,3000000,CNY,474169,Yes,,https://www.bingfan.com/,,Seed,,"457,507"
2015-11-17,Guojin Huangjin produces gold jewelry products.,Guojin Huangjin,https://www.crunchbase.com/organization/guojin-huangjin,"Fashion, Jewelry, Manufacturing","Beijing, Beijing, China, Asia",Series A - Guojin Huangjin,https://www.crunchbase.com/funding_round/guojin-huangjin-series-a--c47dd8b5,1,JD Capital,Early Stage Venture,,Series A,2,10000000,CNY,1567843,,,,13000000,CNY,2056279,Yes,,http://www.guojingold.com/,,Early Stage Venture,,"457,622"
2015-10-19,Shiling Digital Technology is a supplier of tablet keyboards and mobile accessories.,Shiling Digital Technology,https://www.crunchbase.com/organization/shiling-digital-technology,"Computer, Hardware, Supply Chain Management","Longhua, Guangdong, China, Asia",Angel Round - Shiling Digital Technology,https://www.crunchbase.com/funding_round/shiling-digital-technology-angel--26abb5eb,1,Hezhi Capital,Seed,,Angel,1,3000000,CNY,471812,,,,3000000,CNY,471812,Yes,,http://www.zgshiling.com/,,Seed,,"457,726"
2015-11-01,Intern Bird is a recruitment platform that focuses on college student internship and school recruitment.,Intern Bird,https://www.crunchbase.com/organization/intern-bird,"Employment, Recruiting, Staffing Agency","Beijing, Beijing, China, Asia",Angel Round - Intern Bird,https://www.crunchbase.com/funding_round/intern-bird-angel--d44b913a,1,Adfaith,Seed,,Angel,1,2000000,CNY,316588,,,,2000000,CNY,316588,Yes,,http://www.internbird.com,,Seed,,"477,777"
2015-10-28,Leon is an integrated marketing and brand advertising platform.,Leon,https://www.crunchbase.com/organization/leon-399f,"Advertising, B2C, Electronics","Shanghai, Shanghai, China, Asia",Angel Round - Leon,https://www.crunchbase.com/funding_round/leon-399f-angel--9fd3ddea,1,Sanshengshi Chuangtou,Seed,,Angel,1,3000000,CNY,471874,,,,3000000,CNY,471874,Yes,,http://www.leoing.cn/,,Seed,,"458,644"
2015-12-01,BLUE CAT is a cartoon animation and IP operating company.,BLUE CAT,https://www.crunchbase.com/organization/blue-cat,"Animation, Digital Media, Media and Entertainment","Changshahsien, Hunan, China, Asia",Venture Round - BLUE CAT,https://www.crunchbase.com/funding_round/blue-cat-series-unknown--b09ff0e5,1,Pusu Capital,,,Venture - Series Unknown,1,50000000,CNY,7813599,,,,50000000,CNY,7813599,Yes,,http://www.bcct.cn/,,,,"478,340"
2015-11-12,Zesing Software is a software firm that offers software solutions for medical service organizations.,Zesing Software,https://www.crunchbase.com/organization/zesing-software,"Information Technology, Medical, Software","Shanghai, Shanghai, China, Asia",Angel Round - Zesing Software,https://www.crunchbase.com/funding_round/zesing-software-angel--4bd69f41,1,Sichuang Yihui,Seed,,Angel,1,20000000,CNY,3140387,,,,20000000,CNY,3140387,Yes,,http://www.zesing.com/,,Seed,,"458,712"
2015-11-01,Lianguo Wang is an e-commerce company dealing in fruit.,Lianguo Wang,https://www.crunchbase.com/organization/lianguo-wang,"E-Commerce, Fruit, Retail","Baoshan, Shanghai, China, Asia",Angel Round - Lianguo Wang,https://www.crunchbase.com/funding_round/lianguo-wang-angel--e0f3b094,1,CIVC,Seed,,Angel,1,3000000,CNY,474882,,,,3000000,CNY,474882,Yes,,http://13564845682.guanwangbao.com/,,Seed,,"458,764"
2015-12-16,"ZhuoQing HuanBao provides drainage pipe network, dredging, sludge disposal, and heavy metal treatment services.",ZhuoQing HuanBao,https://www.crunchbase.com/organization/zhuoqing-huanbao,"B2C, Industrial, Service Industry","Changshan, Hunan, China, Asia",Angel Round - ZhuoQing HuanBao,https://www.crunchbase.com/funding_round/zhuoqing-huanbao-angel--3cfa14ae,1,Easy Capital,Seed,,Angel,1,3000000,CNY,463604,,,,3000000,CNY,463604,Yes,,http://www.zhuoqingkeji.com,,Seed,,"470,831"
2015-11-16,Yunzhi Yilian provides research and development of smart rear-view mirror and in-depth services of the internet of vehicle applications.,Yunzhi Yilian,https://www.crunchbase.com/organization/yunzhi-yilian,"Automotive, Service Industry","Nanshanqu, Guangdong, China, Asia",Angel Round - Yunzhi Yilian,https://www.crunchbase.com/funding_round/yunzhi-yilian-angel--e29b3e5b,1,Shenzhen Shi Zhi Sheng Tian Cheng Touzi Guanli Hehuo Qiye (Youxian Hehuo),Seed,,Angel,1,3000000,CNY,470843,,,,3000000,CNY,470843,Yes,,http://www.yunovo.cn/,,Seed,,"470,869"
2015-12-15,Vaneqi provides internet of things application development services.,Vaneqi,https://www.crunchbase.com/organization/vaneqi,"Data Visualization, Hardware, Information Services, Information Technology, Internet of Things, Software","Hangzhou, Zhejiang, China, Asia",Angel Round - Vaneqi,https://www.crunchbase.com/funding_round/vaneqi-angel--4b6977b5,1,Shengshan Group,Seed,,Angel,1,3000000,CNY,463813,,,,3000000,CNY,463813,Yes,,http://www.vaneqi.com,,Seed,,"482,417"
2015-10-08,Zhejiang Zhongchuai is a producer and seller of ventilation system products.,Zhejiang Zhongchuai,https://www.crunchbase.com/organization/zhejiang-zhongchuai,"Manufacturing, Sales, Service Industry","Hangzhou, Zhejiang, China, Asia",Angel Round - Zhejiang Zhongchuai,https://www.crunchbase.com/funding_round/zhejiang-zhongchuai-angel--5ea41de5,1,Xinyuan Touzi,Seed,,Angel,1,3000000,CNY,472150,,,,3000000,CNY,472150,Yes,,http://www.zjmana.com/,$1M to $10M,Seed,,"460,189"
2015-11-26,"Caisepiao.com provides tickets for city star entertainment performances, sports events, online ticket payment and after-sales service.",Caisepiao.com,https://www.crunchbase.com/organization/caisepiao-com,"E-Commerce, Events, Internet, Ticketing","Nanshanqu, Guangdong, China, Asia",Angel Round - Caisepiao.com,https://www.crunchbase.com/funding_round/caisepiao-com-angel--2667098e,1,Shenzhenshi Juxinglong Chuangye Touzi Jijin Guanli Hehuo Qiye,Seed,,Angel,1,3000000,CNY,469543,,,,3000000,CNY,469543,Yes,,http://caisepiao.com/,,Seed,,"460,267"
2015-12-08,"Runxin provides research, development, and production of water purification products.",Runxin,https://www.crunchbase.com/organization/runxin,"Manufacturing, Service Industry, Water Purification","Ningbo, Zhejiang, China, Asia",Angel Round - Runxin,https://www.crunchbase.com/funding_round/runxin-angel--66d78e00,1,Canature Health Technology Group,Seed,,Angel,1,3000000,CNY,467592,,,,3000000,CNY,467592,Yes,,http://www.china-runxin.com,$10M to $50M,Seed,,"484,331"
2015-11-19,Jbhope is an elementary and secondary school resource network.,Jbhope,https://www.crunchbase.com/organization/jbhope,"E-Learning, Education, Online Portals","Shanghai, Shanghai, China, Asia",Angel Round - Jbhope,https://www.crunchbase.com/funding_round/jbhope-angel--9a306e62,1,China Equity,Seed,,Angel,1,3000000,CNY,469969,,,,3000000,CNY,469969,Yes,,http://www.jbhope.com,,Seed,,"471,460"
2015-10-23,WTSD is a travel and transportation solutions provider.,WTSD,https://www.crunchbase.com/organization/wtsd,"Logistics, Transportation, Travel","Shenzhen, Guangdong, China, Asia",Angel Round - WTSD,https://www.crunchbase.com/funding_round/wtsd-angel--6c5b8535,1,SZHTI Group,Seed,,Angel,1,3000000,CNY,472383,,,,3000000,CNY,472383,Yes,,http://www.wtsd.cn,,IPO,,"484,911"
2015-11-03,GameraGame is a videogame development and publishing company.,GameraGame,https://www.crunchbase.com/organization/gameragame,"Information Technology, Publishing, Video Games","Shanghai, Shanghai, China, Asia",Angel Round - GameraGame,https://www.crunchbase.com/funding_round/gameragame-angel--ccb9f75a,1,Huaqi Capital,Seed,,Angel,1,3000000,CNY,473452,,,,3000000,CNY,473452,Yes,,http://www.gameragame.com/,$1M to $10M,Seed,,"484,934"
2015-11-01,HelloCareer is a human resource service providing company.,HelloCareer,https://www.crunchbase.com/organization/hellocareer,"Human Resources, Recruiting, Staffing Agency","Beijing, Beijing, China, Asia",Angel Round - HelloCareer,https://www.crunchbase.com/funding_round/hellocareer-angel--d2a20a4a,1,Guanqun Chicheng,Seed,,Angel,1,3000000,CNY,474882,,,,3000000,CNY,474882,Yes,,http://hellocareer.cn/,$1M to $10M,Seed,,"463,363"
2015-10-02,FreshEeasy.cn is a fresh food supplier company.,FreshEeasy.cn,https://www.crunchbase.com/organization/fresheeasy-cn,"Food Delivery, Food Processing, Logistics","Shanghai, Shanghai, China, Asia",Angel Round - FreshEeasy.cn,https://www.crunchbase.com/funding_round/fresheeasy-cn-angel--0b74130f,1,Aquarius Venture Capital,Seed,,Angel,1,3000000,CNY,471999,,,,3000000,CNY,471999,Yes,,http://www.fresheasy.cn,,Seed,,"468,015"
2015-11-30,WINEW is a manufacturer and seller of multimedia command and dispatch systems.,WINEW,https://www.crunchbase.com/organization/winew,"Audio, Video, Video Conferencing","Shenzhen, Guangdong, China, Asia",Series A - WINEW,https://www.crunchbase.com/funding_round/winew-series-a--e5a79ba4,1,SZHTI Group,Early Stage Venture,,Series A,2,3200000,CNY,500372,,,,6200000,CNY,989137,Yes,,https://www.chinahotline.com.cn,,IPO,,"468,089"
2015-10-23,YellFun is a developer of indoor positioning systems.,YellFun,https://www.crunchbase.com/organization/yellfun,"Electronics, Intelligent Systems, Location Based Services","Shanghai, Shanghai, China, Asia",Angel Round - YellFun,https://www.crunchbase.com/funding_round/yellfun-angel--75ed33b2,1,Jieshun Technology,Seed,,Angel,1,3000000,CNY,472383,,,,3000000,CNY,472383,Yes,,http://www.indoorun.cn,,Seed,,"468,680"
2015-11-24,Senink engages in the research and development and sales of hardware and core components of power supplies.,Senink,https://www.crunchbase.com/organization/senink,"Hardware, Sales, Smart Home","Nanshanqu, Guangdong, China, Asia",Angel Round - Senink,https://www.crunchbase.com/funding_round/senink-angel--e9c2a939,1,Zhengxuan Investment,Seed,,Angel,1,3000000,CNY,469606,,,,3000000,CNY,469606,Yes,,http://www.senink.com.cn,,Seed,,"464,317"
2015-10-15,4D Pocket offers software and VR technology-based solutions for the interior design industries.,4D Pocket,https://www.crunchbase.com/organization/siweikoudai,"Architecture, Software, Virtual Reality","Xuhui, Shanghai, China, Asia",Angel Round - 4D Pocket,https://www.crunchbase.com/funding_round/siweikoudai-angel--6aa8bb50,1,RIC Capital Management,Seed,,Angel,1,5000000,CNY,787731,,,,5000000,CNY,787731,Yes,,http://www.4dpoc.com,,Seed,,"465,004"
2015-12-17,Chaoxin.com is a multifunction chat service provider.,Chaoxin.com,https://www.crunchbase.com/organization/chaoxin-com,"Apps, Messaging, Social Media","Jiading, Shanghai, China, Asia",Angel Round - Chaoxin.com,https://www.crunchbase.com/funding_round/chaoxin-com-angel--723db1a7,1,Qixian Touzi,Seed,,Angel,1,3000000,CNY,463017,,,,3000000,CNY,463017,Yes,,https://www.chaoxin.com/,,Seed,,"469,462"
2015-11-19,"HRSTEK provides special robots, EOD robots and equipment for police use.",HRSTEK,https://www.crunchbase.com/organization/hrstek,"Robotics, Security","Minhang, Shanghai, China, Asia",Angel Round - HRSTEK,https://www.crunchbase.com/funding_round/hrstek-angel--40c3e120,1,Inesa Venture Capital,Seed,,Angel,1,3000000,CNY,469969,,,,3000000,CNY,469969,Yes,,http://www.hrstek.com/,,Seed,,"469,522"
2015-11-20,Zhiting Keji focuses on the connection between the parking lot and commercial district.,Zhiting Keji,https://www.crunchbase.com/organization/zhiting-keji,"Apps, Automotive, Parking","Guangzhou Shi, Guangdong, China, Asia",Angel Round - Zhiting Keji,https://www.crunchbase.com/funding_round/zhiting-keji-angel--5bce0fd6,1,Infinite Road Holding Group Co. Ltd.,Seed,,Angel,1,3000000,CNY,469845,,,,3000000,CNY,469845,Yes,,http://ecting.cn/,,Seed,,"465,528"
2015-11-21,HEROSTEM BIOTECHNOLOGY is a biotechnology company that specializes in stem cell research and clinical applications.,HEROSTEM BIOTECHNOLOGY,https://www.crunchbase.com/organization/herostem-biotechnology,"Biotechnology, Health Care, Medical","Changchun, Jilin, China, Asia",Series A - HEROSTEM BIOTECHNOLOGY,https://www.crunchbase.com/funding_round/herostem-biotechnology-series-a--b825d213,1,AEON LIFE,Early Stage Venture,,Series A,1,15000000,CNY,2349060,,,,15000000,CNY,2349060,Yes,,http://jlhuirong.com/,,Early Stage Venture,,"465,642"
2015-12-10,MINGTOU is an investment management company that provides investors with equity investment project reports.,MINGTOU,https://www.crunchbase.com/organization/mingtou,"Finance, Financial Services, Service Industry","Shenzhen, Guangdong, China, Asia",Angel Round - MINGTOU,https://www.crunchbase.com/funding_round/mingtou-angel--811a0f05,1,Jiuye Juntian Venture Capital,Seed,,Angel,1,10000000,CNY,1553656,,,,10000000,CNY,1553656,Yes,,http://www.mingtouwang.com,,Seed,,"466,527"
2015-11-10,P2Pguancha Wang is a financial information platform.,P2Pguancha Wang,https://www.crunchbase.com/organization/p2pguancha-wang,"Financial Services, Information Technology, News","Shenzhen, Guangdong, China, Asia",Angel Round - P2Pguancha Wang,https://www.crunchbase.com/funding_round/p2pguancha-wang-angel--50539aab,1,Hakim Unique Internet,Seed,,Angel,1,20000000,CNY,3144231,,,,20000000,CNY,3144231,Yes,,http://www.p2pguancha.com,,Seed,,"478,019"
2015-10-12,ARTC is an art trading platform for home decor and other related services.,ARTC,https://www.crunchbase.com/organization/artc,"Art, E-Commerce, Trading Platform","Beijing, Beijing, China, Asia",Angel Round - ARTC,https://www.crunchbase.com/funding_round/artc-angel--b5c82f6a,1,Zijia Tang,Seed,,Angel,1,20000000,CNY,3161126,,,,20000000,CNY,3161126,Yes,,http://www.artcare.com/,,Seed,,"470,165"
2015-12-23,Guopei Jigou is a small micro-finance and financial technology integrated service platform.,Guopei Jigou,https://www.crunchbase.com/organization/guopei-jigou,"Consulting, Finance, Financial Services, FinTech","Haidian, Beijing, China, Asia",Angel Round - Guopei Jigou,https://www.crunchbase.com/funding_round/guopei-jigou-angel--3f6bb489,1,L'ontologie,Seed,,Angel,1,3000000,CNY,463084,,,,3000000,CNY,463084,Yes,,http://www.guopeijigou.com,,Seed,,"474,534"
