2015-12-15,iCell is a provider of a biotechnology platform intended to specialize in basic research and clinical application of immune cells.,iCell,https://www.crunchbase.com/organization/icell,"Biotechnology, Health Care, Medical","Putuo, Shanghai, China, Asia",Series A - iCell,https://www.crunchbase.com/funding_round/icell-series-a--ab3a0456,2,"Share Capital, Vangoo Investment Partners",Early Stage Venture,,Series A,4,10000000,CNY,1546045,,,,10000000,CNY,1546045,Yes,,http://www.icell.com.cn/,,,,"556,574"
2015-12-02,MARS FACTORY is an entertainment and social platform.,MARS FACTORY,https://www.crunchbase.com/organization/mars-factory,"Digital Entertainment, Media and Entertainment, Social","Hangzhou, Zhejiang, China, Asia",Seed Round - MARS FACTORY,https://www.crunchbase.com/funding_round/mars-factory-seed--418f033d,1,Juxiu Capital,Seed,,Seed,2,3000000,CNY,468975,,,,6000000,CNY,918510,Yes,,http://www.marsfactory.cn/,,Seed,,"556,973"
2015-12-14,Weiji is a professional hospital performance distribution management service company.,Weiji,https://www.crunchbase.com/organization/weiji,"Consulting, Health Care, Hospital, Professional Services","Haidian, Beijing, China, Asia",Series A - Weiji,https://www.crunchbase.com/funding_round/weiji-series-a--eca8714d,2,"Beijing Dianguan Keji Fuhuaqi Youxian Gongshi, Suhehui",Early Stage Venture,,Series A,4,10000000,CNY,1549435,,,,63000000,CNY,9571574,Yes,,http://www.weijikeji.com/,,Late Stage Venture,,"558,161"
2015-11-06,AMT develops bioresorbable 3D printed vascular stents.,AMT,https://www.crunchbase.com/organization/amt-c73f,"3D Printing, Health Care, Medical","Daxing, Beijing, China, Asia",Series B - AMT,https://www.crunchbase.com/funding_round/amt-c73f-series-b--c4c35f5f,2,"Haidian Pioneer Park, Tianfeng Huiquan",Early Stage Venture,,Series B,6,20000000,CNY,3149256,,,,163000000,CNY,24389719,Yes,,http://www.ametcorp.com/,,Late Stage Venture,,"558,241"
2015-12-07,Leads Biolabs is a biotechnology company that develops treatment outcomes and access for patients worldwide.,Leads Biolabs,https://www.crunchbase.com/organization/leads-biolabs,"Biotechnology, Health Care, Pharmaceutical","Nanjing, Jiangsu, China, Asia",Angel Round - Leads Biolabs,https://www.crunchbase.com/funding_round/leads-biolabs-angel--10f3d76e,2,"Cowin Venture, Shanghai Zhuangzhong Chuangye Touzi",Seed,,Angel,7,,,,,,,100000000,USD,100000000,Yes,,http://www.leadsbiolabs.com,,Late Stage Venture,,"558,426"
2015-12-15,MissQ is an online original content developer platform.,MissQ,https://www.crunchbase.com/organization/missq,"Digital Media, E-Commerce, Internet, Marketing","Beijing, Beijing, China, Asia",Angel Round - MissQ,https://www.crunchbase.com/funding_round/missq-angel--c0114952,2,"CSC Group, Supu Chuangxin",Seed,,Angel,2,5000000,CNY,773022,,,,15000000,CNY,2338408,Yes,,http://missquq.com,,Early Stage Venture,,"557,961"
2015-10-09,JFK Biotech produces and sells molecular diagnostic products for cancer.,JFK Biotech,https://www.crunchbase.com/organization/jfk-biotech,"Biotechnology, Medical","Hangzhou, Zhejiang, China, Asia",Angel Round - JFK Biotech,https://www.crunchbase.com/funding_round/jfk-biotech-angel--728d155f,2,"DNV capital, Qiming Venture Partners",Seed,,Angel,2,3000000,CNY,472654,,,,13000000,CNY,2053199,Yes,,http://www.jfkbio.com/,,Early Stage Venture,,"558,114"
2015-11-16,Trustmo Info is an information security products and technology development company.,Trustmo Info,https://www.crunchbase.com/organization/trustmo-info,"Cyber Security, Information Technology, Security","Guangzhou, Guangdong, China, Asia",Series A - Trustmo Info,https://www.crunchbase.com/funding_round/trustmo-info-series-a--1f347637,2,"Guangdong Technology Financial Group, Ren Feng Yue",Early Stage Venture,,Series A,3,10000000,CNY,1569477,,,,20000000,CNY,3163585,Yes,,https://www.trustmo.com,,IPO,,"557,451"
2015-11-04,Qilu Equity Exchange Center is an equity trading platform.,Qilu Equity Exchange Center,https://www.crunchbase.com/organization/qilu-guquan-jiaoyi-zhongxin,"Finance, Financial Services, Trading Platform","Zibo, Shandong, China, Asia",Seed Round - Qilu Equity Exchange Center,https://www.crunchbase.com/funding_round/qilu-guquan-jiaoyi-zhongxin-seed--0052e590,2,"Cninfo, Zhongtai Securities",Seed,,Seed,4,3000000,CNY,473461,,,,66000000,CNY,9799931,Yes,,https://www.qiluguquan.com/,,,,"558,795"
2015-12-16,U Voice is a developer of intelligent voiceprint recognition technology.,U Voice,https://www.crunchbase.com/organization/u-voice,"Artificial Intelligence (AI), Electronics, Software","Shanghai, Shanghai, China, Asia",Angel Round - U Voice,https://www.crunchbase.com/funding_round/u-voice-angel--81848e92,2,"Kaitai Capital, Xiaoi Robot",Seed,,Angel,2,3000000,CNY,463604,,,,13000000,CNY,2021054,Yes,,http://www.uvoicetech.com,$1M to $10M,Early Stage Venture,,"558,914"
2015-10-19,Huqing Yutang is a manufacturer of medicine.,Huqing Yutang,https://www.crunchbase.com/organization/huqing-yutang,"Health Care, Manufacturing, Medical","Hangzhou, Zhejiang, China, Asia",Series B - Huqing Yutang,https://www.crunchbase.com/funding_round/huqing-yutang-series-b--1033f59a,2,"Hangzhou Qingcheng Touzi Hehuo Qiye (Youxian Hehuo), Ningbo Furui Youyi Guquan Touzi Youxian Gongsi",Early Stage Venture,,Series B,5,20000000,CNY,3145416,,,,273000000,CNY,42679606,Yes,,http://www.hqyt.net/,,,,"559,388"
2015-12-01,Shulian is a reader service platform for educational book publishers.,Shulian,https://www.crunchbase.com/organization/shulian-0de5,"Education, Internet, Online Portals","Hangzhou, Zhejiang, China, Asia",Seed Round - Shulian,https://www.crunchbase.com/funding_round/shulian-0de5-seed--1d717fc8,2,"Jiayuan Capital, Vsun Capital",Seed,,Seed,6,20000000,CNY,3125440,,,,253000000,CNY,35887596,Yes,,https://www.yunti.ren,,Early Stage Venture,,"559,410"
2015-11-03,BabyBus is a developer of educational applications for preschool children.,BabyBus,https://www.crunchbase.com/organization/babybus,"Children, Education, Mobile","Foochow, Fujian, China, Asia",Series B - BabyBus,https://www.crunchbase.com/funding_round/babybus-series-b--911d39a7,1,Gene Capital,Early Stage Venture,,Series B,3,40000000,CNY,6312697,,,,8312697,USD,8312697,Yes,,https://www.babybus.com,$1M to $10M,Early Stage Venture,,"559,930"
2015-11-04,Yun Qingbao offers digital media content production and digital marketing services.,Yun Qingbao,https://www.crunchbase.com/organization/yun-qingbao,"Advertising, Content, Digital Marketing, Digital Media","Guangzhou, Guangdong, China, Asia",Post-IPO Equity - Yun Qingbao,https://www.crunchbase.com/funding_round/yun-qingbao-post-ipo-equity--df8a4797,2,"CFM Investments, Tongan Investment",,,Post-IPO Equity,8,8750000,CNY,1380928,,,,133100000,CNY,19479929,Yes,,http://www.kcis.cn,,IPO,,"563,511"
2015-10-29,Yunanbao is the developer of cloud security technologies and cloud access security broker platforms.,Yunanbao,https://www.crunchbase.com/organization/yunanbao,"Big Data, Cloud Computing, Cloud Security","Shenzhen, Guangdong, China, Asia",Angel Round - Yunanbao,https://www.crunchbase.com/funding_round/yunanbao-angel--8a24ac1b,2,"Shenzhen Gaopinsheng Investment, Surfilter Network Technology",Seed,,Angel,2,3000000,CNY,471923,,,,33000000,CNY,4939425,Yes,,http://www.yunanbao.com.cn,,Early Stage Venture,,"563,523"
2015-12-01,CHENGDU NET CUBE focuses on digital marketing and brand interactive communication services.,CHENGDU NET CUBE,https://www.crunchbase.com/organization/chengdu-net-cube,"Advertising, Digital Marketing, Internet","Chengdu, Sichuan, China, Asia",Angel Round - CHENGDU NET CUBE,https://www.crunchbase.com/funding_round/chengdu-net-cube-angel--9e5d7c9b,1,GF Xinde Investment Management,Seed,,Angel,1,10000000,CNY,1562720,,,,10000000,CNY,1562720,Yes,,http://www.adwlf.com/,,Seed,,"563,853"
2015-10-21,CITY CLOUD DATA CENTER is a data disaster recovery outsourcing service provider company.,CITY CLOUD DATA CENTER,https://www.crunchbase.com/organization/city-cloud-data-center,"Big Data, Information Services, Outsourcing","Hefei, Anhui, China, Asia",Angel Round - CITY CLOUD DATA CENTER,https://www.crunchbase.com/funding_round/city-cloud-data-center-angel--b2e196d7,2,"Anhui Zhongkeda Guozhen Xinxi Keji Youxian Zeren Gongsi, Biaoke Chuangtou",Seed,,Angel,2,3000000,CNY,472518,,,,3000000,CNY,472518,Yes,,http://www.citycloud.org.cn/,,IPO,,"562,299"
2015-10-01,ShareBang is an intelligent social marketing system.,ShareBang,https://www.crunchbase.com/organization/sharebang,"Marketing, Social","Beijing, Beijing, China, Asia",Angel Round - ShareBang,https://www.crunchbase.com/funding_round/sharebang-angel--ca621ddf,2,"Innoangel Fund, Taiyou Fund",Seed,,Angel,3,10000000,CNY,1573229,,,,30000000,CNY,4629841,Yes,,https://www.sharebang.com.cn/,,Early Stage Venture,,"560,759"
2015-12-14,TRCARTOON is an animation and comics studio that engages in comic and animation production.,TRCARTOON,https://www.crunchbase.com/organization/trcartoon,"Animation, Content, TV Production","Dalian, Zhejiang, China, Asia",Angel Round - TRCARTOON,https://www.crunchbase.com/funding_round/trcartoon-angel--1fdcedd2,1,Leyo Capital,Seed,,Angel,2,,,,,,,10000000,CNY,1509445,Yes,,,,Early Stage Venture,,"562,948"
2015-11-17,Sino Vision is a manufacturer of computed tomography machine.,Sino Vision,https://www.crunchbase.com/organization/sino-vision,"Health Care, Manufacturing, Medical, Medical Device","Daxing, Beijing, China, Asia",Series A - Sino Vision,https://www.crunchbase.com/funding_round/sino-vision-series-a--8ce5f30e,2,"CD Capital, Jinshahe Group",Early Stage Venture,,Series A,7,10000000,CNY,1567843,,,,456000000,CNY,70020961,Yes,,http://www.sinovision-tech.com/,,Late Stage Venture,,"563,249"
2015-12-10,Haitashidai is a professional game R&D and distribution company.,Haitashidai,https://www.crunchbase.com/organization/haitashidai,"Gaming, Information Technology, Online Games","Shenzhen, Guangdong, China, Asia",Angel Round - Haitashidai,https://www.crunchbase.com/funding_round/haitashidai-angel--73880249,2,"Jinhui Guoji Touzi, Yinhe Ruida",Seed,,Angel,2,3000000,CNY,466097,,,,13000000,CNY,1976637,Yes,,http://www.hitalkers.com,,Early Stage Venture,,"560,667"
2015-12-22,ZhuoZhuo Technology develops gaming and shopping applications for IOS devices.,ZhuoZhuo Technology,https://www.crunchbase.com/organization/zhuozhuo-technology,"Apps, Gaming, iOS","Chengdu, Sichuan, China, Asia",Angel Round - ZhuoZhuo Technology,https://www.crunchbase.com/funding_round/zhuozhuo-technology-angel--d0ede894,2,"Rongxi Venture, XY Venture Capital",Seed,,Angel,2,3000000,CNY,463105,,,,13000000,CNY,1994476,Yes,,https://zhuozhuo.io/,,Early Stage Venture,,"561,471"
2015-12-01,HuanTek is a research and development company specializing in motion capture and gesture recognition products.,HuanTek,https://www.crunchbase.com/organization/huantek,"Information Technology, Motion Capture, Virtual Reality","Guangzhou, Guangdong, China, Asia",Angel Round - HuanTek,https://www.crunchbase.com/funding_round/huantek-angel--f0e1fb86,1,Dong Bu Heng Zhun,Seed,,Angel,1,4000000,CNY,625088,,,,4000000,CNY,625088,Yes,,http://www.huantek.com,,Seed,,"560,202"
2015-11-02,LePur is a hand-made yogurt brand based in China.,Lepur,https://www.crunchbase.com/organization/lepur,"Fashion, Food and Beverage","Beijing, Beijing, China, Asia",Series A - Lepur,https://www.crunchbase.com/funding_round/lepur-series-a--fd26699d,2,"IDG Capital, ZhenFund",Early Stage Venture,,Series A,5,314985,CNY,49724,,,,945767,CNY,147082,Yes,,http://lechun.cc/,$50M to $100M,,,"560,541"
2015-12-11,Thunderobot provides gaming computers and accessories for esports enthusiasts.,Thunderobot,https://www.crunchbase.com/organization/thunderobot,"E-Commerce, Gaming, Hardware","Qingdao Shi, Shandong, China, Asia",Series B - Thunderobot,https://www.crunchbase.com/funding_round/thunderobot-series-b--f1c70ac7,2,"JD Digits, PurpleSky Capital",Early Stage Venture,,Series B,8,15750000,CNY,2441132,,,,183550000,CNY,27034654,Yes,,https://www.leishen.cn,,IPO,,"568,504"
2015-12-07,Haituanjian is a league building activities services platform company.,Haituanjian,https://www.crunchbase.com/organization/haituanjian,"Enterprise Resource Planning (ERP), Human Resources, Professional Services","Shanghai, Shanghai, China, Asia",Seed Round - Haituanjian,https://www.crunchbase.com/funding_round/haituanjian-seed--95f2768d,2,"Pros Partners, Youth Capital",Seed,,Seed,4,3000000,CNY,468440,,,,46000000,CNY,6810719,Yes,,http://www.haituanjian.com,,Early Stage Venture,,"568,805"
2015-10-22,evenControl provides electromechanical hydraulic integration products and solutions.,evenControl,https://www.crunchbase.com/organization/evencontrol,"Automotive, Manufacturing, Mechanical Engineering","Zhuzhou, Hunan, China, Asia",Angel Round - evenControl,https://www.crunchbase.com/funding_round/evencontrol-angel--4722daea,2,"Guangxin Zhaofu Investment, Jinshan Capital",Seed,,Angel,4,3000000,CNY,472029,,,,63000000,CNY,9375572,Yes,,http://www.jiachengtech.com/,,Late Stage Venture,,"569,427"
2015-11-13,MoShine is a video game development company.,MoShine,https://www.crunchbase.com/organization/moshine,"Gaming, Information Technology, Software, Video Games","Beijing, Beijing, China, Asia",Series A - MoShine,https://www.crunchbase.com/funding_round/moshine-series-a--3238f6dc,2,"Autobot Capital Partners, Shenzhen Shiyoulenianhua Keji Youxian Gongsi",Early Stage Venture,,Series A,3,10000000,CNY,1569331,,,,33000000,CNY,5051268,Yes,,http://www.msplay.cn/,,Early Stage Venture,,"569,522"
2015-10-17,fahaicc.com is a financial risk management information platform.,fahaicc.com,https://www.crunchbase.com/organization/fahaicc-com,"Finance, Risk Management, Wealth Management","Haidian, Beijing, China, Asia",Seed Round - fahaicc.com,https://www.crunchbase.com/funding_round/fahaicc-com-seed--90212167,2,"Bestone, Tsinghua Tongfang",Seed,,Seed,2,10000000,USD,10000000,,,,12879894,USD,12879894,Yes,,http://www.fahaicc.com,,Early Stage Venture,,"569,799"
2015-12-02,White Collar is a gift exchange platform.,White Collar,https://www.crunchbase.com/organization/white-collar,"E-Commerce, Gift, Gift Exchange","Beijing, Beijing, China, Asia",Series A - White Collar,https://www.crunchbase.com/funding_round/white-collar-series-a--5470e979,2,"Huazhen Equity Investment, Zhenggu Advertising",Early Stage Venture,,Series A,3,3000000,CNY,468975,,,,26000000,CNY,4025334,Yes,,http://www.bailingclub.com/,,Early Stage Venture,,"570,183"
2015-12-11,egocar is a vehicle networking equipment development company.,egocar,https://www.crunchbase.com/organization/egocar,"Automotive, Information Services, Information Technology","Shenzhen, Guangdong, China, Asia",Angel Round - egocar,https://www.crunchbase.com/funding_round/egocar-angel--e5874340,2,"Innovation Development Hub, Xianchang Investment",Seed,,Angel,3,3000000,CNY,464978,,,,15900000,CNY,2374120,Yes,,http://www.egocar.com.cn/,,Early Stage Venture,,"571,085"
2015-11-20,Das Security is a information security product and service solution provider.,Das Security,https://www.crunchbase.com/organization/das-security,"Big Data, Hardware, Security","Hangzhou, Zhejiang, China, Asia",Series C - Das Security,https://www.crunchbase.com/funding_round/das-security-series-c--231586d6,2,"Alibaba Innovation Investment, Juren Capital",Late Stage Venture,,Series C,6,100000000,CNY,15661516,,,,285000100,CNY,44148312,Yes,,http://www.dbappsecurity.com.cn,$50M to $100M,IPO,,"571,147"
2015-11-13,Flyminer provides video image recognition solutions and algorithms.,Flyminer,https://www.crunchbase.com/organization/flyminer,"Artificial Intelligence (AI), Image Recognition, Information Technology, Software","Wuhan, Hubei, China, Asia",Series A - Flyminer,https://www.crunchbase.com/funding_round/flyminer-series-a--2a3a61e9,1,Wuhan Optics Valley Elite Investment Management,Early Stage Venture,,Series A,1,10000000,CNY,1569331,,,,10000000,CNY,1569331,Yes,,https://www.flyminer.com/,,Early Stage Venture,,"571,237"
2015-11-10,Xiao Bei Keji is an electronic appliances hardware and software product development company.,Xiao Bei Keji,https://www.crunchbase.com/organization/xiao-bei-keji,"Electronics, Hardware, Software","Haidian, Beijing, China, Asia",Series A - Xiao Bei Keji,https://www.crunchbase.com/funding_round/xiao-bei-keji-series-a--d9a87497,2,"Haier Open Partnership Ecosystem (HOPE), Hiyield Capital",Early Stage Venture,,Series A,3,40000000,CNY,6288462,,,,10756837,USD,10756837,Yes,,http://www.ibaking.com/,,Early Stage Venture,,"571,275"
2015-12-08,Yishengzhan is an online medical education community for doctors based in China.,Yishengzhan,https://www.crunchbase.com/organization/yishengzhan,"Apps, Education, Medical","Shanghai, Shanghai, China, Asia",Series A - Yishengzhan,https://www.crunchbase.com/funding_round/yishengzhan-series-a--d6f28ef7,2,"Dalton Venture, iKang Healthcare Group",Early Stage Venture,,Series A,2,20000000,CNY,3117278,,,,27017278,USD,27017278,Yes,,https://www.yishengzhan.cn/,,Early Stage Venture,,"573,581"
2015-12-01,CloudIn is an international technology company that provides IaaS- and PaaS-based cloud services.,CloudIn,https://www.crunchbase.com/organization/cloudin,"Big Data, Cloud Computing, Cloud Data Services, SaaS, Software","Beijing, Beijing, China, Asia",Seed Round - CloudIn,https://www.crunchbase.com/funding_round/cloudin-seed--9a4407e9,2,"Morningside, Yunqi Partners",Seed,,Seed,2,40000000,CNY,6250879,,,,110000000,CNY,16423523,Yes,,https://www.cloudin.cn/,Less than $1M,Early Stage Venture,,"575,556"
2015-11-13,Qianxing Group is a digital marketing service provider.,Qianxing Group,https://www.crunchbase.com/organization/qianxing-group,Finance,"Chengdu, Sichuan, China, Asia",Angel Round - Qianxing Group,https://www.crunchbase.com/funding_round/qianxing-group-angel--6b52048b,2,"CDHTI Venture Capital, Dexin Investment",Seed,,Angel,3,3000000,CNY,470799,,,,13000000,CNY,1917813,Yes,,http://www.qianxingniwo.com,,,,"575,724"
2015-12-02,Orient Star is a cultural asset integration service platform.,Orient Star,https://www.crunchbase.com/organization/orient-star,"Digital Entertainment, Film, TV","Beijing, Beijing, China, Asia",Series A - Orient Star,https://www.crunchbase.com/funding_round/orient-star-series-a--c6aa346d,2,"Qinghua Chanye Jijin, Yiyixing Capital",Early Stage Venture,,Series A,3,10000000,CNY,1563251,,,,33000000,CNY,5126130,Yes,,http://www.orient-star.cn/,,Early Stage Venture,,"577,012"
2015-11-18,Anxin Doctor is a mobile maternal and pediatric health platform.,Anxin Doctor,https://www.crunchbase.com/organization/anxin-doctor,"Apps, Child Care, Health Care, Mobile, Women's","Beijing, Beijing, China, Asia",Series A - Anxin Doctor,https://www.crunchbase.com/funding_round/anxin-doctor-series-a--d89fc81e,2,"Ping An Ventures, Vision Plus Capital",Early Stage Venture,,Series A,4,,,,,,,32854842,USD,32854842,Yes,,http://anxinyisheng.com/,,Early Stage Venture,,"577,200"
2015-12-01,iGPSPORT is engaged in developing intelligent hardware and data services for sports.,iGPSPORT,https://www.crunchbase.com/organization/igpsport,"Hardware, Sporting Goods, Sports","Wuhan, Hubei, China, Asia",Angel Round - iGPSPORT,https://www.crunchbase.com/funding_round/igpsport-angel--0324ab93,2,"AngelCrunch, East-Lake Venture Capital",Seed,,Angel,2,3000000,CNY,468816,,,,6000000,CNY,917470,Yes,,http://www.igpsport.com,$10M to $50M,Early Stage Venture,,"577,772"
2015-11-13,E-View is a business development company that provides computer management systems and services for the shipping and logistics industries.,E-View,https://www.crunchbase.com/organization/e-view-f3f1,"Information Technology, Logistics, Software","Guangzhou, Guangdong, China, Asia",Angel Round - E-View,https://www.crunchbase.com/funding_round/e-view-f3f1-angel--30d66c58,2,"Guangtou Touzi, Yunhuogui",Seed,,Angel,2,3000000,CNY,470799,,,,13000000,CNY,1944425,Yes,,http://www.evlog.com/,,Early Stage Venture,,"577,841"
2015-12-15,Xiao Shuidi Ketang develops early childhood education technology products.,Xiao Shuidi Ketang,https://www.crunchbase.com/organization/xiao-shuidi-ketang,"Children, Education, Toys","Guangzhou, Guangdong, China, Asia",Series A - Xiao Shuidi Ketang,https://www.crunchbase.com/funding_round/xiao-shuidi-ketang-series-a--47d7e849,2,"The Pacific Securities, Wuhan Optics Valley Elite Investment Management",Early Stage Venture,,Series A,4,30000000,CNY,4638134,,,,93000000,CNY,13887045,Yes,,http://ishuidi.com/,,,,"577,938"
2015-12-01,Kuanyi provides a cash register system for restaurant operations.,Kuanyi,https://www.crunchbase.com/organization/kuanyi,"Information Technology, Payments, Restaurants","Guangzhou, Guangdong, China, Asia",Angel Round - Kuanyi,https://www.crunchbase.com/funding_round/kuanyi-angel--2a06a68e,2,"Innohub Capital, Yiyi",Seed,,Angel,2,10000000,CNY,1562720,,,,20000000,CNY,3093551,Yes,,http://www.kuan1.cn/,,Early Stage Venture,,"578,372"
2015-12-23,iHealthbaby offers medical and healthcare services for women and children.,iHealthbaby,https://www.crunchbase.com/organization/ihealthbaby,"Children, Health Care, Medical","Haidian, Beijing, China, Asia",Angel Round - iHealthbaby,https://www.crunchbase.com/funding_round/ihealthbaby-angel--2838ea99,2,"Ch-gemstone capital, Jiuwu Dingjian",Seed,,Angel,4,3000000,CNY,463084,,,,63000000,CNY,9436650,Yes,,http://www.ihealthbaby.cn/,$10M to $50M,Late Stage Venture,,"578,460"
2015-10-13,Seoul Education is a language training institute.,shoueredu.com,https://www.crunchbase.com/organization/shoueredu-com,"Education, Language Learning, Training","Hangzhou, Zhejiang, China, Asia",Seed Round - shoueredu.com,https://www.crunchbase.com/funding_round/shoueredu-com-seed--bf9b4c7d,2,"NewMargin Ventures, Yonghua Capital",Seed,,Seed,2,1000000,CNY,157784,,,,4000000,CNY,607635,Yes,,http://www.shoueredu.com,,Seed,,"578,592"
2015-12-01,BONBON is a children's clothing shopping platform.,BONBON,https://www.crunchbase.com/organization/bonbon-644d,"Children, E-Commerce, Textiles","Hangzhou, Zhejiang, China, Asia",Series A - BONBON,https://www.crunchbase.com/funding_round/bonbon-644d-series-a--a724c941,2,"5Y Capital, Redpoint Ventures China",Early Stage Venture,,Series A,2,10000000,CNY,1562720,,,,21562720,USD,21562720,Yes,,http://www.bbtkids.cn/,,Early Stage Venture,,"579,018"
2015-12-23,Broadcare Robot is an industrial manufacturing company specialized in medical robot and medical automation.,Broadcare Robot,https://www.crunchbase.com/organization/broadcare-robot,"Health Care, Industrial Manufacturing, Manufacturing, Medical Device, Robotics","Shenzhen, Guangdong, China, Asia",Angel Round - Broadcare Robot,https://www.crunchbase.com/funding_round/broadcare-robot-angel--7fe899b2,2,"Readysun Group, SIAT",Seed,,Angel,4,3000000,CNY,463084,,,,73000000,CNY,10915870,Yes,,http://www.broadcare.com.cn/,,Early Stage Venture,,"579,143"
2015-10-13,REDFINGER is a virtual cloud phone for mobile games and applications.,REDFINGER,https://www.crunchbase.com/organization/redfinger,"Cloud Computing, Information Technology, Mobile Apps","Tianxin, Hunan, China, Asia",Angel Round - REDFINGER,https://www.crunchbase.com/funding_round/redfinger-angel--258cc945,2,"Ding Kai Hu Lian, Heyi Asset Management",Seed,,Angel,2,3000000,CNY,473353,,,,23000000,CNY,3414481,Yes,,https://www.gc.com.cn,,M&A,,"579,593"
2015-12-14,"HOUDAR is a company for R&D, production, sales and service of robotics products.",HOUDAR,https://www.crunchbase.com/organization/houdar,"Manufacturing, Robotics, Sales","Hangzhou, Zhejiang, China, Asia",Angel Round - HOUDAR,https://www.crunchbase.com/funding_round/houdar-angel--e85a8789,2,"Holley Group, Huachang Chuang Tou",Seed,,Angel,2,30000000,CNY,4648306,,,,46500000,CNY,7155407,Yes,,http://www.hzhouda.com/,,IPO,,"579,641"
2015-12-23,Busionline.com is a provider of online entrepreneurship training and service platform solutions.,Busionline.com,https://www.crunchbase.com/organization/busionline-com,"Education, Internet, Training","Hangzhou, Zhejiang, China, Asia",Series A - Busionline.com,https://www.crunchbase.com/funding_round/busionline-com-series-a--77f59645,2,"Jiaxing Linghui Venture Capital Management, Shanghai Fucheng Haifutong Asset Management",Early Stage Venture,,Series A,3,10000000,CNY,1543614,,,,33000000,CNY,4990531,Yes,,http://www.busionline.com/,,Early Stage Venture,,"564,271"
2015-12-01,beidou.im provides emergency communications products and security services.,beidou.im,https://www.crunchbase.com/organization/beidou-im,"Outdoors, Satellite Communication","Guangzhou, Guangdong, China, Asia",Angel Round - beidou.im,https://www.crunchbase.com/funding_round/beidou-im-angel--b9349e4d,1,Techtotop,Seed,,Angel,1,10000000,CNY,1562720,,,,10000000,CNY,1562720,Yes,,https://www.beidou.im,,Seed,,"564,281"
2015-12-01,"Minivision offers machine learning, big data visualization, AI and IoT technology services.",Minivision,https://www.crunchbase.com/organization/minivision,"Artificial Intelligence (AI), Big Data, Internet of Things, Machine Learning","Nanjing, Jiangsu, China, Asia",Series A - Minivision,https://www.crunchbase.com/funding_round/minivision-series-a--9d47bd6b,2,"Nanjing Xinliuyu Touzi, Zhong Ze Capital",Early Stage Venture,,Series A,3,20000000,CNY,3125440,,,,50000000,CNY,7804288,Yes,,https://www.minivision.cn,,Early Stage Venture,,"564,316"
2015-11-10,Smart Conference is an online event management platform.,Smart Conference,https://www.crunchbase.com/organization/smart-conference,"Event Management, Event Promotion, Online Portals","Nanshanqu, Guangdong, China, Asia",Angel Round - Smart Conference,https://www.crunchbase.com/funding_round/smart-conference-angel--d6d1657a,1,HUA YANG XINTONG,Seed,,Angel,1,3000000,CNY,471635,,,,3000000,CNY,471635,Yes,,https://www.zhihuihuiwu.com/,,Seed,,"564,725"
