2015-12-07,Fourier Intelligence is a Technology and design company,Fourier Intelligence,https://www.crunchbase.com/organization/fourier-intelligence,"Medical, Medical Device, Rehabilitation","Shanghai, Shanghai, China, Asia",Angel Round - Fourier Intelligence,https://www.crunchbase.com/funding_round/fourier-intelligence-angel--45f07df1,2,"IDG Capital, Zhangjiang Torch Venture Capital Co",Seed,IDG Capital,Angel,8,8000000,CNY,1249174,,,,1438000000,CNY,207401795,Yes,,http://www.fftai.com,$10M to $50M,Late Stage Venture,,"368,087"
2015-11-24,Weiwangtonglian provides cloud communication and mobile marketing services.,Weiwangtonglian,https://www.crunchbase.com/organization/weiwangtonglian,"Information Technology, Marketing, Mobile","Haidian, Beijing, China, Asia",Series B - Weiwangtonglian,https://www.crunchbase.com/funding_round/weiwangtonglian-series-b--3f06c626,1,Jinhuanan Investment,Early Stage Venture,Jinhuanan Investment,Series B,3,20000000,CNY,3130706,,,,33000000,CNY,5174515,Yes,,http://www.51welink.com/,,IPO,,"371,117"
2015-11-10,Xingtianji develops mobile Internet parent-child education games.,Xingtianji,https://www.crunchbase.com/organization/xingtianji,"Education, Gaming, Media and Entertainment","Haidian, Beijing, China, Asia",Seed Round - Xingtianji,https://www.crunchbase.com/funding_round/xingtianji-seed--55f70ad6,2,"Golden Sunflower Capital, VCSpark",Seed,VCSpark,Seed,4,20000000,CNY,3144231,,,,34000000,CNY,5299809,Yes,,http://www.xingtianji.com/,,Early Stage Venture,,"369,083"
2015-11-01,Phylion Battery is a manufacturer of lithium-ion batteries for electric vehicles.,Phylion Battery,https://www.crunchbase.com/organization/phylion-battery,"Battery, Electric Vehicle, Manufacturing","Suzhou, Jiangsu, China, Asia",Series A - Phylion Battery,https://www.crunchbase.com/funding_round/phylion-battery-series-a--9201d2a0,2,"CCB International, Harmony Riverside",Early Stage Venture,CCB International,Series A,4,400000000,CNY,63317588,,,,2272000000,CNY,349458436,Yes,,http://www.phylion.com/,$1M to $10M,,,"371,942"
2015-11-19,Huikedu is a Beijing-based education provider which offers higher education and vocational education services and products,Huikedu Group,https://www.crunchbase.com/organization/huikedu-group,"E-Commerce, E-Learning, Education, Higher Education","Beijing, Beijing, China, Asia",Series B - Huikedu Group,https://www.crunchbase.com/funding_round/huikedu-group-series-b--23200fda,2,"Fosun RZ Capital, Qianhe Capital",Early Stage Venture,Qianhe Capital,Series B,4,300000000,CNY,46996854,,,,302195048,USD,302195048,Yes,,http://www.huikedu.com,$50M to $100M,Late Stage Venture,,"371,976"
2015-11-23,MOGU operates a fashion-focused e-commerce website.,MOGU,https://www.crunchbase.com/organization/mogujie,"Beauty, E-Commerce, Fashion","Hangzhou, Zhejiang, China, Asia",Series E - MOGU,https://www.crunchbase.com/funding_round/mogujie-series-e--d9757009,2,"Ping An, Ping An Ventures",Late Stage Venture,Ping An Ventures,Series E,7,200000000,USD,200000000,,,,411000000,USD,411000000,Yes,,http://www.mogu-inc.com,$10M to $50M,IPO,,"372,343"
2015-10-01,Just for health is a third party medical services provider.,Kuai Xing Fang,https://www.crunchbase.com/organization/kuai-xing-fang,"Health Care, Medical, Pharmaceutical","Haidian, Beijing, China, Asia",Seed Round - Kuai Xing Fang,https://www.crunchbase.com/funding_round/kuai-xing-fang-seed--3a3cb10d,2,"Matrix Partners China, Zhenshun Jijin",Seed,Matrix Partners China,Seed,3,20000000,CNY,3146459,,,,38000000,CNY,5925823,Yes,,http://www.kuaimayiliao.com/,,Early Stage Venture,,"372,432"
2015-10-27,China Palmary Auto-service Union provides IT solutions for the automotive aftermarket service industry.,China Palmary Auto-service Union,https://www.crunchbase.com/organization/china-palmary-auto-service-union,"Automotive, Information Services, Information Technology","Nanan, Chongqing, China, Asia",Series A - China Palmary Auto-service Union,https://www.crunchbase.com/funding_round/china-palmary-auto-service-union-series-a--ef632b81,1,Richland Equities,Early Stage Venture,Richland Equities,Series A,2,10000000,CNY,1574084,,,,13000000,CNY,2062794,Yes,,http://www.cjm168.com/,,Early Stage Venture,,"372,710"
2015-11-01,Xiao Qian Keji is a travel metaverse script game engine platform.,Xiao Qian Keji,https://www.crunchbase.com/organization/xiao-qian-keji,"Augmented Reality, Information Technology, Metaverse, Travel","Xiamen, Fujian, China, Asia",Angel Round - Xiao Qian Keji,https://www.crunchbase.com/funding_round/xiao-qian-keji-angel--b5d3cc66,2,"AC Accelerator, Eagles Fund",Seed,AC Accelerator,Angel,3,3000000,CNY,474882,,,,14000000,CNY,2100179,Yes,,http://www.lixiaoqian.cn/,,Early Stage Venture,,"364,284"
2015-12-01,Banmi Yunqizhuanjia is an online pregnancy education platform.,Banmi Yunqizhuanjia,https://www.crunchbase.com/organization/banmi-yunqizhuanjia,"Health Care, Information Technology, Medical","Haidian, Beijing, China, Asia",Angel Round - Banmi Yunqizhuanjia,https://www.crunchbase.com/funding_round/banmi-yunqizhuanjia-angel--3c86f677,2,"Angel Plus China, Ming Lei",Seed,Angel Plus China,Angel,3,4200000,CNY,656342,,,,15200000,CNY,2266552,Yes,,http://banmi.mobi/,,Seed,,"365,193"
2015-11-04,Mogoroom is an O2O apartment rental platform that offers standardized apartments for young professionals.,Mogoroom,https://www.crunchbase.com/organization/mogoroom,"Internet, Property Management, Real Estate, Rental","Shanghai, Shanghai, China, Asia",Series B - Mogoroom,https://www.crunchbase.com/funding_round/mogoroom-series-b--0128500a,2,"IDG Capital, KTB Network",Early Stage Venture,KTB Network,Series B,4,30000000,USD,30000000,,,,85000000,USD,85000000,Yes,,http://www.mogoroom.com/,$1M to $10M,Late Stage Venture,,"374,914"
2015-10-26,"Ruhnn Holding distributes clothes, shoes, leather goods, and cosmetics.",Ruhnn Holding Limited,https://www.crunchbase.com/organization/ruhnn-holding-limited,"Consumer Goods, Fashion","Hangzhou, Zhejiang, China, Asia",Series B - Ruhnn Holding Limited,https://www.crunchbase.com/funding_round/ruhnn-holding-limited-series-b--112e4f7f,2,"Legend Capital, SAIF Partners",Early Stage Venture,Legend Capital,Series B,4,,,,,,,300000000,CNY,44324630,Yes,,http://www.ruhnn.com/,$10M to $50M,IPO,,"374,968"
2015-12-03,BOLE DESIGN is an industrial design brand of eco-enterprises.,BOLE DESIGN,https://www.crunchbase.com/organization/bole-design,"Industrial, Industrial Design, Product Design","Hangzhou, Zhejiang, China, Asia",Angel Round - BOLE DESIGN,https://www.crunchbase.com/funding_round/bole-design-angel--455f18c0,1,Kunming Zhongjin Guquan Touzi,Seed,Kunming Zhongjin Guquan Touzi,Angel,1,3000000,CNY,468868,,,,3000000,CNY,468868,Yes,,https://www.hzbole.cn,,Seed,,"375,318"
2015-11-03,Vaqoung is a manufacturer and service provider of automotive air-conditioners and compressors.,Vaqoung,https://www.crunchbase.com/organization/vaqoung,"Electronics, Manufacturing, Service Industry","Changshahsien, Hunan, China, Asia",Series A - Vaqoung,https://www.crunchbase.com/funding_round/vaqoung-series-a--0319e1bb,1,China Development Bank,Early Stage Venture,China Development Bank,Series A,4,64500000,CNY,10179224,,,,94640000,CNY,14912732,Yes,,http://www.vaqoung.com/,,IPO,,"374,108"
2015-11-04,INFINIT is an automotive electronic health record system development company.,INFINIT,https://www.crunchbase.com/organization/infinit-19eb,"Automotive, Electronic Health Record (EHR), Electronics","Wuxi Shi, Jiangsu, China, Asia",Series A - INFINIT,https://www.crunchbase.com/funding_round/infinit-19eb-series-a--9ebb06f8,1,Keluonixin Yangzi Investment Management Consulting,Early Stage Venture,Keluonixin Yangzi Investment Management Consulting,Series A,2,10000000,CNY,1578203,,,,15000000,CNY,2383411,Yes,,http://www.inf-technology.com/,,IPO,,"375,026"
2015-12-01,Zhuanjiabao offers legal and consultancy services.,Zhuanjiabao,https://www.crunchbase.com/organization/zhuanjiabao-com,"Consulting, Law Enforcement, Legal","Chongqing Shi, Chongqing, China, Asia",Angel Round - Zhuanjiabao,https://www.crunchbase.com/funding_round/zhuanjiabao-com-angel--86031702,2,"Amazon AWS Incubator, Nuoyu Investment",Seed,Nuoyu Investment,Angel,2,4500000,CNY,703224,,,,12300000,CNY,1904377,Yes,,http://www.zhuanjiabao.com/,,Early Stage Venture,,"376,452"
2015-10-16,36Kr is a China-based publishing and data company focused on the ‘new economy’,36Kr,https://www.crunchbase.com/organization/36kr,"Finance, Financial Services, FinTech, Information and Communications Technology (ICT), Information Services, Social Media, Venture Capital","Beijing, Beijing, China, Asia",Series D - 36Kr,https://www.crunchbase.com/funding_round/36kr-series-d--e2766105,2,"Ant Group, Matrix Partners China",Late Stage Venture,Ant Group,Series D,6,,,,,,,153110519,USD,153110519,Yes,,http://36kr.com,$10M to $50M,IPO,,"377,110"
2015-12-01,HiCTO offers technical consulting services for entrepreneurs.,HiCTO,https://www.crunchbase.com/organization/hicto,"Business Development, Consulting, Management Consulting","Xuhui, Shanghai, China, Asia",Angel Round - HiCTO,https://www.crunchbase.com/funding_round/hicto-angel--4bcf20b9,2,"Gaorong Capital, Magic Capital",Seed,,Angel,1,3000000,CNY,468816,,,,3000000,CNY,468816,Yes,,https://www.hicto.tech/,,Seed,,"378,093"
2015-11-01,Jenkem Technology is a manufacturer of polyethylene glycol products for medical devices and pharmaceutical applications.,Jenkem Technology,https://www.crunchbase.com/organization/jenkem-technology-4af5,"Manufacturing, Medical, Medical Device, Pharmaceutical","Haidian, Beijing, China, Asia",Angel Round - Jenkem Technology,https://www.crunchbase.com/funding_round/jenkem-technology-4af5-angel--055911a7,1,Yield Capital,Seed,,Angel,1,,,,,,,,,,Yes,,http://www.jenkem.com,,IPO,,"378,197"
2015-12-04,Genesky is a gene analysis technology company.,GENESKY,https://www.crunchbase.com/organization/genesky,"Health Care, Medical, Product Research","Suzhou Shi, Jiangsu, China, Asia",Series A - GENESKY,https://www.crunchbase.com/funding_round/genesky-series-a--d43a497c,3,"Gaotong Touzi, Hongsheng Touzi, Shenzhen Capital Group",Early Stage Venture,,Series A,2,10000000,CNY,1562454,,,,90000000,CNY,14488526,Yes,,http://www.geneskies.com/,,Early Stage Venture,,"378,413"
2015-11-01,Star Time Incubator Management provides corporate management training and consulting services.,Time & Space,https://www.crunchbase.com/organization/time-space,"Consulting, Corporate Training, Service Industry","Beijing, Beijing, China, Asia",Angel Round - Time & Space,https://www.crunchbase.com/funding_round/time-space-angel--b1d44924,2,"Fengyun Capital, Legend Star",Seed,,Angel,1,15000000,CNY,2374410,,,,15000000,CNY,2374410,Yes,,http://www.timeoffice.com.cn/,,Seed,,"378,499"
2015-11-01,soudang.com develops SaaS products for the finance industry.,soudang.com,https://www.crunchbase.com/organization/soudang-com,"Finance, Financial Services, Information Technology, SaaS","Beijing, Beijing, China, Asia",Series A - soudang.com,https://www.crunchbase.com/funding_round/soudang-com-series-a--7b35f7ea,1,Vangoo Investment Partners,Early Stage Venture,Vangoo Investment Partners,Series A,3,20000000,CNY,3165879,,,,4308779,USD,4308779,Yes,,http://www.soudang.com/,,Early Stage Venture,,"378,537"
2015-12-06,CloverSec Labs is a professional network security integrated solution provider.,CloverSec Labs,https://www.crunchbase.com/organization/cloversec-labs,"Information Services, Information Technology, Security","Xian, Hunan, China, Asia",Seed Round - CloverSec Labs,https://www.crunchbase.com/funding_round/cloversec-labs-seed--c57c700b,1,CrestValue,Seed,CrestValue,Seed,3,30000000,CNY,4685187,,,,97000000,CNY,14987807,Yes,,http://www.seclover.com,,Early Stage Venture,,"378,609"
2015-11-18,Source Homo Technology provides image detection systems and intelligent robotics research and development services.,Source Homo Technology,https://www.crunchbase.com/organization/source-homo-technology,"Artificial Intelligence (AI), Image Recognition, Robotics","Baoan, Guangdong, China, Asia",Post-IPO Equity - Source Homo Technology,https://www.crunchbase.com/funding_round/source-homo-technology-post-ipo-equity--26a1a94b,8,"Cezheng Touzi, China Merchants Securities, Essence Securities, GF Securities, Huarong Securities, Huihai Tiancheng, Lihe Xin Nengyuan Chuangtou, Ping An Fund",,,Post-IPO Equity,3,10000000,CNY,1566541,,,,131540000,CNY,21002970,Yes,,https://heylink.me/daftarbonbon777/,,IPO,,"379,010"
2015-11-25,Jiangsu Re-guarantee provides financial services for small and medium-sized enterprises.,Jiangsu Re-guarantee,https://www.crunchbase.com/organization/jiangsu-re-guarantee,"Banking, Financial Services, Small and Medium Businesses","Nanjing, Jiangsu, China, Asia",Series E - Jiangsu Re-guarantee,https://www.crunchbase.com/funding_round/jiangsu-re-guarantee-series-e--ee6b6e7e,8,"Changzhoushi Xinbeiqu Renmin Zhengfu, Dongtaishi Touzi Fazhan Youxian Gongsi, Jiangsusheng Funing Jingji Kaifaqu Guanli Weiyuanhui, Jianhuxian Renmin Zhengfu, Yangzhoushi Guanglingqu Renmin Zhengfu Guoyou Zichan Jiandu Guanli Bangongshi, Yangzhoushi Hanjiangqu Renmin Zhengfu Guoyou Zichan Jiandu Guanli Bangongshi, Yinshan Capital, Zhenjiangshi Chuanshan Fengjing Mingshengqu Guanli Weiyuanhui",Late Stage Venture,,Series E,8,50000000,CNY,7827036,,,,263000000,CNY,41118422,Yes,,http://jscrg.com/,,Late Stage Venture,,"379,421"
2015-11-18,Daoyoudao is a mobile internet marketing and industrial internet service platform.,Daoyoudao,https://www.crunchbase.com/organization/daoyoudao,"Advertising, Digital Marketing, Internet, Marketing","Haidian, Beijing, China, Asia",Post-IPO Equity - Daoyoudao,https://www.crunchbase.com/funding_round/daoyoudao-post-ipo-equity--bdff9fa3,8,"Changjiang Securities, CICC, Cinda Securities, Founder Securities, Guosen Securities, Kaiyuan Securities, Ping An Securities Group Holdings, Zhongtai Securities",,,Post-IPO Equity,4,50000000,CNY,7832706,,,,183000000,CNY,28250356,Yes,,http://www.daoyoudao.com/,,IPO,,"379,817"
2015-11-15,"Zhongshui Sanli provides system integration, application software development, operation and maintenance services for water resources.",Zhongshui Sanli,https://www.crunchbase.com/organization/zhongshui-sanli,"Information Technology, Software, Water","Hefei, Anhui, China, Asia",Venture Round - Zhongshui Sanli,https://www.crunchbase.com/funding_round/zhongshui-sanli-series-unknown--5ae8d8bf,3,"Hefei Huohua Chuangtou, Hengfeng Huifu, Sanda Touzi",,,Venture - Series Unknown,1,50000000,CNY,7841624,,,,50000000,CNY,7841624,Yes,,http://www.sunnyhf.com/,,IPO,,"380,232"
2015-11-13,Beijiao Media is a provider of a K12 online education platform.,Beijiao Media,https://www.crunchbase.com/organization/beijiao-media,"EdTech, Education, Higher Education","Beijing, Beijing, China, Asia",Post-IPO Equity - Beijiao Media,https://www.crunchbase.com/funding_round/beijiao-media-post-ipo-equity--ec6adc18,3,"CITIC Securities, JC Capital, Tianxing Capital",,,Post-IPO Equity,1,80000000,CNY,12554648,,,,80000000,CNY,12554648,Yes,,http://www.bjkgedu.com/,,IPO,,"380,347"
2015-11-17,"Hive is an online community marketplace where young people can discover volunteer jobs, and internship opportunities.",Hivetrips,https://www.crunchbase.com/organization/hivetrips,"Marketplace, Online Portals, Tourism, Travel","Beijing, Beijing, China, Asia",Venture Round - Hivetrips,https://www.crunchbase.com/funding_round/hivetrips-series-unknown--8ed4a70d,3,"CDH Investments, IDG Capital, Will Hunting Capital",,,Venture - Series Unknown,2,6500000,USD,6500000,,,,9500000,USD,9500000,Yes,,http://www.hivetrips.com,,,,"380,760"
2015-11-02,IGene is an audio-visual production company.,IGene,https://www.crunchbase.com/organization/igene,"Audio, Consumer Electronics, Sales","Beijing, Beijing, China, Asia",Series A - IGene,https://www.crunchbase.com/funding_round/igene-series-a--e94d6403,3,"Legend Holdings, Lenovo Capital and Incubator Group (LCIG), Lianxiangle Jijin",Early Stage Venture,,Series A,1,30000000,CNY,4735805,,,,30000000,CNY,4735805,Yes,,http://www.91qiaoqiao.com/,$1M to $10M,Early Stage Venture,,"381,029"
2015-12-01,"Trustdata is a mobile internet big data monitoring platform that provides terminal data products, consulting and professional services.",Trustdata,https://www.crunchbase.com/organization/trustdata,"Big Data, Consulting, Professional Services","Beijing, Beijing, China, Asia",Series A - Trustdata,https://www.crunchbase.com/funding_round/trustdata-series-a--af49168f,3,"Haowangjiao Touzi, Sinovation Ventures, ZhenFund",Early Stage Venture,,Series A,2,40000000,CNY,6250879,,,,7250879,USD,7250879,Yes,,http://www.itrustdata.cn/,,Early Stage Venture,,"381,400"
2015-12-04,Jiela E-sports is an internet company that integrates brand management and software development.,Jiela E-sports,https://www.crunchbase.com/organization/jiela-e-sports,"Coffee, Internet, Video Games","Hangzhou, Zhejiang, China, Asia",Angel Round - Jiela E-sports,https://www.crunchbase.com/funding_round/jiela-e-sports-angel--f8a0ebfd,3,"Dongfang Xingkong Touzi, ShunWang Technology, Xingmeng Chuangtou",Seed,,Angel,1,3000000,CNY,468736,,,,3000000,CNY,468736,Yes,,https://www.ijiela.com/,,Seed,,"381,440"
2015-11-28,Wuage is an e-commerce B2B steel procurement business platform.,Wuage,https://www.crunchbase.com/organization/wuage,"B2B, E-Commerce, Procurement","Beijing, Beijing, China, Asia",Venture Round - Wuage,https://www.crunchbase.com/funding_round/wuage-series-unknown--aa7d32e8,3,"Alibaba Capital Partners, Beijing Yuanhui, Minmentals Development",,,Venture - Series Unknown,1,590000000,CNY,92273401,,,,590000000,CNY,92273401,Yes,,https://www.wuage.com/,,,,"381,673"
2015-12-22,CHYF is a builder of outdoor media network for shelters.,CHYF,https://www.crunchbase.com/organization/chyf,"Advertising, Digital Media, Marketing","Beijing, Beijing, China, Asia",Series A - CHYF,https://www.crunchbase.com/funding_round/chyf-series-a--ef59c2b6,3,"Chuanjiang Investment, Hanfeng Capital, Xin Ding Capital",Early Stage Venture,,Series A,1,10000000,CNY,1543683,,,,10000000,CNY,1543683,Yes,,http://www.chyf.com.cn/,,IPO,,"382,091"
2015-11-16,To Show provides software to create all kinds of graffiti works online.,To Show,https://www.crunchbase.com/organization/to-show,"Graphic Design, Mobile Apps, Software","Changshahsien, Hunan, China, Asia",Angel Round - To Show,https://www.crunchbase.com/funding_round/to-show-angel--5c7ab655,3,"GeekFounders, Sinovation Ventures, ZhenFund",Seed,,Angel,2,6000000,CNY,941686,,,,7000000,CNY,1102720,Yes,,http://www.toshow.com/,,Seed,,"382,135"
2015-11-09,JFun Zhuanjiao provides supply chain management solutions for the retail field and FMCG industry.,JFun Zhuanjiao,https://www.crunchbase.com/organization/jfun-zhuanjiao,"Food and Beverage, Retail, Supply Chain Management","Shenzhen, Guangdong, China, Asia",Angel Round - JFun Zhuanjiao,https://www.crunchbase.com/funding_round/jfun-zhuanjiao-angel--15534a13,3,"Oriental Fortune Capital, Shenzhen Fengtouxia, Yihui Touzi",Seed,,Angel,1,3000000,CNY,471663,,,,3000000,CNY,471663,Yes,,http://www.jfun365.com/,,Seed,,"382,856"
2015-10-28,Kemai is the free individual customer management tool.,Kemai,https://www.crunchbase.com/organization/kemai,"Enterprise Software, Information Services, Information Technology, Mobile Apps, Software","Beijing, Beijing, China, Asia",Series A - Kemai,https://www.crunchbase.com/funding_round/kemai-series-a--73ce95ef,3,"China Soft Capital, IDG Capital, Northern Light Venture Capital",Early Stage Venture,,Series A,2,,,,,,,,,,Yes,,http://www.kemaicrm.com/,,Early Stage Venture,,"383,405"
2015-11-02,Xiaoban Hui engaged in the development and research of audio and video technologies.,Xiaoban Hui,https://www.crunchbase.com/organization/xiaoban-hui,"Audio, Information Technology, Video","Beijing, Beijing, China, Asia",Angel Round - Xiaoban Hui,https://www.crunchbase.com/funding_round/xiaoban-hui-angel--74e911ac,3,"Frees Fund, Hanhai Zhiye, Sinovation Ventures",Seed,,Angel,1,3000000,CNY,473581,,,,3000000,CNY,473581,Yes,,http://xiaobanhui.com/,,Seed,,"382,456"
2015-10-12,"58 Daojia provides online information and access to high-quality offline services such as cleaning, moving, babysitting, and beauty care.",58 Daojia,https://www.crunchbase.com/organization/58daojia,"Internet, Local Business, Service Industry","Beijing, Beijing, China, Asia",Series A - 58 Daojia,https://www.crunchbase.com/funding_round/58daojia-series-a--940a4a14,3,"Alibaba Group, Kohlberg Kravis Roberts, Ping An",Early Stage Venture,,Series A,1,300000000,USD,300000000,700000000,USD,700000000,300000000,USD,300000000,Yes,,https://bj.daojia.com,,Early Stage Venture,,"383,044"
2015-11-23,lvyouquan is a developer of an online travel platform designed to offer product booking and transaction.,lvyouquan,https://www.crunchbase.com/organization/lvyouquan,"B2B, Marketing, Travel","Shanghai, Shanghai, China, Asia",Series B - lvyouquan,https://www.crunchbase.com/funding_round/lvyouquan-series-b--3826e839,3,"E-House, Guangzhou Nan Yue Fund, Haitong Kaiyuan Investment",Early Stage Venture,,Series B,2,78000000,USD,78000000,,,,97517952,USD,97517952,Yes,,http://www.lvyouquan.cn,,Early Stage Venture,,"382,580"
2015-10-27,Yaoshi Quanyun Jiankang is a cloud platform for claiming health insurance policies.,Yaoshi Quanyun Jiankang,https://www.crunchbase.com/organization/yaoshi-quanyun-jiankang,"Health Care, Health Insurance, Medical, Pharmaceutical","Jingan, Shanghai, China, Asia",Angel Round - Yaoshi Quanyun Jiankang,https://www.crunchbase.com/funding_round/yaoshi-quanyun-jiankang-angel--a873fc14,3,"Cenova, Guoyao Jiankang, Winning Health Technology Group",Seed,,Angel,1,6500000,CNY,1023154,,,,6500000,CNY,1023154,Yes,,http://www.pharmakeyring.com/,,Seed,,"382,697"
2015-10-22,iRAID is a mobile Internet financial security identity authentication service provider company.,iRAID,https://www.crunchbase.com/organization/iraid,"Finance, Hardware, Mobile","Shanghai, Shanghai, China, Asia",Series B - iRAID,https://www.crunchbase.com/funding_round/iraid-series-b--082d2b68,3,"Pengchang Qiye Guanli, Shuangdian Qiye Guanli, Yekuo Qiye Guanli",Early Stage Venture,,Series B,3,19800000,CNY,3115388,,,,32800000,CNY,5204078,Yes,,http://www.xwf-id.com,,Early Stage Venture,,"383,574"
2015-10-01,Shanghai Yunfeikong Information Technology Co is a finance and tax cloud management solutions company.,Kuailejia,https://www.crunchbase.com/organization/kuailejia,"Financial Services, Software","Shanghai, Shanghai, China, Asia",Angel Round - Kuailejia,https://www.crunchbase.com/funding_round/kuailejia-angel--17b6e1bb,3,"Plum Ventures, Step Venture Capital, UnityVC",Seed,,Angel,1,7000000,CNY,1101261,,,,7000000,CNY,1101261,Yes,,http://www.funacc.com,,Seed,,"383,578"
2015-10-01,Ai Huan Ji is an idle mobile phone recycling service provider.,Ai Huan Ji,https://www.crunchbase.com/organization/ai-huan-ji,"Mobile Devices, Recycling, Technical Support","Beijing, Beijing, China, Asia",Series A - Ai Huan Ji,https://www.crunchbase.com/funding_round/ai-huan-ji-series-a--fcb8a110,3,"D.Phone, Eagles Fund, Yiyi",Early Stage Venture,,Series A,3,20000000,CNY,3146459,,,,73000000,CNY,11715889,Yes,,http://www.aihuanji.com,,Early Stage Venture,,"383,720"
2015-10-26,Little Tail Sheep Group is a food production and catering chain brand that develops sheep products.,Xiaowei Yang Jituan,https://www.crunchbase.com/organization/xiaowei-yang-jituan,"Catering, Food and Beverage, Restaurants","Baotou, Nei Mongol, China, Asia",Series A - Xiaowei Yang Jituan,https://www.crunchbase.com/funding_round/xiaowei-yang-jituan-series-a--cc546bce,3,"Baihui Hengxing Trading, Jiasheng Group, Jingyang Rongsheng Investment Management Center",Early Stage Venture,,Series A,2,10000000,CNY,1574501,,,,13000000,CNY,2044779,Yes,,http://www.nmxwy.com,$1M to $10M,IPO,,"383,885"
2015-11-30,Huangdi is a technology enterprise that improves environment-friendly vehicle exhaust pollution.,Huangdi,https://www.crunchbase.com/organization/huangdi,"Automotive, Pollution Control, Service Industry","Kaili, Guizhou, China, Asia",Series B - Huangdi,https://www.crunchbase.com/funding_round/huangdi-series-b--b38f0a89,3,"Guizhou Qianhang Shangwu Zixun Zhongxin, Guizhou Ruijin Shangwu Zixun Zhongxin, State Development & Investment Corporation",Early Stage Venture,,Series B,3,19800000,CNY,3096053,,,,32800000,CNY,5182796,Yes,,http://www.huang-di.com/,,Early Stage Venture,,"383,895"
2015-11-30,ICE GROUND is a skincare and beauty products brand.,ICE GROUND,https://www.crunchbase.com/organization/ice-ground,"Beauty, Consumer, Cosmetics","Hangzhou, Zhejiang, China, Asia",Angel Round - ICE GROUND,https://www.crunchbase.com/funding_round/ice-ground-angel--39a3a5f2,3,"Daocin Capital, Tongdao Qichuang, Viki Fund",Seed,,Angel,1,3000000,CNY,469099,,,,3000000,CNY,469099,Yes,,http://www.iceground.cn,,Seed,,"383,971"
2015-11-01,"Autolinked connecting the vehicle with the underlying data network, the core data collection vehicle, and the cloud platform.",Autolinked,https://www.crunchbase.com/organization/autolinked,"Automotive, Data Collection and Labeling, Information Technology","Shanghai, Shanghai, China, Asia",Venture Round - Autolinked,https://www.crunchbase.com/funding_round/autolinked-series-unknown--d09d0ec6,2,"Jiangmen Venture Capital, Microsoft Accelerator",,,Venture - Series Unknown,2,,,,,,,,,,Yes,,http://www.auto-linked.cn/,,,,"384,414"
2015-10-01,Changba is a smart phone app offering users a portable solo KTV booth.,Changba,https://www.crunchbase.com/organization/changba,"Apps, Mobile, Social Media","Beijing, Beijing, China, Asia",Venture Round - Changba,https://www.crunchbase.com/funding_round/changba-series-unknown--38c0bb4c,1,Zhonghe Capital,,,Venture - Series Unknown,2,,,,,,,16000000,USD,16000000,Yes,,http://changba.com,,,,"384,461"
