Announced Date,Organization Description,Organization Name,Organization Name URL,Organization Industries,Organization Location,Transaction Name,Transaction Name URL,Number of Investors,Investor Names,Funding Stage,Lead Investors,Funding Type,Number of Funding Rounds,Money Raised,Money Raised Currency,Money Raised (in USD),Pre-Money Valuation,Pre-Money Valuation Currency,Pre-Money Valuation (in USD),Total Funding Amount,Total Funding Amount Currency,Total Funding Amount (in USD),Equity Only Funding,Diversity Spotlight,Organization Website,Organization Revenue Range,Funding Status,Number of Partner Investors,CB Rank (Funding Round)
2016-03-30,Chehaoduo is an online car trading platform that directly links individual car sellers and buyers.,Chehaoduo,https://www.crunchbase.com/organization/guazi-com,"Automotive, E-Commerce, Online Auctions","Beijing, Beijing, China, Asia",Series A - Chehaoduo,https://www.crunchbase.com/funding_round/guazi-com-series-a--3f0ffe6c,7,"Fengyun Capital, GX Capital, Hike Capital, HSG, Matrix Partners China, Nuoweiqi VC, Welight Capital",Early Stage Venture,"GX Capital, HSG, Matrix Partners China",Series A,9,1484997200,CNY,229527883,750000000,USD,750000000,3849527883,USD,3849527883,Yes,,http://www.guazi.com,$1M to $10M,Late Stage Venture,,"39,455"
2016-03-01,JAKA is a collaborative robot development company focusing on the research and development of robots and smart factories.,JAKA,https://www.crunchbase.com/organization/jaka,"Industrial Automation, Information Services, Robotics","Minhang, Shanghai, China, Asia",Series A - JAKA,https://www.crunchbase.com/funding_round/jaka-series-a--121cbac3,2,"Hejun Capital, Stalagnate Capital",Early Stage Venture,Hejun Capital,Series A,4,15000000,CNY,2289797,,,,175000000,CNY,26663317,Yes,,https://www.jaka.com/,$10M to $50M,Late Stage Venture,,"116,908"
2016-03-02,Haizhi Wangju Internet Technology is a china based company.,Haizhi Wangju Internet Technology,https://www.crunchbase.com/organization/haizhi-wangju-internet-technology,"Big Data, Data Visualization, Mobile","Beijing, Beijing, China, Asia",Series C - Haizhi Wangju Internet Technology,https://www.crunchbase.com/funding_round/haizhi-wangju-internet-technology-series-c--03b63463,3,"IDG Capital, Legend Capital, MSA Capital",Late Stage Venture,Legend Capital,Series C,4,30000000,USD,30000000,220000000,USD,220000000,125397953,USD,125397953,Yes,,http://www.haizhi.com/,$100M to $500M,Late Stage Venture,,"120,369"
2016-04-22,Ant Group strives to enable all consumers and small businesses to have equal access to financial and other services through technology.,Ant Group,https://www.crunchbase.com/organization/ant-group,"Banking, Financial Services, FinTech, Payments","Hangzhou, Zhejiang, China, Asia",Series B - Ant Group,https://www.crunchbase.com/funding_round/ant-group-series-b--c7534906,4,"CCB International, China Development Industrial Bank (CDIB), China Investment Corporation, Primavera Capital Group",Early Stage Venture,China Investment Corporation,Series B,7,4500000000,USD,4500000000,55500000000,USD,55500000000,28500000000,USD,28500000000,Yes,,https://www.antgroup.com,$1B to $10B,Late Stage Venture,,"158,842"
2016-03-01,ImmuQuad Biotechnologies is a leading national high-tech enterprise in the field of immunogenomics (TCR/BCR) technology.,ImmuQuad Biotech,https://www.crunchbase.com/organization/immuquad-biosciences,"Biotechnology, Health Care, Life Science","Hangzhou, Zhejiang, China, Asia",Seed Round - ImmuQuad Biotech,https://www.crunchbase.com/funding_round/immuquad-biosciences-seed--eeb4f648,1,BANGSHI CAPITAL,Seed,,Seed,2,,,,,,,,,,Yes,,http://www.immuquad.com/,Less than $1M,Early Stage Venture,,"166,445"
2016-03-05,A marketing cloud that automates and personalizes marketing campaigns based on journeys of clients.,Convert Lab,https://www.crunchbase.com/organization/convert-lab,"Advertising, Information Technology, Marketing","Pudong, Shandong, China, Asia",Non Equity Assistance - Convert Lab,https://www.crunchbase.com/funding_round/convert-lab-non-equity-assistance--f278c6b1,1,Microsoft Accelerator,,,Non-equity Assistance,2,,,,,,,,,,No,,http://www.convertlab.com,,Late Stage Venture,,"170,359"
2016-03-05,Cipher Gene Tech is a bio medical big data analysis and interpretation platform.,Cipher Gene Tech,https://www.crunchbase.com/organization/cipher-gene-tech,"Developer Tools, Health Care, Information Services","Beijing, Beijing, China, Asia",Non Equity Assistance - Cipher Gene Tech,https://www.crunchbase.com/funding_round/cipher-gene-tech-non-equity-assistance--12ae4652,1,Microsoft Accelerator,,,Non-equity Assistance,4,,,,,,,100000000,CNY,13806624,No,,http://www.ciphergene.com/,$10M to $50M,Late Stage Venture,,"169,858"
2016-04-01,UTRY engages in the R&D and application of intelligent interactive technology.,UTRY,https://www.crunchbase.com/organization/utry,"Information Technology, Software","Hangzhou, Zhejiang, China, Asia",Post-IPO Equity - UTRY,https://www.crunchbase.com/funding_round/utry-post-ipo-equity--28668d2c,13,"Boc International (China), Caitong Asset, CITIC Securities, Dongxing Securities, Everbright Securities, Hua Chang Assets Management, HZTi, Industrial Securities, Robam Industrial Group, Southwest Securities, Wanlian Tianze, Yingda Securities Co., Ltd., Zhongtai Securities",,,Post-IPO Equity,6,77000300,CNY,11893591,,,,171000200,CNY,26874110,Yes,,http://www.utry.cn/,,IPO,,"180,740"
2016-04-14,Ronglian Qimo is a provider of cloud computing and SaaS services.,Ronglian Qimo,https://www.crunchbase.com/organization/ronglian-qimo,"Cloud Computing, Internet, SaaS, Software","Chengdu, Sichuan, China, Asia",Series A - Ronglian Qimo,https://www.crunchbase.com/funding_round/ronglian-qimo-series-a--4b03cc3a,3,"Sequoia Capital, Trustbridge Partners, Yuntongxun",Early Stage Venture,"Sequoia Capital, Yuntongxun",Series A,2,35000000,CNY,5401227,,,,45000000,CNY,7011639,Yes,,https://www.7moor.com/,,Early Stage Venture,1,"202,103"
2016-04-18,YUNCHANGGAME is a mobile phone game development company.,YUNCHANGGAME.COM,https://www.crunchbase.com/organization/yunchanggame-com,"Gaming, Online Games, Software, Video Games","Beijing, Beijing, China, Asia",Post-IPO Equity - YUNCHANGGAME.COM,https://www.crunchbase.com/funding_round/yunchanggame-com-post-ipo-equity--e9411824,21,"Changjiang Securities, China International Fund Management Co., Ltd, China Merchants Securities, CICC Wealth Management, Cinda Securities, First Capital, Goldstate Securities, GREAT WALL GLORY SECURITIES, Guojing Touzi, Guolian Securities, Guotai Junan Securities, Hongjie Jijin, Hongkai Investment, Lianxun Zhengquan, Ruer Touzi, SHANGHAI HUI RONG, Shanghai Ruizhe, TFTR Investment, Tianfeng Securities, Tianxing Capital, Zhongtai Securities",,,Post-IPO Equity,3,100000000,CNY,15443002,,,,100110000,CNY,15460877,Yes,,http://yunchanggame.com/,,IPO,,"203,391"
2016-03-29,"Le Sports, the sports arm of China's leading online video provider, LeEco",Le Sports,https://www.crunchbase.com/organization/le-sports,"Gaming, Sports, Video","Beijing, Beijing, China, Asia",Series B - Le Sports,https://www.crunchbase.com/funding_round/le-sports-series-b--ba692edb,9,"Caissa Tosun Development, China Construction Bank, CICC Capital, HNA Group, Jia Nailiang, Liu Tao, Sun Honglei, Xinpai Capital, Zhongtai Securities",Early Stage Venture,HNA Group,Series B,3,8000000000,CNY,1229498119,13500000000,CNY,2074778076,8800000000,CNY,1358776506,Yes,,http://www.lesports.com/,$1M to $10M,Early Stage Venture,1,"204,637"
2016-05-01,ViaX provides online research-based mentor services and project-based academic courses.,ViaX,https://www.crunchbase.com/organization/viax-cf7a,"E-Learning, Education, Training","Beijing, Beijing, China, Asia",Seed Round - ViaX,https://www.crunchbase.com/funding_round/viax-cf7a-seed--392f4a3a,2,"Blue Elephant Capital, EdBeta Fund",Seed,,Seed,7,,,,,,,11092890,USD,11092890,Yes,,https://www.viax.org/,,Early Stage Venture,,"205,338"
2016-03-14,Ucommune offers co-working space solutions to small-to-medium enterprises.,Ucommune,https://www.crunchbase.com/organization/ucommune,"Coworking, Facility Management, Sharing Economy, Virtual Workforce","Beijing, Beijing, China, Asia",Series A - Ucommune,https://www.crunchbase.com/funding_round/ucommune-series-a--b3bd4afa,5,"China Renaissance, Gaorong Capital, Gopher Asset Management, ShengJing360, ZhenFund",Early Stage Venture,"China Renaissance, Gopher Asset Management",Series A,13,31000000,USD,31000000,,,,802263368,USD,802263368,Yes,,https://www.ucommune.com,$100M to $500M,IPO,,"205,996"
2016-03-18,"MOLBASE is committed to establish the worldâ€™s largest integrated platform for chemical e-commerce,",Molbase,https://www.crunchbase.com/organization/molbase,"Chemical, E-Commerce","Shanghai, Shanghai, China, Asia",Series C - Molbase,https://www.crunchbase.com/funding_round/molbase-series-c--8c07f532,5,"High Ground Capital, HSG, Sinovation Ventures, Trustbridge Partners, Vangoo Investment Partners",Late Stage Venture,"HSG, Trustbridge Partners",Series C,4,,,,,,,10000000,USD,10000000,Yes,,http://www.molbase.com,$50M to $100M,IPO,,"206,670"
2016-03-04,Youmi is an industry-leading mobile advertising and marketing platform. Contact : mrk@youmi.net (skype),Youmi,https://www.crunchbase.com/organization/youmi-31e9,"Ad Network, Advertising, Advertising Platforms, Android, App Marketing, Application Performance Management, Marketing, Mobile Advertising, Mobile Apps, Social Media Marketing","Guangzhou, Guangdong, China, Asia",Post-IPO Equity - Youmi,https://www.crunchbase.com/funding_round/youmi-31e9-post-ipo-equity--642ae6e0,18,"Credit Prosperity Fund, First Seafront Fund, Goldtop Investment, Guangdong Haifu Touzi Guanli Youxian Gongsi, Guangzhou Securities, Guolian Securities, Harvest Fund Management, Huatu Capital, Industrial Securities, Jiukun Touzi, Lide Ziben, Mingdao Investment, North Beta Capital, PreIPO, Qinyuan Investment, Shenzhen Capital Group, SooChow Securities, Zhonghe Nongtou Touzi",,,Post-IPO Equity,7,250000000,CNY,38347028,,,,430870000,CNY,67454706,Yes,,https://www.youmi.net/en/,$1M to $10M,IPO,,"207,958"
2016-04-08,Phantom VR is a virtual reality game development company.,Phantom VR,https://www.crunchbase.com/organization/phantom-vr,"Gaming, Information Technology, Virtual Reality","Haidian, Beijing, China, Asia",Angel Round - Phantom VR,https://www.crunchbase.com/funding_round/phantom-vr-angel--42862123,5,"Hejun Capital, Heyi Ziben, Huanwei Shijie, TipCat, Wuxian Enying",Seed,"Hejun Capital, Huanwei Shijie",Angel,1,3000000,CNY,463955,,,,3000000,CNY,463955,Yes,,http://www.phantomvr.com,,Seed,,"211,161"
2016-04-25,Taidu Technology provides e-commerce consumer product development services.,Taidu Technology,https://www.crunchbase.com/organization/taidu-technology,"Gaming, Product Design","Shenzhen, Guangdong, China, Asia",Series A - Taidu Technology,https://www.crunchbase.com/funding_round/taidu-technology-series-a--82ca2ff8,4,"Handuo, Hengxing Ventures, Prometheus Capital, Puju Ventures",Early Stage Venture,"Handuo, Prometheus Capital",Series A,1,7700000,USD,7700000,,,,7700000,USD,7700000,Yes,,http://www.youtaidu.com,,Early Stage Venture,,"215,164"
2016-03-14,Cainiao Logistics is an internet technology company that specializes in platform services for logistics networks.,Cainiao Logistics,https://www.crunchbase.com/organization/cainiao-logistics,"Delivery, Delivery Service, Logistics, Supply Chain Management","Hangzhou, Zhejiang, China, Asia",Series A - Cainiao Logistics,https://www.crunchbase.com/funding_round/cainiao-logistics-series-a--44c8af39,5,"GIC, Khazanah Nasional, Primavera Capital Group, Temasek Holdings, YF Capital",Early Stage Venture,"GIC, Temasek Holdings",Series A,2,10000000000,CNY,1540592296,40000000000,CNY,6162369184,4870592296,USD,4870592296,Yes,,https://www.cainiao.com,$10B+,M&A,,"216,824"
2016-03-14,Moduovr is a virtual reality entertainment content platform.,Moduovr,https://www.crunchbase.com/organization/moduovr,"Content, Media and Entertainment, Virtual Reality","Haidian, Beijing, China, Asia",Angel Round - Moduovr,https://www.crunchbase.com/funding_round/moduovr-angel--0769b9d1,3,"GeekFounders, RF Capital, Zero2IPO Ventures",Seed,"GeekFounders, Zero2IPO Ventures",Angel,2,6000000,CNY,924355,,,,7000000,CNY,1085397,Yes,,http://www.moduovr.com,,Seed,,"218,602"
2016-04-15,Juanpi.com is a Chinese online platform selling discounted consumer products.,Juanpi,https://www.crunchbase.com/organization/juanpi-com,"E-Commerce, Fashion, Internet, Shopping","Wuhan, Hubei, China, Asia",Series C - Juanpi,https://www.crunchbase.com/funding_round/juanpi-com-series-c--ac9a3766,3,"China Merchants Bank, Juren Capital, Tiantu Capital",Late Stage Venture,"China Merchants Bank, Tiantu Capital",Series C,3,600000000,CNY,92625126,910000000,USD,910000000,135701315,USD,135701315,Yes,,http://www.juanpi.com,,Late Stage Venture,,"218,771"
2016-03-07,FXiaoKe is a Chinese provider of mobile management software for sales teams.,FXiaoKe,https://www.crunchbase.com/organization/fxiaoke-com,"Cloud Computing, CRM, Customer Service, Human Resources, Internet, SaaS, Software, Supply Chain Management","Beijing, Beijing, China, Asia",Series E - FXiaoKe,https://www.crunchbase.com/funding_round/fxiaoke-com-series-e--2d5a7f88,5,"CPE, DCM Ventures, Hillhouse Investment, IDG Capital, Northern Light Venture Capital",Late Stage Venture,"Hillhouse Investment, Northern Light Venture Capital",Series E,12,,,,,,,388000000,USD,388000000,Yes,,https://www.fxiaoke.com/,$10M to $50M,,2,"222,158"
2016-03-30,Kunlun Fight is a Chinese sports company,Kunlun Fight,https://www.crunchbase.com/organization/kunlun-fight,"Event Promotion, Events, Fitness, Sports","Beijing, Beijing, China, Asia",Series B - Kunlun Fight,https://www.crunchbase.com/funding_round/kunlun-fight-series-b--28983e4d,4,"5Y Capital, Hongkun Yirun Investment, Northern Light Venture Capital, Qianhai Wutong Mergers and Acquisitions Funds",Early Stage Venture,5Y Capital,Series B,6,,,,500000000,USD,500000000,51712174,USD,51712174,Yes,,http://en.kunlunjue.com,$1M to $10M,Early Stage Venture,1,"226,405"
2016-04-12,Omni Prime provides Lending as a Service solution to retailers.,Omni Prime,https://www.crunchbase.com/organization/omni-prime-inc,"Financial Services, FinTech, Software","Shanghai, Shanghai, China, Asia",Series C - Omni Prime,https://www.crunchbase.com/funding_round/omni-prime-inc-series-c--e5685b9d,5,"China Renaissance, JD Digits, Moatable, Morningside, Shunwei Capital",Late Stage Venture,"JD Digits, Shunwei Capital",Series C,5,46000000,USD,46000000,,,,87000000,USD,87000000,Yes,,http://www.fenqi.im/,$10M to $50M,Late Stage Venture,1,"228,198"
2016-04-21,"Hua Medicine is a clinical-stage, innovative drug development company in China.",Hua Medicine,https://www.crunchbase.com/organization/hua-medicine,"Biotechnology, Health Care, Life Science, Medical, Pharmaceutical","Shanghai, Shanghai, China, Asia",Series C - Hua Medicine,https://www.crunchbase.com/funding_round/hua-medicine-series-c--360bfeb3,10,"Ally Bridge Group, ARCH Venture Partners, Eight Roads Ventures, F-Prime Capital, Frontline BioVentures, Harvest Global Investments, SAIL Capital Partners LLC, TF Capital, Venrock, WuXi Healthcare Ventures",Late Stage Venture,Harvest Global Investments,Series C,6,50000000,USD,50000000,,,,242400000,USD,242400000,Yes,,https://www.huamedicine.com,$10M to $50M,IPO,2,"230,714"
2016-02-26,Tiandi is a non-alcoholic food and beverage company.,Tiandi,https://www.crunchbase.com/organization/tiandi-no-1-beverage,"Food and Beverage, Food Processing, Sales","Jiangmen, Guangdong, China, Asia",Post-IPO Equity - Tiandi,https://www.crunchbase.com/funding_round/tiandi-no-1-beverage-post-ipo-equity--b418db48,13,"China Merchants Securities, CITIC Securities, Dacheng Innovative Capital Management, GOUFUYUAN VC, Haitong-Fortis Private Equity Fund Management, Industrial Securities Asset Management, Jiangsu Tech Industry Investment Corp., JT Asset Management, Lianchuang Lihao, NewMargin Ventures, Shenzhen Kaiding Juncan venture Cci Capital, Tianxing Capital, Wenqiu Chen",,,Post-IPO Equity,3,470000000,CNY,71891606,,,,862000000,CNY,133710573,Yes,,http://www.tdyh.com.cn/,$1M to $10M,IPO,,"234,594"
2016-03-21,"METAS develops educational smart hardware, and IOT software intended to improve learning outcomes.",METAS,https://www.crunchbase.com/organization/metas-ed7e,"Education, Hardware, Software","Guangzhou, Guangdong, China, Asia",Series A - METAS,https://www.crunchbase.com/funding_round/metas-ed7e-series-a--f0c6e79d,1,Yihua Capital,Early Stage Venture,Yihua Capital,Series A,1,,,,,,,,,,Yes,,http://www.funmetas.com/,,Early Stage Venture,,"235,479"
2016-03-14,BEAUTY PLUS is an aesthetic medicine clinic management platform.,BEAUTY PLUS,https://www.crunchbase.com/organization/beauty-plus-59e0,"Beauty, Software","Nanshanqu, Guangdong, China, Asia",Series A - BEAUTY PLUS,https://www.crunchbase.com/funding_round/beauty-plus-59e0-series-a--41ac1b73,6,"Anzhuoxin Venture Capital, Guangdong Songchuang Chengzhang Touzi, Hongxiu VC, Oriental Fortune Capital, Trend Capital, Welight Capital",Early Stage Venture,Trend Capital,Series A,3,60000000,CNY,9243554,,,,118000000,CNY,18613626,Yes,,https://www.mljia.cn/,,Early Stage Venture,,"237,591"
2016-03-03,Renren Games offers gaming and entertainment services.,Renren Games,https://www.crunchbase.com/organization/renren-games,"Gaming, Media and Entertainment, Mobile","Baoshan, Shanghai, China, Asia",Series A - Renren Games,https://www.crunchbase.com/funding_round/renren-games-series-a--4bf210e7,9,"Hengqin Youth, K2VC, Renhe Capital, Ruihe Capital, Shenzhen Gaea Technology, Tianxing Capital, Xinyu Renhe Innovation Investment, Yidou Investment, Yuezhao Capital Fund Management",Early Stage Venture,,Series A,1,118000000,CNY,18068452,,,,118000000,CNY,18068452,Yes,,http://www.91fun.com/,,IPO,,"237,867"
2016-04-08,Getui is a Beijing-based third-party push notification service provider.,Getui,https://www.crunchbase.com/organization/getui,"Internet, Messaging, Social Entrepreneurship, Software","Hangzhou, Zhejiang, China, Asia",Series C - Getui,https://www.crunchbase.com/funding_round/getui-series-c--75e531ae,4,"China Minsheng Bank, Haitong Securities, SAIF Partners, WI Harper Group",Late Stage Venture,"China Minsheng Bank, Haitong Securities",Series C,5,700000000,CNY,108256105,,,,1110000000,CNY,167810502,Yes,,http://www.igetui.com,$1M to $10M,Late Stage Venture,,"238,643"
2016-05-01,"Deep View Technology is a motion capture and AR, VR application company.",Deep View Technology,https://www.crunchbase.com/organization/deep-view-technology,"3D Technology, Augmented Reality, Virtual Reality","Haidian, Beijing, China, Asia",Angel Round - Deep View Technology,https://www.crunchbase.com/funding_round/deep-view-technology-angel--59745773,1,Galaxy Internet,Seed,,Angel,2,3000000,USD,3000000,,,,3000000,USD,3000000,Yes,,http://www.deepviewtech.com/,,Early Stage Venture,,"242,842"
2016-04-20,Roseonly is an online high-end flower shop providing imported roses for customers in China.,Roseonly,https://www.crunchbase.com/organization/roseonly,"E-Commerce, Internet, Online Forums","Beijing, Beijing, China, Asia",Series C - Roseonly,https://www.crunchbase.com/funding_round/roseonly-series-c--ad292fdd,2,"ProCapital, Yuansheng Capital",Late Stage Venture,Yuansheng Capital,Series C,4,29000000,USD,29000000,,,,39000000,USD,39000000,Yes,,http://www.roseonly.com.cn/,,Late Stage Venture,,"245,928"
2016-03-01,Xiaopeng Motors is an electric vehicle and technology company that designs and manufactures intelligent mobility solutions.,Xpeng Motors,https://www.crunchbase.com/organization/xiaopeng-motors,"Automotive, Autonomous Vehicles, Electric Vehicle, Manufacturing","Guangzhou, Guangdong, China, Asia",Series A - Xpeng Motors,https://www.crunchbase.com/funding_round/xiaopeng-motors-series-a--b40ab295,3,"GWC Innovator Fund, Huirong Deyun Investment, ShengJing360",Early Stage Venture,GWC Innovator Fund,Series A,11,40000000,USD,40000000,,,,6408970886,USD,6408970886,Yes,,https://www.xiaopeng.com,$1B to $10B,IPO,1,"246,451"
2016-03-28,"Yiguo.com, an e-commerce platform owned and run by Shanghai Yiguo E-Commerce, sells fresh food online.",Yiguo.com,https://www.crunchbase.com/organization/shanghai-yiguo-electron-business,"E-Commerce, Grocery, Online Portals, Retail","Changning, Shanghai, China, Asia",Series C - Yiguo.com,https://www.crunchbase.com/funding_round/shanghai-yiguo-electron-business-series-c--90062f60,2,"Alibaba Group, Kohlberg Kravis Roberts",Late Stage Venture,"Alibaba Group, Kohlberg Kravis Roberts",Series C,5,,,,,,,500000000,USD,500000000,Yes,,http://www.yiguo.com,$10M to $50M,Late Stage Venture,1,"248,102"
2016-04-13,CSM Media Research provides advanced research services for live TV ratings and time-shift TV viewing ratings.,CSM Media Research,https://www.crunchbase.com/organization/csm-media-research,"Market Research, Media and Entertainment, TV","Beijing, Beijing, China, Asia",Angel Round - CSM Media Research,https://www.crunchbase.com/funding_round/csm-media-research-angel--08494430,11,"Beijing Beishi Yingtewei Cultural Diffusion, Beijing Gehua CATV, China Broadcasting Network, China International Television, Guoguang Chuanmei Fazhan, JSTV.com, Mango Media, Miwei Huaren Wenhua, Shanghai Media Group, WASU VRAC, Zhejiang Radio & TV Group",Seed,,Angel,1,3000000,CNY,463239,,,,3000000,CNY,463239,Yes,,http://www.csm.com.cn/,$1M to $10M,Seed,,"249,021"
2016-03-01,Zhongdian Datacom Smart Security Technology develops a security risk control platform for urban safety management and risk control.,Zhongdian Datacom Smart Security Technology,https://www.crunchbase.com/organization/zhongdian-datacom-smart-security-technology,"Big Data, Public Safety, Risk Management, Security, Smart Cities","Shenzhen, Guangdong, China, Asia",Angel Round - Zhongdian Datacom Smart Security Technology,https://www.crunchbase.com/funding_round/zhongdian-datacom-smart-security-technology-angel--3539fea2,1,Yuthai Investment,Seed,,Angel,2,,,,,,,100000000,CNY,13938836,Yes,,http://www.zds-t.com,,Late Stage Venture,,"249,508"
2016-04-29,wenqian.cn is an electronic contract signing platform.,wenqian.cn,https://www.crunchbase.com/organization/wenqian-cn,"E-Signature, Software","Hangzhou, Zhejiang, China, Asia",Angel Round - wenqian.cn,https://www.crunchbase.com/funding_round/wenqian-cn-angel--77db0766,4,"Cyzone Angel Fund, Hundsun Technologies, Insigma Technology, Northern Light Venture Capital",Seed,Northern Light Venture Capital,Angel,1,15000000,CNY,2315679,,,,15000000,CNY,2315679,Yes,,https://www.wenqian.cn/,,Seed,,"252,605"
2016-03-21,Meidaila is a computer software company offering technology solutions.,Meidaila1221,https://www.crunchbase.com/organization/elsevier-mdl,"Computer, Information Technology, Robotics, Software","Guangzhou, Guangdong, China, Asia",Series B - Meidaila1221,https://www.crunchbase.com/funding_round/elsevier-mdl-series-b--56577745,4,"Banyan Fund Management, Gaorong Capital, IDG Capital, Ping An Ventures",Early Stage Venture,IDG Capital,Series B,1,12000000,USD,12000000,,,,12000000,USD,12000000,Yes,,http://mdl.com,$10M to $50M,Early Stage Venture,,"252,682"
2016-04-13,Blackbirdsport is an application for recording and sharing riding.,Blackbirdsport,https://www.crunchbase.com/organization/blackbirdsport,"Apps, Mobile Apps, Software, Sports","Haidian, Beijing, China, Asia",Series A - Blackbirdsport,https://www.crunchbase.com/funding_round/blackbirdsport-series-a--b50432c1,4,"Eagles Fund, Hongshijiye Guquan Touzi, Innoangel Fund, Yiyi",Early Stage Venture,Yiyi,Series A,2,10000000,CNY,1544129,,,,13000000,CNY,2024338,Yes,,http://blackbirdsport.com,,Early Stage Venture,,"252,952"
2016-04-01,Shiyanlou.com provides online IT training programs for enterprises and universities.,Shiyanlou.com,https://www.crunchbase.com/organization/shiyanlou-com,"E-Learning, Education, Information Technology","Chengdu, Sichuan, China, Asia",Seed Round - Shiyanlou.com,https://www.crunchbase.com/funding_round/shiyanlou-com-seed--49a28501,4,"Beiruan Angle, Dahe Ventures, Heyi Capital, Innoangel Fund",Seed,Dahe Ventures,Seed,2,10000000,CNY,1544616,,,,13000000,CNY,2030657,Yes,,https://shiyanlou.com,,Seed,,"253,796"
2016-03-25,Taoshihui company is a rural e-commerce platform aiming to help farmers make purchases online.,Taoshihui,https://www.crunchbase.com/organization/taoshihui,"E-Commerce, E-Commerce Platforms, Online Portals","Shenzhen, Guangdong, China, Asia",Series A - Taoshihui,https://www.crunchbase.com/funding_round/taoshihui-series-a--0967c996,4,"Ameba Capital, CITIC Capital Holdings, Li Qi, QF Capital",Early Stage Venture,Ameba Capital,Series A,1,46000000,USD,46000000,,,,46000000,USD,46000000,Yes,,,,Early Stage Venture,,"254,016"
2016-04-01,CHERY NEW ENERGY is a manufacturer and seller of an electric car.,CHERY NEW ENERGY,https://www.crunchbase.com/organization/chery-new-energy,"Electric Vehicle, Manufacturing, Sales","Wuhu, Anhui, China, Asia",Series B - CHERY NEW ENERGY,https://www.crunchbase.com/funding_round/chery-new-energy-series-b--cba27232,2,"Comway Capital, Ruiye Touzi",Early Stage Venture,,Series B,2,30000000,CNY,4633849,,,,33000000,CNY,5103818,Yes,,http://www.cheryev.cn,,Early Stage Venture,,"254,333"
2016-05-01,"Geek+ develops autonomous mobile robots for warehouse, factory, and supply chain management.",Geek+,https://www.crunchbase.com/organization/geek,"Industrial Automation, Logistics, Robotics, Supply Chain Management, Warehouse Automation, Warehousing","Beijing, Beijing, China, Asia",Series A - Geek+,https://www.crunchbase.com/funding_round/geek-series-a--3e815b1e,2,"Banyan Capital Partners, Volcanics Venture",Early Stage Venture,"Banyan Capital Partners, Volcanics Venture",Series A,9,50000000,CNY,7723395,,,,539441286,USD,539441286,Yes,,https://www.geekplus.com,$1M to $10M,Late Stage Venture,,"255,267"
