2016-04-12,"LANTONE develops intelligent medical auxiliary products, diagnose intelligent auxiliary diagnosis and treatment system.",LANTONE,https://www.crunchbase.com/organization/lantone,"Health Care, Information Services, Medical","Hangzhou, Zhejiang, China, Asia",Angel Round - LANTONE,https://www.crunchbase.com/funding_round/lantone-angel--2ff10ba5,2,"Hangzhou Hongzhe Investment, Jiangsu Zhisheng Investment Management Consulting",Seed,,Angel,2,3000000,CNY,464054,,,,23000000,CNY,3400437,Yes,,http://www.zjlantone.com/,,Seed,,"560,158"
2016-04-13,Wenhua Xunli is an online learning and dissemination platform.,Wenhua Xunli,https://www.crunchbase.com/organization/wenhua-xunli,"Art, E-Learning, Internet","Beijing, Beijing, China, Asia",Angel Round - Wenhua Xunli,https://www.crunchbase.com/funding_round/wenhua-xunli-angel--791f6fe6,1,Beiqing Ruichuang,Seed,,Angel,1,3000000,CNY,463239,,,,3000000,CNY,463239,Yes,,http://www.wenhuaxunli.com/,,Seed,,"568,487"
2016-03-25,SOOGIF is an funny picture content platform provider company.,SOOGIF,https://www.crunchbase.com/organization/soogif,"Animation, Media and Entertainment, Social","Xuhui, Shanghai, China, Asia",Angel Round - SOOGIF,https://www.crunchbase.com/funding_round/soogif-angel--011bbcc2,2,"ONES Ventures, Will Hunting Capital",Seed,,Angel,3,3000000,CNY,460469,,,,33000000,CNY,5034068,Yes,,https://www.soogif.com/,,Early Stage Venture,,"569,773"
2016-03-04,DADDYLAB provides one-stop testing technology and consulting services.,DADDYLAB,https://www.crunchbase.com/organization/daddylab,"Children, Social, Test and Measurement","Hangzhou, Zhejiang, China, Asia",Angel Round - DADDYLAB,https://www.crunchbase.com/funding_round/daddylab-angel--e55e1798,2,"Juxiu Capital, Niejing Touzi",Seed,,Angel,3,3000000,CNY,460164,,,,53000000,CNY,7701189,Yes,,https://daddylab.com/,,,,"570,217"
2016-03-21,Youmutou is a real-time spot-wood e-commerce platform.,Youmutou,https://www.crunchbase.com/organization/youmutou,"B2B, E-Commerce, Wood Processing","Dongguang, Guangdong, China, Asia",Angel Round - Youmutou,https://www.crunchbase.com/funding_round/youmutou-angel--25acf1f3,2,"Initial Capital, Welight Capital",Seed,,Angel,2,10000000,CNY,1542950,,,,30000000,CNY,4495982,Yes,,https://www.youmutou.com,,Early Stage Venture,,"571,038"
2016-03-28,Arcvideo Tech is a provider of professional intelligent video solutions and video cloud services.,Arcvideo Tech,https://www.crunchbase.com/organization/arcvideo-tech,"Cloud Computing, Professional Services, Video","Hangzhou, Zhejiang, China, Asia",Venture Round - Arcvideo Tech,https://www.crunchbase.com/funding_round/arcvideo-tech-series-unknown--1e40fd66,2,"Guohai Innovative CCI Capital, Zhongsai Xinhe",,,Venture - Series Unknown,6,20000000,CNY,3072267,,,,484090000,CNY,71194555,Yes,,http://www.arcvideo.cn/,,IPO,,"572,888"
2016-04-01,"Fuyoukache provides long distance truck logistics services to enterprises, individuals and large third-party logistics companies.",Fuyou Kache,https://www.crunchbase.com/organization/fuyoukache,"Logistics, Transportation","Beijing, Beijing, China, Asia",Series B - Fuyou Kache,https://www.crunchbase.com/funding_round/fuyoukache-series-b--22f8d2de,2,"Eastern Bell Capital, GLP",Early Stage Venture,,Series B,6,15000000,USD,15000000,,,,268280342,USD,268280342,Yes,,http://www.fuyoukache.com/,$50M to $100M,Late Stage Venture,,"575,610"
2016-03-31,Shunfei Technology provides full-process technology solutions.,Shunfei Technology,https://www.crunchbase.com/organization/sunteng,"Advertising, Digital Marketing, Marketing","Guangzhou Shi, Guangdong, China, Asia",Angel Round - Shunfei Technology,https://www.crunchbase.com/funding_round/sunteng-angel--1021b0a0,2,"Qmangel Investment Partnership, Xizang Tongmei Wenhua",Seed,,Angel,2,3000000,CNY,464882,,,,13000000,CNY,1971528,Yes,,http://www.sunteng.com/,,Early Stage Venture,,"577,068"
2016-03-01,Chengdu Jiuyou Space-Time Technology develops mobile Internet applications.,MOREWIFI,https://www.crunchbase.com/organization/morewifi,"Internet, Mobile, Software, Wireless","Chengdu, Sichuan, China, Asia",Angel Round - MOREWIFI,https://www.crunchbase.com/funding_round/morewifi-angel--1d2dde82,2,"Defenghao Chuangye Touzi, Limei Advertising",Seed,,Angel,2,3000000,CNY,457959,,,,13000000,CNY,1914231,Yes,,https://www.morewifi.com/,,Early Stage Venture,,"577,070"
2016-03-31,Chipsailing Technology is a fingerprint identification company engaged in the sales of integrated circuits.,Chipsailing,https://www.crunchbase.com/organization/chipsailing,"Biometrics, Security, Software","Nanshanqu, Guangdong, China, Asia",Angel Round - Chipsailing,https://www.crunchbase.com/funding_round/chipsailing-angel--959effbf,2,"Dongfang Economics Equity Investment Fund Management, Qianhai Lanjin International Investment Management",Seed,,Angel,2,3000000,CNY,464882,,,,13000000,CNY,1913228,Yes,,http://www.chipsailing.com,,Early Stage Venture,,"577,291"
2016-04-01,FireGame is a virtual reality game development company.,FireGame,https://www.crunchbase.com/organization/firegame,"Developer Platform, Gaming, Software, Virtual Reality","Wuhan, Hubei, China, Asia",Seed Round - FireGame,https://www.crunchbase.com/funding_round/firegame-seed--99d6154f,2,"Green Pine Capital Partners, Socogame",Seed,,Seed,3,6000000,CNY,926770,,,,21000000,CNY,3101019,Yes,,https://www.vrspy.cn/,,,,"577,293"
2016-03-01,exands is a business-to-business wireless service provider.,exands,https://www.crunchbase.com/organization/exands,"B2B, ISP, Wireless","Shanghai, Shanghai, China, Asia",Series B - exands,https://www.crunchbase.com/funding_round/exands-series-b--c9f5b130,2,"Baidu, Evershine Capital",Early Stage Venture,,Series B,6,,,,,,,,,,Yes,,http://www.exands.com/,$1M to $10M,Late Stage Venture,,"577,711"
2016-04-21,ScenesSound focuses on VR audio technology innovation.,ScenesSound,https://www.crunchbase.com/organization/scenessound,"Audio, Software, Virtual Reality","Shenzhen, Guangdong, China, Asia",Series A - ScenesSound,https://www.crunchbase.com/funding_round/scenessound-series-a--4e86f440,2,"Dongfang Ruijia Touzi, Hua Partners",Early Stage Venture,,Series A,5,10000000,CNY,1543531,,,,113000000,CNY,17274828,Yes,,http://www.scenessound.com/,,Late Stage Venture,,"577,786"
2016-04-13,Yunduan Zhushou is a service provider of the global light game R&D and publishing team.,Yunduan Zhushou,https://www.crunchbase.com/organization/yunduan-zhushou,"Cloud Data Services, Gamification, Information Technology","Chengdu, Sichuan, China, Asia",Seed Round - Yunduan Zhushou,https://www.crunchbase.com/funding_round/yunduan-zhushou-seed--d30b369c,2,"Tahoe Venture, Yowant",Seed,,Seed,3,3000000,CNY,463239,,,,16000000,CNY,2406555,Yes,,http://www.yunduanzs.cn,,Early Stage Venture,,"577,821"
2016-04-20,Fenqix is an online installment O2O service platform.,Fenqix,https://www.crunchbase.com/organization/fenqix,"Finance, Internet","Shenzhen, Guangdong, China, Asia",Series A - Fenqix,https://www.crunchbase.com/funding_round/fenqix-series-a--7219b773,2,"Qixing Piaochong Touzi, Thunderstorm VC",Early Stage Venture,,Series A,4,10000000,CNY,1545796,,,,63000000,CNY,9471878,Yes,,https://www.fenqix.com/,,Late Stage Venture,,"578,635"
2016-03-29,River Security focuses on providing the industry's cutting edge Internet dynamic application security solution.,River Security,https://www.crunchbase.com/organization/river-security,"Cyber Security, Information Technology, Network Security","Shanghai, Shanghai, China, Asia",Series A - River Security,https://www.crunchbase.com/funding_round/river-security-series-a--da2754c4,2,"iStart Ventures, SBCVC",Early Stage Venture,,Series A,5,,,,,,,330000000,CNY,48873413,Yes,,https://www.riversecurity.com.cn/,$1M to $10M,Late Stage Venture,,"578,949"
2016-04-01,GOLDMAG engages in cancer diagnostic reagents development.,GOLDMAG,https://www.crunchbase.com/organization/goldmag-4954,"Biotechnology, Health Care, Medical, Medical Device","Xian Shi, Shaanxi, China, Asia",Series A - GOLDMAG,https://www.crunchbase.com/funding_round/goldmag-4954-series-a--9f695a57,2,"Share Capital, Yixu Investment Management",Early Stage Venture,,Series A,3,10000000,CNY,1544616,,,,33000000,CNY,5044911,Yes,,http://www.goldmag.com.cn/,$1M to $10M,Early Stage Venture,,"579,195"
2016-03-01,FaceU is an online photo-editing and sharing mobile app.,FaceU,https://www.crunchbase.com/organization/faceu,"Mobile, Mobile Apps, Social Media","Shenzhen, Guangdong, China, Asia",Series B - FaceU,https://www.crunchbase.com/funding_round/faceu-series-b--8876377b,1,Lightspeed China Partners,Early Stage Venture,,Series B,4,,,,,,,51615238,USD,51615238,Yes,,http://faceu.net/,,M&A,1,"579,298"
2016-03-01,"CENIC MEDIA provides marketing, big data and TV production services.",CENIC MEDIA,https://www.crunchbase.com/organization/cenic-media,"Advertising, Big Data, Marketing, TV Production","Shanghai, Shanghai, China, Asia",Funding Round - CENIC MEDIA,https://www.crunchbase.com/funding_round/cenic-media-undisclosed--5937ef05,1,Fengshion Capital,,,Funding Round,1,50000000,CNY,7632656,,,,50000000,CNY,7632656,Yes,,http://www.cenicmedia.com/a/en/,,,,"564,217"
2016-03-06,WuXi AppTec provides a broad portfolio of R&D and manufacturing services that enable companies in the pharmaceutical.,WuXi AppTec,https://www.crunchbase.com/organization/wuxi-apptec,"Biotechnology, Health Care, Medical Device, Outsourcing, Pharmaceutical","Shanghai, Shanghai, China, Asia",Debt Financing - WuXi AppTec,https://www.crunchbase.com/funding_round/wuxi-apptec-debt-financing--1e5202cd,1,Ping An Bank,,,Debt Financing,6,1500000000,USD,1500000000,,,,1593470000,USD,1593470000,No,,https://www.wuxiapptec.com,$1B to $10B,M&A,,"564,437"
2016-03-01,WuChain is a supply chain management cloud platform.,WuChain,https://www.crunchbase.com/organization/wuchain,"Information Technology, Supply Chain Management, Warehousing","Haidian, Beijing, China, Asia",Angel Round - WuChain,https://www.crunchbase.com/funding_round/wuchain-angel--2d76f021,1,DianLiang Capitals,Seed,,Angel,1,2000000,CNY,305306,,,,2000000,CNY,305306,Yes,,http://www.wuchain.cn/,,Seed,,"564,479"
2016-04-01,KSUDi is a courier and logistics service provider company.,KSUDi,https://www.crunchbase.com/organization/ksudi,"Freight Service, Logistics, Service Industry","Xuhui, Shanghai, China, Asia",Seed Round - KSUDi,https://www.crunchbase.com/funding_round/ksudi-seed--e3c4e3da,2,"Oriental Fortune Capital, PreAngel",Seed,,Seed,3,3000000,CNY,463385,,,,26000000,CNY,3936410,Yes,,http://www.ksudi.com,$1M to $10M,Early Stage Venture,,"564,678"
2016-03-01,More Dental is a dental hospital that integrats oral medical services.,More Dental,https://www.crunchbase.com/organization/more-dental,"Clinical Trials, Dental, Medical","Shanghai, Shanghai, China, Asia",Series A - More Dental,https://www.crunchbase.com/funding_round/more-dental-series-a--1cf902f0,2,"ShareLink Capital, Tongkong Investment Group",Early Stage Venture,,Series A,2,,,,,,,,,,Yes,,http://www.moreck.cn/,,Early Stage Venture,,"564,690"
2016-03-31,Kuanduoduo is a quanduo supply chain platform.,Kuanduoduo,https://www.crunchbase.com/organization/kuanduoduo,E-Commerce,"Beijing, Beijing, China, Asia",Series A - Kuanduoduo,https://www.crunchbase.com/funding_round/kuanduoduo-series-a--59b55ee1,2,"FutureCap, ZhenFund",Early Stage Venture,,Series A,5,35000000,CNY,5423624,,,,49267638,USD,49267638,Yes,,http://kuandd.com/,,Late Stage Venture,,"564,740"
2016-04-01,EEGSmart is a bioinformatics sensor centered system with artificial intelligence analysis.,EEGSmart,https://www.crunchbase.com/organization/eegsmart,"Artificial Intelligence (AI), Hardware, Sensor","Shenzhen, Guangdong, China, Asia",Series A - EEGSmart,https://www.crunchbase.com/funding_round/eegsmart-series-a--340414d3,2,"Daosheng Yi Tianshi Jijin, Zhongchengyuan Shenzhen Qianhai Touzi Jijin Guanli",Early Stage Venture,,Series A,3,10000000,CNY,1544616,,,,28000000,CNY,4307131,Yes,,http://www.eegsmart.com/,,Early Stage Venture,,"565,109"
2016-04-08,"Pamo Shuju offers digital services, visualization services, and customized services.",Pamo Shuju,https://www.crunchbase.com/organization/pamo-shuju,"Big Data, Cloud Computing, Information Technology","Hangzhou, Zhejiang, China, Asia",Angel Round - Pamo Shuju,https://www.crunchbase.com/funding_round/pamo-shuju-angel--26b9d380,1,Action,Seed,,Angel,1,30000000,CNY,4639547,,,,30000000,CNY,4639547,Yes,,http://www.pamodata.com/,,Seed,,"572,150"
2016-03-02,CVNAVI is a system solution company in the commercial vehicle industry.,CVNAVI,https://www.crunchbase.com/organization/cvnavi,"Automotive, Electronics, Logistics","Qingpu, Shanghai, China, Asia",Angel Round - CVNAVI,https://www.crunchbase.com/funding_round/cvnavi-angel--8e9f6a4e,2,"China Soft Capital, Ronggong Touzi",Seed,,Angel,2,3000000,CNY,457883,,,,13000000,CNY,2053153,Yes,,http://www.cvnavi.com/,,Early Stage Venture,,"572,177"
2016-04-27,SynX develops and manufactures monitoring equipment for high-voltage and distribution lines.,SynX,https://www.crunchbase.com/organization/synx,"Electronics, Hardware, Manufacturing","Huzhou, Zhejiang, China, Asia",Angel Round - SynX,https://www.crunchbase.com/funding_round/synx-angel--53746bf4,2,"Leaguer Group, Xin Chang Electronics Technology",Seed,,Angel,2,6540000,CNY,1006825,,,,26540000,CNY,4007373,Yes,,https://www.synx.net.cn,,IPO,,"572,302"
2016-04-05,Ebusbar designs and sells core components of high-voltage systems for new energy vehicles.,Ebusbar,https://www.crunchbase.com/organization/ebusbar,"Battery, Electronics, Manufacturing","Shenzhen, Guangdong, China, Asia",Series B - Ebusbar,https://www.crunchbase.com/funding_round/ebusbar-series-b--53c3b4c2,2,"Chuang Fu Jin Tai, QC Investment",Early Stage Venture,,Series B,4,19800000,CNY,3057179,,,,42700000,CNY,6660334,Yes,,http://www.ebusbar.net/,,Late Stage Venture,,"572,948"
2016-04-09,"PI.E CHAIN provides supply chain management services for department stores, food, wine, and chemical industries.",PI.E CHAIN,https://www.crunchbase.com/organization/pi-e-chain,"Chemical, Food and Beverage, Supply Chain Management","Daxing, Beijing, China, Asia",Angel Round - PI.E CHAIN,https://www.crunchbase.com/funding_round/pi-e-chain-angel--db519284,2,"Julong, Tongda Zhonghe Technology",Seed,,Angel,2,3000000,CNY,463948,,,,13000000,CNY,2005172,Yes,,http://www.peigao.com.cn/,,Early Stage Venture,,"572,977"
2016-04-20,ULegal is a judicial technology company that provides legal services.,ULegal,https://www.crunchbase.com/organization/ulegal,"Business Development, Legal Tech, Professional Services","Nanshanqu, Guangdong, China, Asia",Angel Round - ULegal,https://www.crunchbase.com/funding_round/ulegal-angel--3a0b236c,2,"Nanji Quan, Qixing Piaochong Touzi",Seed,,Angel,2,3000000,CNY,463739,,,,23000000,CNY,3389127,Yes,,http://www.ulegal.cn,,Early Stage Venture,,"573,598"
2016-04-26,Jinshimisi is a fitness software and hardware company that integrates production and sales.,Jinshimisi,https://www.crunchbase.com/organization/jinshimisi,"Fitness, Hardware, Software","Fengtai, Beijing, China, Asia",Angel Round - Jinshimisi,https://www.crunchbase.com/funding_round/jinshimisi-angel--a33786f3,2,"Shunwei Capital, Xiaomi",Seed,,Angel,4,3000000,CNY,461961,,,,36000000,CNY,5306716,Yes,,https://www.kingsmith.com.cn/,$1M to $10M,Late Stage Venture,,"574,581"
2016-04-25,PARALLAX ONE provides biological sequencing services.,PARALLAX ONE,https://www.crunchbase.com/organization/parallax-one,"Biotechnology, Health Care, Health Diagnostics, Medical","Shaoxing, Zhejiang, China, Asia",Series B - PARALLAX ONE,https://www.crunchbase.com/funding_round/parallax-one-series-b--47fce520,1,Dian Diagnostics,Early Stage Venture,,Series B,3,20000000,CNY,3079928,,,,13571832,USD,13571832,Yes,,http://www.gencracker.com/,,Early Stage Venture,,"575,953"
2016-03-07,JoiWayTechnology is an employment service platform.,JoiWayTechnology,https://www.crunchbase.com/organization/joiwaytechnology,"Consulting, Employment, Recruiting","Guangzhou, Guangdong, China, Asia",Series A - JoiWayTechnology,https://www.crunchbase.com/funding_round/joiwaytechnology-series-a--ebff588c,2,"Plum Ventures, Saiman Fund",Early Stage Venture,,Series A,6,63000000,CNY,9665393,,,,257000100,CNY,38752069,Yes,,https://www.joiway.com,,Late Stage Venture,,"576,724"
2016-03-17,"SkyRover specializes in the research and development, production, sales, and service of high-performance general aviation aircraft.",SkyRover,https://www.crunchbase.com/organization/skyrover,"Aerospace, Manufacturing, Service Industry","Shenzhen, Guangdong, China, Asia",Angel Round - SkyRover,https://www.crunchbase.com/funding_round/skyrover-angel--0c164bbf,2,"Goldport Capital, Yunmu Touzi",Seed,,Angel,2,3000000,CNY,462277,,,,23000000,CNY,3361796,Yes,,http://skyrover.trial.ly200.net,,Early Stage Venture,,"576,776"
2016-03-21,SmartNuclide is a biopharmaceutical company that develops biological drug products.,SmartNuclide,https://www.crunchbase.com/organization/smartnuclide,"Biotechnology, Health Care, Medical, Pharmaceutical","Suzhou, Jiangsu, China, Asia",Angel Round - SmartNuclide,https://www.crunchbase.com/funding_round/smartnuclide-angel--35265201,2,"Alphamab Oncology, Suzhou Gongye Yuanqu Bohe Chuangye Touzi Guanli Youxian Gongsi",Seed,,Angel,4,3000000,CNY,462885,,,,133000000,CNY,18707563,Yes,,https://www.smartnucl.com/,$1M to $10M,Late Stage Venture,,"576,787"
2016-03-15,Chi Biomedicine provides medical and health management services with genetic technology.,Chi Biomedicine,https://www.crunchbase.com/organization/chi-biomedicine,"Biotechnology, Health Care, Medical","Longhua, Guangdong, China, Asia",Series A - Chi Biomedicine,https://www.crunchbase.com/funding_round/chi-biomedicine-series-a--39082e51,2,"Huasheng Yihong Investment Management, Youhe Fengchao",Early Stage Venture,,Series A,4,10000000,CNY,1535895,,,,63000000,CNY,9552672,Yes,,http://chi-biomedicine.com/,,Late Stage Venture,,"566,305"
2016-03-01,Landi English is an online real-time language course provider.,Landi English,https://www.crunchbase.com/organization/landi-english,"E-Learning, EdTech, Education","Hangzhou, Zhejiang, China, Asia",Series B - Landi English,https://www.crunchbase.com/funding_round/landi-english-series-b--cfddd30c,2,"Guojin Capital, Zero2IPO Ventures",Early Stage Venture,,Series B,5,,,,,,,80400000,USD,80400000,Yes,,https://teacher.landi.com/,,Late Stage Venture,,"566,432"
2016-03-01,Sandbox Network Technology is committed to creating a global game UGC platform that helps ordinary players turn their ideas into games.,Sandbox Network Technology,https://www.crunchbase.com/organization/sandbox-network-technology,Gaming,"Zhuhai, Guangdong, China, Asia",Angel Round - Sandbox Network Technology,https://www.crunchbase.com/funding_round/sandbox-network-technology-angel--e40bc02d,2,"Guojin Capital, Zhuhai High Tech Investment",Seed,,Angel,4,,,,,,,300000000,CNY,45850579,Yes,,http://www.sandboxol.cn,$1M to $10M,,,"566,529"
2016-03-01,"Shanghai Rendu Biotechnology Co., Ltd. operates as a biotechnology company.",Shanghai Rendu Biotechnology,https://www.crunchbase.com/organization/shanghai-rendu-biotechnology,"Biopharma, Biotechnology, Health Diagnostics","Shanghai, Shanghai, China, Asia",Series B - Shanghai Rendu Biotechnology,https://www.crunchbase.com/funding_round/shanghai-rendu-biotechnology-series-b--9c65225e,1,Qiming Venture Partners,Early Stage Venture,,Series B,3,2310000,USD,2310000,,,,14183025,USD,14183025,Yes,,http://www.rdbio.com,$1M to $10M,,1,"566,561"
2016-04-08,SocialTok is a digital marketing firm that offers media procurement and content marketing services.,SOCIALTOK,https://www.crunchbase.com/organization/socialtok,"Advertising, Content, Digital Marketing, Mobile Advertising","Nanchangshi, Jiangxi, China, Asia",Angel Round - SOCIALTOK,https://www.crunchbase.com/funding_round/socialtok-angel--c229e48d,2,"Dragon Wings Capital, Xinyu Junen Investment",Seed,,Angel,2,3000000,CNY,463955,,,,13000000,CNY,1962354,Yes,,https://www.socialtok.com/,,IPO,,"566,567"
2016-03-02,"QUANFENG EXPRESS provides supply chain, logistics, and courier services.",QUANFENG EXPRESS,https://www.crunchbase.com/organization/quanfeng-express,"Courier Service, Logistics, Supply Chain Management","Jiading, Shanghai, China, Asia",Series E - QUANFENG EXPRESS,https://www.crunchbase.com/funding_round/quanfeng-express-series-e--c8c162e2,2,"Genuine Venture, Shanghai Lanting Touzi",Late Stage Venture,,Series E,8,50000000,CNY,7631386,,,,1770000000,CNY,266726941,Yes,,http://www.qfkd.com.cn/,,M&A,,"566,613"
2016-03-10,Feixiong.TV is a vertically video game platform.,Feixiong.TV,https://www.crunchbase.com/organization/feixiong-tv,"Digital Entertainment, Internet, Video Games","Shanghai, Shanghai, China, Asia",Series A - Feixiong.TV,https://www.crunchbase.com/funding_round/feixiong-tv-series-a--bc9e69c7,2,"Fenghou Capital, Youku",Early Stage Venture,,Series A,3,10000000,CNY,1535867,,,,33000000,CNY,5014618,Yes,,http://www.feixiong.tv/,,Early Stage Venture,,"569,759"
2016-05-01,Yunding Technology develops smart home security products and services.,Yunding Technology,https://www.crunchbase.com/organization/yunding-technology,"Hardware, Home Services, Real Estate, Security, Smart Home","Changping, Beijing, China, Asia",Series B - Yunding Technology,https://www.crunchbase.com/funding_round/yunding-technology-series-b--579787b0,2,"Fosun International, Fosun RZ Capital",Early Stage Venture,,Series B,8,,,,,,,931000000,CNY,136374440,Yes,,http://www.yunding.cn,$10M to $50M,Private Equity,,"570,276"
2016-05-01,1001 Hao is 3D-shaping manufacturer in China.,1001 Hao,https://www.crunchbase.com/organization/1001-hao,"3D Printing, Manufacturing, Wearables","Nanjing, Jiangsu, China, Asia",Venture Round - 1001 Hao,https://www.crunchbase.com/funding_round/1001-hao-series-unknown--688fe888,1,Empower Investment,,,Venture - Series Unknown,3,,,,,,,,,,Yes,,http://www.1001hao.com/,,,,"570,829"
2016-02-26,Nuode provides wire harness products for industrial equipment and energy vehicle power systems.,Nuode,https://www.crunchbase.com/organization/nuode-4bca,"Automotive, Energy, Industrial, Manufacturing","Jintan, Jiangsu, China, Asia",Angel Round - Nuode,https://www.crunchbase.com/funding_round/nuode-4bca-angel--bd1ea6fc,2,"Jiuzhou Venture, Kunlun Fund",Seed,,Angel,3,3000000,CNY,458883,,,,33000000,CNY,4916584,Yes,,http://www.cznuode.com,,Early Stage Venture,,"567,121"
2016-03-10,"OUDMON is an IT company that provides big data analytics, hardware and software designing services.",OUDMON,https://www.crunchbase.com/organization/oudmon,"Analytics, Big Data, Information Technology, Software","Shenzhen, Guangdong, China, Asia",Series A - OUDMON,https://www.crunchbase.com/funding_round/oudmon-series-a--c5b4fd97,2,"Galaxy Internet, King Capital",Early Stage Venture,,Series A,3,20000000,CNY,3071734,,,,7517072,USD,7517072,Yes,,http://en.oudmon.com/,,Early Stage Venture,,"567,205"
2016-03-31,Wind Fish is an animation and comics development company.,Wind Fish,https://www.crunchbase.com/organization/wind-fish,"Animation, Developer Platform, Media and Entertainment","Fuhou, Fujian, China, Asia",Angel Round - Wind Fish,https://www.crunchbase.com/funding_round/wind-fish-angel--e7bd627d,2,"01vc, SIG China (SIG Asia Investments)",Seed,,Angel,2,9000000,CNY,1394646,,,,4360946,USD,4360946,Yes,,http://www.windfish.cn,$10M to $50M,Early Stage Venture,,"567,214"
2016-03-09,Baida is engaged in research and development of intelligent customer service robots in the e-commerce industry.,Baida,https://www.crunchbase.com/organization/baida,"Artificial Intelligence (AI), Customer Service, Robotics","Shenzhen, Guangdong, China, Asia",Angel Round - Baida,https://www.crunchbase.com/funding_round/baida-angel--50e51ca8,2,"Duoniu Capital, Qipeng.com",Seed,,Angel,2,3000000,CNY,460546,,,,13000000,CNY,2024745,Yes,,http://baida.im/,,Early Stage Venture,,"571,010"
2016-05-01,YKL is is a manufacturer of electrical accessories-plastic trunking products.,YKL,https://www.crunchbase.com/organization/ykl,Fashion,"Guangzhou, Guangdong, China, Asia",Angel Round - YKL,https://www.crunchbase.com/funding_round/ykl-angel--d4e1b863,2,"Huang Feihong Zichan, Qmangel Investment Partnership",Seed,,Angel,2,3000000,CNY,463404,,,,13000000,CNY,1991743,Yes,,http://www.ecalink.com/,$50M to $100M,Early Stage Venture,,"571,645"
2016-04-02,Yunke.ai is an internal data-driven enterprise sales management and external sales enabling platform.,Yunke.ai,https://www.crunchbase.com/organization/yunke-ai,"Analytics, Artificial Intelligence (AI), Big Data, Cloud Management, Machine Learning, Software","Beijing, Beijing, China, Asia",Angel Round - Yunke.ai,https://www.crunchbase.com/funding_round/yunke-ai-angel--2c6e0165,2,"Grains Valley Venture Capital, LongLing Capital",Seed,,Angel,3,4000000,CNY,617378,,,,64000000,CNY,9494995,Yes,,http://www.yunke.ai,,,,"567,367"
2016-04-05,TOMTOP is an e-commerce platform for electronic businesses.,TOMTOP,https://www.crunchbase.com/organization/tomtop,"E-Commerce, Electronics, Wholesale","Shenzhen, Guangdong, China, Asia",Series B - TOMTOP,https://www.crunchbase.com/funding_round/tomtop-series-b--49970263,2,"Guangzheng Jinsui, Jinjun Touzi",Early Stage Venture,,Series B,5,20000000,CNY,3088060,,,,200000000,CNY,30774190,Yes,,http://www.tomtop.cn/,,M&A,,"574,131"
2016-04-11,Roman Life is a mobile game publisher that provides online entertainment products.,Roman Life,https://www.crunchbase.com/organization/roman-life,"Gaming, Media and Entertainment, Online Games","Beijing, Beijing, China, Asia",Series A - Roman Life,https://www.crunchbase.com/funding_round/roman-life-series-a--aed296d7,2,"Jingyao Touzi, Wanglian Touzi",Early Stage Venture,,Series A,3,10000000,CNY,1547787,,,,33000000,CNY,4912158,Yes,,http://www.romanlife.cn/,,M&A,,"574,241"
