2016-04-06,Joyowo.com is an online HR service platform through the Cloud+SaaS model to provide enterprises with social insurance services.,Joyowo.com,https://www.crunchbase.com/organization/joyowo-com,"Business Development, Customer Service, Human Resources, SaaS","Hangzhou, Zhejiang, China, Asia",Series B - Joyowo.com,https://www.crunchbase.com/funding_round/joyowo-com-series-b--255a63b8,4,"Greenwoods Asset Management, HSG, Meridian Capital Asia, Tsing Ventures",Early Stage Venture,HSG,Series B,3,100000000,CNY,15434211,,,,340000000,CNY,53231927,Yes,,http://www.joyowo.com/,$50M to $100M,Late Stage Venture,,"331,641"
2016-04-28,Jigongbao is an Internet company that provides digital services for construction companies.,Jigongbao,https://www.crunchbase.com/organization/jigongbao,"Mobile Apps, Software","Chengdu, Sichuan, China, Asia",Angel Round - Jigongbao,https://www.crunchbase.com/funding_round/jigongbao-angel--70abae7d,4,"Beijing Bohua Xinzhi Technology, Chengdu Hometown City Investment, Huatu Capital, Yihe Chuangtou",Seed,Huatu Capital,Angel,3,10000000,CNY,1543392,,,,20000000,CNY,2987581,Yes,,http://www.jgongb.com/,,Early Stage Venture,,"334,362"
2016-04-05,"LinkDoc Technology Limited is a leading oncology big data company, based in Beijing, China.",LinkDoc Technology,https://www.crunchbase.com/organization/linkdoc-technology,"Big Data, Medical, Oncology, Security","Beijing, Beijing, China, Asia",Series B - LinkDoc Technology,https://www.crunchbase.com/funding_round/linkdoc-technology-series-b--f1ea9c45,4,"Ally Bridge Group, CBC Capital, Cenova, New Enterprise Associates",Early Stage Venture,CBC Capital,Series B,6,,,,,,,1700000000,CNY,253261047,Yes,,https://www.linkdoc.com/,$100M to $500M,,,"332,649"
2016-04-27,Beijing Weiying Technology is a Chinese ticketing application.,Beijing Weiying Technology,https://www.crunchbase.com/organization/beijing-weiying-technology,"Customer Service, E-Commerce, Film, Media and Entertainment, Ticketing","Beijing, Beijing, China, Asia",Series C - Beijing Weiying Technology,https://www.crunchbase.com/funding_round/beijing-weiying-technology-series-c--164ac070,4,"iDreamsky Technology, Ocean Capital, Tencent, Zeus Entertainment",Late Stage Venture,Zeus Entertainment,Series C,5,462000000,USD,462000000,1538000000,USD,1538000000,801981178,USD,801981178,Yes,,http://www.wepiao.com/,,M&A,,"333,007"
2016-03-08,Linmon Pictures is a boutique entertainment studio.,Linmon Pictures,https://www.crunchbase.com/organization/linmon-pictures,"Digital Entertainment, Film, Film Production","Shanghai, Shanghai, China, Asia",Series B - Linmon Pictures,https://www.crunchbase.com/funding_round/linmon-pictures-series-b--ccff6b9c,3,"Hony Capital, Mango V Foundation, Tencent",Early Stage Venture,Hony Capital,Series B,3,76000000,USD,76000000,,,,91362281,USD,91362281,Yes,,http://www.linmon.cn,$50M to $100M,IPO,,"335,355"
2016-04-20,Baidu Video (ç™¾åº¦è§†é¢‘æœç´¢) is a content video platform that offers video search and content collection services in China.,Baidu Video,https://www.crunchbase.com/organization/baidu-video,"Internet, Media and Entertainment, Video","Beijing, Beijing, China, Asia",Series A - Baidu Video,https://www.crunchbase.com/funding_round/baidu-video-series-a--ae52afe0,3,"SAIF Partners, Shanghai New Culture Media Group, Zeus Entertainment",Early Stage Venture,Shanghai New Culture Media Group,Series A,2,500000000,CNY,77289811,1000009039,CNY,154581020,177289811,USD,177289811,Yes,,http://v.baidu.com/,$10M to $50M,Early Stage Venture,,"335,347"
2016-04-13,Qingtuanshe offers an app that connects university students with part-time jobs.,Qingtuanshe,https://www.crunchbase.com/organization/qingtuanshe,"Apps, Consulting, Recruiting","Yuhang, Zhejiang, China, Asia",Series A - Qingtuanshe,https://www.crunchbase.com/funding_round/qingtuanshe-series-a--d8360246,2,"Aqua Ventures, Zhubajie",Early Stage Venture,Zhubajie,Series A,2,8500000,USD,8500000,,,,8500000,USD,8500000,Yes,,http://www.qtshe.com/,$1M to $10M,Early Stage Venture,,"337,953"
2016-04-03,Yunlaiwu is a film and television copyright trading platform and screenwriting community.,Yunlaiwu,https://www.crunchbase.com/organization/yunlaiwu,"Content Creators, Film, Media and Entertainment","Beijing, Beijing, China, Asia",Series A - Yunlaiwu,https://www.crunchbase.com/funding_round/yunlaiwu-series-a--da42d74d,5,"Dahe Ventures, In Capital, Innoangel Fund, iResearch Capital, Qicheng Ziben",Early Stage Venture,,Series A,1,20000000,CNY,3085882,,,,20000000,CNY,3085882,Yes,,http://www.yunlaiwu.com,,Early Stage Venture,,"338,641"
2016-04-25,Quanjing is a visual content provider that allows users to buy and edit stock photos.,Quanjing,https://www.crunchbase.com/organization/quanjing,"Media and Entertainment, Photo Editing, Photography, Software","Beijing, Beijing, China, Asia",Post-IPO Equity - Quanjing,https://www.crunchbase.com/funding_round/quanjing-post-ipo-equity--089caacd,5,"First Capital, Guangzhou Securities, Guotai Junan Securities, Northeast Securities, Zhongtai Securities",,,Post-IPO Equity,3,57000000,CNY,8777794,,,,161000000,CNY,25582620,Yes,,http://quanjing.com,Less than $1M,IPO,,"338,690"
2016-03-29,Immersion Technology is a developer of VR/AR entertainment products for children and teenagers in China.,Immersion Technology,https://www.crunchbase.com/organization/immersion-technology,"Computer, Software, Virtual Reality","Hangzhou, Zhejiang, China, Asia",Series A - Immersion Technology,https://www.crunchbase.com/funding_round/immersion-technology-series-a--67ea8e6b,5,"23Seed, China Weibo Developer Innovation Fund, CrestValue, Enjoyor, Sinowisdom",Early Stage Venture,,Series A,1,10000000,CNY,1536873,,,,10000000,CNY,1536873,Yes,,http://www.vrimmer.cn,,Early Stage Venture,,"338,696"
2016-04-25,AILV is a manufacturer of sexual wellness products.,AILV,https://www.crunchbase.com/organization/ailv,"Adult, Health Care, Manufacturing, Wellness","Huzhou, Zhejiang, China, Asia",Post-IPO Equity - AILV,https://www.crunchbase.com/funding_round/ailv-post-ipo-equity--1aae8411,5,"Haitong Securities, Kuanhua Investment Group, Longde Zichan, Yinling Capital, Zhejiang Changxing Economic and Technological Development",,,Post-IPO Equity,5,50000000,CNY,7699819,,,,362940000,CNY,58148445,Yes,,http://www.eailv.cn/,,IPO,,"339,137"
2016-03-03,E Yang Che is a provider of automobile maintenance and repair services for car owners.,E Yang Che,https://www.crunchbase.com/organization/e-yang-che,"Automotive, Customer Service","Huangpu, Shanghai, China, Asia",Series A - E Yang Che,https://www.crunchbase.com/funding_round/e-yang-che-series-a--279f47b3,5,"China Pacific Insurance, Feimaxing, Hubei Huitian New Materials, Ningbo Huazhong Plastic Products, Shanghai Taihui Touzi Guanli Hehuo Qiye",Early Stage Venture,,Series A,3,100000000,CNY,15312247,,,,160000000,CNY,24778995,Yes,,http://www.yangche.com.cn/,,Early Stage Venture,,"339,189"
2016-03-15,Hylanda is a big data mining and digital transformation service company.,HYLANDA,https://www.crunchbase.com/organization/hylanda,"Big Data, Data Mining, Information Technology","Beijing, Beijing, China, Asia",Series A - HYLANDA,https://www.crunchbase.com/funding_round/hylanda-series-a--d48c837f,5,"Bole Zongheng, Hongdao Capital, Huachuang Shengjing, NewMargin Ventures, Share Capital",Early Stage Venture,,Series A,2,10000000,CNY,1535895,,,,13000000,CNY,2005985,Yes,,http://www.hylanda.com/,,Early Stage Venture,,"339,177"
2016-03-21,"Mengqi Culture offers brand licensing management and derivative product design, production, and marketing services.",Mengqi Culture,https://www.crunchbase.com/organization/mengqi-culture,"Brand Marketing, Intellectual Property, Sales, Toys","Shenzhen, Guangdong, China, Asia",Seed Round - Mengqi Culture,https://www.crunchbase.com/funding_round/mengqi-culture-seed--da452b08,1,Leyo Capital,Seed,Leyo Capital,Seed,1,10000000,CNY,1542950,,,,10000000,CNY,1542950,Yes,,https://www.mekiculture.com,,Seed,,"339,753"
2016-04-20,A mobile app that targets car owners in China,Weiche,https://www.crunchbase.com/organization/weiche,"Mobile, Mobile Devices, Transportation","Beijing, Beijing, China, Asia",Series B - Weiche,https://www.crunchbase.com/funding_round/weiche-series-b--2a0e0f00,3,"DT Capital Partners, GRC SinoGreen Fund, Zero2IPO",Early Stage Venture,GRC SinoGreen Fund,Series B,3,24000000,USD,24000000,,,,24000000,USD,24000000,Yes,,https://weiche.cn/,Less than $1M,Late Stage Venture,,"340,832"
2016-05-01,ShareBang is an intelligent social marketing system.,ShareBang,https://www.crunchbase.com/organization/sharebang,"Marketing, Social","Beijing, Beijing, China, Asia",Seed Round - ShareBang,https://www.crunchbase.com/funding_round/sharebang-seed--a0a40578,3,"Fang Fund Partners, Innoangel Fund, Taiyou Fund",Seed,Fang Fund Partners,Seed,3,10000000,CNY,1544679,,,,30000000,CNY,4629841,Yes,,https://www.sharebang.com.cn/,,Early Stage Venture,,"340,947"
2016-04-01,Xiaoxian Dun is a healthy food products company.,Xiaoxian Dun,https://www.crunchbase.com/organization/xiaoxian-dun,"Food and Beverage, Health Care, Organic Food","Beijing, Beijing, China, Asia",Series A - Xiaoxian Dun,https://www.crunchbase.com/funding_round/xiaoxian-dun-series-a--f954d82c,3,"2049 Group, Hongyi Zhou, Xin Yu Li Mei",Early Stage Venture,Hongyi Zhou,Series A,4,10000000,CNY,1544616,,,,22027523,USD,22027523,Yes,,http://www.xxdun.com,,Late Stage Venture,,"340,981"
2016-03-21,Easyhin Technology is an mobile internet company on healthcare management of women and children.,Easyhin Technology,https://www.crunchbase.com/organization/easyhin-technology,"Children, Health Care, Hospital, Internet, Medical","Shenzhen, Guangdong, China, Asia",Series B - Easyhin Technology,https://www.crunchbase.com/funding_round/easyhin-technology-series-b--79b3c45b,3,"Fosun RZ Capital, Hawthorn Equity Partners, Morningside",Early Stage Venture,Fosun RZ Capital,Series B,5,15000000,USD,15000000,,,,49500647,USD,49500647,Yes,,http://www.easyhin.com/,$1M to $10M,Late Stage Venture,,"346,394"
2016-03-25,ECheng is a big data-driven recruitment platform that provides HR matching and resume screening services for enterprises.,eCheng,https://www.crunchbase.com/organization/echeng,"Analytics, Big Data, Database, Human Resources, Recruiting, SaaS","Shanghai, Shanghai, China, Asia",Series B - eCheng,https://www.crunchbase.com/funding_round/echeng-series-b--a509d060,2,"Cathay Innovation, Lightspeed China Partners",Early Stage Venture,Cathay Innovation,Series B,4,,,,,,,80786615,USD,80786615,Yes,,http://www.ifchange.com/,Less than $1M,Late Stage Venture,1,"346,704"
2016-03-30,"Haozu.com is the first domestic professional house-renting site owned by Anjuke Inc, focused on renting information services.",Haozu.com,https://www.crunchbase.com/organization/haozu-com,"Home Improvement, Home Renovation, Real Estate","Pudong, Shandong, China, Asia",Series A - Haozu.com,https://www.crunchbase.com/funding_round/haozu-com-series-a--f0a479b8,3,"Black Hole Capital, Joy Capital, Northern Light Venture Capital",Early Stage Venture,Joy Capital,Series A,4,39000000,USD,39000000,,,,39000000,USD,39000000,Yes,,http://www.haozu.com,$1B to $10B,Late Stage Venture,,"346,922"
2016-04-22,Tuliu.com is a comprehensive online platform for land transfers in China.,Tuliu.com,https://www.crunchbase.com/organization/tuliu-com,"Online Auctions, Online Portals, Small and Medium Businesses","Changshan, Hunan, China, Asia",Series B - Tuliu.com,https://www.crunchbase.com/funding_round/tuliu-com-series-b--aae78df0,3,"Foyo Culture & Entertainment, Matrix Partners China, Tianqiao Chen",Early Stage Venture,Tianqiao Chen,Series B,3,23000000,USD,23000000,,,,31243482,USD,31243482,Yes,,http://www.tuliu.com/,$1M to $10M,Late Stage Venture,,"347,278"
2016-04-05,"G7 is a fleet management service provider in China that offers IoT/AI services to over 800,000 vehicles.",G7,https://www.crunchbase.com/organization/g7,"Fleet Management, Information Technology, Internet of Things, Logistics, Transportation","Haidian, Beijing, China, Asia",Series C - G7,https://www.crunchbase.com/funding_round/g7-series-c--da385395,3,"Eastern Bell Capital, Temasek Holdings, Tencent",Late Stage Venture,Tencent,Series C,7,45000000,USD,45000000,,,,710000000,USD,710000000,Yes,,http://g7.com.cn,$50M to $100M,Private Equity,,"347,466"
2016-04-01,AirQuality is an air-cleaning technology innovator and manufacturer company.,AirQuality,https://www.crunchbase.com/organization/airquality,Environmental Engineering,"Shanghai, Shanghai, China, Asia",Series B - AirQuality,https://www.crunchbase.com/funding_round/airquality-series-b--e0ac4be3,1,Qiming Venture Partners,Early Stage Venture,Qiming Venture Partners,Series B,2,26000000,CNY,4016002,,,,14016002,USD,14016002,Yes,,http://airquality.com/,Less than $1M,Late Stage Venture,2,"345,192"
2016-05-01,iQUNXING.COM is an internet trading platform that provides the tail of supply chain finance.,iQUNXING.COM,https://www.crunchbase.com/organization/iqunxing-com,"Financial Services, Supply Chain Management, Trading Platform","Xuhui, Shanghai, China, Asia",Series B - iQUNXING.COM,https://www.crunchbase.com/funding_round/iqunxing-com-series-b--4ca753a8,2,"Ally Capital, Qianhai Fund of Funds",Early Stage Venture,Ally Capital,Series B,3,150000000,CNY,23170185,,,,48170185,USD,48170185,Yes,,https://www.iqunxing.com/,,Early Stage Venture,,"347,858"
2016-04-15,UCAR is a chauffeured car service provider committed to guaranteeing safe and standardized chauffeur services for its customers.,UCAR,https://www.crunchbase.com/organization/ucar,"Automotive, Car Sharing, Transportation","Beijing, Beijing, China, Asia",Series C - UCAR,https://www.crunchbase.com/funding_round/ucar-series-c--ae1c6c0a,3,"Alibaba Group, CICC, CITIC Securities",Late Stage Venture,Alibaba Group,Series C,5,3680000000,CNY,568100771,25020000000,CNY,3862467743,2389035662,USD,2389035662,Yes,,http://www.ucarinc.com/,,IPO,,"345,594"
2016-05-01,Youshu is a China-based big data credit investigation company.,Youshu,https://www.crunchbase.com/organization/youshu,"Big Data, Consulting, Finance","Hangzhou, Zhejiang, China, Asia",Series A - Youshu,https://www.crunchbase.com/funding_round/youshu-series-a--b7d8b963,3,"China Venture Capital HRVC, Hangzhou Qinhua Touzi Guanli Co., Ltd., Jinyongxin Investment Management",Early Stage Venture,China Venture Capital HRVC,Series A,4,30000000,CNY,4634037,,,,91000000,CNY,13254277,Yes,,http://www.yscredit.com/,,,,"346,087"
2016-05-01,Puff Gogo is an internet company that provides services to the pet industry.,Puff Gogo,https://www.crunchbase.com/organization/puff-gogo,"Animal Feed, Internet, Pet","Xuhui, Shanghai, China, Asia",Angel Round - Puff Gogo,https://www.crunchbase.com/funding_round/puff-gogo-angel--f7e1c9f4,3,"Hexi Touzi, UnityVC, Xinyu Zhangfushi Touzi",Seed,UnityVC,Angel,3,1000000,CNY,154468,,,,23154468,USD,23154468,Yes,,https://www.puffgogo.com/,,Late Stage Venture,,"346,252"
2016-05-01,"Cycang is an online portal for skincare, jewelry, and clothing.",cycang.com,https://www.crunchbase.com/organization/cycang-com,"Cosmetics, E-Commerce, Jewelry","Guangzhou, Guangdong, China, Asia",Series A - cycang.com,https://www.crunchbase.com/funding_round/cycang-com-series-a--bf16b187,3,"Dream Chaser Capital, Green Pine Capital Partners, SUVC",Early Stage Venture,Green Pine Capital Partners,Series A,4,33000000,CNY,5097441,,,,54000000,CNY,8390990,Yes,,http://cycang.com,,Early Stage Venture,,"348,247"
2016-03-01,"Iron Armour was established in 2009 and have web portal, used equipment transaction, finance and assessment service.",Iron Armour,https://www.crunchbase.com/organization/cehome,"Construction, Facilities Support Services, Infrastructure","Beijing, Beijing, China, Asia",Series C - Iron Armour,https://www.crunchbase.com/funding_round/cehome-series-c--6a91580b,1,Qiming Venture Partners,Late Stage Venture,Qiming Venture Partners,Series C,4,25000000,USD,25000000,,,,73500000,USD,73500000,Yes,,http://www.cehome.com/,Less than $1M,Late Stage Venture,2,"347,036"
2016-04-28,Champion is a professional and customized data platform for sports industry.,Champion,https://www.crunchbase.com/organization/champion-dbeb,"Database, Information Services, Sports","Shanghai, Shanghai, China, Asia",Series A - Champion,https://www.crunchbase.com/funding_round/champion-dbeb-series-a--a47c393c,3,"Shanghai Bingye Qiye Guanlizhongxin, Shanghai Vulcan Capital, Suning Holdings Group",Early Stage Venture,Suning Holdings Group,Series A,3,32000000,CNY,4938855,,,,55000000,CNY,8326655,Yes,,http://www.champdas.com/,,Early Stage Venture,,"343,924"
2016-03-24,Lagou.com offers staffing services.,Lagou,https://www.crunchbase.com/organization/lagou,"Recruiting, Staffing Agency","Beijing, Beijing, China, Asia",Series C - Lagou,https://www.crunchbase.com/funding_round/lagou-series-c--2cbcbd44,2,"Hongdao Capital, Qiming Venture Partners",Late Stage Venture,Hongdao Capital,Series C,6,34000000,USD,34000000,,,,183490890,USD,183490890,Yes,,http://www.lagou.com/,$1M to $10M,Late Stage Venture,1,"344,285"
2016-04-01,Roborock manufactures and markets robotic vacuum cleaners for stores throughout China.,Roborock,https://www.crunchbase.com/organization/roborock,"Machinery Manufacturing, Manufacturing, Robotics","Beijing, Beijing, China, Asia",Series B - Roborock,https://www.crunchbase.com/funding_round/roborock-series-b--3a963c6d,1,Qiming Venture Partners,Early Stage Venture,Qiming Venture Partners,Series B,3,25000000,USD,25000000,,,,28420000,USD,28420000,Yes,,https://us.roborock.com,$1B to $10B,IPO,1,"349,557"
2016-03-29,Heitao focuses on the distribution and operation of mobile game products.,Heitao,https://www.crunchbase.com/organization/heitao,"Digital Entertainment, Gaming, PC Games","Shanghai, Shanghai, China, Asia",Series B - Heitao,https://www.crunchbase.com/funding_round/heitao-series-b--d8583196,9,"BingChuang JiJin, Hai Quan Fund, Jiante Shengming Keji, Jiuli Jijin, Ningbo Meishan Baoshui Gangqu Shuanghao Guquan Touzi, Ningbo Meishan Baoshui Gangqu Yingyaodong Guquan Touzi, Puhua Capital, Yingda Capital Management, Zhongfucun Chuang Tou",Early Stage Venture,,Series B,4,20000000,CNY,3073745,,,,63000000,CNY,9659248,Yes,,http://www.heitao.com,,Late Stage Venture,,"351,307"
2016-04-06,Guance Cloud offers a full-stack observability platform for cloud-based workflows.,Guance Cloud,https://www.crunchbase.com/organization/guanceyun,"Analytics, Cloud Computing, Cloud Data Services, Information Technology, Productivity Tools, Software","Shanghai, Shanghai, China, Asia",Series B - Guance Cloud,https://www.crunchbase.com/funding_round/guanceyun-series-b--4f176766,1,Alibaba Group,Early Stage Venture,Alibaba Group,Series B,5,50000000,CNY,7717106,,,,460000000,CNY,70551277,Yes,,https://www.guance.com,,Late Stage Venture,,"351,438"
2016-04-26,amethystum is a software solutions company for big data optical storage management.,amethystum,https://www.crunchbase.com/organization/amethystum,"Big Data, Data Storage, Software","Meizhou, Guangdong, China, Asia",Venture Round - amethystum,https://www.crunchbase.com/funding_round/amethystum-series-unknown--bba2341f,9,"Guojin Dingxing Investment, Hengqin Feibi Equity, Histtone Capital, Jiade Yangguang Touzi, Maohui Equity, Sova Capital, Tianxing Capital, Yongxin Xianta Luosi Qiye Guanli Zhongxin, Zhuhai Hengqin Yicheng Guanli Zixun Qiye",,,Venture - Series Unknown,4,60000000,CNY,9239222,,,,293500000,CNY,43950001,Yes,,https://amethystum.com/,,IPO,,"351,972"
2016-05-01,"Hengli Group is a textile manufacturing firm that focuses on the production chain in oil refining, petrochemicals, polyester, and textiles.",Hengli Group,https://www.crunchbase.com/organization/hengli-group,"Chemical Engineering, Commercial, Industrial, Manufacturing, Textiles","Suzhou, Jiangsu, China, Asia",Venture Round - Hengli Group,https://www.crunchbase.com/funding_round/hengli-group-series-unknown--049a00e9,1,Zhonghe Capital,,,Venture - Series Unknown,1,,,,,,,,,,Yes,,https://www.hengli.com/,$100M to $500M,,,"352,355"
2016-03-25,Yi Zhibo is a live broadcasting platform.,Yi Zhibo,https://www.crunchbase.com/organization/yi-zhibo,"Broadcasting, Media and Entertainment, Social Media","Beijing, Beijing, China, Asia",Series A - Yi Zhibo,https://www.crunchbase.com/funding_round/yi-zhibo-series-a--d164a932,4,"Lotus Venture Capital, Tengxun Touzi, Trend Capital, Yilian Shixun",Early Stage Venture,,Series A,3,60000000,CNY,9209375,,,,66000000,CNY,10163524,Yes,,https://easylive.com,,Early Stage Venture,,"352,420"
2016-03-01,Fangzhi Technology is a UAV inspection and electric vehicle charging system development company.,FANGZHI TEHNOLOGY,https://www.crunchbase.com/organization/fangzhi-tehnology,"Automotive, Manufacturing, Service Industry","Beijing, Beijing, China, Asia",Venture Round - FANGZHI TEHNOLOGY,https://www.crunchbase.com/funding_round/fangzhi-tehnology-series-unknown--977a89e6,4,"Dunjun Zichan, Puhua Capital, Shanghai Taiheng, Songtong Capital",,,Venture - Series Unknown,1,50000000,CNY,7632656,,,,50000000,CNY,7632656,Yes,,http://www.bjfz.cc/,,IPO,,"352,936"
2016-04-27,Yonegy is a manufacturer in Jiujiang and Jiangxi.,Yonegy,https://www.crunchbase.com/organization/yonegy,"Industrial Automation, Manufacturing, Robotics","Guangzhou, Guangdong, China, Asia",Series A - Yonegy,https://www.crunchbase.com/funding_round/yonegy-series-a--893995e3,4,"GAC Capital, IDG Capital, SAIC Capital, TCL Capital",Early Stage Venture,,Series A,3,,,,,,,13000000,CNY,2022957,Yes,,http://www.yonegy.com/,,Early Stage Venture,,"354,124"
2016-03-03,"BZTONE offers experiential marketing, exhibition hall design and creative planning services.",BZTONE,https://www.crunchbase.com/organization/bztone,"Advertising, Events, Marketing","Minhang, Shanghai, China, Asia",Angel Round - BZTONE,https://www.crunchbase.com/funding_round/bztone-angel--1577a06a,4,"Hubei Provincial High Technology Industry Investment, Lida Automation Technology, Tingsheng Investment, Yinqi Exhibition Engineering",Seed,,Angel,1,3000000,CNY,459367,,,,3000000,CNY,459367,Yes,,http://www.bztone.com,,Seed,,"353,647"
2016-04-18,EFUBAO is an online customization platform for corporate professional and group clothing brans.,EFUBAO,https://www.crunchbase.com/organization/efubao,"E-Commerce, Fashion, Retail","Fengtai, Beijing, China, Asia",Angel Round - EFUBAO,https://www.crunchbase.com/funding_round/efubao-angel--55db3265,4,"Chongqing Wenhua Chuangtou, Eve Group, Huijia Venture Capital, Zhubajie",Seed,,Angel,1,10000000,CNY,1544300,,,,10000000,CNY,1544300,Yes,,http://www.efubao.com/,,Seed,,"353,473"
2016-04-06,Tianyu Zaixian is a mobile game development company.,Tianyu Zaixian,https://www.crunchbase.com/organization/tianyu-zaixian,"Gaming, Internet, Mobile","Beijing, Beijing, China, Asia",Angel Round - Tianyu Zaixian,https://www.crunchbase.com/funding_round/tianyu-zaixian-angel--071486f6,4,"AVIC Trust, Baidu Capital, Qingrongxin, Stream Hill Angels",Seed,,Angel,2,11130000,CNY,1717828,,,,12130000,CNY,1874100,Yes,,http://tianyuonline.cn/,,Seed,,"353,171"
2016-03-28,KIWI is a mobile digital marketing solution provider company.,KIWI,https://www.crunchbase.com/organization/kiwi-6854,"Brand Marketing, Digital Marketing, Mobile Advertising","Guangzhou, Guangdong, China, Asia",Series A - KIWI,https://www.crunchbase.com/funding_round/kiwi-6854-series-a--b4ada5ab,4,"Guangdong Billionhome Fund Management, Meiying Touzi, Mindata, Tongfang Venture Capital",Early Stage Venture,,Series A,2,22000000,CNY,3379494,,,,25000000,CNY,3868204,Yes,,http://www.mokiwi.com,,IPO,,"353,543"
2016-04-25,"Jiangxi Salt Industry Group engages in the production of salt products, kitchen ingredient sales, and salinization products.",Jiangxi Salt Industry Group,https://www.crunchbase.com/organization/jiangxi-salt-industry-group-co-ltd,"Consumer, Industrial, Manufacturing, Sales","Nanchangshi, Jiangxi, China, Asia",Angel Round - Jiangxi Salt Industry Group,https://www.crunchbase.com/funding_round/jiangxi-salt-industry-group-co-ltd-angel--edfdac06,4,"BAIC Capital, CMK Capital, Sino-Rock Investment Management, Xiamen ITG Group",Seed,,Angel,1,3000000,CNY,461989,,,,3000000,CNY,461989,Yes,,http://www.jxsalt.com/,,IPO,,"353,668"
2016-03-16,FTS provides electronic hardware and software products and services in the field of civil aviation.,FTS,https://www.crunchbase.com/organization/fts,"Electronics, Hardware, Software","Haidian, Beijing, China, Asia",Series B - FTS,https://www.crunchbase.com/funding_round/fts-series-b--a5f05e86,4,"CAIF, Henan Splendor Science & Technology, Minghang Investment Management, Source Capital",Early Stage Venture,,Series B,2,20000000,CNY,3074525,,,,30000000,CNY,4684862,Yes,,http://www.fts.aero/,,Early Stage Venture,,"353,202"
2016-03-29,77L is a mobile game portal that provides mobile games and download game distribution functions.,77L.com,https://www.crunchbase.com/organization/77l-com,"Gaming, Mobile, Online Games","Shangrao, Jiangxi, China, Asia",Post-IPO Equity - 77L.com,https://www.crunchbase.com/funding_round/77l-com-post-ipo-equity--f9d4a807,4,"Changjiang Securities, CITIC Securities, Industrial Securities, Yingda Securities Co., Ltd.",,,Post-IPO Equity,3,16000000,CNY,2458996,,,,98390000,CNY,15383948,Yes,,http://www.77l.com,$1M to $10M,,,"353,280"
2016-02-29,51duoying.com is a third-party financial service provider.,51duoying.com,https://www.crunchbase.com/organization/51duoying-com,"Banking, Financial Services, Wealth Management","Shanghai, Shanghai, China, Asia",Series A - 51duoying.com,https://www.crunchbase.com/funding_round/51duoying-com-series-a--4a131b78,3,"Aokang Investment, Xiangrong Hulianwang Jinrong, YC Partners",Early Stage Venture,,Series A,2,9999900,CNY,1526884,,,,12999900,CNY,2008523,Yes,,http://www.51duoying.com/,,M&A,,"354,712"
