2018-02-01,Zhongyan Bicheng Technology is an adapted material manufacturing technology and laminated copper matrix material supplier.,Zhongyan Bicheng Technology,https://www.crunchbase.com/organization/zhongyan-bicheng-technology,,"Beijing, Beijing, China, Asia",Series A - Zhongyan Bicheng Technology,https://www.crunchbase.com/funding_round/zhongyan-bicheng-technology-series-a--00084d54,1,GSR United Capital,Early Stage Venture,GSR United Capital,Series A,1,25000000,CNY,3968380,,,,25000000,CNY,3968380,Yes,,,,Early Stage Venture,,"303,907"
2018-02-09,inhand is an internet of things communication equipment and solution developer.,inhand,https://www.crunchbase.com/organization/inhand,"Hardware, Information Technology, Internet of Things, Software","Beijing, Beijing, China, Asia",Venture Round - inhand,https://www.crunchbase.com/funding_round/inhand-series-unknown--bd5a7862,1,Ying Capital,,Ying Capital,Venture - Series Unknown,4,10000000,CNY,1590103,,,,100880000,CNY,15374666,Yes,,http://www.inhand.com.cn,,IPO,,"293,810"
2018-01-19,Gunlei is a purchasing and sales platform for importing vehicles in China.,Gunlei,https://www.crunchbase.com/organization/gunlei,"Automotive, E-Commerce, Sales","Beijing, Beijing, China, Asia",Corporate Round - Gunlei,https://www.crunchbase.com/funding_round/gunlei-corporate-round--9cca49b1,1,COSCO Shipping Logistics Fund,,COSCO Shipping Logistics Fund,Corporate Round,1,78000000,USD,78000000,,,,78000000,USD,78000000,Yes,,https://www.gunlei.com,$1M to $10M,,,"304,130"
2018-01-02,SKT Education and Beyond is an education platform that provides youth social practice activities and literacy ability research courses.,SKT Education & Beyond,https://www.crunchbase.com/organization/skt-education-beyond,"EdTech, Education, Online Portals","Shenzhen, Guangdong, China, Asia",Seed Round - SKT Education & Beyond,https://www.crunchbase.com/funding_round/skt-education-beyond-seed--7807ea52,1,Zero2IPO,Seed,Zero2IPO,Seed,2,20000000,CNY,3079979,,,,23000000,CNY,3529220,Yes,,https://www.sktedu.com/#/index,,Seed,,"304,185"
2018-01-05,Gonbike is a bike sharing company.,Gonbike,https://www.crunchbase.com/organization/gonbike,"Mobile Apps, Ride Sharing, Security","Shanghai, Shanghai, China, Asia",Angel Round - Gonbike,https://www.crunchbase.com/funding_round/gonbike-angel--b4bef2e3,1,Quan Capital,Seed,Quan Capital,Angel,1,15000000,USD,15000000,,,,15000000,USD,15000000,Yes,,http://www.gonbikesharing.com,,Seed,,"304,269"
2017-12-20,XiaoMaiGui is a Chinese smart vending machine operator backed by Chinese electrical appliance manufacturer Midea Group. ,XiaoMaiGui,https://www.crunchbase.com/organization/xiaomaigui,"Operating Systems, Retail Technology, Vending and Concessions","Hefei, Anhui, China, Asia",Angel Round - XiaoMaiGui,https://www.crunchbase.com/funding_round/xiaomaigui-angel--ad0c5e5e,1,Midea Group,Seed,Midea Group,Angel,1,6800000,USD,6800000,,,,6800000,USD,6800000,Yes,,https://www.xiaomaigui.com/,,Seed,,"316,028"
2017-12-19,PGYER.COM is a mobile beta apps distribution platform.,PGYER.COM,https://www.crunchbase.com/organization/pgyer-com,"Apps, Mobile, Test and Measurement","Xian Shi, Shaanxi, China, Asia",Series B - PGYER.COM,https://www.crunchbase.com/funding_round/pgyer-com-series-b--1256917f,1,Nantong Qixiong,Early Stage Venture,Nantong Qixiong,Series B,3,20000000,CNY,3027505,,,,33000000,CNY,4995166,Yes,,https://www.pgyer.com/,$1M to $10M,Early Stage Venture,,"298,464"
2018-01-08,Dezhong Technology is the provider of urban smart parking solutions services.,Dezhong Technology,https://www.crunchbase.com/organization/dezhong-technology,"Automotive, Parking, Software","Huangpu, Guangdong, China, Asia",Series A - Dezhong Technology,https://www.crunchbase.com/funding_round/dezhong-technology-series-a--b2752a23,1,UFA United Faith,Early Stage Venture,UFA United Faith,Series A,2,10000000,CNY,1538876,,,,13000000,CNY,1978298,Yes,,http://www.dezhongtech.com,,Early Stage Venture,,"316,430"
2018-01-22,Jingji Sichuan Majiang specializes in the development and operation of mobile internet products.,Jingji Sichuan Majiang,https://www.crunchbase.com/organization/jingji-sichuan-majiang,"Information Technology, Internet, Mobile","Beijing, Beijing, China, Asia",Series A - Jingji Sichuan Majiang,https://www.crunchbase.com/funding_round/jingji-sichuan-majiang-series-a--d7d22c80,1,Huarong Hengchuang Guanli,Early Stage Venture,Huarong Hengchuang Guanli,Series A,2,10000000,CNY,1561231,,,,13000000,CNY,2044114,Yes,,http://www.majiangworld.com/,,Early Stage Venture,,"316,501"
2018-02-14,"The world leader in smart parking with 100,000 parking lots globally, positioning No.1 in China.",Jieshun Technology,https://www.crunchbase.com/organization/shenzhen-jieshun,"Information Services, Intelligent Systems, Parking","Shenzhen, Guangdong, China, Asia",Post-IPO Equity - Jieshun Technology,https://www.crunchbase.com/funding_round/shenzhen-jieshun-post-ipo-equity--bc4ac859,1,Ant Group,,Ant Group,Post-IPO Equity,1,31500000,USD,31500000,,,,31500000,USD,31500000,Yes,,https://www.jieshun-tech.com/,,IPO,,"305,357"
2017-12-31,VOC is a smart door lock brand that develops and manufactures smart door locks.,VOC,https://www.crunchbase.com/organization/voc-41bc,"Manufacturing, Retail, Smart Home","Wenzhou, Zhejiang, China, Asia",Series B - VOC,https://www.crunchbase.com/funding_round/voc-41bc-series-b--62b96439,1,Baoxiniao Holding,Early Stage Venture,Baoxiniao Holding,Series B,3,20000000,CNY,3064171,,,,60000000,CNY,9062705,Yes,,http://www.voc.so,,Early Stage Venture,,"299,735"
2018-01-16,"Shenzhen Chuangke Blockchain Technology offers services on research, development, and application of internet and blockchain technology.",M-chain.com,https://www.crunchbase.com/organization/m-chain-com,"Blockchain, Internet, Virtual Currency","Shenzhen, Guangdong, China, Asia",Angel Round - M-chain.com,https://www.crunchbase.com/funding_round/m-chain-com-angel--b9298458,1,Dream Chaser Capital,Seed,Dream Chaser Capital,Angel,1,3000000,CNY,465593,,,,3000000,CNY,465593,Yes,,https://www.m-chain.com/,,Seed,,"299,818"
2018-01-16,Kether is a designer and developer of brain monitoring device company.,Kether,https://www.crunchbase.com/organization/kether-3566,"Electronics, Health Care, Intelligent Systems","Hangzhou, Zhejiang, China, Asia",Series B - Kether,https://www.crunchbase.com/funding_round/kether-3566-series-b--fc3a054c,1,Huadan Angel,Early Stage Venture,Huadan Angel,Series B,5,20000000,CNY,3103951,,,,54000000,CNY,8294097,Yes,,http://kether.cn,,Early Stage Venture,,"299,836"
2018-01-02,Lapador is a manufacturer and seller of baby products.,Lapador,https://www.crunchbase.com/organization/lapador,"Baby, Manufacturing, Sales","Minhang, Shanghai, China, Asia",Series A - Lapador,https://www.crunchbase.com/funding_round/lapador-series-a--a58d4210,1,Baird Asia,Early Stage Venture,Baird Asia,Series A,2,35000000,CNY,5389964,,,,6889964,USD,6889964,Yes,,http://www.lapador.com.cn/,,Early Stage Venture,,"307,076"
2018-01-02,Zhiweixinke specializes in the artificial intelligence-aided morphological examination and pathological diagnosis.,Zhiweixinke,https://www.crunchbase.com/organization/zhiweixinke,"Artificial Intelligence (AI), Health Care, Health Diagnostics, Medical Device","Hangzhou, Zhejiang, China, Asia",Series B - Zhiweixinke,https://www.crunchbase.com/funding_round/zhiweixinke-series-b--c8bae533,1,Puhua Capital,Early Stage Venture,Puhua Capital,Series B,3,20000000,CNY,3079979,,,,33000000,CNY,5026975,Yes,,https://hzzwxk.com/,,Early Stage Venture,,"300,471"
2018-02-01,"AGE provides brand strategy, financial products, channel construction, and talent training services.",AGE,https://www.crunchbase.com/organization/age-bc20,"Advertising, Brand Marketing, Corporate Training, Financial Services","Huangpu, Shanghai, China, Asia",Series B - AGE,https://www.crunchbase.com/funding_round/age-bc20-series-b--ac08b9b4,1,Zendai Group,Early Stage Venture,Zendai Group,Series B,3,20000000,CNY,3174704,,,,33000000,CNY,5108826,Yes,,http://www.age123.com,,Early Stage Venture,,"297,655"
2017-12-25,BeijingHLB provides forensic services to artists and cultural artwork suppliers.,BeijingHLB,https://www.crunchbase.com/organization/beijinghlb,"Art, Legal, Service Industry","Beijing, Beijing, China, Asia",Series C - BeijingHLB,https://www.crunchbase.com/funding_round/beijinghlb-series-c--85fe47c1,1,Amphora Capital,Late Stage Venture,Amphora Capital,Series C,4,30000000,CNY,4566419,,,,74000000,CNY,11162920,Yes,,http://www.beijinghlb.com/,,Late Stage Venture,,"294,827"
2018-02-08,PMDaniu is a cloud-based collaboration platform based in China.,PMDaniu,https://www.crunchbase.com/organization/pmdaniu,"Cloud Computing, Collaboration, Project Management, Software","Jinan, Shandong, China, Asia",Angel Round - PMDaniu,https://www.crunchbase.com/funding_round/pmdaniu-angel--b4a09f1a,1,Ruzhe Venture capital,Seed,Ruzhe Venture capital,Angel,1,,,,,,,,,,Yes,,http://www.pmdaniu.com/,,Seed,,"294,839"
2018-01-30,FANCY CLINIC is a medical beauty chain brand that focuses on microplastic surgery and facial skin rejuvenation.,FANCY CLINIC,https://www.crunchbase.com/organization/fancy-clinic,"Beauty, Health Care, Hospital, Personal Health","Beijing, Beijing, China, Asia",Angel Round - FANCY CLINIC,https://www.crunchbase.com/funding_round/fancy-clinic-angel--dc74e92c,1,Edge Ventures,Seed,Edge Ventures,Angel,1,10000000,CNY,1581966,,,,10000000,CNY,1581966,Yes,,http://www.fancyclinic.com,,Seed,,"294,918"
2017-12-22,A music System Developer .,Mustliten Background Music,https://www.crunchbase.com/organization/mustliten-background-music,Music,"Shanghai, Shanghai, China, Asia",Series A - Mustliten Background Music,https://www.crunchbase.com/funding_round/mustliten-background-music-series-a--20deca63,1,Shangshi Fund,Early Stage Venture,Shangshi Fund,Series A,1,,,,,,,,,,Yes,,,,Early Stage Venture,,"297,743"
2018-02-08,"Wawaji develops, designs, and manufactures water treatment equipment.",Wawaji,https://www.crunchbase.com/organization/wawaji,"Gaming, iOS, Media and Entertainment","Hangzhou, Zhejiang, China, Asia",Series A - Wawaji,https://www.crunchbase.com/funding_round/wawaji-series-a--40a941e9,1,UnityVC,Early Stage Venture,UnityVC,Series A,2,10000000,CNY,1580453,,,,13000000,CNY,2034033,Yes,,http://wawajiapp.com/,,Early Stage Venture,,"295,075"
2018-01-16,InforCreation provides artificial intelligence solutions for smart homes and agriculture fields.,InforCreation,https://www.crunchbase.com/organization/inforcreation,"Agriculture, Artificial Intelligence (AI), Machine Learning, Smart Home, Software","Nanjing, Jiangsu, China, Asia",Post-IPO Equity - InforCreation,https://www.crunchbase.com/funding_round/inforcreation-post-ipo-equity--682551b9,1,Wuhu Construction Investment,,Wuhu Construction Investment,Post-IPO Equity,3,10000000,CNY,1551976,,,,14360000,CNY,2227088,Yes,,http://www.inforcreation.com/,,IPO,,"298,057"
2017-12-28,KiTS is a research and study travel services providing company.,KiTS,https://www.crunchbase.com/organization/kits-148c,"Education, Internet, Travel","Beijing, Beijing, China, Asia",Post-IPO Equity - KiTS,https://www.crunchbase.com/funding_round/kits-148c-post-ipo-equity--b99f3592,1,Zhonghai Softbank Investment Management,,Zhonghai Softbank Investment Management,Post-IPO Equity,2,7500000,CNY,1148123,,,,10500000,CNY,1590761,Yes,,http://www.zkguoji.cn/,,IPO,,"298,085"
2017-12-28,Kuanyi provides a cash register system for restaurant operations.,Kuanyi,https://www.crunchbase.com/organization/kuanyi,"Information Technology, Payments, Restaurants","Guangzhou, Guangdong, China, Asia",Series A - Kuanyi,https://www.crunchbase.com/funding_round/kuanyi-series-a--6bd83d95,1,QF Capital,Early Stage Venture,QF Capital,Series A,2,10000000,CNY,1530831,,,,20000000,CNY,3093551,Yes,,http://www.kuan1.cn/,,Early Stage Venture,,"295,217"
2018-01-30,Suray focuses on providing intelligent storage and transportation solutions.,Suray,https://www.crunchbase.com/organization/suray,"Information Technology, Logistics, Software, Supply Chain Management","Shanghai, Shanghai, China, Asia",Series A - Suray,https://www.crunchbase.com/funding_round/suray-series-a--46278031,1,Kuka Group,Early Stage Venture,Kuka Group,Series A,2,10000000,CNY,1581966,,,,13000000,CNY,2050164,Yes,,http://www.suray.cn/,,Early Stage Venture,,"295,892"
2018-01-17,JINCI is a manufacturer of automotive electrical appliances.,JINCI,https://www.crunchbase.com/organization/jinci,"Automotive, Electronics, Manufacturing","Hangzhou, Zhejiang, China, Asia",Series A - JINCI,https://www.crunchbase.com/funding_round/jinci-series-a--9cfa936a,1,ZSVC,Early Stage Venture,ZSVC,Series A,2,10000000,CNY,1554291,,,,13000000,CNY,2005568,Yes,,http://www.kenaelectrical.com/,,Early Stage Venture,,"295,986"
2018-01-30,Xiaoxiang Youpin is an app that provides loan services.,Xiaoxiang Youpin,https://www.crunchbase.com/organization/xiaoxiang-youpin,"Financial Services, Mobile Apps","Wuxi Shi, Jiangsu, China, Asia",Series B - Xiaoxiang Youpin,https://www.crunchbase.com/funding_round/xiaoxiang-youpin-series-b--34e41278,1,Ningboda Xiexiangze Touzi Guanli Hehuo Qiye,Early Stage Venture,Ningboda Xiexiangze Touzi Guanli Hehuo Qiye,Series B,3,20000000,CNY,3163931,,,,33000000,CNY,5091263,Yes,,http://www.xiaoxiangyoupin.cn,,Early Stage Venture,,"299,363"
2018-02-08,Animation and comic IP (intellectual property) operator based in China.,TOPSHOW,https://www.crunchbase.com/organization/topshow,Animation,"Chongqing, Heilongjiang, China, Asia",Angel Round - TOPSHOW,https://www.crunchbase.com/funding_round/topshow-angel--5f6e7bd3,1,Joyceland,Seed,Joyceland,Angel,1,,,,,,,,,,Yes,,,,Seed,,"299,375"
2018-01-23,SOOGIF is an funny picture content platform provider company.,SOOGIF,https://www.crunchbase.com/organization/soogif,"Animation, Media and Entertainment, Social","Xuhui, Shanghai, China, Asia",Series B - SOOGIF,https://www.crunchbase.com/funding_round/soogif-series-b--cba6ae44,1,People's Jintai investment,Early Stage Venture,People's Jintai investment,Series B,3,20000000,CNY,3123146,,,,33000000,CNY,5034068,Yes,,https://www.soogif.com/,,Early Stage Venture,,"299,540"
2018-01-25,Dianshanghulian is a convenience store supply chain service company based in China.,Dianshanghulian,https://www.crunchbase.com/organization/dianshanghulian,"Logistics, Retail, Supply Chain Management","Beijing, Beijing, China, Asia",Series B - Dianshanghulian,https://www.crunchbase.com/funding_round/dianshanghulian-series-b--8b07f474,1,Zhenru Investment,Early Stage Venture,Zhenru Investment,Series B,1,54800000,USD,54800000,,,,54800000,USD,54800000,Yes,,http://dianshanghulian.com,,Early Stage Venture,,"299,657"
2018-02-08,"Shiji Group provides software solutions and services for the hospitality, food service, retail and entertainment industries.",Shiji Group,https://www.crunchbase.com/organization/beijing-shiji-information-technology,"Hospitality, Point of Sale, Retail Technology, Security, Software","Beijing, Beijing, China, Asia",Post-IPO Equity - Shiji Group,https://www.crunchbase.com/funding_round/beijing-shiji-information-technology-post-ipo-equity--c57e1f2f,1,Alibaba Group,,Alibaba Group,Post-IPO Equity,2,486000000,USD,486000000,793000000,USD,793000000,942910718,USD,942910718,Yes,,https://www.shijigroup.com/,$100M to $500M,IPO,,"301,287"
2017-12-29,ETC Chebao is an automobile life service application.,ETC Chebao,https://www.crunchbase.com/organization/etc-chebao,"Apps, Automotive, Mobile Apps","Guangzhou, Guangdong, China, Asia",Series A - ETC Chebao,https://www.crunchbase.com/funding_round/etc-chebao-series-a--b5a5b85a,1,Beijing Wanji Technology,Early Stage Venture,Beijing Wanji Technology,Series A,1,50040000,CNY,7694673,,,,50040000,CNY,7694673,Yes,,http://www.etcchebao.com,,Early Stage Venture,,"307,426"
2017-12-19,Hangzhou Feizhu Technology is a mobile application to learn English and create dubbed videos.,Yingyuqu Peiyin,https://www.crunchbase.com/organization/yingyuqu-peiyin,"E-Learning, Education, Language Learning","Hangzhou, Zhejiang, China, Asia",Series B - Yingyuqu Peiyin,https://www.crunchbase.com/funding_round/yingyuqu-peiyin-series-b--0942f15f,1,TAL Education Group,Early Stage Venture,TAL Education Group,Series B,5,40000000,CNY,6055010,,,,57000000,CNY,8656648,Yes,,http://qupeiyin.cn,,Early Stage Venture,,"301,359"
2018-02-11,Yixun provides art education and entertainment platform services.,Yixun,https://www.crunchbase.com/organization/yixun,"Art, Education, Media and Entertainment","Wuhan Shi, Hubei, China, Asia",Series B - Yixun,https://www.crunchbase.com/funding_round/yixun-series-b--9a503f8c,1,Huace Film & TV,Early Stage Venture,Huace Film & TV,Series B,3,20000000,CNY,3180156,,,,33000000,CNY,5211499,Yes,,http://www.yixunapp.cn/,,Early Stage Venture,,"307,497"
2018-02-07,Zhuojian Keji provides healthcare and internet products and services for medical institutions.,Zhuojian Keji,https://www.crunchbase.com/organization/zhuojian-keji,"Hardware, Health Care, Internet of Things","Hangzhou, Zhejiang, China, Asia",Series C - Zhuojian Keji,https://www.crunchbase.com/funding_round/zhuojian-keji-series-c--145ce75a,1,Weihai Qidong Rongzi Danbao Youxian Gongsi,Late Stage Venture,Weihai Qidong Rongzi Danbao Youxian Gongsi,Series C,3,30000000,CNY,4785811,,,,220000000,CNY,35417576,Yes,,http://www.zhuojianchina.com/,,Late Stage Venture,,"301,899"
2017-12-31,NoBarriers.ai is the domestic artificial intelligence head company in the field of bioelectrical signals.,NoBarriers.ai,https://www.crunchbase.com/organization/nobarriers-ai,"Artificial Intelligence (AI), Electronics, Wearables","Yuhang, Zhejiang, China, Asia",Angel Round - NoBarriers.ai,https://www.crunchbase.com/funding_round/nobarriers-ai-angel--29efa368,1,Tongmeng Touzi,Seed,Tongmeng Touzi,Angel,1,3000000,CNY,459626,,,,3000000,CNY,459626,Yes,,http://www.nuobaiai.com,,Seed,,"301,906"
2018-02-15,Shunyitong Information Technology is a developer of an online platform that provides smart parking services.,Shunyitong Information Technology,https://www.crunchbase.com/organization/shenzhen-shunyitong-information-technology-co,"Information Services, Internet","Shenzhen, Guangdong, China, Asia",Venture Round - Shunyitong Information Technology,https://www.crunchbase.com/funding_round/shenzhen-shunyitong-information-technology-co-series-unknown--78894bcc,1,Ant Group,,Ant Group,Venture - Series Unknown,1,200000000,CNY,31500528,800000000,CNY,126002111,200000000,CNY,31500528,Yes,,,,,,"301,926"
2017-12-26,Lemobar is a developer of massaging armchairs.,Lemobar,https://www.crunchbase.com/organization/lemobar,"B2C, Customer Service, Electronics, Health Care","Foochow, Fujian, China, Asia",Series A - Lemobar,https://www.crunchbase.com/funding_round/lemobar-series-a--c70a5c07,1,Co-Stone Venture Capital,Early Stage Venture,Co-Stone Venture Capital,Series A,1,50000000,CNY,7638369,,,,50000000,CNY,7638369,Yes,,http://www.lemobar.com/,$50M to $100M,Early Stage Venture,,"302,482"
2017-12-29,Xiamen Ten Points Culture Communication provides online content and marketing promotion based services.,Xiamen Ten Points Culture Communication,https://www.crunchbase.com/organization/shidiandu-shu,"Advertising, Content, Marketing","Xiamen, Fujian, China, Asia",Series B - Xiamen Ten Points Culture Communication,https://www.crunchbase.com/funding_round/shidiandu-shu-series-b--3b5d14de,1,Puhua Capital,Early Stage Venture,Puhua Capital,Series B,3,20000000,CNY,3075409,,,,83000000,CNY,12210175,Yes,,http://www.10dian.com,,Early Stage Venture,,"302,584"
2018-02-06,Home sharing platform based in Beijing.,Wand Trip,https://www.crunchbase.com/organization/wand-trip,Rental,"Beijing, Beijing, China, Asia",Angel Round - Wand Trip,https://www.crunchbase.com/funding_round/wand-trip-angel--babc2ad6,1,Alpha Startups,Seed,Alpha Startups,Angel,1,,,,,,,,,,Yes,,,,Seed,,"296,327"
2018-01-22,REMI provides personal work assistant solutions and services.,REMI,https://www.crunchbase.com/organization/remi-904e,"Employee Benefits, Information Technology, Software","Haidian, Beijing, China, Asia",Series A - REMI,https://www.crunchbase.com/funding_round/remi-904e-series-a--ebae999e,1,Plug and Play China,Early Stage Venture,Plug and Play China,Series A,2,10000000,CNY,1561231,,,,13000000,CNY,2017417,Yes,,http://www.iremi.com/,,Early Stage Venture,,"300,214"
2018-01-30,Collietech is an electronic common technical document (eCTD) software and service provider in China.,Collietech,https://www.crunchbase.com/organization/collietech,"Electronics, Information Technology, Life Science, Software","Suzhou, Jiangsu, China, Asia",Corporate Round - Collietech,https://www.crunchbase.com/funding_round/collietech-corporate-round--c8ce16e4,1,Tigermed,,Tigermed,Corporate Round,1,,,,,,,,,,Yes,,http://www.collietech.com/,,,,"300,838"
2018-01-25,Norman Biological Technology is a manufacturer of automated chemiluminescence system.,Norman Biological Technology,https://www.crunchbase.com/organization/norman-biological-technology,"Biotechnology, Manufacturing, Medical Device","Nanjing, Jiangsu, China, Asia",Series B - Norman Biological Technology,https://www.crunchbase.com/funding_round/norman-biological-technology-series-b--ca695b79,1,Yunsheng Touzi,Early Stage Venture,Yunsheng Touzi,Series B,3,20000000,CNY,3162905,,,,33000000,CNY,5076964,Yes,,http://www.nrmchina.com/,,Early Stage Venture,,"300,940"
2018-02-12,"Gogal is a software development, graphic design, web design and advertising company.",Gogal,https://www.crunchbase.com/organization/gogal,"Advertising, Graphic Design, Software, Web Design","Shenzhen, Guangdong, China, Asia",Series A - Gogal,https://www.crunchbase.com/funding_round/gogal-series-a--d601af2b,1,PurpleSky Capital,Early Stage Venture,PurpleSky Capital,Series A,2,10000000,CNY,1580353,,,,15000000,CNY,2350323,Yes,,http://www.gogal.cn/,,Early Stage Venture,,"300,946"
2018-02-05,Neocobot Technology manufactures intelligent collaborative robots and integrates cutting-edge technologies.,Neocobot Technology,https://www.crunchbase.com/organization/neocobot-technology,"Industrial, Manufacturing, Robotics","Nanshanqu, Guangdong, China, Asia",Angel Round - Neocobot Technology,https://www.crunchbase.com/funding_round/neocobot-technology-angel--0109f7b9,1,Cyzone Angel Fund,Seed,Cyzone Angel Fund,Angel,1,3000000,CNY,476887,,,,3000000,CNY,476887,Yes,,http://www.neocobot.com/,,Seed,,"296,839"
2018-01-17,Homycloud is a product trademark company.,Homycloud,https://www.crunchbase.com/organization/homycloud,"Artificial Intelligence (AI), Big Data, Hardware, Smart Home","Suzhou, Jiangsu, China, Asia",Series A - Homycloud,https://www.crunchbase.com/funding_round/homycloud-series-a--6fec6d35,1,"Baili Touzi Guanli Zixun (Shanghai) Co., Ltd.",Early Stage Venture,"Baili Touzi Guanli Zixun (Shanghai) Co., Ltd.",Series A,2,10000000,CNY,1554291,,,,13000000,CNY,2017375,Yes,,http://www.homycloud.com,,Early Stage Venture,,"296,868"
2018-02-06,Camelia isa fashion and lifestyle content platform.,Camelia,https://www.crunchbase.com/organization/camelia,E-Commerce,"Beijing, Beijing, China, Asia",Series A - Camelia,https://www.crunchbase.com/funding_round/camelia-series-a--26b83454,1,Tencent,Early Stage Venture,Tencent,Series A,1,,,,,,,,,,Yes,,http://www.hicamelia.com/,,Early Stage Venture,,"300,973"
2018-01-29,AICHAIN is a public chain that is specially designed as a blockchain infrastructure for AI applications.,AICHAIN,https://www.crunchbase.com/organization/aichain,"Apps, Artificial Intelligence (AI), Blockchain","Hangzhou, Zhejiang, China, Asia",Corporate Round - AICHAIN,https://www.crunchbase.com/funding_round/aichain-corporate-round--a1630d98,1,Viking Capital,,Viking Capital,Corporate Round,1,,,,,,,,,,Yes,,http://www.aichain.me,,,,"301,081"
2018-02-02,NEWSUN is a manufacturer of children's toy products.,NEWSUN,https://www.crunchbase.com/organization/newsun,"Children, Consumer, Toys","Xiamen, Fujian, China, Asia",Post-IPO Equity - NEWSUN,https://www.crunchbase.com/funding_round/newsun-post-ipo-equity--97b844f1,1,Xingzheng Venture Capital,,Xingzheng Venture Capital,Post-IPO Equity,1,3000000,CNY,475949,,,,3000000,CNY,475949,Yes,,http://www.newsunglobal.com/,,IPO,,"297,229"
2018-01-01,HGT is the provider of smart city and basic mapping service in Hubei Province.,HGT,https://www.crunchbase.com/organization/hgt,"Customer Service, Information Services, Smart Cities","Wuhan, Hubei, China, Asia",Series B - HGT,https://www.crunchbase.com/funding_round/hgt-series-b--cda91660,1,Wuhan Yingzhiyuan Technology Development,Early Stage Venture,Wuhan Yingzhiyuan Technology Development,Series B,3,20000000,CNY,3067085,,,,33000000,CNY,5045041,Yes,,https://www.dx-tech.com/,,Early Stage Venture,,"303,361"
2018-01-22,Geek Morning Star provides programming education services for children.,Geek Morning Star,https://www.crunchbase.com/organization/geek-8,"EdTech, Education, Internet","Beijing, Beijing, China, Asia",Series A - Geek Morning Star,https://www.crunchbase.com/funding_round/geek-8-series-a--f7abf5f9,1,New Oriental Education & Technology Group,Early Stage Venture,New Oriental Education & Technology Group,Series A,1,3100000,USD,3100000,,,,3100000,USD,3100000,Yes,,https://www.geek-8.com/index.html,,Early Stage Venture,,"303,376"
2018-01-02,"GUANGZHOU START TO SAIL INDUSTRIAL ROBOT CO.,LTD is an industrial robot manufacturing company.","GUANGZHOU START TO SAIL INDUSTRIAL ROBOT CO.,LTD",https://www.crunchbase.com/organization/guangzhou-start-to-sail-industrial-robot-co-ltd,"Industrial, Manufacturing, Robotics","Guangzhou, Guangdong, China, Asia","Series B - GUANGZHOU START TO SAIL INDUSTRIAL ROBOT CO.,LTD",https://www.crunchbase.com/funding_round/guangzhou-start-to-sail-industrial-robot-co-ltd-series-b--07ea0839,1,Guangzhou Finance Holdings,Early Stage Venture,Guangzhou Finance Holdings,Series B,3,20000000,CNY,3079979,,,,33000000,CNY,5043430,Yes,,http://www.stsrobot.com/,,Early Stage Venture,,"309,358"
