2018-01-29,WeGene is a genetic testing and personalized healthcare service provider company.,WeGene,https://www.crunchbase.com/organization/wegene,"Biotechnology, Database, Genetics, Health Care","Shenzhen, Guangdong, China, Asia",Series B - WeGene,https://www.crunchbase.com/funding_round/wegene-series-b--315eec11,7,"Bioclub, Fengji Touzi, Hangzhou Fuzhuo Investment Management, Huada Yixue, Lanse Caihong Keji, Puhua Capital, Zhuojia Huizhi Chuangtou",Early Stage Venture,,Series B,3,20000000,CNY,3156073,,,,43000000,CNY,6785847,Yes,,https://www.wegene.com,,Early Stage Venture,,"379,881"
2017-12-21,Jiaanpei operates as an integrated auto service platform.,Jiaanpei,https://www.crunchbase.com/organization/jiaanpei-com,"Auto Insurance, Insurance","Beijing, Beijing, China, Asia",Venture Round - Jiaanpei,https://www.crunchbase.com/funding_round/jiaanpei-com-series-unknown--1b32f9b2,7,"China Minsheng Investment Group, CPE, Grey Tile Capital, Jingyou Group, PICC Financial Services, PICC Property and Casualty, YTO Express",,,Venture - Series Unknown,1,60000000,USD,60000000,,,,60000000,USD,60000000,Yes,,https://cas.jiaanpei.com/cas/login?service=http%3A%2F%2Fwww.jiaanpei.com%2F,,,,"380,078"
2018-01-10,"Black Fish is a consumer finance platform that offers financial service like consumer loans, installment and wealth management facilities.",Black Fish,https://www.crunchbase.com/organization/black-fish,"Consumer, Credit, Financial Services, FinTech, Payments","Nanjing, Jiangsu, China, Asia",Series A - Black Fish,https://www.crunchbase.com/funding_round/black-fish-series-a--028601b0,6,"5Y Capital, Fullcent Capital, Gobi Partners, JAFCO Asia, Lightspeed China Partners, Tao Zhang",Early Stage Venture,,Series A,2,145000000,USD,145000000,,,,195000000,USD,195000000,Yes,,https://www.blackfish.cn,,Early Stage Venture,2,"380,131"
2018-01-01,"Huahui Health engages in the R&D of innovative drugs for digestive diseases such as hepatitis B, liver cancer, and pancreatic cancer.",Huahui Health,https://www.crunchbase.com/organization/huahui-health,"Biotechnology, Health Care, Pharmaceutical","Changping, Beijing, China, Asia",Venture Round - Huahui Health,https://www.crunchbase.com/funding_round/huahui-health-series-unknown--5c268762,1,Zhongcai Financial Holding Investment,,,Venture - Series Unknown,1,,,,,,,,,,Yes,,https://www.huahuihealth.com,,,,"380,199"
2018-01-01,Shijia Investment Management is a technology company focusing on industry 4.0 intelligent manufacturing and R&D and optometry development.,Shijia Investment Management,https://www.crunchbase.com/organization/shijia-investment-management,"Consulting, Information Technology, Manufacturing","Shanghai, Shanghai, China, Asia",Venture Round - Shijia Investment Management,https://www.crunchbase.com/funding_round/shijia-investment-management-series-unknown--d80d3409,1,PreIPO,,,Venture - Series Unknown,1,,,,,,,,,,Yes,,,,,,"380,204"
2018-01-23,World Telecom Satellite is a communications company that engages in the manufacturing and operation of broadband satellite networks.,World Telecom Satellite,https://www.crunchbase.com/organization/world-telecom-satellite,"Information and Communications Technology (ICT), Manufacturing, Satellite Communication","Beijing, Beijing, China, Asia",Angel Round - World Telecom Satellite,https://www.crunchbase.com/funding_round/world-telecom-satellite-angel--b52bc138,3,"Beijing Qianyi Investment Center, Unicom Venture Capital, Zhejiang Jihui Industrial",Seed,,Angel,1,3000000,CNY,468472,,,,3000000,CNY,468472,Yes,,http://www.wotelsat.com/,,Seed,,"380,374"
2018-02-01,Masha Ma is a signature line of a Chinese fashion designer Masha Ma.,Masha Ma,https://www.crunchbase.com/organization/masha-ma,"Consumer Goods, Fashion, Shopping","Beijing, Beijing, China, Asia",Series B - Masha Ma,https://www.crunchbase.com/funding_round/masha-ma-series-b--c07f8dbd,3,"SU&Partners, Vertex Ventures, Vertex Ventures China",Early Stage Venture,,Series B,2,40000000,USD,40000000,,,,40980000,USD,40980000,Yes,,http://www.masha-ma.com/,,Early Stage Venture,,"380,355"
2017-12-19,NRadio is a wireless communication technology service company.,NRadio,https://www.crunchbase.com/organization/nradio,"Internet, Telecommunications, Wireless","Baoan, Guangdong, China, Asia",Angel Round - NRadio,https://www.crunchbase.com/funding_round/nradio-angel--5b4cab24,3,"Enlightenment Capital, Everest Venture Capital, Ningbo Meishan Baoshui Gangqu Mingzhe Touzi Hehuo Qiye",Seed,,Angel,1,20000000,CNY,3027505,,,,20000000,CNY,3027505,Yes,,https://www.nradiowifi.com/,,Seed,,"380,459"
2018-01-11,Rhind Data is a financial data platform.,En-cow (Rhind Data),https://www.crunchbase.com/organization/rhind-data,"Data Center, Financial Services, Software","Xuhui, Shanghai, China, Asia",Seed Round - En-cow (Rhind Data),https://www.crunchbase.com/funding_round/rhind-data-seed--da4ab255,3,"CCINT, Ether Capital, Plum Ventures",Seed,,Seed,1,,,,,,,,,,Yes,,http://www.xiniudata.com/,,Seed,,"380,507"
2018-01-24,Flyingwings engages in the robot service industry.,Flyingwings,https://www.crunchbase.com/organization/flyingwings,"Information Technology, Robotics, Service Industry","Jinqiao, Shanghai, China, Asia",Series A - Flyingwings,https://www.crunchbase.com/funding_round/flyingwings-series-a--8cd07368,3,"Beijing Qingpeng Huayou Investment Management, Huirun Dongfang Touzi Jijin, Keming Shiye Touzi",Early Stage Venture,,Series A,2,10000000,CNY,1569834,,,,13000000,CNY,2025832,Yes,,http://www.flyingwings.cn/,$1M to $10M,Early Stage Venture,,"380,588"
2017-12-22,ycpai.com provides financial services for connecting entrepreneurs on the web.,ycpai.com,https://www.crunchbase.com/organization/ycpai-com,"Communities, Financial Services, Internet","Haidian, Beijing, China, Asia",Series B - ycpai.com,https://www.crunchbase.com/funding_round/ycpai-com-series-b--809a2856,3,"7k7k.com, Autobot Capital Partners, Elex Technology",Early Stage Venture,,Series B,4,20000100,CNY,3041748,,,,7294592,USD,7294592,Yes,,https://www.ycpai.com/,,Early Stage Venture,,"380,823"
2017-12-26,Athena Eye is an artificial intelligence platform that offers face recognition and finger vein recognition.,Athena Eye,https://www.crunchbase.com/organization/athena-eye,"Artificial Intelligence (AI), Biometrics, Security","Xiangtan, Hunan, China, Asia",Post-IPO Equity - Athena Eye,https://www.crunchbase.com/funding_round/athena-eye-post-ipo-equity--57502784,3,"Hunan Honggao Gaoke Touzi Guanli Co., Ltd., Jundu Investment, Xu’s Investment",,,Post-IPO Equity,4,65000000,CNY,9929880,,,,132000000,CNY,20468211,Yes,,http://www.a-eye.cn,$1M to $10M,IPO,,"380,906"
2018-01-12,Yixian Wang is an e-commerce platform for food products and dairy products.,Yixian Wang,https://www.crunchbase.com/organization/yixian-wang,"E-Commerce, Food and Beverage, Food Delivery","Haidian, Beijing, China, Asia",Series A - Yixian Wang,https://www.crunchbase.com/funding_round/yixian-wang-series-a--ec52cca3,3,"Al-Sadiq, Lingshi Touzi, TusStar",Early Stage Venture,,Series A,2,10000000,CNY,1549755,,,,13000000,CNY,1985592,Yes,,http://www.ehalfresh.com,Less than $1M,Early Stage Venture,,"380,949"
2018-01-04,Juice Inn is a fresh juice brand.,Juice Inn,https://www.crunchbase.com/organization/juice-inn,"Food and Beverage, Food Processing","Shanghai, Shanghai, China, Asia",Series A - Juice Inn,https://www.crunchbase.com/funding_round/juice-inn-series-a--441889ed,3,"Charisma Partners, ELEME, Juewei Food",Early Stage Venture,,Series A,1,2800000,USD,2800000,,,,2800000,USD,2800000,Yes,,http://www.happyligo.com,$10M to $50M,Early Stage Venture,,"381,252"
2018-02-05,Pennon is a provider of overseas education consulting and services.,Pennon,https://www.crunchbase.com/organization/pennon,"Education, Higher Education, Information Services, Training, Travel","Qingdao Shi, Shandong, China, Asia",Post-IPO Equity - Pennon,https://www.crunchbase.com/funding_round/pennon-post-ipo-equity--0ebdcccd,3,"Blue Lake Capital, Haier Capital, Yongwan Guoan Jijin",,,Post-IPO Equity,1,30000000,CNY,4768869,,,,30000000,CNY,4768869,Yes,,https://www.pennon.com.cn/,,IPO,,"381,330"
2017-12-31,"ZYBC engages in the materials testing, evaluation & certification, and technical advisory services for traditional Chinese medicine.",ZYBC,https://www.crunchbase.com/organization/zybc,"Advice, Medical, Test and Measurement","Beijing, Beijing, China, Asia",Series A - ZYBC,https://www.crunchbase.com/funding_round/zybc-series-a--2a0ee4a1,3,"Chinese Academy of Medical Sciences, Jinshi Investment, Kangmei Pharmaceutical",Early Stage Venture,,Series A,2,10000000,CNY,1532086,,,,13000000,CNY,1989316,Yes,,http://zybc-bj.com,,Early Stage Venture,,"382,165"
2018-01-06,Finance,Innolife,https://www.crunchbase.com/organization/innolife-f730,,"Beijing, Beijing, China, Asia",Series A - Innolife,https://www.crunchbase.com/funding_round/innolife-f730-series-a--4c940060,3,"IDG Capital, Lingfeng Capital, Morningside Capital",Early Stage Venture,,Series A,2,,,,,,,19000000,CNY,2851173,Yes,,http://www.innolife.cc,$1M to $10M,Early Stage Venture,,"382,220"
2017-12-18,Cosber is a manufacturer of automotive testing products.,Cosber,https://www.crunchbase.com/organization/cosber,"Automotive, Manufacturing, Sales","Nanshanqu, Guangdong, China, Asia",Series A - Cosber,https://www.crunchbase.com/funding_round/cosber-series-a--b2a4f2b5,3,"Galaxy Holding Group, Jingji Capital Management, Shenzhen Guozhong Venture Capital Management",Early Stage Venture,,Series A,2,9900000,CNY,1496435,,,,29900000,CNY,4563374,Yes,,http://www.cosber.com/,,Early Stage Venture,,"382,233"
2017-12-31,OCT is a commercial real estate operations management service provider company.,OCT,https://www.crunchbase.com/organization/oct-bcc9,"Commercial Real Estate, Construction, Real Estate","Beijing, Beijing, China, Asia",Angel Round - OCT,https://www.crunchbase.com/funding_round/oct-bcc9-angel--a37b1310,3,"GSUM Fund Management, Huaqiaocheng Ziben, Wangfujing Mall",Seed,,Angel,1,3000000,CNY,459626,,,,3000000,CNY,459626,Yes,,http://www.octcmc.com/,,Seed,,"381,895"
2018-02-07,99 Interaction Entertainment is a marketing company that provides online and offline communication services.,99 Interaction Entertainment,https://www.crunchbase.com/organization/99-interaction-entertainment,"Advertising, Customer Service, Marketing, Public Relations","Beijing, Beijing, China, Asia",Post-IPO Equity - 99 Interaction Entertainment,https://www.crunchbase.com/funding_round/99-interaction-entertainment-post-ipo-equity--593394d7,3,"GF Qianhe Investment, THG Ventures, Zhengda Tongyuan",,,Post-IPO Equity,3,16420000,CNY,2619434,,,,29420000,CNY,4570236,Yes,,http://www.99ntc.com/,,IPO,,"381,991"
2018-01-12,Yilan is a video platform that uses advanced artificial intelligence technology to process and analyze video content.,Yilan,https://www.crunchbase.com/organization/yilan,"Artificial Intelligence (AI), Machine Learning, Video","Beijing, Beijing, China, Asia",Seed Round - Yilan,https://www.crunchbase.com/funding_round/yilan-seed--c34268a2,3,"IDG Capital, Kinzon Capital, Tianzhihe Investment",Seed,,Seed,1,1000000,CNY,154976,,,,1000000,CNY,154976,Yes,,http://www.yilan.tv/,,Seed,,"382,012"
2017-12-26,Toyone is a 3D printing service provider company.,Toyone,https://www.crunchbase.com/organization/toyone,"3D Printing, Hardware, Product Design","Hangzhou, Zhejiang, China, Asia",Angel Round - Toyone,https://www.crunchbase.com/funding_round/toyone-angel--39fe599f,3,"Dedibot, Hangzhou Ruide Design, Pera Global",Seed,,Angel,1,3000000,CNY,458302,,,,3000000,CNY,458302,Yes,,http://www.toyone.com.cn,,Seed,,"382,851"
2018-01-08,Wang Zifan is a natural dog food manufacturing company.,Wang Zifan,https://www.crunchbase.com/organization/wang-zifan,"Animal Feed, Manufacturing, Pet","Jingan, Shanghai, China, Asia",Series A - Wang Zifan,https://www.crunchbase.com/funding_round/wang-zifan-series-a--4a138d22,3,"Cheng Li, Qianhai Fund of Funds, Qiyi Capital",Early Stage Venture,,Series A,2,20000000,CNY,3077752,,,,25000000,CNY,3812021,Yes,,https://www.wangzaifan.com/,,Early Stage Venture,,"383,205"
2017-12-31,SourceCode is a smart doors and windows maker company.,SourceCode,https://www.crunchbase.com/organization/sourcecode,"Hardware, Internet of Things, Smart Home","Beijing, Beijing, China, Asia",Series A - SourceCode,https://www.crunchbase.com/funding_round/sourcecode-series-a--12d6572b,3,"Donglin Ziben, Gaorong Capital, Tsing Ventures",Early Stage Venture,,Series A,3,20000000,CNY,3064171,,,,26000000,CNY,3995187,Yes,,http://www.chinasourcecode.cn/,,Early Stage Venture,,"383,217"
2018-02-04,3D THX is a one-stop intelligent manufacturing service provider.,3D THX,https://www.crunchbase.com/organization/3d-thx,"Big Data, Hardware, Manufacturing","Hangzhou, Zhejiang, China, Asia",Angel Round - 3D THX,https://www.crunchbase.com/funding_round/3d-thx-angel--984a2bf4,3,"Jinkong Capital, Lingdu Capital, Wuhan Huibo Yongdao Chuangtou",Seed,,Angel,1,3000000,CNY,475496,,,,3000000,CNY,475496,Yes,,https://www.3dthx.com/,,Seed,,"383,376"
2017-12-20,HIGH STORE TECH is a provider of cross-border third-party warehousing services.,HIGH STORE TECH,https://www.crunchbase.com/organization/high-store-tech,"Retail, Supply Chain Management, Warehousing","Hangzhou, Zhejiang, China, Asia",Series A - HIGH STORE TECH,https://www.crunchbase.com/funding_round/high-store-tech-series-a--ca5094ef,3,"Informrack, Liyuan Venture Capital, Yunda Express",Early Stage Venture,,Series A,2,10000000,CNY,1519526,,,,13000000,CNY,1970286,Yes,,http://www.highstore.cn,,Early Stage Venture,,"383,384"
2018-01-01,Proton is a provider of mobile medical health products and solutions.,Proton,https://www.crunchbase.com/organization/proton-ccfc,"Health Care, Medical, Mobile","Hangzhou, Zhejiang, China, Asia",Series A - Proton,https://www.crunchbase.com/funding_round/proton-ccfc-series-a--99ca5ed6,3,"BANGSHI CAPITAL, Hangzhou Qikai Touzi, Zhejiang Yimu Chengyang Touzi",Early Stage Venture,,Series A,2,10000000,CNY,1533542,,,,20000000,CNY,3032823,Yes,,http://www.protontek.com,$1M to $10M,Early Stage Venture,,"382,617"
2017-12-28,eBaoTech is an IT company specialized in developing social insurance applications.,Ebaonet,https://www.crunchbase.com/organization/ebaonet,"Information Technology, Insurance, Social","Beijing, Beijing, China, Asia",Series A - Ebaonet,https://www.crunchbase.com/funding_round/ebaonet-series-a--07be9ce2,3,"Jinglan Investment, Kainike Zichan, Zhuoye Investment Fund Management",Early Stage Venture,,Series A,2,10000000,CNY,1530831,,,,40000000,CNY,6376511,Yes,,http://www.ebaonet.cn/,$1M to $10M,Early Stage Venture,,"382,670"
2018-02-02,Sports insurance company based in Shenzhen.,Sport Covers,https://www.crunchbase.com/organization/sport-covers,Sports,"Shenzhen, Guangdong, China, Asia",Seed Round - Sport Covers,https://www.crunchbase.com/funding_round/sport-covers-seed--866e7e4b,3,"GreatWall Fund, Haitun Baobao, Kangyuan Huiying",Seed,,Seed,2,,,,,,,,,,Yes,,http://www.sport-covers.com/,,Seed,,"382,780"
2018-01-30,ZKS provides internet of things solutions to the medical industry.,ZKS,https://www.crunchbase.com/organization/zks,"Health Care, Internet of Things, Medical","Shenzhen, Guangdong, China, Asia",Series A - ZKS,https://www.crunchbase.com/funding_round/zks-series-a--3322e3ff,3,"Jialin Group, Jianronghe Touzi, Shenzhen Qianhai Jianrong Jijin Guanli Youxian Gongsi",Early Stage Venture,,Series A,2,10000000,CNY,1581966,,,,13000000,CNY,2045205,Yes,,http://www.zksiot.com/,,Early Stage Venture,,"383,463"
2018-02-08,"Artificial Intelligence API marketplace where developers, suppliers and buyers access & develop  A.I. in a trusted collaborative environment",ATN.io,https://www.crunchbase.com/organization/atn-io,"Artificial Intelligence (AI), Blockchain, Developer APIs, Enterprise Applications, Marketplace, Open Source","Shanghai, Shanghai, China, Asia",Corporate Round - ATN.io,https://www.crunchbase.com/funding_round/atn-io-corporate-round--f658bd29,3,"Dream Chaser Capital, Longqing Investment, Waterdrip Capital",,,Corporate Round,1,10000000,USD,10000000,,,,10000000,USD,10000000,Yes,,http://atn.io,$1M to $10M,,,"383,669"
2018-01-02,Mogoroom is an O2O apartment rental platform that offers standardized apartments for young professionals.,Mogoroom,https://www.crunchbase.com/organization/mogoroom,"Internet, Property Management, Real Estate, Rental","Shanghai, Shanghai, China, Asia",Series C - Mogoroom,https://www.crunchbase.com/funding_round/mogoroom-series-c--3a2ed804,3,"Ant Group, Giant Network, YF Capital",Late Stage Venture,,Series C,4,30000000,USD,30000000,,,,85000000,USD,85000000,Yes,,http://www.mogoroom.com/,$1M to $10M,Late Stage Venture,,"383,722"
2017-12-20,KungFu Animation Group provides training and education in the animation field.,KungFu Animation Group,https://www.crunchbase.com/organization/kungfu-animation-group,"Animation, Education, Training","Quanzhou, Fujian, China, Asia",Series E - KungFu Animation Group,https://www.crunchbase.com/funding_round/kungfu-animation-group-series-e--de9b38c5,3,"Chuang, Cloud Ventures, Powise Wealth Mgt.",Late Stage Venture,,Series E,6,50000000,CNY,7597630,,,,163000000,CNY,24485873,Yes,,http://www.kfdm.cn/,,Late Stage Venture,,"383,910"
2018-01-01,Honeycomb is a DIY robot electronic building block construction and STEAM education learning platform,Honeycomb,https://www.crunchbase.com/organization/honeycomb-6e0f,"Education, Robotics, STEM Education","Longhua, Guangdong, China, Asia",Angel Round - Honeycomb,https://www.crunchbase.com/funding_round/honeycomb-6e0f-angel--d29e68ae,3,"GD Guangda Group, Innohub Capital, Shenzhen Investment",Seed,,Angel,2,10000000,CNY,1533542,,,,11000000,CNY,1678402,Yes,,https://www.honeycombkits.com.cn,$1M to $10M,Seed,,"383,939"
2018-01-09,New Flow Technology is a big data company that mainly serves the financial industry.,New Flow Technology,https://www.crunchbase.com/organization/new-flow-technology,"Big Data, Financial Services, FinTech, Software","Beijing, Beijing, China, Asia",Series A - New Flow Technology,https://www.crunchbase.com/funding_round/new-flow-technology-series-a--6776cd8c,3,"360 Capital, PICC Capital Investment Management, SBCVC",Early Stage Venture,,Series A,1,18000000,USD,18000000,,,,18000000,USD,18000000,Yes,,http://www.nflow.cn/,,Early Stage Venture,,"384,167"
2018-01-01,RightKnights is an anti-plagiarism copyright protection activity initiated by media authors.,RightKnights,https://www.crunchbase.com/organization/rightknights,,"Hangzhou, Zhejiang, China, Asia",Venture Round - RightKnights,https://www.crunchbase.com/funding_round/rightknights-series-unknown--3ed3c73f,1,Edge Ventures,,,Venture - Series Unknown,1,,,,,,,,,,Yes,,https://www.rightknights.com/,,,,"384,365"
2018-01-01,"Perfect World Animation engages in the creation, production, and distribution of animation content.",Perfect World Animation,https://www.crunchbase.com/organization/perfect-world-animation,"Animation, Content, Creative Agency, Media and Entertainment","Beijing, Beijing, China, Asia",Venture Round - Perfect World Animation,https://www.crunchbase.com/funding_round/perfect-world-animation-series-unknown--6b79f643,1,Share Capital,,,Venture - Series Unknown,1,,,,,,,,,,Yes,,https://animation.games.wanmei.com,,,,"384,375"
2018-01-01,Qianji Intelligent Technology is a technology-based company engaged in the R&D of intelligent manufacturing software in the aerospace field.,Suzhou Qianji Intelligent Technology,https://www.crunchbase.com/organization/suzhou-qianji-intelligent-technology,"Aerospace, Manufacturing, Software","Suzhou, Jiangsu, China, Asia",Venture Round - Suzhou Qianji Intelligent Technology,https://www.crunchbase.com/funding_round/suzhou-qianji-intelligent-technology-series-unknown--1fe3f715,1,Vangoo Investment Partners,,,Venture - Series Unknown,1,,,,,,,,,,Yes,,http://qianjizn.com/,,,,"384,376"
2018-01-01,"YXgene is a Pharmaceutical company for development of virus vectors, preclinical studies and investigational new drug application",YXgene,https://www.crunchbase.com/organization/yxgene,"Manufacturing, Pharmaceutical","Shenzhen, Guangdong, China, Asia",Venture Round - YXgene,https://www.crunchbase.com/funding_round/yxgene-series-unknown--0014dd67,2,"BioVenture, Eastern Link Capital",,,Venture - Series Unknown,1,,,,,,,,,,Yes,,https://yxgene.com/en/,,,,"384,379"
2018-02-11,Wingspan provides medical imaging solutions.,Wingspan,https://www.crunchbase.com/organization/wingspan-fb3e,"Artificial Intelligence (AI), Biotechnology, Health Care, Medical","Beijing, Beijing, China, Asia",Series C - Wingspan,https://www.crunchbase.com/funding_round/wingspan-fb3e-series-c--b4928ad2,2,"Lang Sheng Investment, Shenzhenshi Huaxia Dexin Jijin Guanli Youxian Gongsi",Late Stage Venture,,Series C,3,30000000,CNY,4770234,,,,27770234,USD,27770234,Yes,,http://www.wingspan.cn/,,Late Stage Venture,,"384,574"
2018-01-01,"Mazo Tech is an OEM/ODM company with its own technology, product patents, and R&D ability.",Mazo Tech,https://www.crunchbase.com/organization/mazo-tech,"Industrial, Industrial Manufacturing, Machinery Manufacturing","Kunshan, Anhui, China, Asia",Venture Round - Mazo Tech,https://www.crunchbase.com/funding_round/mazo-tech-series-unknown--8b11cc69,1,Jade Capital,,,Venture - Series Unknown,1,,,,,,,,,,Yes,,http://www.mazotech.com/,,,,"384,590"
2018-02-05,GLS Fintech involves in developing a cross-boarder supply chain financing platform and associated risk management solutions.,Global Local Service,https://www.crunchbase.com/organization/global-local-service,"Financial Services, FinTech, Supply Chain Management","Nanshanqu, Guangdong, China, Asia",Seed Round - Global Local Service,https://www.crunchbase.com/funding_round/global-local-service-seed--29b116fa,1,Shenzhen Forms Syntron Information,Seed,Shenzhen Forms Syntron Information,Seed,2,10469565,CNY,1664266,120000000,CNY,19075475,13469565,CNY,2142777,Yes,,http://www.glsfintech.com,,Seed,,"384,654"
2018-01-01,Harvest Capital Management is a fund management company that engages in special asset management business.,Harvest Capital Management,https://www.crunchbase.com/organization/harvest-capital-management,"Asset Management, Financial Services","Beijing, Beijing, China, Asia",Private Equity Round - Harvest Capital Management,https://www.crunchbase.com/funding_round/harvest-capital-management-private-equity--8e10981a,1,Hongtai Capital Holdings,Private Equity,Hongtai Capital Holdings,Private Equity,2,480000000,USD,480000000,,,,1280000000,USD,1280000000,Yes,,https://www.harvestcm.com/,,,,"384,880"
2018-01-16,"Jinjiang Electronics is a med-tech company, engaged in the R&D and manufacture of medical equipment like cardiac electrophysiology.",Jinjiang Electronics,https://www.crunchbase.com/organization/jinjiang-electronics,Manufacturing,"Chengdu, Sichuan, China, Asia",Corporate Round - Jinjiang Electronics,https://www.crunchbase.com/funding_round/jinjiang-electronics-corporate-round--8346b884,1,Shenzhen Salubris Pharmaceuticals,,Shenzhen Salubris Pharmaceuticals,Corporate Round,3,,,,,,,700000000,CNY,102206194,Yes,,http://www.jjet.cn/,,Early Stage Venture,,"385,941"
2018-02-06,Uni-Ubi is an AI and IoT solutions provider for smart cities.,Uni-Ubi,https://www.crunchbase.com/organization/uni-ubi,"Artificial Intelligence (AI), Robotics","Hangzhou, Zhejiang, China, Asia",Series A - Uni-Ubi,https://www.crunchbase.com/funding_round/uni-ubi-series-a--f9394b5c,1,Puhua Capital,Early Stage Venture,Puhua Capital,Series A,7,,,,,,,99887850,USD,99887850,Yes,,http://www.uni-ubi.com/,$1M to $10M,Late Stage Venture,,"389,862"
2017-12-19,Ingrem is a computer cockpit manufacturing company.,Ingrem,https://www.crunchbase.com/organization/ingrem,"Computer, Gaming, Manufacturing","Minhang, Shanghai, China, Asia",Series A - Ingrem,https://www.crunchbase.com/funding_round/ingrem-series-a--88c7ac11,1,Huaqi Capital,Early Stage Venture,Huaqi Capital,Series A,2,10000000,CNY,1513752,,,,30000000,CNY,4673509,Yes,,http://www.ingrem.com/,$1M to $10M,Early Stage Venture,,"397,621"
2018-02-03,Yixiaoshi Kuaixiu is a one-hour phone service chain and intelligent terminal platform.,Yixiaoshi Kuaixiu,https://www.crunchbase.com/organization/yixiaoshi-kuaixiu,"Consumer, Mobile, Retail, Service Industry, Software","Guangzhou, Guangdong, China, Asia",Series A - Yixiaoshi Kuaixiu,https://www.crunchbase.com/funding_round/yixiaoshi-kuaixiu-series-a--d968185b,1,GF Securities,Early Stage Venture,GF Securities,Series A,4,3000000,JPY,27247,,,,18838347,USD,18838347,Yes,,https://join.01hour.com/,,Early Stage Venture,,"398,151"
2018-01-01,"Siwei Zongheng is a hyper-converged time-series database that can realize real-time data query, analysis and systems in various scenarios.",Siwei Zongheng,https://www.crunchbase.com/organization/siwei-zongheng,"Analytics, Data Storage, Database","Haidian, Beijing, China, Asia",Angel Round - Siwei Zongheng,https://www.crunchbase.com/funding_round/siwei-zongheng-angel--993a56d5,1,GSR United Capital,Seed,GSR United Capital,Angel,3,3000000,CNY,460063,,,,203000000,CNY,29790190,Yes,,https://www.ymatrix.cn,,Early Stage Venture,,"398,745"
2018-01-23,FXiaoKe is a Chinese provider of mobile management software for sales teams.,FXiaoKe,https://www.crunchbase.com/organization/fxiaoke-com,"Cloud Computing, CRM, Customer Service, Human Resources, Internet, SaaS, Software, Supply Chain Management","Beijing, Beijing, China, Asia",Corporate Round - FXiaoKe,https://www.crunchbase.com/funding_round/fxiaoke-com-corporate-round--4bbcc093,1,Kingdee,,Kingdee,Corporate Round,12,50000000,USD,50000000,,,,388000000,USD,388000000,Yes,,https://www.fxiaoke.com/,$10M to $50M,,,"399,398"
2018-01-08,Flow is a social application based on photo editing and sharing.,Flow,https://www.crunchbase.com/organization/flow-a81f,Software,"Beijing, Beijing, China, Asia",Seed Round - Flow,https://www.crunchbase.com/funding_round/flow-a81f-seed--dcc81265,1,Sky9 Capital,Seed,Sky9 Capital,Seed,2,,,,,,,,,,Yes,,https://www.flowsns.com/,,Early Stage Venture,,"399,700"
