Announced Date,Organization Description,Organization Name,Organization Name URL,Organization Industries,Organization Location,Transaction Name,Transaction Name URL,Number of Investors,Investor Names,Funding Stage,Lead Investors,Funding Type,Number of Funding Rounds,Money Raised,Money Raised Currency,Money Raised (in USD),Pre-Money Valuation,Pre-Money Valuation Currency,Pre-Money Valuation (in USD),Total Funding Amount,Total Funding Amount Currency,Total Funding Amount (in USD),Equity Only Funding,Diversity Spotlight,Organization Website,Organization Revenue Range,Funding Status,Number of Partner Investors,CB Rank (Funding Round)
2018-02-06,"Founded in 2009, Chinese leading eye-tracking hardware software solution company",7Invensun Technology,https://www.crunchbase.com/organization/7invensun,"Personal Health, Product Research, Virtual Reality","Haidian, Beijing, China, Asia",Series C - 7Invensun Technology,https://www.crunchbase.com/funding_round/7invensun-series-c--45de123a,5,"CAS Investment Management, Certain Capital, Hangzhou Daosheng, National SME Development Fund, ZGC Group",Late Stage Venture,"Certain Capital, National SME Development Fund",Series C,4,,,,,,,15000000,USD,15000000,Yes,,http://7invensun.com/,$10M to $50M,Late Stage Venture,,"59,169"
2018-01-18,Xiaopeng Motors is an electric vehicle and technology company that designs and manufactures intelligent mobility solutions.,Xpeng Motors,https://www.crunchbase.com/organization/xiaopeng-motors,"Automotive, Autonomous Vehicles, Electric Vehicle, Manufacturing","Guangzhou, Guangdong, China, Asia",Series B - Xpeng Motors,https://www.crunchbase.com/funding_round/xiaopeng-motors-series-b--aa35654e,9,"5Y Capital, Alibaba Group, Apoletto Managers, CICC, Foxconn Technology Group, GGV Capital, IDG Capital, Matrix Partners China, YF Capital",Early Stage Venture,"Alibaba Group, Foxconn Technology Group, IDG Capital",Series B,11,2200000000,CNY,342639100,1250000000,USD,1250000000,6408970886,USD,6408970886,Yes,,https://www.xiaopeng.com,$1B to $10B,IPO,2,"64,346"
2018-01-18,Aqrose Technology is a China-based company that applies machine vision and machine learning technology into industrial automation.,Aqrose Technology,https://www.crunchbase.com/organization/aqrose-technology,"Artificial Intelligence (AI), Industrial Automation, Machine Learning, Software","Beijing, Beijing, China, Asia",Series A - Aqrose Technology,https://www.crunchbase.com/funding_round/aqrose-technology-series-a--708fe69e,5,"Baidu Ventures, DCM Ventures, Innoangel Fund, Long Capital, Powercloud Venture Capital",Early Stage Venture,"Baidu Ventures, DCM Ventures",Series A,4,8000000,USD,8000000,,,,38000000,USD,38000000,Yes,,http://aqrose.com/,,Early Stage Venture,,"75,244"
2018-01-04,"Kingsoft Cloud is a platform for businesses and developers, providing online cloud storage and cloud distribution services.",Kingsoft Cloud,https://www.crunchbase.com/organization/kingsoft-cloud,"Cloud Computing, Cloud Infrastructure, Internet, Web Hosting","Beijing, Beijing, China, Asia",Series D - Kingsoft Cloud,https://www.crunchbase.com/funding_round/kingsoft-cloud-series-d--b0106f11,4,"Beijing Liyue Jinshi Investment Center (LP), Forebright Capital, Kingsoft, Shunwei Capital",Late Stage Venture,"Beijing Liyue Jinshi Investment Center (LP), Forebright Capital, Shunwei Capital",Series D,10,220000000,USD,220000000,1880000000,USD,1880000000,968480000,USD,968480000,Yes,,http://en.ksyun.com/,$1B to $10B,IPO,,"84,925"
2017-12-27,Global Power Technologies (GPT) is the manufacturer of Silicon Carbide third-generation semiconductors.,Global Power Technologies,https://www.crunchbase.com/organization/global-power-technologies-48a9,"Manufacturing, Semiconductor","Beijing, Beijing, China, Asia",Series B - Global Power Technologies,https://www.crunchbase.com/funding_round/global-power-technologies-48a9-series-b--765d2ae9,1,CM Venture Capital,Early Stage Venture,CM Venture Capital,Series B,4,100000000,CNY,15254483,,,,100000000,CNY,15254483,Yes,,https://globalpowertech.cn/,$1M to $10M,Late Stage Venture,,"87,882"
2018-02-07,Commsat is a low-track small satellite constellation operator based in China.,Commsat,https://www.crunchbase.com/organization/commsat,"Aerospace, Internet of Things, Satellite Communication","Beijing, Beijing, China, Asia",Series A - Commsat,https://www.crunchbase.com/funding_round/commsat-series-a--31d6ef87,4,"CAS Star, Junzi Capital Engineering, Qixi Capital, SkyChee Ventures",Early Stage Venture,"Junzi Capital Engineering, SkyChee Ventures",Series A,7,16000000,USD,16000000,,,,68420559,USD,68420559,Yes,,http://www.commsat.cn,Less than $1M,,,"112,825"
2018-02-01,Minicoffee is an internet company that develops and operates smart coffee terminal equipment for companies,Minicoffee,https://www.crunchbase.com/organization/minicoffee,"Coffee, Food and Beverage, Manufacturing","Beijing, Beijing, China, Asia",Series A - Minicoffee,https://www.crunchbase.com/funding_round/minicoffee-series-a--3a0220f5,3,"Dark Horse Ventures, Fengyun Capital, Grit Ventures",Early Stage Venture,,Series A,2,,,,,,,448000000,CNY,62865723,Yes,,https://www.xiaokacoffee.com,,Early Stage Venture,,"113,130"
2018-01-01,China Reserve National Energy is a developer of air energy storage technology.,China Reserve National Energy,https://www.crunchbase.com/organization/china-reserve-national-energy,"Energy, Energy Management, Energy Storage, Industrial","Haidian, Beijing, China, Asia",Angel Round - China Reserve National Energy,https://www.crunchbase.com/funding_round/china-reserve-national-energy-angel--201f4888,1,Huirong Deyun Investment,Seed,,Angel,2,,,,,,,1000000000,CNY,141376727,Yes,,https://www.caes.store/,,Early Stage Venture,,"113,625"
2018-01-30,Ma Shang Ying is a data technology company that provides retail measurement services for FMCG brands.,WinWin Network,https://www.crunchbase.com/organization/ma-shang-ying,"Enterprise Resource Planning (ERP), Management Consulting, Retail","Beijing, Beijing, China, Asia",Series A - WinWin Network,https://www.crunchbase.com/funding_round/ma-shang-ying-series-a--9e9ac94e,3,"58.com, Cheetah Mobile, Sinovation Ventures",Early Stage Venture,Cheetah Mobile,Series A,3,20000000,CNY,3163931,,,,23000000,CNY,3627335,Yes,,http://www.winwin-inc.com/,,Early Stage Venture,,"120,253"
2018-01-04,Aqara develops and designs hardware and software solutions for the home.,Aqara,https://www.crunchbase.com/organization/lumi-united-technology,"Home Services, Internet of Things, Smart Home, Software","Shenzhen, Guangdong, China, Asia",Series B - Aqara,https://www.crunchbase.com/funding_round/lumi-united-technology-series-b--5313c7ff,2,"Cathay Capital, Lanting Capital",Early Stage Venture,Cathay Capital,Series B,6,100000000,CNY,15398237,,,,271846242,USD,271846242,Yes,,https://www.aqara.com/en/home.html,$100M to $500M,Late Stage Venture,1,"120,398"
2017-12-29,DGene is a virtual reality solution provider.,DGene,https://www.crunchbase.com/organization/dgene-digital-technology,"Augmented Reality, Computer Vision, Virtual Reality","Shanghai, Shanghai, China, Asia",Seed Round - DGene,https://www.crunchbase.com/funding_round/dgene-digital-technology-seed--64157ee9,3,"Alibaba Group, GSR Ventures, SAIF Partners",Seed,Alibaba Group,Seed,5,,,,,,,41326887,USD,41326887,Yes,,https://www.dgene.com/,$10M to $50M,Early Stage Venture,,"120,441"
2017-12-20,LP Pharmaceuticals is a pharmaceutical company.,LP Pharmaceuticals,https://www.crunchbase.com/organization/lp-pharmaceutical,"Biopharma, Delivery, Health Care, Pharmaceutical","Xiamen, Fujian, China, Asia",Series B - LP Pharmaceuticals,https://www.crunchbase.com/funding_round/lp-pharmaceutical-series-b--50170b61,3,"CMB International Capital Corporation, SDIC Fund Management, Zhangzhou Pientzehuang Pharmaceutical",Early Stage Venture,SDIC Fund Management,Series B,3,30000000,USD,30000000,,,,102000000,USD,102000000,Yes,,http://www.lppharma.com/en/,,Late Stage Venture,,"120,348"
2018-02-05,"Data Analytics, Cash Flow Analytics, Accounting Automation, Auditing Automation",Xencio Data Technology,https://www.crunchbase.com/organization/xencio-data-technology-ltd,"Payments, Robotics","Shanghai, Shanghai, China, Asia",Angel Round - Xencio Data Technology,https://www.crunchbase.com/funding_round/xencio-data-technology-ltd-angel--8c1d89e2,1,Cloud Angel Fund,Seed,Cloud Angel Fund,Angel,4,,,,,,,25000000,CNY,3552903,Yes,,http://www.xencio.com,$1M to $10M,Early Stage Venture,1,"122,218"
2018-01-01,InDeco is a one-stop Internet space solution provider.,InDeco China,https://www.crunchbase.com/organization/indeco-china,Internet,"Beijing, Beijing, China, Asia",Series A - InDeco China,https://www.crunchbase.com/funding_round/indeco-china-series-a--d0e946e1,4,"Chaosheng Capital, Everbright, Source Code Capital, ZhenFund",Early Stage Venture,Source Code Capital,Series A,3,,,,,,,20000000,USD,20000000,Yes,,http://in-deco.com/,,Late Stage Venture,,"123,299"
2018-01-01,Fen-z Interactive is a social media marketing service provider.,Fen-z Interactive,https://www.crunchbase.com/organization/fen-z-interactive,"Advertising, Marketing, Social Media","Chaoyang, Liaoning, China, Asia",Series A - Fen-z Interactive,https://www.crunchbase.com/funding_round/fen-z-interactive-series-a--14e753a3,2,"Ruchuan Capital, Yinbaodian Chuangtou",Early Stage Venture,Yinbaodian Chuangtou,Series A,3,,,,,,,100000000,CNY,15464316,Yes,,http://www.fen-z.com/,,Early Stage Venture,,"126,329"
2017-12-27,"Suning Finance is a financial technology platform that includes wealth management, loans, insurance, and the suning card.",Suning Finance,https://www.crunchbase.com/organization/suning-finance,"Finance, Financial Services, Insurance, InsurTech","Xuanwu, Henan, China, Asia",Venture Round - Suning Finance,https://www.crunchbase.com/funding_round/suning-finance-series-unknown--3e675754,5,"Everbright-IDG Industrial Fund, GP Capital, Macrolink Group, Shenzhen Capital Group, YF Capital",,YF Capital,Venture - Series Unknown,4,5335000000,CNY,813826663,26965000000,CNY,4113371317,1860301970,USD,1860301970,Yes,,https://jinrong.suning.com/,,M&A,,"127,179"
2017-12-21,WOWJOY TECHNOLOGY is a provider of data-driven medical services.,WOWJOY TECHNOLOGY,https://www.crunchbase.com/organization/wowjoy-technology,"Health Care, Internet, Medical","Hangzhou, Zhejiang, China, Asia",Angel Round - WOWJOY TECHNOLOGY,https://www.crunchbase.com/funding_round/wowjoy-technology-angel--dfb7a604,6,"Funcity Capital, GOVTOR, Real Power Capital, Shulan Health, Shulan Junjie Capital, Zhuhai Hengqin Shuimu Zhuohua Management Consulting",Seed,,Angel,4,3000000,CNY,455415,,,,25516454,USD,25516454,Yes,,https://www.wowjoy.cn/,,Early Stage Venture,,"129,633"
2018-01-01,"Future Vision provides myopia prevention and control, amblyopia rehabilitation training, and medical optometry for children aged 3-16",Future Vision,https://www.crunchbase.com/organization/future-vision,"Eyewear, Health Care, Optical Communication","Shanghai, Shanghai, China, Asia",Venture Round - Future Vision,https://www.crunchbase.com/funding_round/future-vision-series-unknown--a8013b2b,2,"Empower Investment, Volcanics Venture",,,Venture - Series Unknown,2,,,,,,,,,,Yes,,http://www.wleye.com/,,Early Stage Venture,,"147,377"
2018-02-14,"JD Logistics is a supply chain solutions provider focused on warehousing, express, oversized, cold chain, and cross-border services.",JD Logistics,https://www.crunchbase.com/organization/jd-logistics,"Delivery Service, Logistics, Supply Chain Management","Beijing, Beijing, China, Asia",Venture Round - JD Logistics,https://www.crunchbase.com/funding_round/jd-logistics-series-unknown--bb3bc592,12,"China Development Bank Capital, China Life Insurance, China Merchants Group, China Structural Reform Fund, Hillhouse Investment, HSG, ICBC International, InnoVision Capital, K11 Investment, K3 Ventures, Kunyan Capital, Tencent",,,Venture - Series Unknown,3,2500000000,USD,2500000000,11000000000,USD,11000000000,3590000000,USD,3590000000,Yes,,https://www.jdl.com,$10B+,IPO,1,"147,464"
2018-01-01,Beijing Institute of Technology Genshu Technology is focused on transformation and industrialization of aerospace biomedical science.,Beijing Institute of Technology Genshu Technology,https://www.crunchbase.com/organization/beijing-institute-of-technology-genshu-technology,Aerospace,"Beijing, Beijing, China, Asia",Venture Round - Beijing Institute of Technology Genshu Technology,https://www.crunchbase.com/funding_round/beijing-institute-of-technology-genshu-technology-series-unknown--e28ff58f,1,Beijing Capital Science and Technology Development Group,,,Venture - Series Unknown,3,,,,,,,,,,Yes,,https://www.lggs.tech/,,Early Stage Venture,,"158,060"
2018-01-01,"AIWAYS is a manufacturer of smart electric car, based in Shanghai.",AIWAYS,https://www.crunchbase.com/organization/aiways,"Artificial Intelligence (AI), Automotive, Electric Vehicle, Manufacturing","Shanghai, Shanghai, China, Asia",Series A - AIWAYS,https://www.crunchbase.com/funding_round/aiways-series-a--163a80b4,1,CCI Holdings,Early Stage Venture,,Series A,7,2000000000,CNY,306708481,,,,5200000000,CNY,791729484,Yes,,https://www.ai-ways.com/,Less than $1M,,,"158,131"
2018-01-01,"Viablife Biotech provides synthetic biology, research, development, production, and application services in the biotechnology industry.",Viablife Biotech,https://www.crunchbase.com/organization/viablife-biotech,"Biopharma, Biotechnology, Life Science, Manufacturing","Hangzhou, Zhejiang, China, Asia",Venture Round - Viablife Biotech,https://www.crunchbase.com/funding_round/viablife-biotech-series-unknown--03751c4f,1,Shulan Junjie Capital,,,Venture - Series Unknown,2,,,,,,,,,,Yes,,https://www.viablife.com/,,,,"159,247"
2018-01-01,Fourier focuses on the development and design of digital-analog hybrid chips.,Fourier,https://www.crunchbase.com/organization/fourier-3917,"Application Specific Integrated Circuit (ASIC), Audio, Semiconductor","Xuhui, Shanghai, China, Asia",Seed Round - Fourier,https://www.crunchbase.com/funding_round/fourier-3917-seed--4b96df7b,1,Compound Interest Huitong,Seed,,Seed,2,,,,,,,,,,Yes,,https://www.foursemi.com,,Late Stage Venture,,"159,267"
2018-01-01,Provider of gene sequencing and detection solutions used in cancer research and treatment.,Geneplus-Beijing Co. Ltd.,https://www.crunchbase.com/organization/geneplus-beijing-co-ltd,"Biotechnology, Health Diagnostics, Oncology","Huakang, Anhui, China, Asia",Venture Round - Geneplus-Beijing Co. Ltd.,https://www.crunchbase.com/funding_round/geneplus-beijing-co-ltd-series-unknown--f4e66264,1,Volcanics Venture,,,Venture - Series Unknown,4,,,,,,,153302445,USD,153302445,Yes,,https://www.gene-plus.com/,,Late Stage Venture,,"159,725"
2018-01-01,Neptune Robotics develops and manufactures underwater drones designed for enterprises in the maritime industry.,Neptune Robotics,https://www.crunchbase.com/organization/neptune-robotics,"Information Technology, Manufacturing, Marine Technology, Robotics","Shenzhen, Guangdong, China, Asia",Seed Round - Neptune Robotics,https://www.crunchbase.com/funding_round/neptune-robotics-seed--7e0006fb,2,"Cloud Angel Fund, HAX",Seed,,Seed,3,,,,,,,17250000,USD,17250000,Yes,,https://neptune-robotics.com/,$1M to $10M,Early Stage Venture,,"159,768"
2017-12-26,Kinger Robot is an industrial robot developer company.,Kinger Robot,https://www.crunchbase.com/organization/kinger-robot,"Industrial, Manufacturing, Robotics","Qingdao Shi, Shandong, China, Asia",Series A - Kinger Robot,https://www.crunchbase.com/funding_round/kinger-robot-series-a--4d6237d8,3,"Mesnac, Qingdao Hi-Tech Venture Capital, Rongyu Ziben",Early Stage Venture,,Series A,4,10000000,CNY,1527674,,,,33000000,CNY,5162177,Yes,,http://www.kingerobot.com/,,Private Equity,,"160,673"
2018-01-01,Tauren is a domestic and hybrid design enterprise of analog and analog-digital chips.,Tauren,https://www.crunchbase.com/organization/tauren,"Electronics, Hardware, Semiconductor","Pudong, Shandong, China, Asia",Venture Round - Tauren,https://www.crunchbase.com/funding_round/tauren-series-unknown--ad7d2182,1,Mount Morning Capital,,,Venture - Series Unknown,2,,,,,,,49500000,CNY,7397113,Yes,,http://www.taurentech.net/,,,,"161,034"
2018-01-01,"eSign is a market leader in electronic signatures offering services to corporations, government service systems, and individual users.",eSign,https://www.crunchbase.com/organization/esign-4ff9,"E-Signature, Enterprise, Privacy, Security","Hangzhou, Zhejiang, China, Asia",Series B - eSign,https://www.crunchbase.com/funding_round/esign-4ff9-series-b--72e70943,1,Eminence Ventures,Early Stage Venture,,Series B,2,,,,,,,1200000000,CNY,185994606,Yes,,https://www.esign.cn,,Late Stage Venture,,"161,681"
2018-01-01,Qingflow is a software-as-a-service platform that enables users to create management systems.,Qingflow,https://www.crunchbase.com/organization/qingflow,"Information Technology, SaaS, Software","Minhang, Shanghai, China, Asia",Venture Round - Qingflow,https://www.crunchbase.com/funding_round/qingflow-series-unknown--349081c3,1,01vc,,,Venture - Series Unknown,3,,,,,,,75000000,CNY,11750329,Yes,,https://qingflow.com,,Early Stage Venture,,"161,687"
2017-12-19,Xianghang develops media-free holographic projection technology.,Xianghang,https://www.crunchbase.com/organization/xianghang,"Hardware, Information Technology","Jingan, Shanghai, China, Asia",Angel Round - Xianghang,https://www.crunchbase.com/funding_round/xianghang-angel--4ef27d25,2,"AVIC, Hangzhou Economic Development Zone Capital",Seed,,Angel,2,3000000,CNY,454126,,,,103000000,CNY,14702591,Yes,,http://www.xianghangkeji.com,,Early Stage Venture,,"162,887"
2018-01-17,Zhongchuzhiyun is a logistics company.,Zhongchuzhiyun,https://www.crunchbase.com/organization/zhongchuzhiyun,Logistics,"Nanjing, Jiangsu, China, Asia",Series A - Zhongchuzhiyun,https://www.crunchbase.com/funding_round/zhongchuzhiyun-series-a--078e1ef3,2,"China Southern Capital Management, Nanjing Nangang Iron & Steel United Co",Early Stage Venture,,Series A,4,,,,,,,761000000,CNY,120390438,Yes,,https://www.zczy56.com/,,Late Stage Venture,,"164,573"
2018-01-01,Bluetron Industrial Internet Information is a part of the Computer Systems Design and Related Services Industry.,Bluetron Industrial Internet Information,https://www.crunchbase.com/organization/bluetron-industrial-internet-information,"Cloud Data Services, Computer, Information Technology, Internet, Professional Services, Software","Ningbo, Zhejiang, China, Asia",Seed Round - Bluetron Industrial Internet Information,https://www.crunchbase.com/funding_round/bluetron-industrial-internet-information-seed--a1cc67d2,2,"SDIC Venture Capital, Wanxiang Group",Seed,,Seed,2,,,,,,,500000000,CNY,78601522,Yes,,http://www.bluetron.cn,,,,"164,781"
2018-02-01,"Sweeper is a biological environmental protection, planting and breeding company.",Sweeper,https://www.crunchbase.com/organization/sinosweeper,"Agriculture, Environmental Engineering, Waste Management","Nanjing, Jiangsu, China, Asia",Series A - Sweeper,https://www.crunchbase.com/funding_round/sinosweeper-series-a--7667ae09,1,GSR United Capital,Early Stage Venture,,Series A,5,5000000,CNY,793676,,,,5193676,USD,5193676,Yes,,https://www.sinosweeper.com,,Early Stage Venture,,"166,972"
2018-01-01,Yidianling operates as a technology-enabled psychology service provider.,Yidianling,https://www.crunchbase.com/organization/yidianling-b1aa,"Information Technology, Psychology, Wellness","Hangzhou, Zhejiang, China, Asia",Seed Round - Yidianling,https://www.crunchbase.com/funding_round/yidianling-b1aa-seed--6c199cbc,1,Prox Ventures,Seed,,Seed,2,,,,,,,,,,Yes,,https://www.ydl.com/,,Early Stage Venture,,"167,468"
2018-01-10,Hipower provides clinical trials and post-marketing clinical re-evaluation technical services for pharmaceutical products.,Hipower,https://www.crunchbase.com/organization/hipower,"Biotechnology, Health Care, Medical, Pharmaceutical","Guangzhou, Guangdong, China, Asia",Venture Round - Hipower,https://www.crunchbase.com/funding_round/hipower-series-unknown--d2b6c0e1,1,Hejun Capital,,,Venture - Series Unknown,2,50000000,CNY,7682498,,,,50000000,CNY,7682498,Yes,,http://www.gz-hipower.com/,,Early Stage Venture,,"167,403"
2017-12-22,Huitongda is a Chinese logistics service company providing home appliance supply chain services for the township market.,Huitongda,https://www.crunchbase.com/organization/huitongda,"E-Commerce, Home Appliances, Logistics, Retail, Supply Chain Management","Nanjing, Jiangsu, China, Asia",Series C - Huitongda,https://www.crunchbase.com/funding_round/huitongda-series-c--721e4c03,1,U.S.-China Green Fund,Late Stage Venture,U.S.-China Green Fund,Series C,6,500000000,CNY,76043314,1530000000,USD,1530000000,6300000000,CNY,996246806,Yes,,http://www.htd.cn,$50M to $100M,IPO,1,"177,311"
2018-01-25,"Kuaishou is an online video platform that allows its users to broadcast daily activities, habits, and more online.",Kuaishou Technology,https://www.crunchbase.com/organization/kuaishou,"Artificial Intelligence (AI), Mobile Apps, Photo Sharing, Social Network, Video Streaming","Beijing, Beijing, China, Asia",Series E - Kuaishou Technology,https://www.crunchbase.com/funding_round/kuaishou-series-e--daa56a73,4,"5Y Capital, DCM Ventures, Mubadala Capital Ventures, Tencent",Late Stage Venture,Tencent,Series E,9,1000000000,USD,1000000000,17000000000,USD,17000000000,4370000000,USD,4370000000,Yes,,http://www.kuaishou.com,$1B to $10B,IPO,3,"179,962"
2018-01-01,"Pencil Road is an enterprise service platform covering business information, brand marketing, investment and financing services,etc",Pencil Road,https://www.crunchbase.com/organization/pencil-road,"Business Development, Digital Media, News","Haidian, Beijing, China, Asia",Venture Round - Pencil Road,https://www.crunchbase.com/funding_round/pencil-road-series-unknown--05c21ca8,8,"Dahe Ventures, Heqian Touzi, Innoangel Fund, K2VC, NEEO FUND, Weizhong Xiang Jijin, Xinyi Capital, Zhizhuo Capital",,Heqian Touzi,Venture - Series Unknown,1,,,,,,,,,,Yes,,https://www.pencilnews.cn,,,,"184,876"
2017-12-18,Hesai Technology is a designer and manufacturer of laser sensors for robots and self-driving cars.,Hesai Technology,https://www.crunchbase.com/organization/hesai,"Autonomous Vehicles, Laser, Manufacturing, Sensor, Transportation","Shanghai, Shanghai, China, Asia",Venture Round - Hesai Technology,https://www.crunchbase.com/funding_round/hesai-series-unknown--604111d2,1,ZhenFund,,,Venture - Series Unknown,11,1000000,CNY,151155,,,,603847182,USD,603847182,Yes,,http://www.hesaitech.com,$100M to $500M,IPO,,"189,000"
2018-01-15,"Zelgen is focused on cancer, hematology and auto-immune products.",Zelgen,https://www.crunchbase.com/organization/suzhou-zelgen-biopharmaceuticals,"Biopharma, Biotechnology, Health Care","Kunshan, Anhui, China, Asia",Series B - Zelgen,https://www.crunchbase.com/funding_round/suzhou-zelgen-biopharmaceuticals-series-b--d393754f,3,"Minsheng Life Insurance, Share Capital, Shenzhen Capital Group",Early Stage Venture,"Minsheng Life Insurance, Share Capital, Shenzhen Capital Group",Series B,3,400000000,CNY,62132062,,,,400000000,CNY,62132062,Yes,,http://www.zelgen.com/en/lianxiwomen/,$1M to $10M,IPO,,"197,338"
2017-12-26,China TOP1 online service platform in construction equipment industry,Iron Armour,https://www.crunchbase.com/organization/iron-armour-inc,"Construction, Internet, Internet of Things, Machinery Manufacturing, Trading Platform","Beijing, Beijing, China, Asia",Series C - Iron Armour,https://www.crunchbase.com/funding_round/iron-armour-inc-series-c--9cf3724c,6,"CBC Capital, DCM Ventures, Far East Horizon, Grand Flight Investment, Qiming Venture Partners, Yuansheng Capital",Late Stage Venture,"CBC Capital, Grand Flight Investment",Series C,4,50000000,USD,50000000,,,,100000000,USD,100000000,Yes,,https://www.tiejia.com.cn/,,Late Stage Venture,,"197,680"
2017-12-28,Huaqin Communication Technology is a mobile phone research and development company.,Huaqin Communication Technology,https://www.crunchbase.com/organization/huaqin-communication-technology,"Communication Hardware, Mobile Devices, Software, Telecommunications, Wireless","Shanghai, Shanghai, China, Asia",Series A - Huaqin Communication Technology,https://www.crunchbase.com/funding_round/huaqin-communication-technology-series-a--d244b6a7,7,"Hua Capital, Intel Capital, Northern Light Venture Capital, Sinoking Capital, Summitview Capital, Walden International, Wise Road Capital",Early Stage Venture,"Hua Capital, Intel Capital",Series A,3,870000000,CNY,133182291,,,,2020000000,CNY,297590110,Yes,,https://www.huaqin.com,$10B+,Early Stage Venture,2,"199,180"
2018-01-01,Lingxi is a company that applies machine intelligence to provide sales conversion services.,Lingxi,https://www.crunchbase.com/organization/lingxi,"Artificial Intelligence (AI), Financial Services, Machine Learning, Sales","Beijing, Beijing, China, Asia",Angel Round - Lingxi,https://www.crunchbase.com/funding_round/lingxi-angel--2a9bbfb1,1,Huirong Deyun Investment,Seed,,Angel,3,,,,,,,6200000,USD,6200000,Yes,,https://www.xi-ai.com,$1M to $10M,Late Stage Venture,,"199,676"
2018-01-01,Ronbay Technology is a manufacturer of cathode materials for power batteries.,Ronbay Technology,https://www.crunchbase.com/organization/ronbay-technology,"Energy, Manufacturing","Yuyao, Zhejiang, China, Asia",Venture Round - Ronbay Technology,https://www.crunchbase.com/funding_round/ronbay-technology-series-unknown--ad937d0c,10,"CAS Investment Management, CHERAMI, GoldenSand Capital, GP Hi-Tech Capital, Haitong Capital, Kingdom Capital, Sega Wenhua, Tsinghua Holdings Capital, V Fund Management, Zhejiang Paradise",,,Venture - Series Unknown,3,,,,,,,,,,Yes,,http://www.ronbaymat.com,,IPO,,"203,255"
