2018-01-01,"YLZ Information Technology researches, develops, and provides software applications and services.",YLZ Information Technology,https://www.crunchbase.com/organization/ylz-information-technology,"Communication Hardware, Information Technology, Software","Xiamen, Fujian, China, Asia",Private Equity Round - YLZ Information Technology,https://www.crunchbase.com/funding_round/ylz-information-technology-private-equity--eecf12b4,1,Kingdom Capital,Private Equity,,Private Equity,1,,,,,,,,,,Yes,,http://www.ylzinfo.com/,,IPO,,"447,205"
2018-01-01,Beijing Shuimu Tongda Transportation is a hydrogen fuel cell bus operator.,Beijing Shuimu Tongda Transportation,https://www.crunchbase.com/organization/beijing-shuimu-tongda-transportation,"Autonomous Vehicles, Fuel Cell, Transportation","Haidian, Beijing, China, Asia",Venture Round - Beijing Shuimu Tongda Transportation,https://www.crunchbase.com/funding_round/beijing-shuimu-tongda-transportation-series-unknown--ca425614,1,Tsinghua Innovation Ventures,,,Venture - Series Unknown,1,,,,,,,,,,Yes,,http://www.smtd-baas.cn/,,,,"446,494"
2018-01-01,Medpace Medtech focuses on the treatment of functional and metabolic diseases by neuromodulation.,Medpace Medtech,https://www.crunchbase.com/organization/medpace-medtech,"Biotechnology, Health Care, Life Science, Medical, Therapeutics","Hangzhou, Zhejiang, China, Asia",Venture Round - Medpace Medtech,https://www.crunchbase.com/funding_round/medpace-medtech-series-unknown--a86f8c9b,1,Prox Ventures,,,Venture - Series Unknown,1,,,,,,,,,,Yes,,http://www.med-pace.com,$1M to $10M,,,"453,956"
2018-01-17,Palmstar Game is a developer of mobile games designed for relaxation.,Palmstar Game,https://www.crunchbase.com/organization/palmstar-game,"Gaming, Mobile Apps, Software","Hefei, Anhui, China, Asia",Angel Round - Palmstar Game,https://www.crunchbase.com/funding_round/palmstar-game-angel--4bf9167e,1,Prometheus Capital,Seed,,Angel,1,3000000,CNY,466287,,,,3000000,CNY,466287,Yes,,http://www.palmstar.com.cn/,,Seed,,"447,026"
2018-01-01,Huayu Health Management is a member-based high-end health management organization.,Huayu Health Management,https://www.crunchbase.com/organization/huayu-health-management,"Health Care, Medical","Haidian, Beijing, China, Asia",Venture Round - Huayu Health Management,https://www.crunchbase.com/funding_round/huayu-health-management-series-unknown--ba955ff4,1,Tsinghua Innovation Ventures,,,Venture - Series Unknown,1,,,,,,,,,,Yes,,http://www.hypmd.cn/,,,,"447,040"
2018-01-01,ZGmicro is committed to the research and development of technologies and products in the field of sensor network IoT chips.,ZGmicro,https://www.crunchbase.com/organization/zgmicro,"Electronics, Internet of Things, Manufacturing","Wuxi, Anhui, China, Asia",Venture Round - ZGmicro,https://www.crunchbase.com/funding_round/zgmicro-series-unknown--92119544,1,Fi Capital,,,Venture - Series Unknown,1,,,,,,,,,,Yes,,http://www.zgmicro.com/,,,,"447,214"
2018-02-06,Movutang is an online platform for design and graphic creators.,Movutang,https://www.crunchbase.com/organization/movutang,"Digital Entertainment, Graphic Design, Online Portals","Shenzhen, Guangdong, China, Asia",Seed Round - Movutang,https://www.crunchbase.com/funding_round/movutang-seed--9ac2cf7d,1,Cycas Capital,Seed,,Seed,1,1000000,CNY,159147,,,,1000000,CNY,159147,Yes,,https://www.moyutang.fun,,Seed,,"447,281"
2017-12-31,HiteVision is an important enterprise in domestic education informationization.,HiteVision,https://www.crunchbase.com/organization/hitevision,"E-Learning, Education","Haidian, Beijing, China, Asia",Private Equity Round - HiteVision,https://www.crunchbase.com/funding_round/hitevision-private-equity--a09ee222,1,Crown Asia Investment,Private Equity,,Private Equity,1,,,,,,,,,,Yes,,http://www.honghe-tech.com/,,IPO,,"447,578"
2017-12-16,Maternity Care offers healthy food for pregnant women in china.,Maternity Care,https://www.crunchbase.com/organization/maternity-care,"Child Care, Customer Service, Health Care","Suzhou, Jiangsu, China, Asia",Angel Round - Maternity Care,https://www.crunchbase.com/funding_round/maternity-care-angel--c671dc3b,1,Pegasus Group,Seed,,Angel,1,3000000,CNY,453796,,,,3000000,CNY,453796,Yes,,http://www.4007777537.com,,Seed,,"448,233"
2018-01-28,ETBOT is a welding robot developer and service provider.,ETBOT,https://www.crunchbase.com/organization/etbot,"Industrial, Robotics, Wedding","Suzhou, Jiangsu, China, Asia",Angel Round - ETBOT,https://www.crunchbase.com/funding_round/etbot-angel--a34f15a0,1,Jiangsu Hagong Intelligent Robot,Seed,,Angel,1,3000000,CNY,474958,,,,3000000,CNY,474958,Yes,,http://www.hrgetbot.com,,Seed,,"449,261"
2018-01-01,Shenzhen Arthur Medical Robot focuses on research and development of medical diagnosis and treatment rehabilitation and monitoring robots.,Shenzhen Arthur Medical Robot,https://www.crunchbase.com/organization/shenzhen-arthur-medical-robot,"Health Diagnostics, Medical, Robotics","Shenzhen, Guangdong, China, Asia",Venture Round - Shenzhen Arthur Medical Robot,https://www.crunchbase.com/funding_round/shenzhen-arthur-medical-robot-series-unknown--dfebc788,1,Tsinghua Innovation Ventures,,,Venture - Series Unknown,1,,,,,,,,,,Yes,,,,,,"452,042"
2018-01-01,Intac Optical Instrument manufactures testing equipment for the LCD and OLED industries.,Intac Optical Instrument,https://www.crunchbase.com/organization/intac-optical-instrument,"Industrial, Manufacturing, Test and Measurement","Kunshan, Anhui, China, Asia",Private Equity Round - Intac Optical Instrument,https://www.crunchbase.com/funding_round/intac-optical-instrument-private-equity--4da405e6,1,Integrity Capital Partners,Private Equity,,Private Equity,1,,,,,,,,,,Yes,,http://www.caidaopi.com.cn,,Private Equity,,"449,536"
2018-02-01,Chewang Technology is a transportation service provider offering logistics and transportation services.,Chewang Technology,https://www.crunchbase.com/organization/chewang-technology,"Freight Service, Logistics, Transportation","Nanjing, Jiangsu, China, Asia",Series A - Chewang Technology,https://www.crunchbase.com/funding_round/chewang-technology-series-a--a25100ca,1,GSR United Capital,Early Stage Venture,,Series A,1,27857143,CNY,4421909,,,,27857143,CNY,4421909,Yes,,https://www.zjcw.cn/,,Early Stage Venture,,"452,426"
2018-01-01,"Youwu Smart designs and produces whole-house customization services, smart home products, and home peripheral products for consumers.",Youwu Smart,https://www.crunchbase.com/organization/youwu-smart,"Consumer Goods, Manufacturing","Qingdao Shi, Shandong, China, Asia",Venture Round - Youwu Smart,https://www.crunchbase.com/funding_round/youwu-smart-series-unknown--f6197f0a,1,Qingdao Shaohai Gaochuang Tiandi Investment,,,Venture - Series Unknown,1,,,,,,,,,,Yes,,,,,,"452,453"
2018-01-24,Haoting Xinfeng produces indoor air purification products.,Haoting Xinfeng,https://www.crunchbase.com/organization/haoting-xinfeng,"Environmental Engineering, Hardware, Manufacturing","Tangshan, Hebei, China, Asia",Series A - Haoting Xinfeng,https://www.crunchbase.com/funding_round/haoting-xinfeng-series-a--2d1be6b0,1,Tangshan Gaoxin Chuangtou,Early Stage Venture,,Series A,2,3000000,CNY,470950,,,,6000000,CNY,927142,Yes,,http://www.haotingkeji.com,,Early Stage Venture,,"453,030"
2018-02-01,"Leesche develops large-scale cinema 4D, 5D dynamic theaters.",Leesche,https://www.crunchbase.com/organization/leesche,"Hardware, Information Technology, Virtual Reality","Guangzhou, Guangdong, China, Asia",Series A - Leesche,https://www.crunchbase.com/funding_round/leesche-series-a--63a34484,1,Origins Capital,Early Stage Venture,,Series A,2,3000000,CNY,476206,,,,6000000,CNY,933179,Yes,,http://www.leesche.cn,,Early Stage Venture,,"450,579"
2018-01-01,TS Imaging aims to transform the scientific research results to serve doctors and aid patients with precise imaging.,TS Imaging,https://www.crunchbase.com/organization/ts-imaging,"Health Care, Medical","Changping, Beijing, China, Asia",Venture Round - TS Imaging,https://www.crunchbase.com/funding_round/ts-imaging-series-unknown--393b936a,1,Tsinghua Innovation Ventures,,,Venture - Series Unknown,2,,,,,,,,,,Yes,,http://www.tsimaging.net/,,,,"452,677"
2018-01-09,"Elitenect Technologies specializes in robot navigation and positioning, indoor positioning technology research and product development.",Elitenect Technologies,https://www.crunchbase.com/organization/elitenect-technologies,"Artificial Intelligence (AI), Mobile, Robotics","Haidian, Beijing, China, Asia",Angel Round - Elitenect Technologies,https://www.crunchbase.com/funding_round/elitenect-technologies-angel--1bc38456,1,Tsinghua Tongfang,Seed,,Angel,1,3000000,CNY,459376,,,,3000000,CNY,459376,Yes,,http://www.iotcnn.com,,Seed,,"453,155"
2018-01-29,Joy & Focus is an online education platform for children.,JOYCUS,https://www.crunchbase.com/organization/joycus,"EdTech, Education, Training","Shunyi, Beijing, China, Asia",Angel Round - JOYCUS,https://www.crunchbase.com/funding_round/joycus-angel--106e4a8e,1,Cyanhill Capital,Seed,,Angel,1,3000000,CNY,473411,,,,3000000,CNY,473411,Yes,,http://joycus.com/,,Seed,,"453,350"
2018-01-26,IEStreet is an investment management and business service company.,IEStreet,https://www.crunchbase.com/organization/iestreet,"Finance, Financial Services, Incubators","Haidian, Beijing, China, Asia",Series A - IEStreet,https://www.crunchbase.com/funding_round/iestreet-series-a--b4326893,1,Shenzhen Qianhai Lifang Xinxi Jishu Youxian Gongsi,Early Stage Venture,,Series A,2,10000000,CNY,1583318,,,,13000000,CNY,2019352,Yes,,http://www.ies.vc,,Early Stage Venture,,"449,957"
2018-01-01,Therma Tech provides thermal control products and solutions.,Therma Tech,https://www.crunchbase.com/organization/therma-tech,"Automotive, Machinery Manufacturing","Dongguancun, Anhui, China, Asia",Venture Round - Therma Tech,https://www.crunchbase.com/funding_round/therma-tech-series-unknown--af1ce78c,1,Tengye Ventures,,,Venture - Series Unknown,1,,,,,,,,,,Yes,,http://www.thermatech.cn/,,,,"452,055"
2018-02-12,Fish Studio develops animation production and original animation IP projects.,Fish Studio,https://www.crunchbase.com/organization/fish-studio,"Animation, Digital Entertainment, Video","Hangzhou, Zhejiang, China, Asia",Angel Round - Fish Studio,https://www.crunchbase.com/funding_round/fish-studio-angel--c48b13c5,1,2:10 AM Animation,Seed,,Angel,1,3000000,CNY,474106,,,,3000000,CNY,474106,Yes,,http://www.10000fish.com,,Seed,,"450,959"
2018-01-01,BIOTIME focuses on the research of POCT precision diagnosis technology.,BIOTIME,https://www.crunchbase.com/organization/biotime-1276,"Biotechnology, Health Care, Health Diagnostics, Medical","Haicang, Fujian, China, Asia",Venture Round - BIOTIME,https://www.crunchbase.com/funding_round/biotime-1276-series-unknown--bf56168e,1,Tianjin Venture Capital,,,Venture - Series Unknown,1,,,,,,,,,,Yes,,http://www.biotime.cn,$1M to $10M,,,"451,231"
2018-01-24,Maker Store provides vending machines.,Maker Store,https://www.crunchbase.com/organization/maker-store,Food and Beverage,"Zhengzhou, Henan, China, Asia",Seed Round - Maker Store,https://www.crunchbase.com/funding_round/maker-store-seed--6a6744c8,1,Panda Capital,Seed,,Seed,1,,,,,,,,,,Yes,,http://www.mkzx360.com/,,Seed,,"454,121"
2017-12-27,DUOXIWA provides maternal and child health care services.,DUOXIWA,https://www.crunchbase.com/organization/duoxiwa,"Child Care, Health Care, Wellness","Shenzhen, Guangdong, China, Asia",Angel Round - DUOXIWA,https://www.crunchbase.com/funding_round/duoxiwa-angel--1f175327,1,Tengxun Touzi,Seed,,Angel,1,3000000,CNY,457634,,,,3000000,CNY,457634,Yes,,https://www.duoxiwa.com,,Seed,,"454,374"
2018-01-29,Jikexiu is an online-to-offline smartphone maintenance service platform based in China.,Jikexiu,https://www.crunchbase.com/organization/jikexiu,"Electronics, Hardware, Mobile, Mobile Devices, Service Industry","Chongqing, Heilongjiang, China, Asia",Series A - Jikexiu,https://www.crunchbase.com/funding_round/jikexiu-series-a--c4f91622,1,Huohua Venture Capital,Early Stage Venture,,Series A,1,7000000,USD,7000000,,,,7000000,USD,7000000,Yes,,https://www.jikexiu.com,,Early Stage Venture,,"455,353"
2018-01-08,Hebei City Card is the provider of transportation smart card services.,Hebei City Card,https://www.crunchbase.com/organization/hebei-city-card,"Automotive, Credit Cards, Public Transportation","Shijiazhuang, Hebei, China, Asia",Series A - Hebei City Card,https://www.crunchbase.com/funding_round/hebei-city-card-series-a--69cc0779,1,Hebei Information Industry Investment Group,Early Stage Venture,,Series A,2,10000000,CNY,1538876,,,,13000000,CNY,1901633,Yes,,http://www.966009.com/,,Early Stage Venture,,"455,602"
2017-12-19,"C-Dragon manufactures cardiovascular system drugs, obstetrics, gynecology, and digestive disease drugs.",C-Dragon,https://www.crunchbase.com/organization/c-dragon,"Manufacturing, Pharmaceutical","Chaohu, Anhui, China, Asia",Angel Round - C-Dragon,https://www.crunchbase.com/funding_round/c-dragon-angel--8da812a1,1,Fortune Valley Capital,Seed,,Angel,1,3000000,CNY,454126,,,,3000000,CNY,454126,Yes,,http://www.c-dragon.com.cn/,,Seed,,"455,620"
2018-01-13,CoinMeet is building an inclusive blockchain ecosystem by integrating wallet and identity.,Coinmeet,https://www.crunchbase.com/organization/coinmeet,"Blockchain, Digital Media","Beijing, Beijing, China, Asia",Seed Round - Coinmeet,https://www.crunchbase.com/funding_round/coinmeet-seed--9628bb9b,1,Node Capital,Seed,,Seed,2,1000000,USD,1000000,,,,1000000,USD,1000000,Yes,,https://coinmeet.io,,Seed,,"455,806"
2018-02-07,CVNAVI is a system solution company in the commercial vehicle industry.,CVNAVI,https://www.crunchbase.com/organization/cvnavi,"Automotive, Electronics, Logistics","Qingpu, Shanghai, China, Asia",Series A - CVNAVI,https://www.crunchbase.com/funding_round/cvnavi-series-a--672d2674,1,Shanghai Haoyi,Early Stage Venture,,Series A,2,10000000,CNY,1595270,,,,13000000,CNY,2053153,Yes,,http://www.cvnavi.com/,,Early Stage Venture,,"455,965"
2018-01-09,Hollpin,Hollpin,https://www.crunchbase.com/organization/hollpin,Food and Beverage,"Hangzhou, Zhejiang, China, Asia",Seed Round - Hollpin,https://www.crunchbase.com/funding_round/hollpin-seed--5a36d06f,1,Funcity Capital,Seed,,Seed,1,,,,,,,,,,Yes,,http://www.hollpin.com/,,Seed,,"456,242"
2018-01-19,AI Bird UAV is an unmanned aerial vehicles and mobile cloud platform developer company.,AI Bird UAV,https://www.crunchbase.com/organization/ai-bird-uav,"Artificial Intelligence (AI), Cloud Computing, Drones, Industrial, Software","Wuhan, Hubei, China, Asia",Corporate Round - AI Bird UAV,https://www.crunchbase.com/funding_round/ai-bird-uav-corporate-round--165083a1,1,Shanghai Huace Navigation Technology,,,Corporate Round,2,1000000,CNY,156087,,,,6000000,CNY,959762,Yes,,http://www.aibird.com/,,,,"456,317"
2018-02-12,Fasoft is an intelligent financial analysis and management software development company.,Fasoft,https://www.crunchbase.com/organization/fasoft,"Financial Services, Information Services, Intelligent Systems, Software","Haidian, Beijing, China, Asia",Angel Round - Fasoft,https://www.crunchbase.com/funding_round/fasoft-angel--cbd03923,1,Ningbo Green Lemon Investment Management,Seed,,Angel,1,3000000,CNY,474106,,,,3000000,CNY,474106,Yes,,http://www.fasoft.com.cn/,,Seed,,"456,717"
2018-01-30,Dreamland Maker Technology is an AR and VR animation content provider company.,Dreamland Maker Technology,https://www.crunchbase.com/organization/dreamland-maker-technology,"Animation, Information Services, Virtual Reality","Guangzhou, Guangdong, China, Asia",Series C - Dreamland Maker Technology,https://www.crunchbase.com/funding_round/dreamland-maker-technology-series-c--b86c96e1,1,Hangzhou Xiluo Cultural and Creative,Late Stage Venture,,Series C,4,30000000,CNY,4745897,,,,80000000,CNY,12332900,Yes,,http://www.acgvr.com/,Less than $1M,Late Stage Venture,,"456,903"
2018-02-08,SINO Assessment Group is a sanitation inspection and testing evaluation agency.,SINO ASSESSMENT GROUP,https://www.crunchbase.com/organization/sino-assessment-group,"Cosmetics, Food and Beverage, Health Care, Public Safety","Longhua, Guangdong, China, Asia",Series B - SINO ASSESSMENT GROUP,https://www.crunchbase.com/funding_round/sino-assessment-group-series-b--0eccd308,1,SZHTI Group,Early Stage Venture,,Series B,3,20000000,CNY,3160906,,,,33000000,CNY,5142819,Yes,,http://www.sagchina.com,$1M to $10M,Early Stage Venture,,"457,279"
2017-12-26,dushi11.com is the provider of online pharmacy and family doctor services.,dushi11.com,https://www.crunchbase.com/organization/dushi11-com,"Health Care, Medical, Pharmaceutical","Shenzhen, Guangdong, China, Asia",Post-IPO Equity - dushi11.com,https://www.crunchbase.com/funding_round/dushi11-com-post-ipo-equity--d0f2843d,1,Zhongwei Jijin,,,Post-IPO Equity,1,30000000,CNY,4583021,,,,30000000,CNY,4583021,Yes,,http://www.dushi11.com/,,IPO,,"457,444"
2018-01-25,Xinzhentech.com provides financial product development and operational services.,Xinzhentech.com,https://www.crunchbase.com/organization/xinzhentech-com,"Financial Services, Information Technology","Nanshanqu, Guangdong, China, Asia",Series A - Xinzhentech.com,https://www.crunchbase.com/funding_round/xinzhentech-com-series-a--22686688,1,Daohe Keji Touzi,Early Stage Venture,,Series A,2,10000000,CNY,1581453,,,,13000000,CNY,2027493,Yes,,https://www.xinzhentech.com/,,Early Stage Venture,,"457,471"
2018-01-03,Shengxue Jiaoyu is an education big data empowerment company.,Shengxue Jiaoyu,https://www.crunchbase.com/organization/shengxue-jiaoyu,"Big Data, Education, Training","Chengdu, Sichuan, China, Asia",Angel Round - Shengxue Jiaoyu,https://www.crunchbase.com/funding_round/shengxue-jiaoyu-angel--2e7cf282,1,Sichuan Development Guidance Fund,Seed,,Angel,1,3000000,CNY,461277,,,,3000000,CNY,461277,Yes,,http://www.sxw.cn,,M&A,,"457,728"
2018-02-12,JIACHEN is a manufacturing enterprise that researches and develops new energy vehicle control systems and related electrical components.,JIACHEN,https://www.crunchbase.com/organization/jiachen,"Electronics, Energy, Manufacturing","Zhengzhou, Henan, China, Asia",Angel Round - JIACHEN,https://www.crunchbase.com/funding_round/jiachen-angel--8ad9e742,1,Hangcha Group,Seed,,Angel,1,3000000,CNY,474106,,,,3000000,CNY,474106,Yes,,http://www.jiachenin.com/,$1M to $10M,Seed,,"477,749"
2017-12-25,Mankebao is a canteen information management system company.,Mankebao,https://www.crunchbase.com/organization/mankebao,"Information Technology, Management Information Systems, Software","Beijing, Beijing, China, Asia",Angel Round - Mankebao,https://www.crunchbase.com/funding_round/mankebao-angel--41143030,1,Xiyun International,Seed,,Angel,1,3000000,CNY,456642,,,,3000000,CNY,456642,Yes,,http://www.mankebao.cn,,Seed,,"478,583"
2018-01-23,Songguo Chuxing is a shared motorcycle operator.,Songguo Chuxing,https://www.crunchbase.com/organization/songguo-chuxing,"Cycling, GreenTech, Travel","Beijing, Beijing, China, Asia",Angel Round - Songguo Chuxing,https://www.crunchbase.com/funding_round/songguo-chuxing-angel--fa22fb1b,1,K2VC,Seed,,Angel,1,3000000,CNY,468472,,,,3000000,CNY,468472,Yes,,https://songguo7.com/,Less than $1M,Seed,,"458,962"
2017-12-26,"MachineMind builds artificial intelligence hardware, AI brain of intelligent hardware and artificial intelligence cloud platform.",MachineMind,https://www.crunchbase.com/organization/machinemind,"Artificial Intelligence (AI), Hardware, Robotics","Jiading, Shanghai, China, Asia",Angel Round - MachineMind,https://www.crunchbase.com/funding_round/machinemind-angel--c4bb8db3,1,Huaqing Capital,Seed,,Angel,2,3000000,CNY,458302,,,,4000000,CNY,603495,Yes,,https://www.machinemind.com/,,Seed,,"470,863"
2018-02-09,ZHONGER is an automotive disc brakes manufacturing company.,ZHONGER,https://www.crunchbase.com/organization/zhonger,"Automotive, Manufacturing, Transportation","Shiyan, Hubei, China, Asia",Angel Round - ZHONGER,https://www.crunchbase.com/funding_round/zhonger-angel--b61d8e99,1,Hubei Provincial High Technology Industry Investment,Seed,,Angel,1,3000000,CNY,477031,,,,3000000,CNY,477031,Yes,,http://www.zeaxle.com,,Seed,,"460,055"
2018-01-02,"WUHAN JINYU FREE TRADE DEVELOPMENT Co., Ltd is engaged in import and export trade, warehousing logistics, processing, and sales.","WUHAN JINYU FREE TRADE DEVELOPMENT Co., Ltd",https://www.crunchbase.com/organization/wuhan-jinyu-free-trade-development-co-ltd,"Food Processing, Logistics, Sales, Supply Chain Management, Warehousing","Wuhan, Hubei, China, Asia","Series A - WUHAN JINYU FREE TRADE DEVELOPMENT Co., Ltd",https://www.crunchbase.com/funding_round/wuhan-jinyu-free-trade-development-co-ltd-series-a--ff1c2c45,1,China-Africa Xinyin Investment,Early Stage Venture,,Series A,2,10000000,CNY,1539990,,,,13000000,CNY,2022854,Yes,,http://www.wuhanjinyu.com/,,Early Stage Venture,,"482,768"
2017-12-25,FanS provides online and offline assistance services and commodities.,FanS,https://www.crunchbase.com/organization/fans,"Big Data, Internet, Media and Entertainment","Haidian, Beijing, China, Asia",Angel Round - FanS,https://www.crunchbase.com/funding_round/fans-angel--05f3d1d9,1,N5Capital,Seed,,Angel,1,3000000,CNY,456642,,,,3000000,CNY,456642,Yes,,http://www.fan-s.cn,,Seed,,"460,259"
2018-01-24,APEERI is a professional research and consulting organization focusing on sustainable economic development in counties.,Asia-Pacific Eco-Economic Research Institute,https://www.crunchbase.com/organization/asia-pacific-eco-economic-research-institute,"Big Data, Consulting, Information Technology","Guangzhou, Guangdong, China, Asia",Series A - Asia-Pacific Eco-Economic Research Institute,https://www.crunchbase.com/funding_round/asia-pacific-eco-economic-research-institute-series-a--b2dade28,1,Flower King Eco-Engineering,Early Stage Venture,,Series A,1,10000000,CNY,1569834,,,,10000000,CNY,1569834,Yes,,http://www.apeeri.com/,,Early Stage Venture,,"483,730"
2018-01-28,Starwin Fintech is a fintech company that help every individual to get financial services by the power of information technology.,Starwin Fintech,https://www.crunchbase.com/organization/starwin-fintech,"Finance, Financial Services, FinTech, Information Services, Information Technology","Huangpu, Shanghai, China, Asia",Angel Round - Starwin Fintech,https://www.crunchbase.com/funding_round/starwin-fintech-angel--e0cf42f9,1,Jingtong Equity Investment,Seed,,Angel,1,3000000,CNY,474958,,,,3000000,CNY,474958,Yes,,https://www.starwin.tech/,,Seed,,"484,376"
2017-12-26,"Xinhui is a software development, microbiological, and genetic testing company.",Xinhui,https://www.crunchbase.com/organization/xinhui,"Biotechnology, Medical, Software","Changping, Beijing, China, Asia",Series A - Xinhui,https://www.crunchbase.com/funding_round/xinhui-series-a--8474697c,1,Rongguangyuan Guquan Touzi,Early Stage Venture,,Series A,2,10000000,CNY,1527674,,,,13000000,CNY,1973485,Yes,,http://www.xhpr.net/,,Early Stage Venture,,"460,579"
2018-01-30,Chiyue Wenhua is a reading and literature distribution network service provider.,Chiyue Wenhua,https://www.crunchbase.com/organization/chiyue-wenhua,"Customer Service, Digital Entertainment, Media and Entertainment","Beijing, Beijing, China, Asia",Angel Round - Chiyue Wenhua,https://www.crunchbase.com/funding_round/chiyue-wenhua-angel--b2ccae9e,1,Shangbang Keji,Seed,,Angel,1,5000000,CNY,790983,,,,5000000,CNY,790983,Yes,,http://www.52chiyue.com,,Seed,,"460,670"
2018-01-31,Wulin Dahui is an online service platform that serves people in square dance and aerobics.,Wulin Dahui,https://www.crunchbase.com/organization/wulin-dahui,"Communities, Internet, Social","Haidian, Beijing, China, Asia",Series A - Wulin Dahui,https://www.crunchbase.com/funding_round/wulin-dahui-series-a--0b3bde66,1,Wulin Mengzhu,Early Stage Venture,,Series A,2,6000000,CNY,953971,,,,8000000,CNY,1241960,Yes,,http://www.wulinmz.com,,Early Stage Venture,,"460,705"
2018-01-17,Boyichuangwei Digital Media is a digital entertainment company that integrates content creation and IP operation solutions.,BeiJing BoYiChuangWei Digital Media,https://www.crunchbase.com/organization/beijing-boyichuangwei-digital-media-co-ltd,"Content Creators, Digital Entertainment, Digital Media, Media and Entertainment","Haidian, Beijing, China, Asia",Post-IPO Equity - BeiJing BoYiChuangWei Digital Media,https://www.crunchbase.com/funding_round/beijing-boyichuangwei-digital-media-co-ltd-post-ipo-equity--91a3d399,1,CHENGMEI VENTURES,,,Post-IPO Equity,5,34210000,CNY,5317231,,,,117210000,CNY,17818202,Yes,,http://www.boetech.cn/,,IPO,,"471,096"
2018-02-08,Yikongwang is an one-stop funeral service platform.,Yikongwang,https://www.crunchbase.com/organization/yikongwang,"Funerals, Internet, Social","Zhabei, Shanghai, China, Asia",Series D - Yikongwang,https://www.crunchbase.com/funding_round/yikongwang-series-d--1af99026,1,TopoScend Capital,Late Stage Venture,,Series D,5,50000000,CNY,7902265,,,,19800297,USD,19800297,Yes,,http://www.yiko.org/,,Late Stage Venture,,"471,230"
2018-01-19,Smart Dragon is a film and television production company.,Smart Dragon,https://www.crunchbase.com/organization/smart-dragon,"Digital Entertainment, Film Production, TV Production","Beijing, Beijing, China, Asia",Series B - Smart Dragon,https://www.crunchbase.com/funding_round/smart-dragon-series-b--8e16047c,1,Tengxun Touzi,Early Stage Venture,,Series B,2,20000000,CNY,3121732,,,,120000000,CNY,18387043,Yes,,http://www.linglongmedia.cn/,,Early Stage Venture,,"467,628"
2018-02-09,IPao is a vehicle rescue service platform.,IPao,https://www.crunchbase.com/organization/ipao,"Automotive, Information Technology, Service Industry","Beijing, Beijing, China, Asia",Angel Round - IPao,https://www.crunchbase.com/funding_round/ipao-angel--ef2121ef,1,Huagai Capital,Seed,,Angel,1,3000000,CNY,477031,,,,3000000,CNY,477031,Yes,,http://www.ipaosos.com/,,Seed,,"467,664"
