2018-04-09,weiboreach.com provides internet business intelligence services.,weiboreach.com,https://www.crunchbase.com/organization/weiboreach-com,"Analytics, Big Data, Data Mining, Social Network","Haidian, Beijing, China, Asia",Series A - weiboreach.com,https://www.crunchbase.com/funding_round/weiboreach-com-series-a--170f71f4,1,Toutoushidao Capital,Early Stage Venture,Toutoushidao Capital,Series A,2,10000000,CNY,1585490,,,,13000000,CNY,2066602,Yes,,http://www.weiboreach.com/,,Early Stage Venture,,"290,008"
2018-04-25,CompassX is a blockchain-based travel booking platform.,CompassX,https://www.crunchbase.com/organization/compassx,"Hospitality, Travel","Guangzhou, Guangdong, China, Asia",Angel Round - CompassX,https://www.crunchbase.com/funding_round/compassx-angel--3ffafe2b,1,Manzi Fund,Seed,Manzi Fund,Angel,1,,,,,,,,,,Yes,,,,Seed,,"304,496"
2018-04-15,Yidao Yongche is a Chinese domestic e-commerce website platform that enables users to book professional car reservation services online.,Yidao Yongche,https://www.crunchbase.com/organization/yongche,"Automotive, E-Commerce","Beijing, Beijing, China, Asia",Private Equity Round - Yidao Yongche,https://www.crunchbase.com/funding_round/yongche-private-equity--946ed001,1,China CITIC Bank,Private Equity,China CITIC Bank,Private Equity,7,,,,,,,790000000,USD,790000000,Yes,,https://www.yongche.biz/,$100M to $500M,Private Equity,,"304,587"
2018-03-26,NCast is a smart education solutions provider company.,NCast,https://www.crunchbase.com/organization/ncast,"Content Creators, EdTech, Education, Training","Huangpu, Guangdong, China, Asia",Series B - NCast,https://www.crunchbase.com/funding_round/ncast-series-b--5fcc9a5c,1,Mingchen Xinxi,Early Stage Venture,Mingchen Xinxi,Series B,3,20000000,CNY,3188216,,,,33000000,CNY,5207082,Yes,,http://www.ncast.com.cn/,,Early Stage Venture,,"304,899"
2018-04-11,BioLynx supplies in-vitro diagnostic reagents and antibodies.,BioLynx,https://www.crunchbase.com/organization/biolynx,Health Diagnostics,"Hangzhou, Zhejiang, China, Asia",Series A - BioLynx,https://www.crunchbase.com/funding_round/biolynx-series-a--fd11c748,1,Puhua Capital,Early Stage Venture,Puhua Capital,Series A,1,,,,,,,,,,Yes,,http://biolynx.cn/,,Early Stage Venture,,"305,797"
2018-02-28,A medical cosmetology service platform Based in Guangzhou.,Micheng,https://www.crunchbase.com/organization/micheng,"Health Care, Medical","Guangzhou, Guangdong, China, Asia",Corporate Round - Micheng,https://www.crunchbase.com/funding_round/micheng-corporate-round--b3ec40f8,1,Huoshan Capital,,Huoshan Capital,Corporate Round,1,,,,,,,,,,Yes,,,,,,"306,060"
2018-03-02,gsdata.cn is a public data network industry that provides financial media and public opinion big data service.,gsdata.cn,https://www.crunchbase.com/organization/gsdata-cn,"Analytics, Big Data, Internet","Haidian, Beijing, China, Asia",Series A - gsdata.cn,https://www.crunchbase.com/funding_round/gsdata-cn-series-a--12a04067,1,Linksus Digiwork,Early Stage Venture,Linksus Digiwork,Series A,3,10000000,CNY,1575262,,,,34000000,CNY,5296723,Yes,,http://www.gsdata.cn/,,Early Stage Venture,,"306,474"
2018-04-26,Wutuobang offers hotel property management system.,Wutuobang,https://www.crunchbase.com/organization/wutuobang,"Hotel, Internet, Real Time, Software","Beijing, Beijing, China, Asia",Seed Round - Wutuobang,https://www.crunchbase.com/funding_round/wutuobang-seed--20f983be,1,Duocaitou,Seed,Duocaitou,Seed,1,1000000,CNY,157817,,,,1000000,CNY,157817,Yes,,http://wutuobang123.com/,,Seed,,"306,543"
2018-03-01,buka.tv is a universal online education cloud service platform company.,buka.tv,https://www.crunchbase.com/organization/buka-tv,"Cloud Data Services, Education, Information Technology","Haidian, Beijing, China, Asia",Series A - buka.tv,https://www.crunchbase.com/funding_round/buka-tv-series-a--a93866f4,1,New Oriental Education & Technology Group,Early Stage Venture,New Oriental Education & Technology Group,Series A,3,30000000,CNY,4717686,,,,42000000,CNY,6468764,Yes,,https://www.buka.tv,,Early Stage Venture,,"307,780"
2018-03-02,JYC99.com is an online loan information intermediary platform.,JYC99.com,https://www.crunchbase.com/organization/jyc99-com,"Asset Management, Financial Services, Service Industry","Hangzhou, Zhejiang, China, Asia",Series B - JYC99.com,https://www.crunchbase.com/funding_round/jyc99-com-series-b--49384e56,1,Ya Ge Er Investment,Early Stage Venture,Ya Ge Er Investment,Series B,3,20000000,CNY,3150524,,,,33000000,CNY,5087125,Yes,,https://www.jyc99.com,,Early Stage Venture,,"308,231"
2018-03-08,Afanti is an internet technology company that focuses on artificial intelligence education in primary and secondary schools.,Afanti,https://www.crunchbase.com/organization/afanti-92f6,"Artificial Intelligence (AI), Education, Internet","Haidian, Beijing, China, Asia",Series C - Afanti,https://www.crunchbase.com/funding_round/afanti-92f6-series-c--a52670c3,1,Sogou,Late Stage Venture,Sogou,Series C,4,30000000,CNY,4729909,,,,84334525,USD,84334525,Yes,,http://afanti100.com,,Late Stage Venture,,"308,406"
2018-03-15,Uki is an application for heterosexual love social platform.,Uki,https://www.crunchbase.com/organization/uki,"Adult, Apps, Social","Shanghai, Shanghai, China, Asia",Series A - Uki,https://www.crunchbase.com/funding_round/uki-series-a--f38ede01,1,Jianzheng Touzi,Early Stage Venture,Jianzheng Touzi,Series A,2,10000000,CNY,1581865,,,,13000000,CNY,2067137,Yes,,http://www.neoclub.cn/,,Early Stage Venture,,"308,749"
2018-03-16,New face is an art education and fashion media company.,NEWFACE,https://www.crunchbase.com/organization/newface,"Art, Communities, Fashion","Houshayu, Beijing, China, Asia",Angel Round - NEWFACE,https://www.crunchbase.com/funding_round/newface-angel--394aa790,1,JD Finance,Seed,JD Finance,Angel,1,3000000,CNY,473814,,,,3000000,CNY,473814,Yes,,http://www.newface.cn,,Seed,,"308,903"
2018-02-24,JParking is a smart parking integrated service provider company.,JParking,https://www.crunchbase.com/organization/jparking,"Automotive, Parking","Futian, Guangdong, China, Asia",Venture Round - JParking,https://www.crunchbase.com/funding_round/jparking-series-unknown--78e4fe0e,1,Shanghai Yunxin Venture Capital,,Shanghai Yunxin Venture Capital,Venture - Series Unknown,2,200000000,CNY,31563166,,,,203000000,CNY,32021125,Yes,,http://www.jparking.cn/,,,,"308,918"
2018-04-17,24h smart gym operator based in Shanghai.,Park Box,https://www.crunchbase.com/organization/park-box,Fitness,"Shanghai, Shanghai, China, Asia",Series A - Park Box,https://www.crunchbase.com/funding_round/park-box-series-a--452b24dd,1,Huazhu Hotels Group,Early Stage Venture,Huazhu Hotels Group,Series A,1,,,,,,,,,,Yes,,,,Early Stage Venture,,"308,963"
2018-02-22,Left Pocket Studio is an animation company that creates animation content and products.,Left Pocket Studio,https://www.crunchbase.com/organization/left-pocket-studio,"Animation, Content, Graphic Design","Songjiang, Shanghai, China, Asia",Series B - Left Pocket Studio,https://www.crunchbase.com/funding_round/left-pocket-studio-series-b--a584757d,1,Youku,Early Stage Venture,Youku,Series B,3,20000000,CNY,3148565,,,,33000000,CNY,5025574,Yes,,http://www.leftpocketstudio.com/,,Early Stage Venture,,"309,739"
2018-04-02,Shanghai Ciyu Information Technologies develops and delivers revolutionary products with disruptive pSTT-MRAM technologies.,Shanghai Ciyu Information Technologies,https://www.crunchbase.com/organization/shanghai-ciyu-information-technologies,"Hardware, Manufacturing","Shanghai, Shanghai, China, Asia",Series B - Shanghai Ciyu Information Technologies,https://www.crunchbase.com/funding_round/shanghai-ciyu-information-technologies-series-b--f9e78718,1,Huaxi Holding,Early Stage Venture,Huaxi Holding,Series B,2,,,,,,,,,,Yes,,http://cymram.com/,,Early Stage Venture,,"309,941"
2018-03-26,Spiced duck and chicken chain brand based in Nanjing.,LuRenJia,https://www.crunchbase.com/organization/lurenjia,"Brand Marketing, Food and Beverage","Nanjing, Jiangsu, China, Asia",Series A - LuRenJia,https://www.crunchbase.com/funding_round/lurenjia-series-a--33ecbbf2,1,Tiantu Capital,Early Stage Venture,Tiantu Capital,Series A,2,15000000,USD,15000000,,,,15000000,USD,15000000,Yes,,,$1M to $10M,Early Stage Venture,,"310,154"
2018-04-20,Danqingyinghua is a cartoon and film production firm.,Danqingyinghua,https://www.crunchbase.com/organization/danqingyinghua,Film Production,"Beijing, Beijing, China, Asia",Angel Round - Danqingyinghua,https://www.crunchbase.com/funding_round/danqingyinghua-angel--701b42ce,1,iQiyi,Seed,iQiyi,Angel,1,,,,,,,,,,Yes,,,,Seed,,"310,170"
2018-03-20,ChinaStar is a human resource and outsourcing company that provides recruiting and HR consulting services.,ChinaStar,https://www.crunchbase.com/organization/chinastar,"Human Resources, Outsourcing, Recruiting","Beijing, Beijing, China, Asia",Series B - ChinaStar,https://www.crunchbase.com/funding_round/chinastar-series-b--9e9b76b4,1,Beijing Zhongmao Industrial Enterprise Management,Early Stage Venture,Beijing Zhongmao Industrial Enterprise Management,Series B,3,20000000,CNY,3157662,,,,33000000,CNY,5128812,Yes,,http://www.chinastar1.com/,$1M to $10M,Early Stage Venture,,"310,521"
2018-04-20,Reliable Assistant Computer Simulator is an emulator combined with keyboard and mouse control.,kpzs.com,https://www.crunchbase.com/organization/kpzs-com,"Apps, Information Services, Information Technology, Software","Foochow, Fujian, China, Asia",Series B - kpzs.com,https://www.crunchbase.com/funding_round/kpzs-com-series-b--9443d965,1,Huabin Venture Capital,Early Stage Venture,Huabin Venture Capital,Series B,4,20000000,CNY,3176973,,,,40300000,CNY,6349303,Yes,,http://www.kpzs.com,,Early Stage Venture,,"311,580"
2018-03-20,Dalian SkyO Technology is engaged in the development of virtual reality and augmented reality products.,Dalian SkyO Technology,https://www.crunchbase.com/organization/dalian-skyo-technology,"Augmented Reality, Information Technology, Virtual Reality","Dalian Shi, Liaoning, China, Asia",Series A - Dalian SkyO Technology,https://www.crunchbase.com/funding_round/dalian-skyo-technology-series-a--a0efec7c,1,Dalian Art College,Early Stage Venture,Dalian Art College,Series A,2,1000000,CNY,157883,,,,1157883,USD,1157883,Yes,,http://www.dlskyo.com,,Early Stage Venture,,"312,273"
2018-03-16,Tisu is a media advertising and marketing company.,Tisu,https://www.crunchbase.com/organization/tisu,"Advertising, Digital Media, Marketing","Hangzhou, Zhejiang, China, Asia",Series A - Tisu,https://www.crunchbase.com/funding_round/tisu-series-a--7eee052d,1,Shangde Heli Touzi,Early Stage Venture,Shangde Heli Touzi,Series A,2,10000000,CNY,1579380,,,,13000000,CNY,2034433,Yes,,http://www.pblab.com,,Early Stage Venture,,"312,399"
2018-03-12,Ingrem is a computer cockpit manufacturing company.,Ingrem,https://www.crunchbase.com/organization/ingrem,"Computer, Gaming, Manufacturing","Minhang, Shanghai, China, Asia",Series B - Ingrem,https://www.crunchbase.com/funding_round/ingrem-series-b--87088c75,1,Shanghai Leyu Wangluo,Early Stage Venture,Shanghai Leyu Wangluo,Series B,2,20000000,CNY,3159757,,,,30000000,CNY,4673509,Yes,,http://www.ingrem.com/,$1M to $10M,Early Stage Venture,,"312,801"
2018-04-23,"Biaotianxia provides online trademark registration, search, and trading service platform.",Biaotianxia,https://www.crunchbase.com/organization/biaotianxia,Trading Platform,"Guangzhou, Guangdong, China, Asia",Angel Round - Biaotianxia,https://www.crunchbase.com/funding_round/biaotianxia-angel--0086cb1e,1,Reading Capital,Seed,Reading Capital,Angel,1,,,,,,,,,,Yes,,http://biaotianxia.com/,,Seed,,"312,835"
2018-03-13,Anbai Technology is a cybersecurity service provider.,Anbai Technology,https://www.crunchbase.com/organization/anbai-technology,"Cloud Computing, Computer, Cyber Security, Internet","Beijing, Beijing, China, Asia",Series A - Anbai Technology,https://www.crunchbase.com/funding_round/anbai-technology-series-a--90c60007,1,Binhai,Early Stage Venture,Binhai,Series A,1,9500000,USD,9500000,,,,9500000,USD,9500000,Yes,,http://www.anbai.com,,Early Stage Venture,,"291,887"
2018-04-26,111.com.cn operates as an online portal for selling pharmaceutical products.,Yiyao,https://www.crunchbase.com/organization/yiyao,"E-Commerce, Online Portals, Pharmaceutical","Guangdong, Jilin, China, Asia",Series E - Yiyao,https://www.crunchbase.com/funding_round/yiyao-series-e--f856a1b2,1,6 Dimensions Capital,Late Stage Venture,6 Dimensions Capital,Series E,6,50000000,USD,50000000,,,,279325715,USD,279325715,Yes,,http://www.111.com.cn/,,Late Stage Venture,,"313,161"
2018-04-17,Mobile video studio based in China.,Can Video China,https://www.crunchbase.com/organization/can-video,Video,"Shanghai, Shanghai, China, Asia",Series B - Can Video China,https://www.crunchbase.com/funding_round/can-video-series-b--4c2ea46d,1,Tencent,Early Stage Venture,Tencent,Series B,1,,,,,,,,,,Yes,,,,Early Stage Venture,,"313,241"
2018-04-27,PENGYUAN CREDIT SERVICE is a credit investigation company,PENGYUAN CREDIT SERVICE CO. LTD,https://www.crunchbase.com/organization/pengyuan-credit-service-co-ltd,"Customer Service, Finance, Service Industry","Shenzhen, Guangdong, China, Asia",Series D - PENGYUAN CREDIT SERVICE CO. LTD,https://www.crunchbase.com/funding_round/pengyuan-credit-service-co-ltd-series-d--2242378a,1,Gopher Asset Management,Late Stage Venture,Gopher Asset Management,Series D,4,50000000,CNY,7895776,,,,103000000,CNY,15749561,Yes,,http://www.pycredit.cn,,Late Stage Venture,,"313,376"
2018-04-20,Marketing management system developer based in Beijing.,Weimai,https://www.crunchbase.com/organization/weimai-f8e9,Marketing,"Beijing, Beijing, China, Asia",Series A - Weimai,https://www.crunchbase.com/funding_round/weimai-f8e9-series-a--da4ff718,1,Joy Capital,Early Stage Venture,Joy Capital,Series A,1,2000000,USD,2000000,,,,2000000,USD,2000000,Yes,,http://app.weimai.com,,Early Stage Venture,,"291,975"
2018-04-11,Xptah specializes in researching and developing the inertial sensor motion capture system.,Xptah,https://www.crunchbase.com/organization/xptah,"Motion Capture, Sensor, Wearables","Nanjing, Jiangsu, China, Asia",Series B - Xptah,https://www.crunchbase.com/funding_round/xptah-series-b--301ea6c3,1,Haifeng Partners,Early Stage Venture,Haifeng Partners,Series B,3,20000000,CNY,3190072,,,,33000000,CNY,5153352,Yes,,http://www.xptah.com,,Early Stage Venture,,"314,471"
2018-03-12,Tianjin Pharmaceutical develops oral liquid products.,Tianjin Pharmaceutical,https://www.crunchbase.com/organization/tianjin-pharmaceutical,"Health Care, Medical, Pharmaceutical","Changshahsien, Hunan, China, Asia",Series C - Tianjin Pharmaceutical,https://www.crunchbase.com/funding_round/tianjin-pharmaceutical-series-c--55c1418a,1,Tianxin Shiye,Late Stage Venture,Tianxin Shiye,Series C,4,30000000,CNY,4739636,,,,63000000,CNY,9522432,Yes,,http://www.hntianjin.com/,,Late Stage Venture,,"292,004"
2018-04-16,MangoTree is a manufacturer of test and measurement products.,MangoTree,https://www.crunchbase.com/organization/mangotree,"Computer, Hardware, Manufacturing","Suzhou, Jiangsu, China, Asia",Series A - MangoTree,https://www.crunchbase.com/funding_round/mangotree-series-a--c20d4bd5,1,Eagles Fund,Early Stage Venture,Eagles Fund,Series A,2,10000000,CNY,1593245,,,,13000000,CNY,2056271,Yes,,http://www.mangotree.cn/,,Early Stage Venture,,"292,033"
2018-03-20,DataEye is a big data company that specializes in mobile advertising information analysis.,DataEye,https://www.crunchbase.com/organization/dataeye,"Advertising, Analytics, Big Data","Nanshanqu, Guangdong, China, Asia",Series D - DataEye,https://www.crunchbase.com/funding_round/dataeye-series-d--11bf68d4,1,YouAI,Late Stage Venture,YouAI,Series D,4,50000000,CNY,7894155,,,,230000000,CNY,35369224,Yes,,https://www.dataeye.com/,,Late Stage Venture,,"314,927"
2018-03-14,Rainbow Snail is a quality education solutions provider based in China.,Rainbow Snail,https://www.crunchbase.com/organization/rainbow-snail,"EdTech, Education, Information Services","Chaoyang, Liaoning, China, Asia",Series A - Rainbow Snail,https://www.crunchbase.com/funding_round/rainbow-snail-series-a--60103f0b,1,Shaolin Temple,Early Stage Venture,Shaolin Temple,Series A,1,8000000,USD,8000000,,,,8000000,USD,8000000,Yes,,http://www.mychwn.com/homemanager/home/homeViewAction.htm?nav_id=1,,Early Stage Venture,,"314,957"
2018-04-27,Automatic printing terminal and service provider based in China.,MiaoYin,https://www.crunchbase.com/organization/miaoyin,Printing,"Xiamen, Fujian, China, Asia",Corporate Round - MiaoYin,https://www.crunchbase.com/funding_round/miaoyin-corporate-round--a2f2b227,1,Ucommune,,Ucommune,Corporate Round,1,,,,,,,,,,Yes,,http://aimiaoyin.com/,,,,"314,974"
2018-04-20,Apax Group is a marketing firm that focuses on providing innovate commercial practices.,Apax Group,https://www.crunchbase.com/organization/apax-group,"Commercial, Event Management, Marketing, Tour Operator, Tourism","Jingan, Shanghai, China, Asia",Series A - Apax Group,https://www.crunchbase.com/funding_round/apax-group-series-a--bcef4e2c,1,Cultural Investment Holdings,Early Stage Venture,Cultural Investment Holdings,Series A,2,15900000,USD,15900000,,,,16500000,USD,16500000,Yes,,http://www.apaxgroup.com/#,$1M to $10M,Early Stage Venture,,"315,044"
2018-03-06,Little Adam is an English elementary education service provider company.,Little Adam,https://www.crunchbase.com/organization/little-adam,"E-Learning, Education, Language Learning","Xuhui, Shanghai, China, Asia",Seed Round - Little Adam,https://www.crunchbase.com/funding_round/little-adam-seed--0a39952f,1,IFSC,Seed,IFSC,Seed,2,1000000,CNY,158465,,,,2000000,CNY,312459,Yes,,http://www.xuexue365.com/,,Seed,,"312,562"
2018-04-23,Stars China is a neutral and open interactive new media video operation company.,Stars China,https://www.crunchbase.com/organization/stars-china,"Internet, TV, Video","Haidian, Beijing, China, Asia",Series B - Stars China,https://www.crunchbase.com/funding_round/stars-china-series-b--6f1d9ad6,1,Tvmining,Early Stage Venture,Tvmining,Series B,3,20000000,CNY,3165909,,,,33000000,CNY,5151742,Yes,,http://www.starschina.com,,Early Stage Venture,,"312,590"
2018-04-08,Zhongke Heyi is a developer of plant vaccine for agricultural production.,Zhongke Heyi,https://www.crunchbase.com/organization/zhongke-heyi,"Agriculture, Biotechnology","Dalian Shi, Liaoning, China, Asia",Seed Round - Zhongke Heyi,https://www.crunchbase.com/funding_round/zhongke-heyi-seed--2fd0d7fa,1,National SME Development Fund,Seed,National SME Development Fund,Seed,1,5000000,CNY,792412,,,,5000000,CNY,792412,Yes,,https://plantvaccine.com.cn/,,Seed,,"292,241"
2018-04-16,QC Maker Education is a creativity education solution provider.,QC Maker Education,https://www.crunchbase.com/organization/qc-maker-education,"E-Learning, EBooks, Education","Beijing, Beijing, China, Asia",Series A - QC Maker Education,https://www.crunchbase.com/funding_round/qc-maker-education-series-a--7090850d,1,Timing Group,Early Stage Venture,Timing Group,Series A,1,3800000,USD,3800000,,,,3800000,USD,3800000,Yes,,http://www.qcmaker.com/,,Early Stage Venture,,"292,260"
2018-03-29,Laozihao App is a digital platform for handicraft business.,Laozihao App,https://www.crunchbase.com/organization/laozihao-app,"Art, Handmade, Internet","Yuhang, Zhejiang, China, Asia",Series B - Laozihao App,https://www.crunchbase.com/funding_round/laozihao-app-series-b--b060163f,1,Beethink,Early Stage Venture,Beethink,Series B,2,20000000,CNY,3179701,,,,30000000,CNY,4683537,Yes,,http://www.lzhplus.com/,,Early Stage Venture,,"313,336"
2018-04-20,AppAdhoc is a A/B Testing cloud service platform.,AppAdhoc,https://www.crunchbase.com/organization/appadhoc,"Cloud Data Services, Service Industry","Beijing, Beijing, China, Asia",Series A - AppAdhoc,https://www.crunchbase.com/funding_round/appadhoc-series-a--fed9e1cd,1,ASBV,Early Stage Venture,ASBV,Series A,1,,,,,,,,,,Yes,,http://www.appadhoc.com/,,Early Stage Venture,,"292,347"
2018-04-17,Elephant Games is a game developing company.,Elephant Games,https://www.crunchbase.com/organization/elephant-games,"Gaming, Media and Entertainment","Shenzhen, Guangdong, China, Asia",Seed Round - Elephant Games,https://www.crunchbase.com/funding_round/elephant-games-seed--bdc1cdbb,1,Tencent,Seed,Tencent,Seed,1,4800000,USD,4800000,,,,4800000,USD,4800000,Yes,,http://elephant-games.am,,Seed,,"292,468"
2018-04-11,Shuwen Biotech is engaged in licensing and developing innovative diagnostic products and services for disease prevention.,Shuwen Biotech,https://www.crunchbase.com/organization/shuwen-biotech,"Biotechnology, Medical","Deqing, Zhejiang, China, Asia",Series A - Shuwen Biotech,https://www.crunchbase.com/funding_round/shuwen-biotech-series-a--6940b716,1,Tasly Pharmaceutical,Early Stage Venture,Tasly Pharmaceutical,Series A,2,,,,,,,4000000,USD,4000000,Yes,,http://www.shuwenbiotech.com/,,Early Stage Venture,,"292,578"
2018-03-15,"HyTriage is engages in research, development, production, and sales of in-vitro diagnostic reagents and inspection and analysis instruments.",HyTriage,https://www.crunchbase.com/organization/hytriage,"Health Care, Health Diagnostics, Wellness","Beijing, Beijing, China, Asia",Series B - HyTriage,https://www.crunchbase.com/funding_round/hytriage-series-b--a877149b,1,Yahui Precision Medicine Fund,Early Stage Venture,Yahui Precision Medicine Fund,Series B,2,25000000,CNY,3954664,,,,35000000,CNY,5443497,Yes,,http://www.hytriage.com/,$10M to $50M,Early Stage Venture,,"292,596"
2018-04-13,Shangxue Bang is a bigdata application service provider for Chinese schools.,Shangxue Bang,https://www.crunchbase.com/organization/shangxue-bang,"Big Data, Education, Internet","Guangzhou, Guangdong, China, Asia",Series C - Shangxue Bang,https://www.crunchbase.com/funding_round/shangxue-bang-series-c--8ba8ce53,1,Country Garden,Late Stage Venture,Country Garden,Series C,4,30000000,CNY,4780876,,,,63000000,CNY,9699365,Yes,,http://www.sxkid.com,,Late Stage Venture,,"314,027"
2018-04-28,BMHQG is a maternal and child products company.,BMHQG,https://www.crunchbase.com/organization/bmhqg,"Children, Consumer Goods, Health Care, Personal Health","Chengdu, Sichuan, China, Asia",Series B - BMHQG,https://www.crunchbase.com/funding_round/bmhqg-series-b--2d6ae837,1,Joyceland,Early Stage Venture,Joyceland,Series B,2,10000000,CNY,1579155,,,,46000000,CNY,6821304,Yes,,http://www.bmhqg.com/,$1B to $10B,Early Stage Venture,,"292,676"
2018-03-11,Mobwalker provides mobile marketing promotion services.,Mobwalker,https://www.crunchbase.com/organization/mobwalker,"Advertising, Creative Agency, Marketing","Beijing, Beijing, China, Asia",Angel Round - Mobwalker,https://www.crunchbase.com/funding_round/mobwalker-angel--471d5594,1,Hanlin Capital,Seed,Hanlin Capital,Angel,1,3000000,CNY,473859,,,,3000000,CNY,473859,Yes,,http://www.mobwalker.com/,,Seed,,"303,396"
2018-02-24,Mofiman is a provider of integrated solutions for internet of things products.,Mofiman,https://www.crunchbase.com/organization/mofiman,"Information Technology, Internet of Things, Security","Nanshanqu, Guangdong, China, Asia",Series A - Mofiman,https://www.crunchbase.com/funding_round/mofiman-series-a--193cf7b1,1,Dongtu Technology,Early Stage Venture,Dongtu Technology,Series A,1,10000000,CNY,1578158,,,,10000000,CNY,1578158,Yes,,http://www.mofiman.cn/,,Early Stage Venture,,"292,960"
2018-03-22,canguanwuyou.cn is an e-commerce platform for catering companies.,canguanwuyou.cn,https://www.crunchbase.com/organization/canguanwuyou-cn,"B2B, Catering, E-Commerce","Haidian, Beijing, China, Asia",Series B - canguanwuyou.cn,https://www.crunchbase.com/funding_round/canguanwuyou-cn-series-b--eace509c,1,Jiuyou Fund,Early Stage Venture,Jiuyou Fund,Series B,3,20000000,USD,20000000,,,,30484647,USD,30484647,Yes,,http://www.canguanwuyou.cn,,Early Stage Venture,,"303,620"
2018-04-09,Ri Yuetong is a cultural science and technology innovation enterprise.,Ri Yuetong,https://www.crunchbase.com/organization/ri-yuetong,"Apps, E-Learning, Reading Apps","Hangzhou, Zhejiang, China, Asia",Series A - Ri Yuetong,https://www.crunchbase.com/funding_round/ri-yuetong-series-a--8f9604b9,1,"Yangtze Delta Region Institute of Tsinghua University, Zhejiang",Early Stage Venture,"Yangtze Delta Region Institute of Tsinghua University, Zhejiang",Series A,3,10000000,CNY,1585490,,,,23000000,CNY,3590431,Yes,,http://www.dayread.cn,,Early Stage Venture,,"314,554"
2018-03-26,1Hulian is a domestic financial and insurance industry integrated service provider.,1Hulian,https://www.crunchbase.com/organization/1hulian,"Information Technology, Internet, Wireless","Shenzhen, Guangdong, China, Asia",Series B - 1Hulian,https://www.crunchbase.com/funding_round/1hulian-series-b--01a49e30,1,Zuoyu Capital,Early Stage Venture,Zuoyu Capital,Series B,3,20000000,CNY,3188216,,,,33000000,CNY,5137271,Yes,,http://www.1hulian.net,,Early Stage Venture,,"293,015"
2018-03-05,Ziya is an asset trading service platform based in China.,Ziya,https://www.crunchbase.com/organization/ziya,"Asset Management, Finance, Financial Services","Haidian, Beijing, China, Asia",Seed Round - Ziya,https://www.crunchbase.com/funding_round/ziya-seed--cae32233,1,GOHO AMC,Seed,GOHO AMC,Seed,1,3000000,CNY,472489,,,,3000000,CNY,472489,Yes,,http://www.ziyawang.com/,,Seed,,"314,693"
2018-04-26,Intelligent manufacturing solutions provider based in Shanghai.,Hongpu Information,https://www.crunchbase.com/organization/hongpu-information,Manufacturing,"Shanghai, Shanghai, China, Asia",Seed Round - Hongpu Information,https://www.crunchbase.com/funding_round/hongpu-information-seed--b8f0293e,1,Everland Capital,Seed,Everland Capital,Seed,1,,,,,,,,,,Yes,,https://www.hongpucorp.com/,,Seed,,"314,761"
