2018-03-20,LEAP TO CLOUD is a domestic software developer that provides enterprise-level cloud solutions.,LEAP TO CLOUD,https://www.crunchbase.com/organization/leap-to-cloud,"Computer, Enterprise, Software","Xuhui, Shanghai, China, Asia",Angel Round - LEAP TO CLOUD,https://www.crunchbase.com/funding_round/leap-to-cloud-angel--d72811e6,1,Angel Around,Seed,,Angel,1,3000000,CNY,473649,,,,3000000,CNY,473649,Yes,,http://www.leaptocloud.com/,,Seed,,"451,645"
2018-04-16,Digital currency market analysis platform based in China.,bte.top,https://www.crunchbase.com/organization/bte-top,"Financial Services, Market Research","Beijing, Beijing, China, Asia",Series A - bte.top,https://www.crunchbase.com/funding_round/bte-top-series-a--42787e91,1,SBCVC,Early Stage Venture,,Series A,1,,,,,,,,,,Yes,,http://bte.top/,,Early Stage Venture,,"454,019"
2018-03-30,GOGO STORE is a mobile coffee car franchise operator.,GOGO STORE,https://www.crunchbase.com/organization/gogo-store,Food and Beverage,"Jingan, Shanghai, China, Asia",Seed Round - GOGO STORE,https://www.crunchbase.com/funding_round/gogo-store-seed--185bbfbb,1,The Arena Capital,Seed,,Seed,1,,,,,,,,,,Yes,,http://www.gogo-store.com,,Seed,,"454,092"
2018-03-06,Deyanshe provides a social platform for its members.,Deyanshe,https://www.crunchbase.com/organization/deyanshe,"Education, Social, Social Media","Jingan, Shanghai, China, Asia",Angel Round - Deyanshe,https://www.crunchbase.com/funding_round/deyanshe-angel--3c5f93c1,1,Jiuyouque Touzi,Seed,,Angel,2,3000000,CNY,475394,,,,5000000,CNY,765434,Yes,,http://www.deyanshe.cn,,Seed,,"456,331"
2018-04-27,Yuanan Zhineng provides real-time analysis of industrial video products.,Yuanan Zhineng,https://www.crunchbase.com/organization/yuanan-zhineng,"Analytics, Software, Video","Shanghai, Shanghai, China, Asia",Series A - Yuanan Zhineng,https://www.crunchbase.com/funding_round/yuanan-zhineng-series-a--e419e7dd,1,Hefei Xinfeng Guquan Touzi,Early Stage Venture,,Series A,2,3000000,CNY,473747,,,,6000000,CNY,927197,Yes,,http://www.yuananzhineng.com,,Early Stage Venture,,"456,388"
2018-04-26,"Zhima Jiqiren is a platform for hardware robots, customer service robots, and hardware developers.",Zhima Jiqiren,https://www.crunchbase.com/organization/zhima-jiqiren,"Hardware, Information Technology, Robotics, Software","Nanjing, Jiangsu, China, Asia",Angel Round - Zhima Jiqiren,https://www.crunchbase.com/funding_round/zhima-jiqiren-angel--91ed2a4e,1,Plug and Play China,Seed,,Angel,1,3000000,CNY,473451,,,,3000000,CNY,473451,Yes,,http://www.zhimabot.com/,,Seed,,"457,067"
2018-03-30,wxiao.net provides information technology services for primary and secondary users.,wxiao.net,https://www.crunchbase.com/organization/wxiao-net,"Blockchain, Information Technology, Software","Wuhan, Hubei, China, Asia",Seed Round - wxiao.net,https://www.crunchbase.com/funding_round/wxiao-net-seed--ef8fe4aa,1,Z Ventures Group,Seed,,Seed,3,10000000,CNY,1590685,,,,15000000,CNY,2345806,Yes,,https://www.xiaolianhao.com/,,Seed,,"457,262"
2018-04-01,Smartvision provides video search and cross-lens body recognition and tracking technology services.,Smartvision,https://www.crunchbase.com/organization/smartvision,"Apps, Image Recognition, Information Technology, Security, Software","Hangzhou, Zhejiang, China, Asia",Angel Round - Smartvision,https://www.crunchbase.com/funding_round/smartvision-angel--ce1e2707,1,Zhongtian Fangwu Fund Management,Seed,,Angel,1,10000000,CNY,1591520,,,,10000000,CNY,1591520,Yes,,http://smartvision.cn/,,Seed,,"457,968"
2018-02-27,"Qimen Hudong is an advertising agency specializing in Facebook, Google, and TikTok advertisements.",Qimen Hudong,https://www.crunchbase.com/organization/qimen-hudong,"Advertising, Gaming, Mobile, Video Games","Chengdu, Sichuan, China, Asia",Angel Round - Qimen Hudong,https://www.crunchbase.com/funding_round/qimen-hudong-angel--bcdbb470,1,Beijing Feiliujiutian Technology,Seed,,Angel,1,3000000,CNY,474839,,,,3000000,CNY,474839,Yes,,http://www.aiqimen.com,,Seed,,"458,039"
2018-04-25,Jiadao offers a motor vehicle pollution prevention and control system.,Jiadao,https://www.crunchbase.com/organization/jiadao,"Automotive, Environmental Consulting, Information Services, Information Technology, Manufacturing","Haidian, Beijing, China, Asia",Series C - Jiadao,https://www.crunchbase.com/funding_round/jiadao-series-c--a2aa5baa,1,Qingxin Kongqi Lianmeng,Late Stage Venture,,Series C,4,30000000,CNY,4741634,,,,63000000,CNY,9948970,Yes,,http://www.jiadao31.com/,,Late Stage Venture,,"458,845"
2018-05-01,"iPayChat is a live stream video chat, online dating, flirting, make money online, live streaming, and live broadcasting app.",iPayChat,https://www.crunchbase.com/organization/ipaychat,"Apps, Software","Hangzhou, Zhejiang, China, Asia",Venture Round - iPayChat,https://www.crunchbase.com/funding_round/ipaychat-series-unknown--147e0417,1,SIG China (SIG Asia Investments),,,Venture - Series Unknown,1,,,,,,,,,,Yes,,http://www.ipaychat.cn/,,,,"479,527"
2018-04-20,Langcai,Langcai,https://www.crunchbase.com/organization/langcai,,"Jiangbei, Chongqing, China, Asia",Seed Round - Langcai,https://www.crunchbase.com/funding_round/langcai-seed--6a341b82,1,Tronfund,Seed,,Seed,1,,,,,,,,,,Yes,,http://www.langcai.co,,Seed,,"459,168"
2018-04-12,QIANYUE is a beauty cross-border supply chain service platform.,QIANYUE,https://www.crunchbase.com/organization/qianyue,"Beauty, Logistics, Supply Chain Management","Hangzhou, Zhejiang, China, Asia",Angel Round - QIANYUE,https://www.crunchbase.com/funding_round/qianyue-angel--7358c392,1,Hongfan Capital,Seed,,Angel,1,3000000,CNY,476811,,,,3000000,CNY,476811,Yes,,http://www.qianyuesc.com/,,Seed,,"459,653"
2018-03-06,Youchuangsite is a third-party logistics service company that provides commodity supply chain services.,Youchuangsite,https://www.crunchbase.com/organization/youchuangsite,"Logistics, Supply Chain Management, Warehousing","Xiamen, Fujian, China, Asia",Angel Round - Youchuangsite,https://www.crunchbase.com/funding_round/youchuangsite-angel--de1b0a21,1,Xiamen Science & Technology Industrial Group,Seed,,Angel,1,3000000,CNY,475394,,,,3000000,CNY,475394,Yes,,http://www.4008797956.com/,,Seed,,"459,691"
2018-03-21,Rayion is an enterprise that provides creative interactive display and scene-based marketing services.,Rayion,https://www.crunchbase.com/organization/rayion,"Home Improvement, Smart Home, Virtual Reality","Beijing, Beijing, China, Asia",Series B - Rayion,https://www.crunchbase.com/funding_round/rayion-series-b--d2b7a252,1,Jia.com,Early Stage Venture,,Series B,3,20000000,CNY,3162955,,,,43000000,CNY,6700541,Yes,,http://www.rayion.com,,Early Stage Venture,,"470,866"
2018-04-04,CEZANNE is a dairy product brand that supplies dairy products.,CEZANNE,https://www.crunchbase.com/organization/cezanne,"Agriculture, Consumer Goods, Supply Chain Management","Yinchuan, Ningxia, China, Asia",Venture Round - CEZANNE,https://www.crunchbase.com/funding_round/cezanne-series-unknown--9d39b140,1,Nestle China,,,Venture - Series Unknown,3,50000000,CNY,7931472,,,,80000000,CNY,12374126,Yes,,http://www.saishangmilk.com,,,,"460,044"
2018-04-25,Black Dog Technology provides NFC-based public transportation mobile payment and smart travel service solutions.,Heigo,https://www.crunchbase.com/organization/heigo,"Mobile Payments, Transportation, Travel","Beijing, Beijing, China, Asia",Angel Round - Heigo,https://www.crunchbase.com/funding_round/heigo-angel--fba4e677,1,JD Digits,Seed,,Angel,1,3000000,CNY,474163,,,,3000000,CNY,474163,Yes,,http://www.heigo.com.cn,,Seed,,"460,071"
2018-03-08,Bride Elysee is a wedding service provider.,BRIDE ELYSEE,https://www.crunchbase.com/organization/bride-elysee,"Event Management, Events, Wedding","Minhang, Shanghai, China, Asia",Post-IPO Equity - BRIDE ELYSEE,https://www.crunchbase.com/funding_round/bride-elysee-post-ipo-equity--8c23f6ed,1,Fortune Link,,,Post-IPO Equity,1,18000000,CNY,2837945,,,,18000000,CNY,2837945,Yes,,http://www.huajialishe.com/,,IPO,,"484,341"
2018-03-01,Lingxian is a financial platform for the agricultural sector.,Lingxian,https://www.crunchbase.com/organization/lingxian,"Agriculture, Finance, Financial Services","Shenzhen, Guangdong, China, Asia",Series B - Lingxian,https://www.crunchbase.com/funding_round/lingxian-series-b--dbc1e12e,1,9F Group,Early Stage Venture,,Series B,3,20000000,CNY,3145124,,,,34000000,CNY,5306545,Yes,,http://www.lingxianlicai.com,,Early Stage Venture,,"460,608"
2018-03-31,Clothes Make is a men's fashion customization services platform.,Clothes Make,https://www.crunchbase.com/organization/clothes-make,"E-Commerce, Fashion, Sales","Hangzhou, Zhejiang, China, Asia",Angel Round - Clothes Make,https://www.crunchbase.com/funding_round/clothes-make-angel--c95985d1,1,Hangzhou Ruide Design,Seed,,Angel,1,3000000,CNY,477198,,,,3000000,CNY,477198,Yes,,https://www.clothesmake.com.cn/,,Seed,,"460,774"
2018-03-09,DOWORLD TECHNOLOGY provide services on the application of 3D printing technology in the medical field.,DOWORLD TECHNOLOGY,https://www.crunchbase.com/organization/doworld-technology,"3D Printing, 3D Technology, Apps, Health Care, Medical","Xian Shi, Shaanxi, China, Asia",Angel Round - DOWORLD TECHNOLOGY,https://www.crunchbase.com/funding_round/doworld-technology-angel--f9b93c9d,1,Weinan ZhongshiDingcheng Touzi,Seed,,Angel,1,3000000,CNY,473835,,,,3000000,CNY,473835,Yes,,http://www.3dtt.com.cn/,,Seed,,"460,788"
2018-03-12,"Kiss Future provides cultural tourism, PAN entertainment, and cinema services.",Kiss Future,https://www.crunchbase.com/organization/kiss-future,,"Xian Shi, Shaanxi, China, Asia",Series A - Kiss Future,https://www.crunchbase.com/funding_round/kiss-future-series-a--5488bef4,1,IDG Capital,Early Stage Venture,,Series A,1,,,,,,,,,,Yes,,http://www.kissfuture.cn,,Early Stage Venture,,"471,156"
2018-03-05,Micro Communication is an internet marketing platform that provides social media marketing services.,Micro Communication,https://www.crunchbase.com/organization/wei-chuanbo,"Advertising, Digital Marketing, Marketing, Social Media Marketing","Beijing, Beijing, China, Asia",Post-IPO Equity - Micro Communication,https://www.crunchbase.com/funding_round/wei-chuanbo-post-ipo-equity--c386abbf,1,Sensegain Asset Management,,,Post-IPO Equity,4,87380000,CNY,13762039,,,,426990000,CNY,65743426,Yes,,http://www.weichuanbo.com/,,M&A,,"461,189"
2018-03-01,AISkin is an artificial intelligence company that creates skin detection products.,AISkin,https://www.crunchbase.com/organization/aiskin,"Artificial Intelligence (AI), Beauty, Information Technology","Fengxian, Shanghai, China, Asia",Angel Round - AISkin,https://www.crunchbase.com/funding_round/aiskin-angel--a2e9e620,1,Wuqiong Chuangtou,Seed,,Angel,1,3000000,CNY,471769,,,,3000000,CNY,471769,Yes,,http://www.aiskin.cn,,Seed,,"461,271"
2018-04-18,Satellite communication system developer based in Nanjing.,Neking Technology,https://www.crunchbase.com/organization/neking-technology,Satellite Communication,"Nanjing, Jiangsu, China, Asia",Angel Round - Neking Technology,https://www.crunchbase.com/funding_round/neking-technology-angel--7ad167b8,1,Vinno Capital,Seed,,Angel,1,,,,,,,,,,Yes,,,,Seed,,"471,257"
2018-04-24,ZGL is a carbon fiber bicycles and carbon fiber products manufacturer company.,ZGL,https://www.crunchbase.com/organization/zgl-china,"Cycling, Manufacturing, Sporting Goods","Lianyungang, Jiangsu, China, Asia",Post-IPO Equity - ZGL,https://www.crunchbase.com/funding_round/zgl-china-post-ipo-equity--cf1ffafd,1,Lianyungang Jinhai Chuangtou,,,Post-IPO Equity,1,4800000,CNY,761180,,,,4800000,CNY,761180,Yes,,http://www.carbonbiking.com,,IPO,,"471,477"
2018-03-01,Xmove is a mobile application for a transportation ticket booking platform.,xmove,https://www.crunchbase.com/organization/xmove,"Apps, Ticketing, Transportation","Beijing, Beijing, China, Asia",Angel Round - xmove,https://www.crunchbase.com/funding_round/xmove-angel--862e87c9,1,UTour Group,Seed,,Angel,1,3000000,CNY,471769,,,,3000000,CNY,471769,Yes,,http://www.g2rail.com,,Seed,,"461,447"
2018-03-15,Xiao Dou Mengda Youxi is an online mobile game publishing platform.,Xiao Dou Mengda Youxi,https://www.crunchbase.com/organization/xiao-dou-mengda-youxi,"Gaming, Online Games, Publishing","Beijing, Beijing, China, Asia",Angel Round - Xiao Dou Mengda Youxi,https://www.crunchbase.com/funding_round/xiao-dou-mengda-youxi-angel--ad45276b,1,Zhongshan Jinsheng,Seed,,Angel,1,3000000,CNY,474560,,,,3000000,CNY,474560,Yes,,http://www.ligugame.com/,,Seed,,"461,465"
2018-04-04,Kuaizaixuetang provides online tutoring for primary and secondary schools.,Kuaizaixuetang,https://www.crunchbase.com/organization/kuaizaixuetang,"E-Learning, Education, Training","Minhang, Shanghai, China, Asia",Series A - Kuaizaixuetang,https://www.crunchbase.com/funding_round/kuaizaixuetang-series-a--52b8f70a,1,Northern Light Venture Capital,Early Stage Venture,,Series A,2,10000000,CNY,1586294,,,,13000000,CNY,2035814,Yes,,https://www.kuaizaixuetang.com/,,Early Stage Venture,,"472,190"
2018-04-12,Huimei is a professional management agency.,Huimei,https://www.crunchbase.com/organization/huimei,"IT Management, Professional Services","Daxing, Beijing, China, Asia",Angel Round - Huimei,https://www.crunchbase.com/funding_round/huimei-angel--63e16a94,1,Daocin Capital,Seed,,Angel,1,3000000,CNY,476811,,,,3000000,CNY,476811,Yes,,http://www.hmyc365.cn/,,Seed,,"462,577"
2018-04-13,Tanwu is a digital technology platform that provides credit leasing services.,Tanwu,https://www.crunchbase.com/organization/tanwu,"Consumer, Consumer Electronics, Rental","Shenzhen, Guangdong, China, Asia",Angel Round - Tanwu,https://www.crunchbase.com/funding_round/tanwu-angel--e7bef912,1,Ant Group,Seed,,Angel,1,20000000,CNY,3187251,,,,20000000,CNY,3187251,Yes,,https://www.tanwuapp.com/#/,,Seed,,"476,386"
2018-03-09,Chao Shenghuo is a city life guide website.,Chao Shenghuo,https://www.crunchbase.com/organization/chao-shenghuo,"Digital Media, Information Services, Online Portals","Shenzhen, Guangdong, China, Asia",Post-IPO Equity - Chao Shenghuo,https://www.crunchbase.com/funding_round/chao-shenghuo-post-ipo-equity--a7ff4a25,1,Anda Capital,,,Post-IPO Equity,2,20000000,CNY,3158903,,,,41500000,CNY,6490189,Yes,,http://kdwaimai.com/,$10M to $50M,IPO,,"472,635"
2018-02-28,Wooden Wolf is a game development company specializes in storytelling games.,Wooden Wolf,https://www.crunchbase.com/organization/wooden-wolf,"Gaming, Software","Shenzhen, Guangdong, China, Asia",Angel Round - Wooden Wolf,https://www.crunchbase.com/funding_round/wooden-wolf-angel--ef999096,1,Papergames,Seed,,Angel,1,3000000,CNY,473833,,,,3000000,CNY,473833,Yes,,http://liuyanzhentan.cn,,Seed,,"464,136"
2018-03-13,Dehuo Technology is a developer of the AR panoramic simulation systems.,Dahooo,https://www.crunchbase.com/organization/dahooo,"Software, Virtual Reality","Haidian, Beijing, China, Asia",Venture Round - Dahooo,https://www.crunchbase.com/funding_round/dahooo-series-unknown--c26633e6,1,Chuangjin Ziben,,,Venture - Series Unknown,3,50000000,CNY,7909765,,,,63000000,CNY,9900621,Yes,,http://www.dahooo.com/,,,,"476,695"
2018-04-20,TOP DRAW is a mobile internet and triple play integration new media content operator.,TOP DRAW,https://www.crunchbase.com/organization/top-draw-e449,"Internet, Media and Entertainment, Mobile","Shanghai, Shanghai, China, Asia",Angel Round - TOP DRAW,https://www.crunchbase.com/funding_round/top-draw-e449-angel--151857c7,1,Binfu Capital,Seed,,Angel,1,3000000,CNY,476546,,,,3000000,CNY,476546,Yes,,http://www.topdraw.cn/,,Seed,,"472,996"
2018-03-01,"Biokangtai is a listed company integrating research, development, production and sales of biological products.",Biokangtai,https://www.crunchbase.com/organization/biokangtai,Biotechnology,"Guangdong, Jilin, China, Asia",Post-IPO Equity - Biokangtai,https://www.crunchbase.com/funding_round/biokangtai-post-ipo-equity--19eab478,1,6 Dimensions Capital,,,Post-IPO Equity,2,,,,,,,,,,Yes,,http://www.biokangtai.com,$500M to $1B,IPO,,"464,240"
2018-03-19,X Control is a developer and manufacturer of aerial vehicle control systems and drone solutions.,X Control,https://www.crunchbase.com/organization/x-control,"Aerospace, Drones, Manufacturing","Beijing, Beijing, China, Asia",Angel Round - X Control,https://www.crunchbase.com/funding_round/x-control-angel--2938962b,1,Phegda Venture Investment,Seed,,Angel,1,3000000,CNY,473670,,,,3000000,CNY,473670,Yes,,http://www.xcontrolsys.com/,,Seed,,"476,728"
2018-03-16,Kujiang is a fiction reading platform.,Kujiang.com,https://www.crunchbase.com/organization/kujiang-com,"Digital Entertainment, Internet, Media and Entertainment","Nanjing, Jiangsu, China, Asia",Series A - Kujiang.com,https://www.crunchbase.com/funding_round/kujiang-com-series-a--adf6e0b1,1,Tengxun Touzi,Early Stage Venture,,Series A,3,10000000,CNY,1579380,,,,14000000,CNY,2188737,Yes,,http://www.kujiang.com/,,Early Stage Venture,,"464,924"
2018-03-07,DERPIN is a medical care system developer company.,DEPIN,https://www.crunchbase.com/organization/derpin,"Health Care, Medical, Medical Device","Suzhou Shi, Jiangsu, China, Asia",Post-IPO Equity - DEPIN,https://www.crunchbase.com/funding_round/derpin-post-ipo-equity--64509366,1,Fortune Venture Capital,,,Post-IPO Equity,3,30000000,CNY,4742296,,,,41110000,CNY,6454904,Yes,,http://www.szdepin.com/,,IPO,,"465,080"
2018-03-10,ensenmax provides intelligent industrial gas monitoring and internet of things solutions.,ensenmax,https://www.crunchbase.com/organization/ensenmax,"Industrial, Internet of Things, Manufacturing, Sensor","Baoshan, Shanghai, China, Asia",Seed Round - ensenmax,https://www.crunchbase.com/funding_round/ensenmax-seed--26c51d28,1,Pan-Lin Capital,Seed,,Seed,2,3000000,CNY,473835,,,,6000000,CNY,923619,Yes,,http://www.ensmax.com/,,Seed,,"465,430"
2018-03-02,"Meinkind manufactures baby toys, baby car seat, baby care and bath products.",Meinkind,https://www.crunchbase.com/organization/meinkind,"Consumer Goods, Health Care, Manufacturing","Fujiang, Sichuan, China, Asia",Venture Round - Meinkind,https://www.crunchbase.com/funding_round/meinkind-series-unknown--78185ebe,1,Prometheus Capital,,,Venture - Series Unknown,1,11000000,USD,11000000,,,,11000000,USD,11000000,Yes,,http://www.meinkindbaby.com,$10M to $50M,,,"465,714"
2018-03-01,QKZJ.com is an information service media platform for blockchain industries.,QKZJ.com,https://www.crunchbase.com/organization/qkzj-com,"Blockchain, Information Services, Information Technology","Xiamen, Fujian, China, Asia",Seed Round - QKZJ.com,https://www.crunchbase.com/funding_round/qkzj-com-seed--40ac3f3a,1,Ruzhe Venture capital,Seed,,Seed,1,1000000,CNY,157256,,,,1000000,CNY,157256,Yes,,http://www.qkzj.com/,,Seed,,"474,190"
2018-04-12,ScientistIn is a technology supply-demand docking platform.,ScientistIn,https://www.crunchbase.com/organization/scientistin,"Big Data, Internet, Service Industry","Jiaxing, Zhejiang, China, Asia",Series B - ScientistIn,https://www.crunchbase.com/funding_round/scientistin-series-b--588272f6,1,TusStar,Early Stage Venture,,Series B,3,20000000,CNY,3178741,,,,33000000,CNY,5119276,Yes,,http://www.scientistin.com/,,Early Stage Venture,,"477,921"
2018-03-07,"HANGZHOU METRO is a construction, operation, and management company for rail transit projects.",HANGZHOU METRO,https://www.crunchbase.com/organization/hangzhou-metro,"Construction, Railroad, Transportation","Hangzhou, Zhejiang, China, Asia",Angel Round - HANGZHOU METRO,https://www.crunchbase.com/funding_round/hangzhou-metro-angel--f2be6a10,1,China Development Bank,Seed,,Angel,1,3000000,CNY,474230,,,,3000000,CNY,474230,Yes,,http://www.hzmetro.com/,,Seed,,"466,476"
2018-04-27,Cheshi.com is an online car buying service platform.,Cheshi.com,https://www.crunchbase.com/organization/cheshi-com,"Automotive, E-Commerce, Internet","Beijing, Beijing, China, Asia",Venture Round - Cheshi.com,https://www.crunchbase.com/funding_round/cheshi-com-series-unknown--8f1e4087,1,Industrial Securities,,,Venture - Series Unknown,1,100000000,CNY,15791552,,,,100000000,CNY,15791552,Yes,,http://www.cheshi.com/,$10M to $50M,,,"470,153"
2018-02-22,Youguang Network is a mobile game development company.,Youguang Network,https://www.crunchbase.com/organization/youguang-network,"Information Technology, Mobile, Online Games","Xuhui, Shanghai, China, Asia",Angel Round - Youguang Network,https://www.crunchbase.com/funding_round/youguang-network-angel--fc42af6b,1,Tengxun Touzi,Seed,,Angel,1,3000000,CNY,472285,,,,3000000,CNY,472285,Yes,,http://www.11h5.com/,,Seed,,"470,191"
2018-03-29,guorn.com is an investment research platform company.,guorn.com,https://www.crunchbase.com/organization/guorn-com,"E-Learning, Internet, Trading Platform","Hangzhou, Zhejiang, China, Asia",Series A - guorn.com,https://www.crunchbase.com/funding_round/guorn-com-series-a--42f69060,1,Zhejiang Ningju,Early Stage Venture,,Series A,2,10000000,CNY,1589850,,,,13000000,CNY,2074116,Yes,,https://guorn.com/,,Early Stage Venture,,"474,434"
2018-02-27,YooTnn is an online child safety education services platform in China.,YooTnn,https://www.crunchbase.com/organization/yootnn,"Child Care, Education, Online Portals","Haidian, Beijing, China, Asia",Angel Round - YooTnn,https://www.crunchbase.com/funding_round/yootnn-angel--b81d4d3d,1,Lingshi Touzi,Seed,,Angel,1,3000000,CNY,474839,,,,3000000,CNY,474839,Yes,,http://www.yootnn.com,,Seed,,"466,802"
2018-04-18,Betterlife is a bioelectric amplification and detection circuit manufacturing company.,Betterlife,https://www.crunchbase.com/organization/betterlife,"Electronics, Hardware, Manufacturing","Shenzhen, Guangdong, China, Asia",Post-IPO Equity - Betterlife,https://www.crunchbase.com/funding_round/betterlife-post-ipo-equity--cbc97ad4,1,Yuanzhi Chuang Tou,,,Post-IPO Equity,2,15000000,CNY,2390349,,,,70000000,CNY,10535842,Yes,,http://www.blestech.com,,IPO,,"478,156"
2018-03-18,Hongli Zhihui Group is a Global LED components and LED solution provider.,Hongli Zhihui Group,https://www.crunchbase.com/organization/hongli-zhihui-group,Electronics,"Guangzhou, Guangdong, China, Asia",Corporate Round - Hongli Zhihui Group,https://www.crunchbase.com/funding_round/hongli-zhihui-group-corporate-round--42566a87,1,IDG Capital,,,Corporate Round,1,455000000,CNY,71781280,,,,455000000,CNY,71781280,Yes,,http://www.honglitronic.com/,,IPO,,"470,401"
2018-03-27,Fermi Science is a child education agency focusing on developing scientific interests based in China.,Fermi Science,https://www.crunchbase.com/organization/fermi-science,"E-Learning, EdTech, Education, STEM Education","Beijing, Beijing, China, Asia",Seed Round - Fermi Science,https://www.crunchbase.com/funding_round/fermi-science-seed--daa51a5d,1,AC Accelerator,Seed,,Seed,1,,,,,,,,,,Yes,,http://old.fermiedu.com/,,Seed,,"470,538"
2018-03-26,Lurenjia Food,Lurenjia Food,https://www.crunchbase.com/organization/lurenjia-food,Food and Beverage,"Nanjing, Jiangsu, China, Asia",Series A - Lurenjia Food,https://www.crunchbase.com/funding_round/lurenjia-food-series-a--9463e126,1,Tiantu Capital,Early Stage Venture,,Series A,1,,,,,,,,,,Yes,,http://www.lurenjiafood.com,,Early Stage Venture,,"470,607"
2018-04-01,Aquarobotman is a portable underwater robot manufacturing company.,Aquarobotman,https://www.crunchbase.com/organization/aquarobotman,"Manufacturing, Marine Technology, Robotics","Shenzhen, Guangdong, China, Asia",Angel Round - Aquarobotman,https://www.crunchbase.com/funding_round/aquarobotman-angel--cd010133,1,Lingdu Capital,Seed,,Angel,1,10000000,CNY,1591520,,,,10000000,CNY,1591520,Yes,,http://www.aquarobotman.com,,Seed,,"470,717"
2018-03-27,DK-AI is an integrated online sales platform for smart home products.,DK-AI,https://www.crunchbase.com/organization/dk-ai,"Artificial Intelligence (AI), Consumer Electronics, E-Commerce, Electronic Design Automation (EDA), Sales","Shenzhen, Guangdong, China, Asia",Angel Round - DK-AI,https://www.crunchbase.com/funding_round/dk-ai-angel--a8f6a852,1,Huagao Touzi,Seed,,Angel,1,3000000,CNY,477532,,,,3000000,CNY,477532,Yes,,http://www.dk-ai.com/,,Seed,,"480,629"
2018-04-01,Shanghai DZH is a financial information service provider that focuses on financial market software development.,Shanghai DZH,https://www.crunchbase.com/organization/shanghai-dzh,"Financial Services, FinTech, Software","Pudong, Shandong, China, Asia",Series B - Shanghai DZH,https://www.crunchbase.com/funding_round/shanghai-dzh-series-b--cdab6be4,1,GSR United Capital,Early Stage Venture,,Series B,1,81000000,CNY,12891315,,,,81000000,CNY,12891315,Yes,,http://www.dzh.com.cn,,Early Stage Venture,,"477,070"
2018-04-12,stackedu.com provides future science and technology education for young children.,stackedu.com,https://www.crunchbase.com/organization/stackedu-com,"Children, E-Learning, Education","Beijing, Beijing, China, Asia",Series A - stackedu.com,https://www.crunchbase.com/funding_round/stackedu-com-series-a--5247a689,1,Chengdu Xinghui Shiye Kaifa Youxian Zeren Gongsi,Early Stage Venture,,Series A,2,10000000,CNY,1589370,,,,13000000,CNY,2021354,Yes,,https://stackedu.com/,,Early Stage Venture,,"471,709"
2018-03-20,Pitaya specializes in healthcare information technology services.,Pitaya,https://www.crunchbase.com/organization/pitaya-e683,"Health Care, Information Services, Information Technology, Medical","Guangzhou, Guangdong, China, Asia",Angel Round - Pitaya,https://www.crunchbase.com/funding_round/pitaya-e683-angel--499fcece,1,Hainan Huantai Equity Investment Fund Management,Seed,,Angel,1,3000000,CNY,473649,,,,3000000,CNY,473649,Yes,,http://www.pitaya100.com,,Seed,,"471,907"
