2023-12-01,"Wellari specialized in the research, development, and manufacture of metal 3D printing powder.",Wellari,https://www.crunchbase.com/organization/wellari,"3D Printing, Manufacturing","Xuzhou, Jiangsu, China, Asia",Series B - Wellari,https://www.crunchbase.com/funding_round/wellari-series-b--23cd9892,2,"Chengtong Mixed Reform, GOVTOR",Early Stage Venture,Chengtong Mixed Reform,Series B,2,250000000,CNY,35350279,750000000,CNY,106050837,350000000,CNY,49293974,Yes,,http://www.wllxcl.com/,,Early Stage Venture,,"70,169",
2023-09-26,NetInfo develops audio and video converged communications software.,NetInfo,https://www.crunchbase.com/organization/netinfo-7e8e,"Communications Infrastructure, Service Industry, Software","Shenzhen, Guangdong, China, Asia",Venture Round - NetInfo,https://www.crunchbase.com/funding_round/netinfo-7e8e-series-unknown--b14ac0c4,4,"Guangdong Industrial Development Fund, Haikong Tiancheng Fund, Shenzhen Investment, Xiaoxiang Zhiyi",,Guangdong Industrial Development Fund,Venture - Series Unknown,1,100000000,CNY,13676710,,,,100000000,CNY,13676710,Yes,,http://www.netinfosz.com/,,,,"70,804",
2023-09-14,Phase Change Energy Storage is an innovative utility for energy storage materials and typical chemical fibers.,Phase Change Energy Storage,https://www.crunchbase.com/organization/phase-change-energy-storage,"Advanced Materials, Energy, Manufacturing","Haidian, Beijing, China, Asia",Angel Round - Phase Change Energy Storage,https://www.crunchbase.com/funding_round/phase-change-energy-storage-angel--64c920b8,1,Founder H Fund,Seed,Founder H Fund,Angel,1,,,,,,,,,,Yes,,,,Seed,,"70,851",
2023-09-22,Gubon Semiconductor is a semiconductor and wearable smart device developer.,Gubang Semiconductor,https://www.crunchbase.com/organization/gubang-semiconductor,"Manufacturing, Semiconductor","Shenzhen, Guangdong, China, Asia",Series A - Gubang Semiconductor,https://www.crunchbase.com/funding_round/gubang-semiconductor-series-a--f85b09a4,2,"Goldport Capital, Industrial Capital",Early Stage Venture,Goldport Capital,Series A,1,,,,,,,,,,Yes,,https://www.gosemicon.com,,Early Stage Venture,,"70,890",
2023-11-10,Monte Carlo is an AI-based blockchain technology company that offers users with high-simulation agents and intelligent credit data products.,Monte Carlo,https://www.crunchbase.com/organization/monte-carlo-11aa,"Artificial Intelligence (AI), Blockchain, Internet","Changping, Beijing, China, Asia",Angel Round - Monte Carlo,https://www.crunchbase.com/funding_round/monte-carlo-11aa-angel--d9b66276,1,Youzu Interactive,Seed,Youzu Interactive,Angel,1,,,,,,,,,,Yes,,,,Seed,,"71,173",
2023-12-05,LiangLa Shuju is a one-stop travel service platform.,LiangLa Shuju,https://www.crunchbase.com/organization/liangla-shuju,"Transportation, Travel","Minhang, Shanghai, China, Asia",Venture Round - LiangLa Shuju,https://www.crunchbase.com/funding_round/liangla-shuju-series-unknown--5d924f15,1,Ruiqing No. 3 Fund,,Ruiqing No. 3 Fund,Venture - Series Unknown,3,,,,,,,50000000,CNY,7600895,Yes,,http://www.liangla.mobi/,,,1,"70,973",
2023-10-31,Tuxiaobao is committed to building a comprehensive Internet of Things platform that is both influential and comprehensive for sharing.,Tuxiaobao,https://www.crunchbase.com/organization/tuxiaobao,"Big Data, Internet of Things, Sharing Economy","Hangzhou, Zhejiang, China, Asia",Seed Round - Tuxiaobao,https://www.crunchbase.com/funding_round/tuxiaobao-seed--61764be8,1,Caigao Investment,Seed,Caigao Investment,Seed,1,10000000,CNY,1366811,,,,10000000,CNY,1366811,Yes,,http://www.tuxiaobao.net,,Seed,,"70,859",
2023-09-12,Doujin Culture is a cross-border e-commerce firm offers significant support for brands looking to expand internationally.,Doujin Culture,https://www.crunchbase.com/organization/doujin-culture,"E-Commerce, Information Services, Service Industry","Hangzhou, Zhejiang, China, Asia",Seed Round - Doujin Culture,https://www.crunchbase.com/funding_round/doujin-culture-seed--cc255a84,1,Boyu Capital,Seed,Boyu Capital,Seed,1,20000000,HKD,2555132,,,,20000000,HKD,2555132,Yes,,http://tkdoujin.cn,,Seed,,"71,010",
2023-11-23,AVIC is an emerging high-tech company specialising in artificial intelligence and service robots.,AVIC Robots,https://www.crunchbase.com/organization/avic-robots,"Aerospace, Artificial Intelligence (AI), Robotics","Xianyang, Shaanxi, China, Asia",Series B - AVIC Robots,https://www.crunchbase.com/funding_round/avic-robots-series-b--cade3a71,5,"Chunde Touzi, Cowin Capital, Fengxi Fund, Qingshi Capital, Shaanxi Capital Fund",Early Stage Venture,Cowin Capital,Series B,2,100000000,CNY,14092844,,,,100000000,CNY,14092844,Yes,,http://www.avicrobot.cn/,,Early Stage Venture,2,"70,789",
2023-10-10,Metorage is an R&D manufacturer of semiconductor storage products.,Metorage,https://www.crunchbase.com/organization/metorage,"Energy Storage, Manufacturing, Semiconductor","Shenzhen, Guangdong, China, Asia",Corporate Round - Metorage,https://www.crunchbase.com/funding_round/metorage-corporate-round--0ada0ac2,1,Eternal Asia Supply Chain Management,,Eternal Asia Supply Chain Management,Corporate Round,1,,,,,,,,,,Yes,,https://metorage.cn,,,,"71,089",
2023-10-26,Coolono Biotechnology is a biotechnology company that specializes in biosafety monitoring and animal experimental services.,Coolono Biotechnology,https://www.crunchbase.com/organization/coolono-biotechnology,"Biotechnology, Clinical Trials","Hangzhou, Zhejiang, China, Asia",Corporate Round - Coolono Biotechnology,https://www.crunchbase.com/funding_round/coolono-biotechnology-corporate-round--8de66a79,1,Shimai Pharmaceutical Group,,Shimai Pharmaceutical Group,Corporate Round,1,10000000,CNY,1366886,,,,10000000,CNY,1366886,Yes,,,,,,"70,952",
2023-10-25,Benogy is a provider of portable energy storage power supply solutions.,Benogy,https://www.crunchbase.com/organization/benogy,"Energy Storage, Power Grid, Semiconductor","Yancheng, Jiangsu, China, Asia",Corporate Round - Benogy,https://www.crunchbase.com/funding_round/benogy-corporate-round--aac2a368,1,Zhongke Tianwen,,Zhongke Tianwen,Corporate Round,1,,,,,,,,,,Yes,,https://www.guangjd.cn,,,,"70,921",
2023-12-14,Oak Heron Technology is a robotics company that specializes in the development of life-service robots.,Oak Heron Technology,https://www.crunchbase.com/organization/oak-heron-technology,Robotics,"Beijing, Beijing, China, Asia",Corporate Round - Oak Heron Technology,https://www.crunchbase.com/funding_round/oak-heron-technology-corporate-round--541704ea,1,JD.com,,JD.com,Corporate Round,1,,,,,,,,,,Yes,,https://www.robot-x.cn,,,,"71,226",
2023-12-27,Rhino Medical develops an advanced technologies with independent intellectual property rights.,Rhino Medical,https://www.crunchbase.com/organization/rhino-medical-a335,"Intellectual Property, Medical, Pharmaceutical, Product Research","Hangzhou, Zhejiang, China, Asia",Series A - Rhino Medical,https://www.crunchbase.com/funding_round/rhino-medical-a335-series-a--ba159cce,5,"Dalton Venture, Legend Capital, Prox Ventures, Taiyu Investment, Tao Capital",Early Stage Venture,Legend Capital,Series A,2,100000000,CNY,14002857,,,,100000000,CNY,14002857,Yes,,,,Early Stage Venture,5,"70,882",
2023-09-11,Aorui Bio is a biotech R&D company that combines whole genome liquid biopsy and ML tech for wireless cancer early screening technology.,Aorui Bio,https://www.crunchbase.com/organization/aorui-bio,"Biotechnology, Medical","Hangzhou, Zhejiang, China, Asia",Series B - Aorui Bio,https://www.crunchbase.com/funding_round/aorui-bio-series-b--c982a107,3,"Fortune Venture Capital, Renjing Biology, Tao Capital",Early Stage Venture,Fortune Venture Capital,Series B,2,100000000,CNY,13719303,,,,200000000,CNY,29398937,Yes,,https://www.oriomics.com/#/,,Early Stage Venture,2,"71,150",
2023-09-25,Zhonghui Laser is an emerging technology company dedicated to the development and manufacture of advanced lasers.,Zhonghui Laser,https://www.crunchbase.com/organization/zhonghui-laser,"Laser, Manufacturing","Suzhou, Jiangsu, China, Asia",Series A - Zhonghui Laser,https://www.crunchbase.com/funding_round/zhonghui-laser-series-a--84d5f9d2,3,"Fortune Venture Capital, Northern Light Venture Capital, Restone Capital",Early Stage Venture,Restone Capital,Series A,2,,,,,,,,,,Yes,,http://www.gloryphotonics.com/,,Early Stage Venture,1,"71,873",
2023-09-19,Wenji Dental Network is a O2O dental platform that offers digital solutions for diagnosis and treatment efficiency.,Wenji Dental Network,https://www.crunchbase.com/organization/wenji-dental-network,"Dental, Medical","Nanjing, Jiangsu, China, Asia",Seed Round - Wenji Dental Network,https://www.crunchbase.com/funding_round/wenji-dental-network-seed--93d40fea,1,AD-VC funds,Seed,AD-VC funds,Seed,1,200000000,CNY,27410027,,,,200000000,CNY,27410027,Yes,,,,Seed,1,"72,282",
2023-11-07,Hydrogen Aviation Technology is a hydrogen fuel cell research and development enterprise.,Hydrogen Aviation Technology,https://www.crunchbase.com/organization/hydrogen-aviation-technology,"Aerospace, Energy, Fuel Cell","Huzhou, Zhejiang, China, Asia",Series A - Hydrogen Aviation Technology,https://www.crunchbase.com/funding_round/hydrogen-aviation-technology-series-a--ff2d2ff5,3,"Hengxu Capital, Welight Capital, Xinghua Dingli",Early Stage Venture,Hengxu Capital,Series A,2,,,,,,,,,,Yes,,http://www.qinghang-tech.com/,,Early Stage Venture,,"72,549",
2023-11-22,Douxun Technology delivers digital transformation and upgrading solutions for central businesses and state-owned organizations.,Douxun Technology,https://www.crunchbase.com/organization/douxun-technology,"Service Industry, Smart Cities","Putian, Fujian, China, Asia",Series A - Douxun Technology,https://www.crunchbase.com/funding_round/douxun-technology-series-a--1a84e91a,1,Haitong Securities,Early Stage Venture,Haitong Securities,Series A,1,150000000,CNY,20963775,2850000000,CNY,398311717,150000000,CNY,20963775,Yes,,http://www.douxunkeji.com,,Early Stage Venture,,"73,294",
2023-09-15,Jieyou Popo is a Chinese fried chicken brand that combines the Internet and catering models.,Jieyou Popo,https://www.crunchbase.com/organization/jieyou-popo,"Food and Beverage, Food Delivery, Internet","Daxing, Beijing, China, Asia",Angel Round - Jieyou Popo,https://www.crunchbase.com/funding_round/jieyou-popo-angel--ea3a4e90,1,Junying Venture Capital,Seed,Junying Venture Capital,Angel,1,10000000,CNY,1374608,190000000,CNY,26117556,10000000,CNY,1374608,Yes,,,,Seed,,"73,499",
2023-09-19,"Quanteng Medical is dedicated to scientific and technological innovation that provides MRI, CT, X-ray, and other medical imaging equipments.",Quanteng Medical,https://www.crunchbase.com/organization/quanteng-medical,"Health Care, Hospital, Medical","Beijing, Beijing, China, Asia",Series C - Quanteng Medical,https://www.crunchbase.com/funding_round/quanteng-medical-series-c--44adf34c,3,"CICC Capital, Straits Equity Fund, Zhongchen Guochi",Late Stage Venture,CICC Capital,Series C,1,100000000,CNY,13705013,,,,100000000,CNY,13705013,Yes,,https://www.kuanteng.com,,Late Stage Venture,,"73,555",
2023-09-12,"Ruier Weikang focuses on the development and commercialization of brain scientific disease diagnostic, monitoring, and therapy products.",Ruier Weikang,https://www.crunchbase.com/organization/ruier-weikang,"Biotechnology, Health Care, Health Diagnostics, Medical","Hangzhou, Zhejiang, China, Asia",Seed Round - Ruier Weikang,https://www.crunchbase.com/funding_round/ruier-weikang-seed--8e8ed9a6,2,"Nuoyu Capital, Ye Huahua",Seed,Nuoyu Capital,Seed,1,,,,,,,,,,Yes,,,,Seed,1,"73,558",
2023-09-23,PixelPunk is an anti-social face-blocking selfie app.,PixelPunk,https://www.crunchbase.com/organization/pixelpunk,"Photography, Software","Changyang, Beijing, China, Asia",Seed Round - PixelPunk,https://www.crunchbase.com/funding_round/pixelpunk-seed--1ca19478,1,NetEase Capital,Seed,NetEase Capital,Seed,1,,,,,,,,,,Yes,,https://www.pixelpunk.cn,,Seed,,"73,648",
2023-09-27,Paoyunjianri is a high-tech company that offers automation solutions for factory scenarios.,Paoyunjianri,https://www.crunchbase.com/organization/paoyunjianri,"Industrial Automation, Information Technology, Manufacturing","Shenzhen, Guangdong, China, Asia",Series A - Paoyunjianri,https://www.crunchbase.com/funding_round/paoyunjianri-series-a--d82c8eed,1,Iflytek,Early Stage Venture,Iflytek,Series A,2,,,,,,,,,,Yes,,,,Early Stage Venture,,"73,632",
2023-09-20,Hutou Fried Chicken is an emerging Chinese fried chicken chain brandchain known for its unique Chaoshan Southern Milk Fried Chicken flavor.,Hutou Zha,https://www.crunchbase.com/organization/hutou-zha,"Catering, Food and Beverage, Food Processing","Xiamen, Fujian, China, Asia",Angel Round - Hutou Zha,https://www.crunchbase.com/funding_round/hutou-zha-angel--2ef9621f,1,Jiwei Ventures,Seed,Jiwei Ventures,Angel,1,140000,USD,140000,,,,140000,USD,140000,Yes,,,,Seed,,"73,523",
2023-09-20,Xinshijie specializes on lithium battery devices with energy density and safety.,Xinshijie,https://www.crunchbase.com/organization/xinshijie,"Battery, Energy, Manufacturing","Shenzhen, Guangdong, China, Asia",Seed Round - Xinshijie,https://www.crunchbase.com/funding_round/xinshijie-seed--62526991,5,"Ehang, Fenghe Capital, GL Ventures LLC, Qianhai Fund of Funds, Smart Internet Fund",Seed,GL Ventures LLC,Seed,1,100000000,CNY,13723068,,,,100000000,CNY,13723068,Yes,,,,Seed,,"73,734",
2023-09-15,Bangu Medical is a high-tech enterprise focused on offering of information system solutions for the medical supply chain industry.,Bangu Medical,https://www.crunchbase.com/organization/bangu-medical,"Information Technology, Internet of Things, Medical","Chengdu, Sichuan, China, Asia",Series A - Bangu Medical,https://www.crunchbase.com/funding_round/bangu-medical-series-a--d328e9a6,1,Lianzong Capital,Early Stage Venture,Lianzong Capital,Series A,1,,,,,,,,,,Yes,,https://www.pangu16.com/,Less than $1M,Early Stage Venture,1,"73,695",
2023-09-21,"Matrix Software is a research organization that focuses on the analysis, management, and prevention of information technology risks.",Matrix Software,https://www.crunchbase.com/organization/matrix-software-f32c,"Information Technology, Software","Jinan, Shandong, China, Asia",Venture Round - Matrix Software,https://www.crunchbase.com/funding_round/matrix-software-f32c-series-unknown--ad9cc462,1,Addor Capital,,Addor Capital,Venture - Series Unknown,1,,,,,,,,,,Yes,,https://www.matrixerp.com,,,1,"73,820",
2023-11-20,Fengweirenjian is a chain operator for community catering.,Fengweirenjian,https://www.crunchbase.com/organization/fengweirenjian,Catering,"Yubei, Chongqing, China, Asia",Seed Round - Fengweirenjian,https://www.crunchbase.com/funding_round/fengweirenjian-seed--90920313,1,Mirei Capital,Seed,Mirei Capital,Seed,1,30000000,CNY,4184918,,,,30000000,CNY,4184918,Yes,,,,Seed,,"73,774",
2023-09-15,Diallebo is a biotech company that focuses on R&D of laboratory testing products for autoimmune diseases and neurological diseases.,Diallebo,https://www.crunchbase.com/organization/diallebo,"Biotechnology, Health Diagnostics, Manufacturing","Zhangjiagang, Jiangsu, China, Asia",Series A - Diallebo,https://www.crunchbase.com/funding_round/diallebo-series-a--786f6fdc,5,"Grand Yangtze Capital, Shulan Junjie Capital, Smart Venture Capital, Zhangjiagang Jinmao Venture Capital, Zhangjiagang Talent No. 1 Fund",Early Stage Venture,Grand Yangtze Capital,Series A,1,100000000,CNY,13746082,,,,100000000,CNY,13746082,Yes,,,,Early Stage Venture,1,"73,797",
2023-10-30,Shihang Intelligent is a company that creates water robots and intelligent unmanned equipment.,Shihang Intelligent,https://www.crunchbase.com/organization/shihang-intelligent,"Manufacturing, Robotics","Fengtai, Beijing, China, Asia",Angel Round - Shihang Intelligent,https://www.crunchbase.com/funding_round/shihang-intelligent-angel--1c413773,3,"Jade Capital, Kunshan Angel Fund, ShengJing360",Seed,Kunshan Angel Fund,Angel,4,10000000,CNY,1367428,,,,10000000,CNY,1367428,Yes,,,,Seed,,"73,840",
2023-10-10,"Borg Technology is a producer of testing and micromachining tools, with an emphasis on optical and precision optical devices.",Borg Technology,https://www.crunchbase.com/organization/borg-technology-dd18,"Advanced Materials, Electronics, Manufacturing","Suzhou, Jiangsu, China, Asia",Series A - Borg Technology,https://www.crunchbase.com/funding_round/borg-technology-dd18-series-a--ef884eac,3,"CAS Star, Loongson Technology, Qianhai Fund of Funds",Early Stage Venture,CAS Star,Series A,1,50000000,CNY,6853070,,,,50000000,CNY,6853070,Yes,,,,Early Stage Venture,1,"75,243",
2023-09-24,"Sky Eagle Technology is a technology platform that offers research, development, and designing of parachute equipment and training services.",Sky Eagle Technology,https://www.crunchbase.com/organization/sky-eagle-technology,"Industrial Manufacturing, Training","Shenzhen, Guangdong, China, Asia",Series A - Sky Eagle Technology,https://www.crunchbase.com/funding_round/sky-eagle-technology-series-a--ad2acdc3,2,"Changyingxin Investment, Mengjing Investment",Early Stage Venture,,Series A,1,,,,,,,,,,Yes,,http://www.ty-equip.com/,,Early Stage Venture,,"75,362",
2023-12-06,Shiyou Keji is an animation technology services.,Shiyou Keji,https://www.crunchbase.com/organization/shiyou-keji,"Animation, Augmented Reality, Virtual Reality","Chedaogou, Beijing, China, Asia",Series B - Shiyou Keji,https://www.crunchbase.com/funding_round/shiyou-keji-series-b--d60b3f8f,4,"Brilliance Beauty, Dinosaur Park Group, Shantou Wanshun New Material, Tiandi Online",Early Stage Venture,,Series B,6,100000000,CNY,14049088,,,,233000000,CNY,33575810,Yes,,http://www.4utech.com,,Early Stage Venture,,"75,474",
2023-12-12,Xingsai Bio is a developer of single-cell analysis instruments and supporting reagents and consumables.,Xingsai Bio,https://www.crunchbase.com/organization/xingsai-bio,"Biotechnology, Health Care, Medical","Qingdao Shi, Shandong, China, Asia",Series A - Xingsai Bio,https://www.crunchbase.com/funding_round/xingsai-bio-series-a--06d199b4,2,"Haitang Fund, Hengxu Capital",Early Stage Venture,Hengxu Capital,Series A,3,100000000,CNY,13933398,,,,100000000,CNY,13933398,Yes,,http://www.singlecellbiotech.com/index.html,,,2,"75,794",
2023-09-18,Mengmo Biotech is a biopharmaceutical company that focuses onR&D of new drugs for degenerative eye diseases.,Mengmo Biotech,https://www.crunchbase.com/organization/mengmo-biotech,"Biopharma, Biotechnology, Therapeutics","Chengdu, Sichuan, China, Asia",Angel Round - Mengmo Biotech,https://www.crunchbase.com/funding_round/mengmo-biotech-angel--dce0ee22,1,Life Garden Venture capital,Seed,Life Garden Venture capital,Angel,1,,,,,,,,,,Yes,,,,Seed,1,"76,108",
2023-09-25,Chengdu Tianrui Xingtong Technology specializes in active phased array semiconductors and antennas for microwave and millimeter waves.,Chengdu Tianrui Xingtong Technology,https://www.crunchbase.com/organization/chengdu-tianrui-xingtong-technology,"Machinery Manufacturing, Manufacturing, Semiconductor","Chengdu, Sichuan, China, Asia",Venture Round - Chengdu Tianrui Xingtong Technology,https://www.crunchbase.com/funding_round/chengdu-tianrui-xingtong-technology-series-unknown--6439666f,2,"Deno Capital, DNV capital",,Deno Capital,Venture - Series Unknown,1,,,,,,,,,,Yes,,http://www.t-ray.net/Company,,,,"76,133",
2023-12-12,Langhe Medical focuses on the early diagnosis and early non-invasive interventional treatment of lung cancer.,Langhe Medical,https://www.crunchbase.com/organization/langhe-medical-5ed3,"Health Care, Health Diagnostics, Robotics","Xuhui, Shanghai, China, Asia",Series C - Langhe Medical,https://www.crunchbase.com/funding_round/langhe-medical-5ed3-series-c--42d9cbac,2,"Jiuyou Fund, Shangguo Investment Management",Late Stage Venture,"Jiuyou Fund, Shangguo Investment Management",Series C,2,100000000,CNY,13933398,,,,100000000,CNY,13933398,Yes,,http://www.lunghealth.cn,,Late Stage Venture,,"76,155",
2023-10-17,Lixin Huigan is a full-service manufacturer of sensors and an application service provider.,Lixin Huigan,https://www.crunchbase.com/organization/lixin-huigan,"Manufacturing, Semiconductor, Sensor","Changan, Shaanxi, China, Asia",Series A - Lixin Huigan,https://www.crunchbase.com/funding_round/lixin-huigan-series-a--6228770e,4,"Henan Hanwei Electronics, Qiming Venture Partners, Shaanxi Kongtian Science and Technology Angel Fund Partnership, Yizhan Capital",Early Stage Venture,"Qiming Venture Partners, Shaanxi Kongtian Science and Technology Angel Fund Partnership",Series A,1,10000000,CNY,1367484,,,,10000000,CNY,1367484,Yes,,https://sensecraft.cn,,Early Stage Venture,,"76,187",
2023-12-29,Fuhydrogen is a research and development manufacturer of proton exchange membrane products.,Fuhydrogen,https://www.crunchbase.com/organization/fuhydrogen,"Advanced Materials, Manufacturing","Suzhou, Jiangsu, China, Asia",Series A - Fuhydrogen,https://www.crunchbase.com/funding_round/fuhydrogen-series-a--5e82282b,1,Tangxing Capital,Early Stage Venture,Tangxing Capital,Series A,4,,,,,,,,,,Yes,,http://www.focus-star.net,,Early Stage Venture,,"76,495",
2023-11-21,PowerValue provides engineering experts and scientists with excellent solutions for semiconductor wafer and chip testing and verification.,PowerValue,https://www.crunchbase.com/organization/powervalue,"Semiconductor, Test and Measurement","Pudong, Shandong, China, Asia",Series A - PowerValue,https://www.crunchbase.com/funding_round/powervalue-series-a--d6c633cc,2,"Addor Capital, Zhongtian Huifu",Early Stage Venture,"Addor Capital, Zhongtian Huifu",Series A,3,,,,,,,10000000,CNY,1569711,Yes,,http://www.pwrvalue.com/,,Early Stage Venture,,"76,646",
2023-11-15,Kenweiting is a Chinese-style burger chain brand.,Kenweiting,https://www.crunchbase.com/organization/kenweiting,Food and Beverage,"Changshahsien, Hunan, China, Asia",Seed Round - Kenweiting,https://www.crunchbase.com/funding_round/kenweiting-seed--ba2c73a1,1,China Capital Investment Group,Seed,China Capital Investment Group,Seed,2,10000000,CNY,1379919,,,,10000000,CNY,1379919,Yes,,,,Seed,,"76,681",
2023-10-10,Alioth focuses on the development and application of technical products for pharmaceutical process technology.,Alioth,https://www.crunchbase.com/organization/elios-ccd0,"Biopharma, Biotechnology, Health Care, Medical, Pharmaceutical","Shanghai, Shanghai, China, Asia",Series A - Alioth,https://www.crunchbase.com/funding_round/elios-ccd0-series-a--97455aed,4,"AstraZeneca CICC Medical Industry Fund, Legend Capital, Matrix Partners China, Yi Shuishuishan",Early Stage Venture,AstraZeneca CICC Medical Industry Fund,Series A,2,100000000,CNY,13706140,,,,190000000,CNY,26285460,Yes,,https://www.aliothbio.com,,Early Stage Venture,2,"77,132",
2023-09-28,"HOKO is a manufacturer that combines the design, manufacture, marketing, and after-sales care of air purifiers.",HOKO,https://www.crunchbase.com/organization/hoko-c882,"Consumer Electronics, Electronics, Manufacturing","Guangzhou, Guangdong, China, Asia",Venture Round - HOKO,https://www.crunchbase.com/funding_round/hoko-c882-series-unknown--6d74fe8b,1,Goldport Capital,,Goldport Capital,Venture - Series Unknown,1,,,,,,,,,,Yes,,https://www.hoko-airpurifier.com,,,,"77,409",
2023-09-22,Accompany Rabbit Technology is a business platform for digital services that brings together exceptional cutting-edge business platforms.,Accompany Rabbit Technology,https://www.crunchbase.com/organization/accompany-rabbit-technology,"Information Technology, Professional Services","Guangzhou, Guangdong, China, Asia",Venture Round - Accompany Rabbit Technology,https://www.crunchbase.com/funding_round/accompany-rabbit-technology-series-unknown--a1c2aa60,1,AD-VC funds,,AD-VC funds,Venture - Series Unknown,2,100000000,CNY,13702384,,,,130000000,CNY,17874149,Yes,,https://www.runningrabbit.cn,,,,"77,335",
2023-12-22,RegenGeek is a provider of a new generation of large scale stem production technology.,RegenGeek,https://www.crunchbase.com/organization/regengeek,"Health Care, Medical, Medical Device","Shenzhen, Guangdong, China, Asia",Series A - RegenGeek,https://www.crunchbase.com/funding_round/regengeek-series-a--f662bbde,4,"China Development Institute, Goldport Capital, Haining Talent Science and Technology Innovation Group, Yang Sail Zhiyuan Industrial Investment",Early Stage Venture,"Goldport Capital, Haining Talent Science and Technology Innovation Group",Series A,2,,,,,,,,,,Yes,,http://www.regengeek.com/,,Early Stage Venture,,"77,631",
2023-09-26,Pangqi Seiko offers digital logistics services.,Pangqi Seiko,https://www.crunchbase.com/organization/pangqi-seiko,"Logistics, Warehousing","Shenzhen, Guangdong, China, Asia",Seed Round - Pangqi Seiko,https://www.crunchbase.com/funding_round/pangqi-seiko-seed--407e1ca2,3,"Fosun Capital, Guiyang Venture Capital, Zhuoyuan Capital",Seed,"Fosun Capital, Guiyang Venture Capital",Seed,2,,,,,,,,,,Yes,,https://www.pqksjd.com/,,Seed,,"77,632",
2023-10-18,Yuanyi Biotech is specialized in creating artificial microbial technology and products.,Yuanyi Biotech,https://www.crunchbase.com/organization/yuanyi-biotech,"Biotechnology, Medical, Pharmaceutical","Tianjin, Guangdong, China, Asia",Series A - Yuanyi Biotech,https://www.crunchbase.com/funding_round/yuanyi-biotech-series-a--e226c590,2,"Ruipeng Touzi, Tasly Holding Group",Early Stage Venture,"Ruipeng Touzi, Tasly Holding Group",Series A,2,100000000,CNY,13671474,,,,150000000,CNY,21538181,Yes,,http://yuanyibio.com/,,Early Stage Venture,,"77,972",
2024-01-01,Dokedoor develops a wide range of gaming software.,Dokedoor,https://www.crunchbase.com/organization/dokedoor,"Gamification, Gaming, Software","Hangzhou, Zhejiang, China, Asia",Venture Round - Dokedoor,https://www.crunchbase.com/funding_round/dokedoor-series-unknown--3d67b870,1,Dunhong Capital Management,,,Venture - Series Unknown,1,,,,,,,,,,Yes,,http://dokedoor.com/,,,,"80,495",
