2023-11-01,Wiling Medical offers extensive knowledge of the principles and clinical uses of implantable brain-computer interfaces.,Weiling Medical,https://www.crunchbase.com/organization/weiling-medical,"Medical, Medical Device, Neuroscience","Shenzhen, Guangdong, China, Asia",Angel Round - Weiling Medical,https://www.crunchbase.com/funding_round/weiling-medical-angel--794c2628,4,"CDH Investments, Gaorong Capital, Life Garden Venture capital, Qiji Investment",Seed,Gaorong Capital,Angel,2,,,,,,,10000000,CNY,1454863,Yes,,https://we-linking.com ,,Seed,4,"224,335",
2023-11-15,Gongda Laser is a industrial manufacturing company engaged in manufacturing intelligent industrial laser equipment.,Gongda Laser,https://www.crunchbase.com/organization/shenzhen-gongda-laser,"Hardware, Industrial Manufacturing, Laser, Manufacturing","Shenzhen, Guangdong, China, Asia",Series B - Gongda Laser,https://www.crunchbase.com/funding_round/shenzhen-gongda-laser-series-b--5e96a0fa,2,"Beijing Xiaomi Manufacturing Equity Investment, Lingyun Optical",Early Stage Venture,Beijing Xiaomi Manufacturing Equity Investment,Series B,3,100000000,CNY,13799194,,,,200000000,CNY,28724344,Yes,,http://www.gongdalaser.com/,,Early Stage Venture,1,"224,216",
2023-11-06,Noconda Pharmaceutical is a pharmaceutical company that specializes in development of formula foods for special medical purposes.,Noconda Pharmaceutical,https://www.crunchbase.com/organization/noconda-pharmaceutical,"Biopharma, Medical, Pharmaceutical","Beijing, Beijing, China, Asia",Secondary Market - Noconda Pharmaceutical,https://www.crunchbase.com/funding_round/noconda-pharmaceutical-secondary-market--9e1e644c,1,Keyuan Pharmaceutical,,Keyuan Pharmaceutical,Secondary Market,2,180000000,CNY,24760647,1320000000,CNY,181578079,180000000,CNY,24760647,No,,https://www.nkdpharm.com,,Private Equity,,"224,225",
2023-10-30,Shihang Intelligent is a company that creates water robots and intelligent unmanned equipment.,Shihang Intelligent,https://www.crunchbase.com/organization/shihang-intelligent,"Manufacturing, Robotics","Fengtai, Beijing, China, Asia",Debt Financing - Shihang Intelligent,https://www.crunchbase.com/funding_round/shihang-intelligent-debt-financing--0556d59e,1,Industrial and Commercial Bank of China,,Industrial and Commercial Bank of China,Debt Financing,4,,,,,,,10000000,CNY,1367428,No,,,,Seed,,"224,553",
2023-10-07,Healsun Biopharm is a Biopharmaceutical company that focuses on antibody/recombinant protein CRO/CDMO,Healsun Biopharm,https://www.crunchbase.com/organization/healsun-biopharm,"Biopharma, Biotechnology, Health Care, Pharmaceutical","Hangzhou, Zhejiang, China, Asia",Series B - Healsun Biopharm,https://www.crunchbase.com/funding_round/healsun-biopharm-series-b--dc3a8bdb,2,"China Medical System Holdings Limited, Dongfang Jiafu",Early Stage Venture,China Medical System Holdings Limited,Series B,5,200000000,CNY,27797854,,,,705000000,CNY,101278582,Yes,,http://www.hs-biopharm.com,,Early Stage Venture,,"224,854",
2023-11-17,Jincihaina New Material is a technology-based company that specializes in nanocrystalline magnetic materials and application solutions.,Jincihaina New Material,https://www.crunchbase.com/organization/jincihaina-new-material,"Advanced Materials, Industrial Manufacturing, Manufacturing","Guangzhou, Guangdong, China, Asia",Seed Round - Jincihaina New Material,https://www.crunchbase.com/funding_round/jincihaina-new-material-seed--6ccacfb9,1,Fuhai Zhongrui Fund,Seed,Fuhai Zhongrui Fund,Seed,2,,,,,,,,,,Yes,,https://www.joinchina.com.cn,,,,"225,078",
2023-09-25,Huizhi International Tourism provides digital marketing services as well as dissemination of hotel resources abroad.,Huizhi International Tourism,https://www.crunchbase.com/organization/huizhi-international-tourism,"Digital Marketing, Travel, Travel Agency","Guangzhou, Guangdong, China, Asia",Series B - Huizhi International Tourism,https://www.crunchbase.com/funding_round/huizhi-international-tourism-series-b--9a8a4de1,2,"Chengwei Capital, Enlight Growth Partners",Early Stage Venture,"Chengwei Capital, Enlight Growth Partners",Series B,2,,,,,,,100000000,CNY,13786448,Yes,,http://www.huizhi-intl.com,,Early Stage Venture,2,"226,308",
2023-10-19,Rosiwit is a robotics company that focuses on intelligent service robots to develop artificial intelligence.,Rosiwit,https://www.crunchbase.com/organization/rosiwit,"Artificial Intelligence (AI), Intelligent Systems, Robotics","Nanjing, Jiangsu, China, Asia",Seed Round - Rosiwit,https://www.crunchbase.com/funding_round/rosiwit-seed--37b9fe20,3,"Hongnuo Venture Capital, Horizon Ocean Pine Fund, Winreal Investment",Seed,"Hongnuo Venture Capital, Horizon Ocean Pine Fund, Winreal Investment",Seed,2,,,,,,,,,,Yes,,https://www.rosiwit.com,,Seed,1,"227,346",
2023-09-19,Guoke Ling Fiber focuses on technological research and industrialization of key materials for hydrogen fuel cells.,Guoke Ling Fiber,https://www.crunchbase.com/organization/guoke-ling-fiber,"Industrial Manufacturing, Manufacturing","Changzhou, Zhejiang, China, Asia",Angel Round - Guoke Ling Fiber,https://www.crunchbase.com/funding_round/guoke-ling-fiber-angel--8eafcd36,4,"Gobi Partners GBA, Phoenix Tree Capital Partners, Weichi Equity, Xiaofanzhuo",Seed,"Gobi Partners GBA, Phoenix Tree Capital Partners, Weichi Equity",Angel,2,,,,,,,,,,Yes,,,,Seed,2,"227,022",
2023-10-17,Baichuan Intelligence develops general artificial intelligence services to build large model bases.,Baichuan Intelligence,https://www.crunchbase.com/organization/baichuan-intelligence,"Artificial Intelligence (AI), Generative AI, Information Services, Software","Haidian, Beijing, China, Asia",Series A - Baichuan Intelligence,https://www.crunchbase.com/funding_round/baichuan-intelligence-series-a--a10e6af7,3,"Alibaba Group, Tencent, Xiaomi",Early Stage Venture,"Alibaba Group, Tencent, Xiaomi",Series A,3,300000000,USD,300000000,1000000000,USD,1000000000,740000000,USD,740000000,Yes,,https://www.baichuan-ai.com,,Early Stage Venture,,"226,848",
2023-09-22,Fuhydrogen is a research and development manufacturer of proton exchange membrane products.,Fuhydrogen,https://www.crunchbase.com/organization/fuhydrogen,"Advanced Materials, Manufacturing","Suzhou, Jiangsu, China, Asia",Seed Round - Fuhydrogen,https://www.crunchbase.com/funding_round/fuhydrogen-seed--eafb12a2,4,"GP Capital, SND Ventures Group, Su Venture Capital, Zhongguancun Development Frontier Enterprise Investment Fund",Seed,GP Capital,Seed,4,,,,,,,,,,Yes,,http://www.focus-star.net,,Early Stage Venture,,"228,126",
2023-10-10,Metalens is a designer and manufacturer of optical devices.,MetaLenX,https://www.crunchbase.com/organization/metalenx,Manufacturing,"Shenzhen, Guangdong, China, Asia",Series A - MetaLenX,https://www.crunchbase.com/funding_round/metalenx-series-a--c1784c41,8,"Guolian Capital, Haibang Capital, Huixin Investment, Jinfu Capital, Seas Capital, SZHTI Group, Yunshi Capital, Zhejiang Paradise",Early Stage Venture,,Series A,3,100000000,CNY,13706140,,,,210000000,CNY,28977653,Yes,,http://www.metalenx.com,,Early Stage Venture,,"229,660",
2023-12-27,Neurodome is a manufacturer of non-invasive deep brain nerve modulation technology and products.,Neurodome,https://www.crunchbase.com/organization/neurodome,"Biotechnology, Medical, Medical Device","Xian Shi, Shaanxi, China, Asia",Seed Round - Neurodome,https://www.crunchbase.com/funding_round/neurodome-seed--47bb3d19,7,"China Singapore Suzhou Industrial Park Ventures, Frees Fund, Oriza Holdings, Shaanxi Investment Capital, Shunwei Capital, Xi'an Caijin, Xi'an Talent Fund",Seed,"Oriza Holdings, Shaanxi Investment Capital",Seed,3,,,,,,,,,,Yes,,http://www.neurodome-med.com,,Early Stage Venture,4,"230,538",
2023-09-29,Chinagene Tech is an ophthalmology clinical genetic diagnosis organization,Chinagene Tech,https://www.crunchbase.com/organization/chinagene-tech,"Clinical Trials, Enterprise","Changping, Beijing, China, Asia",Venture Round - Chinagene Tech,https://www.crunchbase.com/funding_round/chinagene-tech-series-unknown--b40094a1,2,"GP Capital, Kunlun Capital",,Kunlun Capital,Venture - Series Unknown,7,,,,,,,180000000,CNY,27898628,Yes,,http://www.chinagene.cc/,,,,"230,991",
2023-09-28,Triastek is a 3D printing technology startup.,Triastek,https://www.crunchbase.com/organization/triastek,"3D Printing, Manufacturing, Pharmaceutical","Nanjing, Jiangsu, China, Asia",Series C - Triastek,https://www.crunchbase.com/funding_round/triastek-series-c--ecd22c65,3,"Goldmine Multi-family Office, Guoxin Investment, Xiaodong Zheng",Late Stage Venture,Guoxin Investment,Series C,6,150000000,CNY,20545412,,,,680000000,CNY,102401798,Yes,,https://www.triastek.com,$1M to $10M,Late Stage Venture,,"231,113",
2023-10-10,GravityXR is an XR chip developer and a terminal equipment manufacturer serving the XR (AR/VR/MR) field.,GravityXR,https://www.crunchbase.com/organization/gravityxr,"Industrial Manufacturing, Information Technology, Semiconductor, Virtual Reality","Ningbo, Zhejiang, China, Asia",Series A - GravityXR,https://www.crunchbase.com/funding_round/gravityxr-series-a--bbe67cdd,10,"37 Interactive Entertainment, China Merchants Venture Capital, Glory Ventures, Haiding Capital, HSG, miHoYo, Monolith Management, Ningbo Commerce Bank, Tongge Venture Capital, Zhongyuan Capital",Early Stage Venture,Monolith Management,Series A,4,,,,,,,,,,Yes,,https://www.gravityxr.cn/,,Early Stage Venture,3,"231,326",
2023-10-19,"Yixinshang Technology is a ESOP service provider that offers full-process equity incentive plans, professional services and SaaS solutions.",Yixinshang Technology,https://www.crunchbase.com/organization/yixinshang-technology,"Consulting, Employee Benefits, Enterprise Software, SaaS","Beijing, Beijing, China, Asia",Seed Round - Yixinshang Technology,https://www.crunchbase.com/funding_round/yixinshang-technology-seed--36f05031,3,"Sinovation Ventures, Xiaomi, Zhongguancun Science City Science",Seed,,Seed,2,,,,,,,,,,Yes,,https://www.uponeshare.com,,Seed,,"231,370",
2023-09-19,Chuguang 3D is a Optical micro-nano 3D sensor manufacturing company.,Chuguang 3D,https://www.crunchbase.com/organization/chuguang-3d,"3D Technology, Information Technology, Optical Communication, Sensor","Wuhan, Hubei, China, Asia",Angel Round - Chuguang 3D,https://www.crunchbase.com/funding_round/chuguang-3d-angel--8e686dd6,1,Frees Fund,Seed,Frees Fund,Angel,2,10000000,CNY,1370501,,,,10000000,CNY,1370501,Yes,,,,Seed,1,"231,486",
2023-10-20,Hongzheng Energy Storage focuses on technological innovation and product research & development in the field of energy storage.,Hongzheng Energy Storage,https://www.crunchbase.com/organization/hongzheng-energy-storage,"Energy, Energy Storage, Information Technology","Fengxian, Shanghai, China, Asia",Series A - Hongzheng Energy Storage,https://www.crunchbase.com/funding_round/hongzheng-energy-storage-series-a--d7271697,2,"Cowin Venture, Licheng Capital",Early Stage Venture,Licheng Capital,Series A,3,100000000,CNY,13666617,,,,200000000,CNY,27618483,Yes,,https://www.hoenergypower.cn/,,Early Stage Venture,,"231,714",
2023-10-07,Sky Limit Entertainment Group is committed to creating the ultimate immersive social entertainment experience with VR.,Skylimit Entertainment Group,https://www.crunchbase.com/organization/skylimit-entertainment-group,"Digital Entertainment, Information Technology, Media and Entertainment, Virtual Reality","Beijing, Beijing, China, Asia",Series C - Skylimit Entertainment Group,https://www.crunchbase.com/funding_round/skylimit-entertainment-group-series-c--e50a2ff4,7,"CITIC Centenary Assets, Guoke BOE, Hangzhou Industrial Investment Group, Jiahesheng Capital, NetEase, Tsinghua Holdings Capital, Weed Ventures",Late Stage Venture,,Series C,6,,,,,,,15397800,USD,15397800,Yes,,http://www.skylimit.com,$1M to $10M,Late Stage Venture,,"231,948",
2023-11-10,Laser Link is a laser communication company that focuses on development of precision optical-mechanical products for commercial aircraft.,Laser Link,https://www.crunchbase.com/organization/laser-link,"Laser, Optical Communication, Satellite Communication","Shanghai, Shanghai, China, Asia",Series A - Laser Link,https://www.crunchbase.com/funding_round/laser-link-series-a--301ec7bb,3,"Fibonacci VC, Oriza Fund of Funds, Sincere Capital",Early Stage Venture,"Fibonacci VC, Sincere Capital",Series A,5,100000000,CNY,13718174,,,,300000000,CNY,41518231,Yes,,https://laserlink.tech,,Early Stage Venture,3,"231,985",
2023-12-06,Lanzhuo is a leader in the industrial Internet platform.,Lanzhuo,https://www.crunchbase.com/organization/lanzhuo,"Android, Internet, Operating Systems, Software","Ningbo, Zhejiang, China, Asia",Venture Round - Lanzhuo,https://www.crunchbase.com/funding_round/lanzhuo-series-unknown--2edc7ac0,2,"Hangzhou Yunlan Equity Investment Partnership, Lenovo Capital and Incubator Group (LCIG)",,"Hangzhou Yunlan Equity Investment Partnership, Lenovo Capital and Incubator Group (LCIG)",Venture - Series Unknown,2,,,,,,,500000000,CNY,78777375,Yes,,https://www.supos.com/,,,,"235,713",
2023-11-07,Juna Technology is a green-tech platform that focuses on green hydrogen-advanced electrode material applications.,Juna Technology,https://www.crunchbase.com/organization/juna-technology,"Advanced Materials, GreenTech, Hydroelectric","Jiading, Shanghai, China, Asia",Seed Round - Juna Technology,https://www.crunchbase.com/funding_round/juna-technology-seed--7f735846,3,"Dongfang Jiafu, Yangtze River Innovation Investment, Zhejiang Yankon",Seed,Yangtze River Innovation Investment,Seed,2,100000000,CNY,13737962,,,,100000000,CNY,13737962,Yes,,http://www.jnh2.cn,,Seed,,"236,477",
2023-12-13,"Zling smart focuses on intelligent network connection, artificial intelligence, and mobile Internet technologies in smart cars and trains.",Zling smart,https://www.crunchbase.com/organization/zling-smart,"Automotive, Industrial, Service Industry, Software","Chengdu, Sichuan, China, Asia",Venture Round - Zling smart,https://www.crunchbase.com/funding_round/zling-smart-series-unknown--8ce85a8c,1,Shunwei Capital,,Shunwei Capital,Venture - Series Unknown,2,,,,,,,,,,Yes,,http://www.zlingsmart.com/,,,,"241,015",
2023-12-29,Dishi Medical is a company that manufactures Ophthalmic Medical Devices and other micro-assisted robots supported by biotechnology.,Dishi Medical,https://www.crunchbase.com/organization/dishi-medical,"Biotechnology, Manufacturing, Medical","Hangzhou, Zhejiang, China, Asia",Seed Round - Dishi Medical,https://www.crunchbase.com/funding_round/dishi-medical-seed--33e967ec,1,Fortune Venture Capital,Seed,Fortune Venture Capital,Seed,4,,,,,,,,,,Yes,,https://dessight.cn,,,1,"241,018",
2023-09-14,Hong Jing Drive provides a computing platform for autonomous driving vehicles.,Hong Jing Drive,https://www.crunchbase.com/organization/hong-jing-drive,"Artificial Intelligence (AI), Automotive, Autonomous Vehicles","Hangzhou, Zhejiang, China, Asia",Series B - Hong Jing Drive,https://www.crunchbase.com/funding_round/hong-jing-drive-series-b--1e867685,10,"Bojiang Capital, China Construction Bank, Classy Solid Asset Management, Dianshi Zichan, GoldStone Investment, Guolian Securities, Hefei Industry Investment Group, Prosperity7 Ventures, Sinowealth Capital, Zhongan Capital",Early Stage Venture,,Series B,10,100000000,CNY,13742493,,,,50118278,USD,50118278,Yes,,http://www.hongjingdrive.com/,,Late Stage Venture,4,"241,898",
2023-09-12,Optoxuhai is a full-spectrum technology platform offers complete set of device and module solutions based on spectral analysis & detection.,Optoxuhai,https://www.crunchbase.com/organization/optoxuhai,"Electronics, Information Technology","Xuzhou, Jiangsu, China, Asia",Series A - Optoxuhai,https://www.crunchbase.com/funding_round/optoxuhai-series-a--e735be0b,3,"Hongsheng Capital, Nanjing Chunchao Fund, Rexian Capital",Early Stage Venture,Hongsheng Capital,Series A,4,,,,,,,18000000,CNY,2622642,Yes,,http://www.optoxuhai.com/,,Early Stage Venture,,"242,132",
2023-12-19,Shaanxi Liangwei Bioengineering is a bioengineering company that offers research and development services for food and nutrition.,Shaanxi Liangwei Bioengineering,https://www.crunchbase.com/organization/shaanxi-liangwei-bioengineering,"Agriculture, AgTech, Biotechnology, Life Science","Shanxi, Fujian, China, Asia",Series A - Shaanxi Liangwei Bioengineering,https://www.crunchbase.com/funding_round/shaanxi-liangwei-bioengineering-series-a--d6381d18,4,"National Capital, Shenzhen Zhongrong Runze Asset Management, Yida China Holdings, Zhangjiagang Jinmao Venture Capital",Early Stage Venture,,Series A,3,7000000,USD,7000000,,,,14000000,USD,14000000,Yes,,https://www.lifewe.cn/,,Early Stage Venture,,"254,166",
2024-01-01,Chizhu Technology is a supplier of OEM vehicle-mounted intelligent mechanical products.,Chizhu Technology,https://www.crunchbase.com/organization/chizhu-technology,"Electronics, Mechanical Design, Supply Chain Management","Minhang, Shanghai, China, Asia",Private Equity Round - Chizhu Technology,https://www.crunchbase.com/funding_round/chizhu-technology-private-equity--6830a649,1,October Capital,Private Equity,,Private Equity,3,,,,,,,,,,Yes,,,,Private Equity,,"254,221",
2023-10-10,Jiyi Technology is a complete solution supplier for plasma applications.,Jiyi Technology,https://www.crunchbase.com/organization/jiyi-technology,"Advanced Materials, Manufacturing, Semiconductor","Minhang, Shanghai, China, Asia",Venture Round - Jiyi Technology,https://www.crunchbase.com/funding_round/jiyi-technology-series-unknown--f96da990,9,"Fortune Fountain Capital, Hefei Industry Investment Group, Jadex Capital, Jinding Capital, Shanghai Renyi, Sun Rock Capital, Tuojing Technology, Yintaihuaying, Yixin Investment",,,Venture - Series Unknown,4,,,,,,,,,,Yes,,http://www.jetplasma.com,,,1,"254,962",
2023-10-24,Zhongzhiwei Technology is a developer of collaborative network security solutions powered by artificial intelligence and machine learning.,Zhongzhiwei Technology,https://www.crunchbase.com/organization/zhongzhiwei-technology,"Artificial Intelligence (AI), Machine Learning, Security","Nanking, Jiangsu, China, Asia",Series A - Zhongzhiwei Technology,https://www.crunchbase.com/funding_round/zhongzhiwei-technology-series-a--989056fa,2,"Huashan Capital, Nanjing Innovation Capital Group",Early Stage Venture,Huashan Capital,Series A,4,,,,,,,100000000,CNY,13932428,Yes,,https://www.openxorg.com/,,Early Stage Venture,,"255,270",
2023-10-09,Rouling Technology focuses on the research of non-invasive brain-computer interface technology.,Rouling Technology,https://www.crunchbase.com/organization/rouling-technology,"Hardware, Medical, Neuroscience","Hangzhou, Zhejiang, China, Asia",Seed Round - Rouling Technology,https://www.crunchbase.com/funding_round/rouling-technology-seed--2813f7ad,2,"Blue Bay Ventures, Zhenghexiang Health Pharmacy",Seed,Blue Bay Ventures,Seed,3,,,,,,,,,,Yes,,https://www.flexolinkai.com/,,Seed,1,"255,612",
2023-09-14,Zero Data Technology is a blockchain application solution for enterprises.,Zero Data Technology,https://www.crunchbase.com/organization/zero-data-technology,Blockchain,"Shanghai, Shanghai, China, Asia",Series B - Zero Data Technology,https://www.crunchbase.com/funding_round/zero-data-technology-series-b--6ef9455e,1,Digital China Investment,Early Stage Venture,Digital China Investment,Series B,2,,,,,,,,,,Yes,,https://www.lingshu.net/index,$1M to $10M,Early Stage Venture,1,"255,635",
2023-11-05,"01.AI is developing a language model for the Chinese market that enhances productivity, creating significant economic and societal value.",01.AI,https://www.crunchbase.com/organization/01-ai,"Artificial Intelligence (AI), Information Technology, Software","Beijing, Beijing, China, Asia",Series A - 01.AI,https://www.crunchbase.com/funding_round/01-ai-series-a--ac833d85,2,"Alibaba Cloud, Sinovation Ventures",Early Stage Venture,Alibaba Cloud,Series A,2,,,,,,,,,,Yes,,https://01.ai/,$10M to $50M,,,"256,561",
2023-10-08,"Lianfeng Xunsheng is an acoustic AI detection company that focuses on manufacturing, R&D acoustic AI monitoring instruments and equipment.",Lianfeng Xunsheng,https://www.crunchbase.com/organization/lianfeng-xunsheng,"Artificial Intelligence (AI), Machinery Manufacturing","Xian, Hunan, China, Asia",Seed Round - Lianfeng Xunsheng,https://www.crunchbase.com/funding_round/lianfeng-xunsheng-seed--bfc75562,1,Xi'an Talent Fund,Seed,Xi'an Talent Fund,Seed,2,10000000,CNY,1369582,,,,20000000,CNY,2745950,Yes,,https://www.lfxstek.com,,,,"256,688",
2023-12-28,Yuewei Medical is a developer of cardiac surgery interventional medical devices.,Yuewei Medical,https://www.crunchbase.com/organization/yuewei-medical,"Health Care, Medical Device","Beijing, Beijing, China, Asia",Series A - Yuewei Medical,https://www.crunchbase.com/funding_round/yuewei-medical-series-a--3a808bb6,5,"IDG Capital, Nuoyu Capital, South China Venture Capital, Venucia Capital Holdings, Yuanhui Chuangyi",Early Stage Venture,Nuoyu Capital,Series A,3,100000000,CNY,14068655,,,,100000000,CNY,14068655,Yes,,http://yuewei.net.cn,$1M to $10M,Early Stage Venture,4,"256,642",
2023-09-25,True Talents For China (TTC) is a digital and intelligent professional talent service company.,True Talents For China (TTC),https://www.crunchbase.com/organization/true-talents-for-china-ttc,"Advice, Business Intelligence, Cloud Data Services, Professional Services, Recruiting","Beijing, Beijing, China, Asia",Seed Round - True Talents For China (TTC),https://www.crunchbase.com/funding_round/true-talents-for-china-ttc-seed--692d80b1,1,Sinovation Ventures,Seed,Sinovation Ventures,Seed,3,,,,,,,,,,Yes,,https://www.ttcadvisory.com,,Seed,,"256,778",
2023-12-21,Yiran Biotechnology is a research and development company that produces lactic acid bacteria and probiotic products.,Yiran Biotechnology,https://www.crunchbase.com/organization/yiran-biotechnology,"Agriculture, Biopharma, Biotechnology","Shijiazhuang, Hebei, China, Asia",Corporate Round - Yiran Biotechnology,https://www.crunchbase.com/funding_round/yiran-biotechnology-corporate-round--1d2c1646,1,Shijiazhuang Junlebao Dairy,,Shijiazhuang Junlebao Dairy,Corporate Round,2,,,,,,,1400000,USD,1400000,Yes,,http://www.yrsw.cn ,,,,"257,044",
2023-11-22,"Gaofu Power provides product research, product development, production, and sales services.",Gaofu Power,https://www.crunchbase.com/organization/gaofu-power-8068,Manufacturing,"Haidian, Beijing, China, Asia",Venture Round - Gaofu Power,https://www.crunchbase.com/funding_round/gaofu-power-8068-series-unknown--befed0c4,1,ZSVC,,ZSVC,Venture - Series Unknown,3,,,,,,,100000000,CNY,15709685,Yes,,http://www.hsspower.cn/,,Early Stage Venture,,"257,025",
2023-12-05,Aerofugia is a technology company with low-altitude travel and vehicle-mounted flight as its core.,Aerofugia,https://www.crunchbase.com/organization/aerofugia,"Aerospace, Service Industry, Travel","Chengdu, Sichuan, China, Asia",Series A - Aerofugia,https://www.crunchbase.com/funding_round/aerofugia-series-a--84da0ddf,7,"Airport Capital, CAS Star, Haining Hairui Investment Management, Huaxi Jinzhi Investment, Sichuan Fengyi, Tsinghua Holdings Capital, Yunsheng Capital",Early Stage Venture,CAS Star,Series A,5,,,,,,,100000000,CNY,13786068,Yes,,https://www.aerofugia.com,$1M to $10M,Early Stage Venture,,"257,104",
2023-10-19,Ruizhu Technology is focused on 3D ranging technology in the field of lidar.,Ruizhu Technology,https://www.crunchbase.com/organization/ruizhu-technology,"Automotive, Robotics, Security","Haidian, Beijing, China, Asia",Series A - Ruizhu Technology,https://www.crunchbase.com/funding_round/ruizhu-technology-series-a--0e803f37,6,"China Fortune-Tech Capital, Feitu Venture Capital, Juntong Capital, PreIPO, Qiandao Fund, Qiyu Chuangying",Early Stage Venture,China Fortune-Tech Capital,Series A,3,100000000,CNY,13675775,,,,200000000,CNY,27490410,Yes,,http://www.rayz.ai,,,,"257,093",
2024-01-03,Libei Electro-Hydraulics is a high-end hydraulic valve product R&D and manufacturer.,Libei Electro-hydraulic Technology,https://www.crunchbase.com/organization/libei-electro-hydraulic-technology,"Manufacturing, Sales, Semiconductor","Hangzhou, Zhejiang, China, Asia",Series A - Libei Electro-hydraulic Technology,https://www.crunchbase.com/funding_round/libei-electro-hydraulic-technology-series-a--b91b0bcd,1,Atom Ventures,Early Stage Venture,Atom Ventures,Series A,2,,,,,,,,,,Yes,,https://www.rebotech.cn,,,,"257,542",
2023-10-16,Rongsu Technology is a provider of metal wire feeding additive equipment and services.,Rongsu Technology,https://www.crunchbase.com/organization/rongsu-technology,"Advanced Materials, Manufacturing","Taicang, Jiangsu, China, Asia",Seed Round - Rongsu Technology,https://www.crunchbase.com/funding_round/rongsu-technology-seed--e6ab99e3,3,"FutureCap, Jiuhe Venture Capital, UnityVC",Seed,"Jiuhe Venture Capital, UnityVC",Seed,3,,,,,,,109000000,CNY,15060307,Yes,,https://www.rongsu.com,,Seed,1,"262,420",
2023-09-20,Yitong Technology is an AI integrated platform and intelligent data processing solution provider of no-code modeling automated model.,Yitong Technology,https://www.crunchbase.com/organization/yitong-technology,"Artificial Intelligence (AI), Software, Software Engineering","Shenzhen, Guangdong, China, Asia",Series A - Yitong Technology,https://www.crunchbase.com/funding_round/yitong-technology-series-a--933a9e68,4,"CITIC Capital Holdings, GP Capital, Rongyu Venture Capital, Zhuoyuan Capital",Early Stage Venture,"CITIC Capital Holdings, GP Capital",Series A,7,100000000,CNY,13723068,,,,149003000,CNY,21051875,Yes,,https://www.apulis.cn/,,,3,"264,667",
