2024-07-08,Shanghai Sulfur Yuan is a manufacturer of innovative energy materials and efficient batteries.,Shanghai Sulfur Yuan,https://www.crunchbase.com/organization/shanghai-sulfur-yuan,"Advanced Materials, Battery, Energy","Minhang, Shanghai, China, Asia",Seed Round - Shanghai Sulfur Yuan,https://www.crunchbase.com/funding_round/shanghai-sulfur-yuan-seed--09e20320,2,"CAS Star, Gezhi Asset Management",Seed,CAS Star,Seed,1,,,,,,,,,,Yes,,,,Seed,2,"25,261",
2024-07-22,"Polycent, a company with expertise in power technology, industrial control, data intelligence, and FPGA, develops digital power solutions.",Polycent,https://www.crunchbase.com/organization/polycent,"Electronics, Manufacturing","Huangpu, Shanghai, China, Asia",Seed Round - Polycent,https://www.crunchbase.com/funding_round/polycent-seed--f35cf187,1,Frees Fund,Seed,Frees Fund,Seed,1,,,,,,,,,,Yes,,https://www.huadong-china.com,,Seed,1,"25,278",
2024-10-31,"Color Tech is a company specialized in the research and development, manufacturing, and sales of semi-solid battery electrolytes.",Color Tech,https://www.crunchbase.com/organization/color-tech,"Battery, Manufacturing","Hefei, Anhui, China, Asia",Seed Round - Color Tech,https://www.crunchbase.com/funding_round/color-tech-seed--746b7c55,1,Cowin Capital,Seed,Cowin Capital,Seed,1,,,,,,,,,,Yes,,,,Seed,,"25,407",
2024-07-29,"New Vision Electronics engages in windshield HUD and intelligent vehicle equipment R & D, production and sales.",New Vision Electronics,https://www.crunchbase.com/organization/new-vision-electronics,"Automotive, Electronics, Manufacturing","Yizheng, Jiangsu, China, Asia",Venture Round - New Vision Electronics,https://www.crunchbase.com/funding_round/new-vision-electronics-series-unknown--0fd5f617,2,"Bridge Capital China, CVC Zhongqing Capital",,CVC Zhongqing Capital,Venture - Series Unknown,4,,,,,,,55767850,USD,55767850,Yes,,http://www.zjautomotive.com/,,,,"25,431",
2024-07-11,"Ligu Renewable Energy is a renewable energy company that provides organic liquid hydrogen storage, transportation and renewable solutions.",Ligu Renewable Energy,https://www.crunchbase.com/organization/ligu-renewable-energy,"Energy Storage, Hydroelectric, Renewable Energy","Hefei, Anhui, China, Asia",Seed Round - Ligu Renewable Energy,https://www.crunchbase.com/funding_round/ligu-renewable-energy-seed--7ba46bdb,2,"K2VC, Ying Capital",Seed,Ying Capital,Seed,1,,,,,,,,,,Yes,,,,Seed,,"25,442",
2024-08-02,The Prospective Innovation Institute is a technological achievement transformation service provider,Prospective Innovation Institute,https://www.crunchbase.com/organization/prospective-innovation-institute,"Information Services, Service Industry","Minhang, Shanghai, China, Asia",Venture Round - Prospective Innovation Institute,https://www.crunchbase.com/funding_round/prospective-innovation-institute-series-unknown--15c187ab,1,Shanghai STVC Group,,Shanghai STVC Group,Venture - Series Unknown,1,5000000,CNY,698402,,,,5000000,CNY,698402,Yes,,,,,,"25,434",
2024-11-05,Haoli Technology is a developer of microfluidic production chips.,Haoli Technology,https://www.crunchbase.com/organization/haoli-technology,"Electronics, Manufacturing, Semiconductor","Hangzhou, Zhejiang, China, Asia",Seed Round - Haoli Technology,https://www.crunchbase.com/funding_round/haoli-technology-seed--c334ad7c,2,"Deshi Capital, GSR United Capital",Seed,Deshi Capital,Seed,2,,,,,,,,,,Yes,,http://haolitech.com/,,Seed,2,"25,529",
2024-06-04,Rainbow Star provides agricultural products and food for children in China.,Rainbow Star,https://www.crunchbase.com/organization/rainbow-star,"Agriculture, AgTech, Farming","Xian Shi, Shaanxi, China, Asia",Series B - Rainbow Star,https://www.crunchbase.com/funding_round/rainbow-star-series-b--cf08a023,1,Initiate capital,Early Stage Venture,Initiate capital,Series B,2,,,,,,,,,,Yes,,https://caihongxingqiu.com/,$10M to $50M,Early Stage Venture,,"25,557",
2024-09-25,Falcon Technology builds consumer-grade AR ecosystem and provides users with high-quality AR products and services.,Falcon Technology,https://www.crunchbase.com/organization/falcon-technology,"Augmented Reality, Online Portals, Virtual Reality","Shenzhen, Guangdong, China, Asia",Series B - Falcon Technology,https://www.crunchbase.com/funding_round/falcon-technology-series-b--f58a291d,3,"Jiaxing Nanhu Keying, Wuxi Huikai Zhenghe, Wuxi Huishan Science and Technology Innovation Industry Group",Early Stage Venture,,Series B,5,,,,,,,200000000,CNY,28318264,Yes,,https://www.rayneo.cn,,Early Stage Venture,3,"25,625",
2024-07-17,Bangke Intelligent is an intelligent solutions company that specializes in the development of large language model products and solutions.,Bangke Intelligent,https://www.crunchbase.com/organization/bangke-intelligent,"Artificial Intelligence (AI), Business Intelligence, Developer Tools","Beijing, Beijing, China, Asia",Corporate Round - Bangke Intelligent,https://www.crunchbase.com/funding_round/bangke-intelligent-corporate-round--a4165d9a,1,Tansun,,Tansun,Corporate Round,1,120000000,CNY,16528015,1380000000,CNY,190072172,120000000,CNY,16528015,Yes,,,,,,"25,633",
2024-08-12,"MoreVFX provides visual effects for film, TV series, and animation production.",MoreVFX,https://www.crunchbase.com/organization/morevfx,"Animation, Film Production, TV Production","Beijing, Beijing, China, Asia",Corporate Round - MoreVFX,https://www.crunchbase.com/funding_round/morevfx-corporate-round--10a7355a,1,Dengfeng International,,Dengfeng International,Corporate Round,2,,,,,,,10000000,CNY,1539338,Yes,,http://www.morevfx.com/,,,,"25,640",
2024-07-23,Kangfude Pharmaceutical is a pharmaceutical company that specializes in the development and manufacturing of cytotoxic anti-tumor APIs.,Kangfude Pharmaceutical,https://www.crunchbase.com/organization/kangfude-pharmaceutical,"Biopharma, Medical, Pharmaceutical","Banan, Chongqing, China, Asia",Series A - Kangfude Pharmaceutical,https://www.crunchbase.com/funding_round/kangfude-pharmaceutical-series-a--5345a260,1,Shanghai Desano Pharmaceuticals Investment,Early Stage Venture,Shanghai Desano Pharmaceuticals Investment,Series A,1,120000000,CNY,16494165,,,,120000000,CNY,16494165,Yes,,,,Early Stage Venture,,"25,669",
2024-07-24,Metrono is a manufacturer of cable and optical cable that provides high-performance rail transit special cables solutions.,Metrono,https://www.crunchbase.com/organization/metrono,"Freight Service, Manufacturing, Railroad","Maanshan, Anhui, China, Asia",Venture Round - Metrono,https://www.crunchbase.com/funding_round/metrono-series-unknown--fa3a15f8,1,Co-Stone Venture Capital,,Co-Stone Venture Capital,Venture - Series Unknown,1,20000000,CNY,2753986,,,,20000000,CNY,2753986,Yes,,http://mbcavi.cn,,,,"25,680",
2024-06-22,Alpha Biophama is a clinical stage biopharmaceutical company.,Alpha Biopharma,https://www.crunchbase.com/organization/alpha-biopharm,"Biopharma, Health Care, Therapeutics","Huangpu, Shanghai, China, Asia",Series B - Alpha Biopharma,https://www.crunchbase.com/funding_round/alpha-biopharm-series-b--4fe57be6,1,Qiming Venture Partners,Early Stage Venture,,Series B,4,23880000,USD,23880000,,,,93880000,USD,93880000,Yes,,https://www.alphabiopharma.com,$10M to $50M,Early Stage Venture,1,"25,721",
2024-08-09,Xiaoyi is a research and development manufacturer of smart pet products.,Xiaoyi,https://www.crunchbase.com/organization/xiaoyi-04d4,"Clinical Trials, Lifestyle, Manufacturing, Pet","Jiangdu, Zhejiang, China, Asia",Series B - Xiaoyi,https://www.crunchbase.com/funding_round/xiaoyi-04d4-series-b--7154dc53,1,Jinding Capital,Early Stage Venture,Jinding Capital,Series B,2,100000000,CNY,13953423,,,,100000000,CNY,13953423,Yes,,http://www.elspet.cn/,,Early Stage Venture,,"25,729",
2024-07-13,"Shala Shike is a supply chain technology company that focuses on catering, dining, cold chain distribution, and unmanned machine sales.",Shala Shike,https://www.crunchbase.com/organization/shala-shike,"Catering, Food and Beverage, Supply Chain Management","Daojiao, Guangdong, China, Asia",Series A - Shala Shike,https://www.crunchbase.com/funding_round/shala-shike-series-a--df5e0936,1,Plum Ventures,Early Stage Venture,Plum Ventures,Series A,2,50000000,CNY,6896171,,,,150000000,CNY,20895107,Yes,,https://www.shalashike.com,,Early Stage Venture,1,"25,738",
2024-09-30,Tachem is a research and development manufacturer of protected amino acid series products.,Tachem,https://www.crunchbase.com/organization/tachem,"Biotechnology, Health Care, Medical","Zigong, Sichuan, China, Asia",Series B - Tachem,https://www.crunchbase.com/funding_round/tachem-series-b--2bfe11a1,1,Qiming Venture Partners,Early Stage Venture,,Series B,3,65000000,CNY,9261766,,,,565000000,CNY,79052467,Yes,,https://www.cdthchem.com/,,Early Stage Venture,1,"25,745",
2024-06-25,Aichang New Energy is a developer of third-generation micro-string inverter technology.,Aichang New Energy,https://www.crunchbase.com/organization/aichang-new-energy,"Energy, Energy Storage, Manufacturing","Suzhou, Jiangsu, China, Asia",Seed Round - Aichang New Energy,https://www.crunchbase.com/funding_round/aichang-new-energy-seed--15a516ec,1,Edge Ventures,Seed,Edge Ventures,Seed,2,,,,,,,,,,Yes,,http://www.advansol-power.com,,Seed,,"25,794",
2024-08-10,Zhideyuanjian is a medical group company specializing in precision ophthalmology diagnosis and treatment.,Zhideyuanjian,https://www.crunchbase.com/organization/zhideyuanjian,"Health Care, Health Diagnostics, Medical","Wuxi Shi, Jiangsu, China, Asia",Series A - Zhideyuanjian,https://www.crunchbase.com/funding_round/zhideyuanjian-series-a--fe811f52,3,"Beijing Medical and Health Industry Investment Fund, Shunchuang Industrial Investment Management Fund, Shunxi Fund",Early Stage Venture,Beijing Medical and Health Industry Investment Fund,Series A,1,100000000,CNY,13953423,,,,100000000,CNY,13953423,Yes,,https://www.bio-zdmc.com,,Early Stage Venture,,"25,796",
2024-07-15,Fanmi Tech is an auto financial services platform that provides car owners and companies with auto finance and loan solutions.,Fanmi Tech,https://www.crunchbase.com/organization/fanmi-tech,"Credit, Finance, Financial Services, FinTech","Hefei, Anhui, China, Asia",Seed Round - Fanmi Tech,https://www.crunchbase.com/funding_round/fanmi-tech-seed--a41c6ae2,1,Dongyang Zhongrui Industrial,Seed,Dongyang Zhongrui Industrial,Seed,1,100000000,CNY,13774294,,,,100000000,CNY,13774294,Yes,,,,Seed,,"25,894",
2024-08-01,"Feiduwei specializes on the research and development of mixed digital and analog circuits, including signal chain and power-related chips.",Feiduwei,https://www.crunchbase.com/organization/feiduwei,"Automotive, Electronics","Guangdong, Jilin, China, Asia",Angel Round - Feiduwei,https://www.crunchbase.com/funding_round/feiduwei-angel--e9a1fa36,3,"Beyond Capital, Cowin Capital, Delta Capital",Seed,,Angel,1,,,,,,,,,,Yes,,,,Seed,,"25,884",
2024-07-20,Ruijiming Biological is a biotech company that specializes in the development and production of regenerative medicine raw materials.,Ruijiming Biological,https://www.crunchbase.com/organization/ruijiming-biological,"Biopharma, Biotechnology, Medical","Shandong, Fujian, China, Asia",Series A - Ruijiming Biological,https://www.crunchbase.com/funding_round/ruijiming-biological-series-a--f468968e,2,"Huiyu Private Equity Fund Management, S'Young",Early Stage Venture,Huiyu Private Equity Fund Management,Series A,1,,,,,,,,,,Yes,,http://www.mgpdrn.cn,,Early Stage Venture,,"25,984",
2024-07-25,Qingjianting Technology is a company that specializes in the development of overall solutions for advanced thin film deposition technology.,Qingjianting Technology,https://www.crunchbase.com/organization/qingjianting-technology,"Advanced Materials, Electronics, Manufacturing","Shanghai, Shanghai, China, Asia",Seed Round - Qingjianting Technology,https://www.crunchbase.com/funding_round/qingjianting-technology-seed--a437bb85,1,Endeavor Fund,Seed,Endeavor Fund,Seed,1,,,,,,,,,,Yes,,,,Seed,,"25,986",
2024-08-13,Jing Yue Rong is a restaurant brands operating company.,Jing Yue Rong,https://www.crunchbase.com/organization/jing-yue-rong,"Customer Service, Food and Beverage, Restaurants","Xuhui, Shanghai, China, Asia",Series A - Jing Yue Rong,https://www.crunchbase.com/funding_round/jing-yue-rong-series-a--e322b1a7,1,Charisma Partners,Early Stage Venture,,Series A,3,2810000,USD,2810000,,,,6220993,USD,6220993,Yes,,http://www.jyrong.com/,,Early Stage Venture,,"25,979",
2024-06-06,"Chengdu Pukang Biotechnology Co., Ltd develops and supplies PEG derivatives, polypeptide drug side chains, and intermediates.",Chengdu Pukang Biotechnology Co.,https://www.crunchbase.com/organization/chengdu-pukang-biotechnology-co,"Biotechnology, Chemical, Pharmaceutical","Chengdu, Sichuan, China, Asia",Series B - Chengdu Pukang Biotechnology Co.,https://www.crunchbase.com/funding_round/chengdu-pukang-biotechnology-co-series-b--3b047696,5,"Grand Yangtze Capital, Hillhouse Ventures, Huimei Capital, IDG Capital, Mirae Asset Venture Investment",Early Stage Venture,"IDG Capital, Mirae Asset Venture Investment",Series B,1,,,,,,,,,,Yes,,https://www.pu-kang.com,Less than $1M,Early Stage Venture,,"26,104",
2024-08-15,Dilberg is a heavy industrial intelligent robot enterprise with algorithms for analyzing point cloud data and designing robot trajectories.,Dilberg,https://www.crunchbase.com/organization/dilberg,"Information Technology, Robotics, Software","Shenzhen, Guangdong, China, Asia",Seed Round - Dilberg,https://www.crunchbase.com/funding_round/dilberg-seed--f63bf9de,2,"Hua Capital, TopoScend Capital",Seed,Hua Capital,Seed,2,,,,,,,,,,Yes,,https://www.darerobot.com,,Seed,2,"26,136",
2024-07-15,Qingyan Haolong New Energy offers PTC heating film products.,Qingyan Haolong New Energy,https://www.crunchbase.com/organization/qingyan-haolong-new-energy,"Battery, Energy, Manufacturing","Shenzhen, Guangdong, China, Asia",Series A - Qingyan Haolong New Energy,https://www.crunchbase.com/funding_round/qingyan-haolong-new-energy-series-a--6687f21f,1,Co-Stone Venture Capital,Early Stage Venture,Co-Stone Venture Capital,Series A,1,,,,,,,,,,Yes,,http://www.qingyanhaolong.com,,Early Stage Venture,,"26,144",
2024-08-02,Runbo Technology specializes in providing industrial product testing services.,Runbo Technology,https://www.crunchbase.com/organization/runbo-technology,"Infrastructure, Manufacturing","Chengdu, Sichuan, China, Asia",Venture Round - Runbo Technology,https://www.crunchbase.com/funding_round/runbo-technology-series-unknown--d15e1320,1,Western Capital,,Western Capital,Venture - Series Unknown,1,,,,,,,,,,Yes,,http://www.cdrbkj.com,,,,"26,151",
2024-07-12,LONGi Hydrogen Energy specializes in providing water electrolysis hydrogen production equipment and solutions.,LONGi Hydrogen Energy,https://www.crunchbase.com/organization/longi-hydrogen-energy,"Energy, Energy Efficiency, Renewable Energy","Xian Shi, Shaanxi, China, Asia",Series A - LONGi Hydrogen Energy,https://www.crunchbase.com/funding_round/longi-hydrogen-energy-series-a--4f9439a1,6,"GF Xinde Investment Management, Hidden Hill Capital, Rosefinch Investment, Shaanxi Capital Fund, Xuqiangrui Clean Energy, Yonghua Capital",Early Stage Venture,,Series A,1,1000000000,CNY,137923425,9000000000,CNY,1241310824,1000000000,CNY,137923425,Yes,,https://www.longi.com/en/products/hydrogen,$10B+,Early Stage Venture,,"26,153",
2024-08-05,"Addy Gene is a gene editing technology firm that specializes in CRISPR/Cas research, development, services, and industrialization.",Addygene,https://www.crunchbase.com/organization/addygene,"Medical, Pharmaceutical","Guangzhou, Guangdong, China, Asia",Seed Round - Addygene,https://www.crunchbase.com/funding_round/addygene-seed--8a157000,3,"GreatWall Fund, Yanghe Touzi, Zhongda Venture Capital",Seed,,Seed,1,10000000,CNY,1404258,,,,10000000,CNY,1404258,Yes,,https://www.edgene.cn,,Seed,,"26,226",
2024-08-02,"Qianjifang Medicine is a pharmaceutical company that is involved in the research, development, and production of mulberry mushroom strains.",Qianjifang Medicine,https://www.crunchbase.com/organization/qianjifang-medicine,"AgTech, Pharmaceutical, Retail","Hangzhou, Zhejiang, China, Asia",Seed Round - Qianjifang Medicine,https://www.crunchbase.com/funding_round/qianjifang-medicine-seed--e6937555,1,Sunbow Capital,Seed,,Seed,1,140000,USD,140000,,,,140000,USD,140000,Yes,,https://www.qjfhealth.com/,,Seed,,"26,277",
2024-07-15,Yuanqi Semiconductor generates and manufactures semiconductor device-specific equipment.,Yuanqi Semiconductor,https://www.crunchbase.com/organization/yuanqi-semiconductor,"Application Specific Integrated Circuit (ASIC), Electronic Design Automation (EDA), Semiconductor","Hangzhou, Zhejiang, China, Asia",Series A - Yuanqi Semiconductor,https://www.crunchbase.com/funding_round/yuanqi-semiconductor-series-a--a18fa567,2,"Guangdong Aofei Data Technology, Wenming Investment",Early Stage Venture,,Series A,1,,,,,,,,,,Yes,,,,Early Stage Venture,,"26,288",
2024-08-17,Jusai Pump Industry offers various pump products.,Jusai Pump Industry,https://www.crunchbase.com/organization/jusai-pump-industry,"Automotive, Machinery Manufacturing, Mechanical Design","Yueyang, Hunan, China, Asia",Seed Round - Jusai Pump Industry,https://www.crunchbase.com/funding_round/jusai-pump-industry-seed--d64a4453,1,China Great Wall Asset Management,Seed,China Great Wall Asset Management,Seed,1,,,,,,,,,,Yes,,,,Seed,,"26,338",
2024-07-11,Kunteng Tech develops auxiliary drives for electric and hybrid passenger vehicles.,Kunteng Tech,https://www.crunchbase.com/organization/kunteng-tech,"Automotive, Machinery Manufacturing, Manufacturing","Chengdu, Sichuan, China, Asia",Seed Round - Kunteng Tech,https://www.crunchbase.com/funding_round/kunteng-tech-seed--60113722,5,"Chengdu High-tech Ceyuan Capital, Chengdu Science and Technology Venture Capital, Innoangel Fund, Pan-Lin Capital, Parkland Group",Seed,,Seed,1,,,,,,,,,,Yes,,https://www.quantentech.com,,Seed,,"26,367",
2024-07-24,Huizhi High-end Engineering Machinery Innovation Center provides technical services in the fields of engineering and agricultural machinery.,Huizhi High-end Engineering Machinery Innovation Center,https://www.crunchbase.com/organization/huizhi-high-end-engineering-machinery-innovation-center,"Industrial Engineering, Innovation Management, Machinery Manufacturing","Xuzhou, Jiangsu, China, Asia",Corporate Round - Huizhi High-end Engineering Machinery Innovation Center,https://www.crunchbase.com/funding_round/huizhi-high-end-engineering-machinery-innovation-center-corporate-round--aa4f726f,4,"BAOSTEEL, FinDreams Battery, Jiangsu Hengli Hydraulic, Yantai Eddie Precision Machinery",,,Corporate Round,1,,,,,,,,,,Yes,,,,,,"26,388",
2024-07-09,Juxie Intelligent is an intelligent technology company that specializes in the development and production of harmonic reducers.,Juxie Intelligent,https://www.crunchbase.com/organization/juxie-intelligent,"Intelligent Systems, Manufacturing, Mechanical Engineering","Wuxi Shi, Jiangsu, China, Asia",Venture Round - Juxie Intelligent,https://www.crunchbase.com/funding_round/juxie-intelligent-series-unknown--ff292e4c,2,"Hexi Group, Nanjing Innovation Capital Group",,Nanjing Innovation Capital Group,Venture - Series Unknown,1,,,,,,,,,,Yes,,https://juxiedrive.com,,,1,"26,449",
2024-08-01,Yixin Display is a display screen device producer.,Yixin Display,https://www.crunchbase.com/organization/yixin-display,"Computer, Manufacturing","Guangxi, Jiangsu, China, Asia",Seed Round - Yixin Display,https://www.crunchbase.com/funding_round/yixin-display-seed--3befbb15,1,Tianhou Fund,Seed,Tianhou Fund,Seed,1,,,,,,,,,,Yes,,,,Seed,,"26,511",
2024-07-22,"Enshiwei is a medtech company that specializes in the R&D, manufacturing and production of endoscope products for diagnosis and treatment.",Enshiwei,https://www.crunchbase.com/organization/enshiwei,"Manufacturing, Medical, Medical Device","Suzhou, Jiangsu, China, Asia",Series A - Enshiwei,https://www.crunchbase.com/funding_round/enshiwei-series-a--ce7a6030,1,Kunshan Gaoxin Jituan,Early Stage Venture,Kunshan Gaoxin Jituan,Series A,2,,,,,,,10000000,CNY,1446069,Yes,,,,Early Stage Venture,,"26,565",
2024-09-25,XinpleTek is a RF front-end solution provider.,XinpleTek,https://www.crunchbase.com/organization/xinpletek,Hardware,"Shanghai, Shanghai, China, Asia",Series A - XinpleTek,https://www.crunchbase.com/funding_round/xinpletek-series-a--88d18637,3,"Chuangdong Hefei Red Brick Dongfang Fund, NuoTie Zichan, Xinyuan Fund",Early Stage Venture,,Series A,3,100000000,CNY,14218077,,,,100000000,CNY,14218077,Yes,,http://xinpletek.com/,$1M to $10M,Early Stage Venture,,"26,658",
2024-07-16,Beidou Information Technology provides AI-based software and secure AI-enhanced solutions for customers.,Beidou Information Technology,https://www.crunchbase.com/organization/beidou-information-technology,"Information Technology, Software","Jinan, Shandong, China, Asia",Series A - Beidou Information Technology,https://www.crunchbase.com/funding_round/beidou-information-technology-series-a--d714afbd,1,GoldStone Investment,Early Stage Venture,GoldStone Investment,Series A,1,12000000,CNY,1680955,,,,12000000,CNY,1680955,Yes,,,,Early Stage Venture,,"26,671",
2024-07-18,Dailai Technology offers non-invasive neurological stimulation and monitoring solutions.,Dailai Technology,https://www.crunchbase.com/organization/dailai-technology,"Biotechnology, Health Care, Medical, Medical Device","Haidian, Beijing, China, Asia",Seed Round - Dailai Technology,https://www.crunchbase.com/funding_round/dailai-technology-seed--341c6503,1,Fong Capital Partners,Seed,Fong Capital Partners,Seed,1,,,,,,,,,,Yes,,,,Seed,,"26,744",
2024-06-17,EagleChip operates as a chip design company.,EagleChip,https://www.crunchbase.com/organization/eaglechip,"Electronics, Field-Programmable Gate Array (FPGA), Semiconductor","Suzhou, Jiangsu, China, Asia",Seed Round - EagleChip,https://www.crunchbase.com/funding_round/eaglechip-seed--0270e89b,1,Bojiang Capital,Seed,Bojiang Capital,Seed,2,,,,,,,286000000,CNY,41507024,Yes,,http://eaglechip.com,,Seed,1,"26,768",
2024-08-05,Guancheng Information is a competent provider of comprehensive intelligent industrial solutions.,Guancheng Information,https://www.crunchbase.com/organization/guancheng-information,"Medical, Medical Device","Suzhou, Jiangsu, China, Asia",Series A - Guancheng Information,https://www.crunchbase.com/funding_round/guancheng-information-series-a--895339ad,3,"Leading Future, Mr. Zhu Guodong, SND Ventures Group",Early Stage Venture,,Series A,1,50000000,CNY,7021289,,,,50000000,CNY,7021289,Yes,,http://www.gct-china.com,,Early Stage Venture,,"26,813",
2024-07-31,Qingke Dynamics is a microgas turbine equipment manufacturer that focuses on emerging clean energy technology research and development.,Qingke Dynamics,https://www.crunchbase.com/organization/qingke-dynamics,"Clean Energy, Energy, Manufacturing","Beijing, Beijing, China, Asia",Seed Round - Qingke Dynamics,https://www.crunchbase.com/funding_round/qingke-dynamics-seed--3c3c510c,2,"Yiyuan Aerospace, Yonggui Fund",Seed,Yonggui Fund,Seed,3,,,,,,,,,,Yes,,,,Seed,,"26,815",
2024-07-23,Hexi Silicon New Materials offers industrial silicon smelting services and various other solutions.,Hexi Silicon New Materials,https://www.crunchbase.com/organization/hexi-silicon-new-materials,"Advanced Materials, Industrial Manufacturing, Manufacturing","Zhangye, Gansu, China, Asia",Series A - Hexi Silicon New Materials,https://www.crunchbase.com/funding_round/hexi-silicon-new-materials-series-a--b9911a29,1,Gansu Financial Holding Group,Early Stage Venture,Gansu Financial Holding Group,Series A,1,,,,,,,,,,Yes,,,,Early Stage Venture,,"26,829",
2024-10-31,Curegene focuses on the treatment of anti-viral diseases as well as cardiovascular and cerebrovascular diseases.,Curegene,https://www.crunchbase.com/organization/curegene,"Health Care, Hospital, Therapeutics","Shanghai, Shanghai, China, Asia",Series B - Curegene,https://www.crunchbase.com/funding_round/curegene-series-b--8281fb1d,3,"Aeonmed Medical Treatment, Guosen Innovation Equity, Infinity Equity",Early Stage Venture,Guosen Innovation Equity,Series B,3,,,,,,,200000000,CNY,27930125,Yes,,https://www.curegene.com.cn,,Early Stage Venture,,"26,832",
2024-07-10,Qichuan Technology offers home furnishing and digital marketing services.,Qichuan Technology,https://www.crunchbase.com/organization/qichuan-technology,"E-Commerce, Furniture, Home Decor","Hangzhou, Zhejiang, China, Asia",Seed Round - Qichuan Technology,https://www.crunchbase.com/funding_round/qichuan-technology-seed--22b11970,1,Xinjincheng Group,Seed,Xinjincheng Group,Seed,1,10000000,CNY,1374476,,,,10000000,CNY,1374476,Yes,,,,Seed,,"26,848",
2024-07-03,Neusoft Medical Systems is a leading manufacturer of medical equipment and service in china.,Neusoft Medical Systems,https://www.crunchbase.com/organization/neusoft-medical-systems,"Health Care, Manufacturing","Shenyang, Liaoning, China, Asia",Venture Round - Neusoft Medical Systems,https://www.crunchbase.com/funding_round/neusoft-medical-systems-series-unknown--59412034,1,China General Technology,,China General Technology,Venture - Series Unknown,3,,,,,,,440000000,USD,440000000,Yes,,http://medical.neusoft.com,Less than $1M,,1,"27,007",
2024-07-30,Xicheng Technology is a professional vehicle electronic and electrical parts supplier.,Xicheng Technology,https://www.crunchbase.com/organization/xicheng-technology,Automotive,"Fuhou, Fujian, China, Asia",Venture Round - Xicheng Technology,https://www.crunchbase.com/funding_round/xicheng-technology-series-unknown--a2778c5e,1,Industrial Securities Capital,,Industrial Securities Capital,Venture - Series Unknown,1,,,,,,,,,,Yes,,http://www.xcfz.cn,,,,"27,009",
