2024-11-20,TransBIM is an AI-powered tool for designing building drawings.,TransBIM,https://www.crunchbase.com/organization/transbim,"Construction, Software","Zhengzhou, Henan, China, Asia",Series A - TransBIM,https://www.crunchbase.com/funding_round/transbim-series-a--cb91968b,1,TEC,Early Stage Venture,TEC,Series A,1,,,,,,,,,,Yes,,https://www.cndswd.com,,Early Stage Venture,,"18,870",
2024-11-07,Xirui Materials is a technology-based material company that focuses on the development and application of rare earth functional materials.,Xirui Materials,https://www.crunchbase.com/organization/xirui-materials,"Advanced Materials, Industrial, Manufacturing","Hangzhou, Zhejiang, China, Asia",Series A - Xirui Materials,https://www.crunchbase.com/funding_round/xirui-materials-series-a--ced61ea0,1,Hainan Zhonghao Enterprise Management,Early Stage Venture,Hainan Zhonghao Enterprise Management,Series A,1,,,,,,,,,,Yes,,http://www.xrething.com,,Early Stage Venture,,"18,943",
2024-11-13,Maomaochong Technology provides a comprehensive platform for paper writing services.,Maomaochong Technology,https://www.crunchbase.com/organization/maomaochong-technology,"EdTech, Education","Huinan, Shanghai, China, Asia",Seed Round - Maomaochong Technology,https://www.crunchbase.com/funding_round/maomaochong-technology-seed--da5ad4cb,1,Alpha Startups,Seed,Alpha Startups,Seed,2,,,,,,,,,,Yes,,https://www.mymmc.cn,,Seed,,"18,952",
2024-11-11,"Jingdao Intelligence is an intelligent manufacturing company that specializes in developing electric servos, special motors, and products.",Jingdao Intelligence,https://www.crunchbase.com/organization/jingdao-intelligence,"Automotive, Intelligent Systems, Manufacturing","Hangzhou, Zhejiang, China, Asia",Series B - Jingdao Intelligence,https://www.crunchbase.com/funding_round/jingdao-intelligence-series-b--93e50ecc,2,"Demao Capital, West Lake Science and Technology Direct Investment Fund",Early Stage Venture,,Series B,2,,,,,,,,,,Yes,,http://www.hzjdi.net,,Early Stage Venture,,"19,031",
2024-11-11,Coretech Technologies is a company that creates sophisticated sensors and novel materials for new power systems.,Coretech Technologies,https://www.crunchbase.com/organization/coretech-technologies,"Manufacturing, Sensor","Daxing, Beijing, China, Asia",Seed Round - Coretech Technologies,https://www.crunchbase.com/funding_round/coretech-technologies-seed--4f0444ce,1,Tsinghua Innovation Ventures,Seed,Tsinghua Innovation Ventures,Seed,1,6000000,CNY,831935,,,,6000000,CNY,831935,Yes,,,,Seed,,"19,099",
2024-06-21,Huimaiche is a company that provides full-chain solutions for new retail in the automotive industry.,Huimaiche,https://www.crunchbase.com/organization/huimaiche,"Automotive, Retail","Shenzhen, Guangdong, China, Asia",Series A - Huimaiche,https://www.crunchbase.com/funding_round/huimaiche-series-a--08ead5e4,2,"Plum Ventures, Shunfu Capital",Early Stage Venture,Plum Ventures,Series A,1,50000000,CNY,6885819,500000000,CNY,68858193,50000000,CNY,6885819,Yes,,http://www.17hmc.cn/#,,Early Stage Venture,2,"19,148",
2024-08-22,Paide New Energy focuses on the localization and industrialization of key materials for hydrogen energy and water electrolysis.,Paide New Energy,https://www.crunchbase.com/organization/paide-new-energy,"Energy, Energy Management, Water","Guangzhou, Guangdong, China, Asia",Seed Round - Paide New Energy,https://www.crunchbase.com/funding_round/paide-new-energy-seed--7d4435e8,2,"Guangzhou Red Bird Qihang Fund, Lenovo Capital and Incubator Group (LCIG)",Seed,"Guangzhou Red Bird Qihang Fund, Lenovo Capital and Incubator Group (LCIG)",Seed,1,,,,,,,,,,Yes,,,,Seed,2,"19,166",
2024-11-24,Wantong Special Plastics is a subsidiary of Kingfa Technology that provides comprehensive solutions for special engineering plastics.,Wantong Special Plastics,https://www.crunchbase.com/organization/wantong-special-plastics,Manufacturing,"Guangdong, Jilin, China, Asia",Venture Round - Wantong Special Plastics,https://www.crunchbase.com/funding_round/wantong-special-plastics-series-unknown--a82f05eb,1,GoldStone Investment,,GoldStone Investment,Venture - Series Unknown,1,500000000,CNY,69032169,3100000000,CNY,427999448,500000000,CNY,69032169,Yes,,,,,,"19,193",
2024-10-31,Chimagen Biosciences is a company that is creating a novel class of multi-functional monoclonal antibodies for cancer therapy.,Chimagen Biosciences,https://www.crunchbase.com/organization/chimagen-biosciences,"Biotechnology, Health Care, Medical","Chengdu, Sichuan, China, Asia",Series B - Chimagen Biosciences,https://www.crunchbase.com/funding_round/chimagen-biosciences-series-b--ca0fff16,2,"Foresite Capital, Lilly Asia Ventures",Early Stage Venture,,Series B,1,,,,,,,,,,Yes,,http://www.chimagen.com,,Early Stage Venture,,"19,192",
2024-10-22,ENCOS is a developer of high-performance robot integrated joint modules.,ENCOS,https://www.crunchbase.com/organization/encos-6a0d,"Advanced Materials, Robotic Process Automation (RPA)","Nanjing, Jiangsu, China, Asia",Seed Round - ENCOS,https://www.crunchbase.com/funding_round/encos-6a0d-seed--b776b660,3,"Oasis Capital, Ralph Investment Management, Tsinghua Innovation Ventures",Seed,Oasis Capital,Seed,1,,,,,,,,,,Yes,,http://www.encos.cn,,Seed,2,"19,214",
2024-09-25,Zhidao Technology is a new energy urban logistics vehicles company that focuses on new energy vehicle production and testing equipment.,Zhidao Technology,https://www.crunchbase.com/organization/zhidao-new-energy,"Electric Vehicle, Energy Efficiency, Manufacturing","Hefei, Anhui, China, Asia",Corporate Round - Zhidao Technology,https://www.crunchbase.com/funding_round/zhidao-new-energy-corporate-round--7fd278b4,2,"Dongcheng Industrial Investment, Kaide New Energy",,Dongcheng Industrial Investment,Corporate Round,1,330000000,CNY,46919654,3300363036,CNY,469248153,330000000,CNY,46919654,Yes,,,,,,"19,256",
2024-10-25,AIFORWARD is an AIoT building intelligence and smart community solution provider.,AIFORWARD,https://www.crunchbase.com/organization/aiforward,"Artificial Intelligence (AI), Cloud Management, Internet of Things","Tianjing, Tianjin, China, Asia",Series A - AIFORWARD,https://www.crunchbase.com/funding_round/aiforward-series-a--5c7e12c0,1,Oriza Fund of Funds,Early Stage Venture,Oriza Fund of Funds,Series A,3,,,,,,,500000000,CNY,76602531,Yes,,http://www.aiforward.com/,,Early Stage Venture,,"19,265",
2024-07-29,Shanhe Analog & Digital is a company committed to becoming the premier supplier of domestic automotive-grade SBC chips.,Shanhe Analog & Digital,https://www.crunchbase.com/organization/shanhe-analog-digital,"Advanced Materials, Application Specific Integrated Circuit (ASIC), Semiconductor","Suzhou, Jiangsu, China, Asia",Seed Round - Shanhe Analog & Digital,https://www.crunchbase.com/funding_round/shanhe-analog-digital-seed--b1b036ff,3,"Glory Ventures, Wenzhi Venture Capital, Yongxin Capital",Seed,"Glory Ventures, Yongxin Capital",Seed,1,,,,,,,,,,Yes,,,,Seed,1,"19,308",
2024-11-06,Younengchuang Technology is a power electronic conversion technology company.,Younengchuang,https://www.crunchbase.com/organization/younengchuang,"Energy Storage, Manufacturing, Semiconductor","Qingdao Shi, Shandong, China, Asia",Seed Round - Younengchuang,https://www.crunchbase.com/funding_round/younengchuang-seed--33848e7a,1,Milestone Capital,Seed,Milestone Capital,Seed,1,,,,,,,,,,Yes,,http://www.unc-energy.com,,Seed,,"19,330",
2024-09-19,Plastic Technology is a developer of industrial enzyme preparations.,Plastic New Technology,https://www.crunchbase.com/organization/plastic-new-technology,"Biotechnology, Chemical Engineering, Industrial","Beijing, Beijing, China, Asia",Angel Round - Plastic New Technology,https://www.crunchbase.com/funding_round/plastic-new-technology-angel--a99a4f25,2,"C&I Capital, Innoangel Fund",Seed,,Angel,1,,,,,,,,,,Yes,,,,Seed,,"19,396",
2024-10-16,Juntong Future is an artificial intelligence and digital intelligence security service provider.,Juntong Future,https://www.crunchbase.com/organization/juntong-future,"Artificial Intelligence (AI), Security","Hangzhou, Zhejiang, China, Asia",Seed Round - Juntong Future,https://www.crunchbase.com/funding_round/juntong-future-seed--0ef78a28,2,"Delian Capital, The Linhui Fund",Seed,"Delian Capital, The Linhui Fund",Seed,1,,,,,,,,,,Yes,,https://www.juntong.ai,,Seed,2,"19,395",
2024-09-02,Geyuan New Materials is a company that creates high-performance silicon-based anode materials.,Geyuan New Materials,https://www.crunchbase.com/organization/geyuan-new-materials,"Advanced Materials, Manufacturing","Quzhou, Zhejiang, China, Asia",Seed Round - Geyuan New Materials,https://www.crunchbase.com/funding_round/geyuan-new-materials-seed--f1517313,2,"Kylinhall Partners, Zhejiang Paradise",Seed,,Seed,2,,,,,,,,,,Yes,,,,Seed,,"19,401",
2024-11-04,Magicpen Bio is a crop seed manufacturer and seller that engages in scientific research and development of agriculture production.,Magicpen Bio,https://www.crunchbase.com/organization/magicpen-bio,"Agriculture, Biotechnology, Manufacturing, Product Research","Hefei, Anhui, China, Asia",Seed Round - Magicpen Bio,https://www.crunchbase.com/funding_round/magicpen-bio-seed--d5064b5d,1,Plum Ventures,Seed,Plum Ventures,Seed,2,10000000,CNY,1408689,,,,10000000,CNY,1408689,Yes,,https://magicpenbio.com/,,Seed,,"19,410",
2024-11-08,Phylion Power (Chuzhou) is a lithium battery company that specializes in developing lithium battery products.,Phylion Power (Chuzhou),https://www.crunchbase.com/organization/phylion-power-chuzhou,"Battery, Electric Vehicle, Energy","Chuzhou, Anhui, China, Asia",Series A - Phylion Power (Chuzhou),https://www.crunchbase.com/funding_round/phylion-power-chuzhou-series-a--26836d85,2,"CMC Capital Group, Jintong Capital",Early Stage Venture,,Series A,1,,,,,,,,,,Yes,,,,Early Stage Venture,,"19,417",
2024-10-12,"Yizhu Technology is a software company that specializes in AI computing power, engineering and consulting for storage data.",Yizhu Technology,https://www.crunchbase.com/organization/yizhu-technology,"Artificial Intelligence (AI), Cloud Computing, Data Center, Software","Suzhou, Jiangsu, China, Asia",Venture Round - Yizhu Technology,https://www.crunchbase.com/funding_round/yizhu-technology-series-unknown--338a891c,2,"Shengshi Technology, Xction Capital",,,Venture - Series Unknown,2,,,,,,,,,,Yes,,https://yizhu-tech.com/about.php###,,,,"19,434",
2024-09-14,Medtech Technology is a firm that develops innovative ophthalmic medical devices.,Medtech Technology,https://www.crunchbase.com/organization/medtech-technology,"Health Care, Medical Device, Pharmaceutical","Qiantang, Fujian, China, Asia",Series B - Medtech Technology,https://www.crunchbase.com/funding_round/medtech-technology-series-b--bfffbe3a,3,"Decheng Capital, Hangzhou Heda Industry Fund, Sunland Fund",Early Stage Venture,,Series B,1,200000000,CNY,28194826,,,,200000000,CNY,28194826,Yes,,https://www.mdcotech.com,,Early Stage Venture,2,"19,465",
2024-08-09,Botai Automation is specialized in CNC system research and development.,Botai Automation,https://www.crunchbase.com/organization/botai-automation,"Machinery Manufacturing, Manufacturing","Minhang, Shanghai, China, Asia",Seed Round - Botai Automation,https://www.crunchbase.com/funding_round/botai-automation-seed--772edf03,4,"GGV Capital, Glory Ventures, Shida Venture Capital, Yiyuan Investment",Seed,Shida Venture Capital,Seed,2,100000000,CNY,13953423,,,,130000000,CNY,18157282,Yes,,,,Seed,1,"19,480",
2024-08-07,"Fengguang Tongchuang is a new material developer in chemical product sales, non-ferrous metal alloy sales, building materials sales, etc.",Fengguang Tongchuang,https://www.crunchbase.com/organization/fengguang-tongchuang,"Packaging Services, Retail, Wholesale","Baoshan, Shanghai, China, Asia",Seed Round - Fengguang Tongchuang,https://www.crunchbase.com/funding_round/fengguang-tongchuang-seed--91e814c0,6,"Fengguang New Materials, Mr. Ma Fulin, Mr. Wang Mengxiang, Mr. Wang Yahua, Mr. Wang Zhi, Mr. Zhou Yinghui",Seed,Fengguang New Materials,Seed,1,,,,,,,,,,Yes,,,,Seed,,"19,489",
2024-10-10,Chenzhi Technology focuses on the research and development of automotive intelligent wire-controlled chassis systems.,Chenzhi Technology,https://www.crunchbase.com/organization/chenzhi-technology,Automotive,"Chongqing, Heilongjiang, China, Asia",Corporate Round - Chenzhi Technology,https://www.crunchbase.com/funding_round/chenzhi-technology-corporate-round--9fc2f814,2,"Changan Automobile, Guangzhou Automobile Group",,Guangzhou Automobile Group,Corporate Round,1,550000000,CNY,77671548,1283333333,CNY,181233612,550000000,CNY,77671548,Yes,,,,,,"19,506",
2024-09-27,"Kangrui Jiayang is a health management company that provides services for elderly care, nursing, rehabilitation, and other service fields.",Kangrui Jiayang,https://www.crunchbase.com/organization/kangrui-jiayang,"Health Care, Medical, Nursing and Residential Care","Ningbo, Zhejiang, China, Asia",Venture Round - Kangrui Jiayang,https://www.crunchbase.com/funding_round/kangrui-jiayang-series-unknown--6f98d6a0,1,Yuexin Health Medical Investment,,Yuexin Health Medical Investment,Venture - Series Unknown,1,,,,,,,,,,Yes,,http://www.krjycn.com,,,,"19,515",
2024-08-23,Neurogin is a bioelectronics company that provides reliable monitoring and auxiliary diagnostic tools for clinical and health institutions.,Neurogin,https://www.crunchbase.com/organization/neurogin,"Biotechnology, Medical Device, Neuroscience","Chengdu, Sichuan, China, Asia",Seed Round - Neurogin,https://www.crunchbase.com/funding_round/neurogin-seed--b57d9de3,1,Green Pine Capital Partners,Seed,Green Pine Capital Partners,Seed,1,,,,,,,,,,Yes,,https://www.neurogin.com,,Seed,1,"19,529",
2024-11-08,Jishi Medical is a med-tech company that specializes in the research and development of ophthalmology diagnosis and treatment.,Jishi Medical,https://www.crunchbase.com/organization/jishi-medical,"Health Care, Health Diagnostics, Medical","Suzhou, Jiangsu, China, Asia",Seed Round - Jishi Medical,https://www.crunchbase.com/funding_round/jishi-medical-seed--808377d0,1,Fosun Health Capital,Seed,Fosun Health Capital,Seed,1,,,,,,,,,,Yes,,,,Seed,,"19,593",
2024-11-19,Syneron is a company that using artificial intelligence and biotechnology to address two significant global challenges.,Syneron,https://www.crunchbase.com/organization/syneron,"Artificial Intelligence (AI), Biotechnology","Guangzhou, Guangdong, China, Asia",Series A - Syneron,https://www.crunchbase.com/funding_round/syneron-series-a--da3855ae,2,"AstraZeneca Pharmaceutical, Lilly Asia Ventures",Early Stage Venture,,Series A,2,,,,,,,,,,Yes,,,,Early Stage Venture,,"19,588",
2024-11-04,Zhiyao Yuanchuang is an AI macromolecular drug design service provider.,Zhiyao Yuanchuang,https://www.crunchbase.com/organization/zhiyao-yuanchuang,"Artificial Intelligence (AI), Biotechnology, Health Care","Minhang, Shanghai, China, Asia",Seed Round - Zhiyao Yuanchuang,https://www.crunchbase.com/funding_round/zhiyao-yuanchuang-seed--2bbd73c3,1,Hupu,Seed,Hupu,Seed,1,,,,,,,,,,Yes,,https://aimedorig.com,,Seed,,"19,626",
2024-11-01,Zixiyang Open Air is a platform for the low-altitude cultural and tourism business that primarily hosts and operates tourist attractions.,Zixiyang Open Air,https://www.crunchbase.com/organization/zixiyang-open-air,"Transportation, Travel","Shanghai, Shanghai, China, Asia",Corporate Round - Zixiyang Open Air,https://www.crunchbase.com/funding_round/zixiyang-open-air-corporate-round--0a658153,1,BR-Robot,,BR-Robot,Corporate Round,1,,,,,,,,,,Yes,,,,,,"19,668",
2024-08-23,Ehome Health offers primary healthcare and diagnostic services through innovative technological applications.,Ehome Health,https://www.crunchbase.com/organization/ehome-health,"Health Care, Health Diagnostics, Personal Health","Changsha, Jiangsu, China, Asia",Series D - Ehome Health,https://www.crunchbase.com/funding_round/ehome-health-series-d--491eab1d,2,"Huding Fund, Hunan Xingxiang Investment",Late Stage Venture,"Huding Fund, Hunan Xingxiang Investment",Series D,2,,,,,,,,,,Yes,,https://www.ehomepoct.com/zh/home/homepage,,Late Stage Venture,,"19,681",
2024-06-18,"KingAgroot is a biotechnology company that researches, develops, and sells new pesticides and seeds.",KingAgroot,https://www.crunchbase.com/organization/kingagroot,"Agriculture, Biotechnology, Chemical, Farming","Qingdao Shi, Shandong, China, Asia",Venture Round - KingAgroot,https://www.crunchbase.com/funding_round/kingagroot-series-unknown--fb5619c6,1,Shandong New Growth Drivers Fund,,Shandong New Growth Drivers Fund,Venture - Series Unknown,2,,,,,,,86580000,USD,86580000,Yes,,https://www.kingagroot.com ,,,,"19,684",
2024-10-26,Xiangmengyou is a professional company operating international and domestic travel business.,Xiangmengyou,https://www.crunchbase.com/organization/xiangmengyou,"Business Travel, Tourism, Travel","Beijing, Beijing, China, Asia",Seed Round - Xiangmengyou,https://www.crunchbase.com/funding_round/xiangmengyou-seed--31c8693c,2,"Deep Blue Capital, Htrip",Seed,,Seed,3,,,,,,,,,,Yes,,http://www.xmynb.com,,Seed,1,"19,701",
2024-08-16,"yeba is a nightclub-based mobile social app that offers drinks cards, game halls, chat rooms, and private communities.",yeba,https://www.crunchbase.com/organization/yeba,"Apps, Software","Tianhe, Hubei, China, Asia",Venture Round - yeba,https://www.crunchbase.com/funding_round/yeba-series-unknown--4d0c4e9e,2,"Shenzhen Yiquchong, Zhongfeng Guolian",,"Shenzhen Yiquchong, Zhongfeng Guolian",Venture - Series Unknown,1,37500000,CNY,5233775,,,,37500000,CNY,5233775,Yes,,http://yeba.im,$1M to $10M,,,"19,711",
2024-08-14,"Lemon Biotechnology is a large domestic pectin production enterprise which integrates product development, processing and sales.",Lemon Biotechnology,https://www.crunchbase.com/organization/guangzhou-laimeng-jituan,"Food and Beverage, Food Processing, Manufacturing","Guangzhou, Guangdong, China, Asia",Series A - Lemon Biotechnology,https://www.crunchbase.com/funding_round/guangzhou-laimeng-jituan-series-a--62c12c0e,2,"Hubei Changjiang Radio, Television and Cultural Investment, Sunsail Ventures",Early Stage Venture,"Hubei Changjiang Radio, Television and Cultural Investment",Series A,2,4219986,USD,4219986,,,,18143684,USD,18143684,Yes,,http://www.sinopectin.com/,,Early Stage Venture,,"19,707",
2024-08-10,Xiaoyao Massage is a massage service provider company.,Xiaoyao Massage,https://www.crunchbase.com/organization/xiaoyao-massage,"Health Care, Wellness","Nanning, Guangxi, China, Asia",Seed Round - Xiaoyao Massage,https://www.crunchbase.com/funding_round/xiaoyao-massage-seed--70ff4d91,2,"Judou Capital, Tongluda CVC",Seed,Tongluda CVC,Seed,1,1350000,CNY,188371,,,,1350000,CNY,188371,Yes,,,,Seed,2,"19,757",
2024-11-22,Ranpu Microelectronics is a company that involved in automation and intelligence of chip design.,Ranpu Microelectronic,https://www.crunchbase.com/organization/ranpu-microelectronic,"Manufacturing, Semiconductor","Shanghai, Shanghai, China, Asia",Seed Round - Ranpu Microelectronic,https://www.crunchbase.com/funding_round/ranpu-microelectronic-seed--1e9b96ca,1,Huayu Science and Technology,Seed,Huayu Science and Technology,Seed,1,,,,,,,,,,Yes,,https://www.icprophet.com,,Seed,,"19,786",
2024-08-13,Tongchao Precision Machinery develops high-precision electrodes for chemical vapor deposition and DRY (dry etching) equipment.,Tongchao Precision Machinery,https://www.crunchbase.com/organization/tongchao-precision-machinery,"Electronics, Manufacturing, Semiconductor","Wuhu, Anhui, China, Asia",Venture Round - Tongchao Precision Machinery,https://www.crunchbase.com/funding_round/tongchao-precision-machinery-series-unknown--03ee3fc7,6,"Bondshine Capital, Camel Equity Investment, Guoyuan Financial Holding Group, Guoyuan Innovation Investment, Hefei City Construction and Investment Holding Group, Shanghai GuoHe Capital",,,Venture - Series Unknown,2,,,,,,,,,,Yes,,https://www.tongchaotech.com,Less than $1M,,,"19,788",
2024-09-04,Air Touch is an integrated circuit design service provider.,Air Touch,https://www.crunchbase.com/organization/air-touch,"Aerospace, Software, Space Travel","Hangzhou, Zhejiang, China, Asia",Series D - Air Touch,https://www.crunchbase.com/funding_round/air-touch-series-d--538070e4,2,"Ningbo Tongshang Fund, ZSCO",Late Stage Venture,ZSCO,Series D,3,,,,,,,100000000,CNY,15770383,Yes,,http://www.airtouching.com,,Late Stage Venture,,"19,795",
2024-10-15,TopXgun is a provider of flying control systems and unmanned aerial vehicle industrial solutions.,TopXgun Robotics,https://www.crunchbase.com/organization/topxgun-robotics,"Artificial Intelligence (AI), Autonomous Vehicles, Big Data, Corporate Training, Technical Support","Shanghai, Shanghai, China, Asia",Series C - TopXgun Robotics,https://www.crunchbase.com/funding_round/topxgun-robotics-series-c--a11be098,1,Golden Rain Bogor,Late Stage Venture,,Series C,3,,,,,,,100000000,CNY,15091378,Yes,,http://www.topxgun.com/,$1M to $10M,Late Stage Venture,,"19,876",
2024-11-01,"Bobang automobile is a high-tech company that specializes in the research, development, and manufacturing of automobile micromotor products.",Bobang Automotive,https://www.crunchbase.com/organization/bobang-automotive,"Automotive, Manufacturing","Qingpu Qu, Shanghai, China, Asia",Corporate Round - Bobang Automotive,https://www.crunchbase.com/funding_round/bobang-automotive-corporate-round--79a8d701,1,Baolong Technology,,Baolong Technology,Corporate Round,1,35000000,CNY,4913936,,,,35000000,CNY,4913936,Yes,,http://www.bobang-auto.com,,,,"19,912",
2024-09-12,Faroad is a manufacturer of SMT machines.,Faroad,https://www.crunchbase.com/organization/faroad,"Industrial Engineering, Machinery Manufacturing, Product Design","Shenzhen, Guangdong, China, Asia",Series C - Faroad,https://www.crunchbase.com/funding_round/faroad-series-c--84956665,1,Qingshi Asset Management Group,Late Stage Venture,Qingshi Asset Management Group,Series C,1,,,,,,,,,,Yes,,https://faroadsmt.com,,Late Stage Venture,,"19,927",
2024-09-09,SiliCool is a company that focuses on chip interconnection technology.,SiliCool,https://www.crunchbase.com/organization/silicool,"Application Specific Integrated Circuit (ASIC), Semiconductor","Tangjiabang, Zhejiang, China, Asia",Venture Round - SiliCool,https://www.crunchbase.com/funding_round/silicool-series-unknown--463cde1a,3,"CRRC Capital, Waniu Capital, Wenxin Fund",,CRRC Capital,Venture - Series Unknown,1,100000000,CNY,14055604,,,,100000000,CNY,14055604,Yes,,https://www.silicooltech.com,,,,"19,936",
2024-10-07,Changnong Agriculture and Animal Husbandry is one of the pig farming platforms mainly engaged in breeding of fine breeds.,Changnong Agriculture and Animal Husbandry,https://www.crunchbase.com/organization/changnong-agriculture-and-animal-husbandry,"Agriculture, Animal Feed, Farming","Hefei, Anhui, China, Asia",Series A - Changnong Agriculture and Animal Husbandry,https://www.crunchbase.com/funding_round/changnong-agriculture-and-animal-husbandry-series-a--0f46c4b1,1,Hefei City Construction and Investment Holding Group,Early Stage Venture,Hefei City Construction and Investment Holding Group,Series A,1,30000000,CNY,4273504,600252100,CNY,85505997,30000000,CNY,4273504,Yes,,,,Early Stage Venture,,"20,016",
2024-09-20,Weimai is a domestic supplier of semiconductor magnetic fluid sealing transfer systems.,Weimai,https://www.crunchbase.com/organization/weimai-33d8,"Industrial, Semiconductor, Service Industry","Shanghai, Shanghai, China, Asia",Seed Round - Weimai,https://www.crunchbase.com/funding_round/weimai-33d8-seed--6eb6ec59,1,Huayi Ventures,Seed,Huayi Ventures,Seed,1,,,,,,,,,,Yes,,,,Seed,,"20,034",
2024-08-19,Zhongke Huasi specializing in the design and manufacturing of high-performance digital-analog hybrid LED matrix driver chips.,Zhongke Huasi,https://www.crunchbase.com/organization/zhongke-huasi,"Electronics, Manufacturing, Semiconductor","Suzhou, Jiangsu, China, Asia",Seed Round - Zhongke Huasi,https://www.crunchbase.com/funding_round/zhongke-huasi-seed--6f2ac3a4,3,"DB Investment, Dunhong Capital Management, Jinding Lixin Micro Industry Fund",Seed,Jinding Lixin Micro Industry Fund,Seed,1,,,,,,,,,,Yes,,,,Seed,,"20,042",
2024-09-20,Infy Power is a power electronics technology company that specializes in core technologies and system solutions for power conversion.,Infy Power,https://www.crunchbase.com/organization/infy-power,"Charging Infrastructure, Electronics, Energy Storage","Shenzhen, Guangdong, China, Asia",Venture Round - Infy Power,https://www.crunchbase.com/funding_round/infy-power-series-unknown--81888d8c,2,"PetroChina Kunlun Capital, Sinopec Capital",,,Venture - Series Unknown,1,,,,,,,,,,Yes,,https://www.infypower.cn,,,,"20,075",
2024-10-04,Amazinc is a zinc battery R&D and production company that specializes in zinc battery development and manufacture.,Amazinc,https://www.crunchbase.com/organization/amazinc,"Battery, Manufacturing","Dongguang, Guangdong, China, Asia",Seed Round - Amazinc,https://www.crunchbase.com/funding_round/amazinc-seed--da4f18b3,1,Huagai Capital,Seed,Huagai Capital,Seed,1,,,,,,,,,,Yes,,https://www.amazinc.com.cn,,Seed,,"20,094",
2024-10-29,Qiwu Technology is committed to empowering enterprises with smart operations in the era of big data and social networks.,Qiwu Technology,https://www.crunchbase.com/organization/qiwu-technology,"Big Data, Business Development, Information Technology","Tongzhou, Beijing, China, Asia",Venture Round - Qiwu Technology,https://www.crunchbase.com/funding_round/qiwu-technology-series-unknown--4fcedad0,1,Hike Capital,,Hike Capital,Venture - Series Unknown,1,30000000,CNY,4206925,,,,30000000,CNY,4206925,Yes,,https://qiwujituan.com,,,,"20,134",
