2024-09-14,TsaiHua manufactures colored coating materials.,TsaiHua,https://www.crunchbase.com/organization/tsaihua,"Enterprise, Manufacturing","Beijing, Beijing, China, Asia",Series A - TsaiHua,https://www.crunchbase.com/funding_round/tsaihua-series-a--1ee6974f,3,"Chuhui Capital, High-quality Development Fund, Yangtze River Delta Digital Fund",Early Stage Venture,High-quality Development Fund,Series A,3,,,,,,,2265771,USD,2265771,Yes,,http://www.tsaihua.com/,$1M to $10M,Early Stage Venture,,"53,082",
2024-07-11,Tingsheng Technology develops intra cardiac ultrasound ICE products.,Tingsheng Technology,https://www.crunchbase.com/organization/tingsheng-technology,"Health Care, Medical Device","Nanjing, Jiangsu, China, Asia",Series B - Tingsheng Technology,https://www.crunchbase.com/funding_round/tingsheng-technology-series-b--7ba1cbb4,2,"Jingming Capital, Qiming Venture Partners",Early Stage Venture,Jingming Capital,Series B,3,8340000,USD,8340000,,,,38902672,USD,38902672,Yes,,http://www.tingsn.com/,,Early Stage Venture,1,"53,224",
2024-09-08,"Signal Easy is a high-tech company that combines R&D, manufacturing, sales, and services.",Signal Easy,https://www.crunchbase.com/organization/signal-easy,Manufacturing,"Chengdu, Sichuan, China, Asia",Corporate Round - Signal Easy,https://www.crunchbase.com/funding_round/signal-easy-corporate-round--6b76d956,1,Huaqin Communication Technology,,Huaqin Communication Technology,Corporate Round,1,,,,,,,,,,Yes,,http://www.signal-easy.com,,,,"53,288",
2024-07-30,REDPINE is a medical healthcare instrument providing industry.,REDPINE,https://www.crunchbase.com/organization/redpine-cf84,Health Care,"Guangdong, Jilin, China, Asia",Series D - REDPINE,https://www.crunchbase.com/funding_round/redpine-cf84-series-d--bfbf7542,7,"CICC Capital, Guangzhou Industrial Investment Group, Guangzhou Yuexiu Industrial Investment Fund, Oriza Seed Capital (Oriza Yuandian), Qingke Capital, Suzhou Trust, Tongying Venture Capital",Late Stage Venture,CICC Capital,Series D,4,,,,,,,15200000,USD,15200000,Yes,,http://en.gzredpine.com,$10M to $50M,Late Stage Venture,,"53,486",
2024-11-08,"Kanghua Biological is a research and development, production, and operation of preventive biological products.",Chengdu Kanghua Biological Products,https://www.crunchbase.com/organization/chengdu-kanghua-biological-products,"Agriculture, Biotechnology, Life Science, Product Research","Chengdu, Sichuan, China, Asia",Post-IPO Secondary - Chengdu Kanghua Biological Products,https://www.crunchbase.com/funding_round/chengdu-kanghua-biological-products-post-ipo-secondary--e9997f03,1,Sichuan Development Securities Fund,,Sichuan Development Securities Fund,Post-IPO Secondary,2,352420084,CNY,49089047,5326645340,CNY,741955279,352420084,CNY,49089047,No,,https://www.kangh.com,,IPO,,"53,591",
2024-07-27,Hanerxi is a pen injector developer of an adjustable precision injection pen for drug delivery in chronic ailments and diseases.,Hallsey,https://www.crunchbase.com/organization/hallsey,"Health Care, Medical, Medical Device","Suzhou, Jiangsu, China, Asia",Series B - Hallsey,https://www.crunchbase.com/funding_round/hallsey-series-b--a02c60b9,4,"Herui Venture Capital, Jianchuang Medical Growth Fund, Lishui State Investment, ZSCO",Early Stage Venture,"Jianchuang Medical Growth Fund, ZSCO",Series B,2,,,,,,,10000000,CNY,1570450,Yes,,http://www.healthy-med.com/,,Early Stage Venture,,"53,682",
2024-07-25,"AVIC Helicopter designs, develops, manufactures, and sells helicopters, airplane parts, and aviation-related products.",AVICOPTER PLC,https://www.crunchbase.com/organization/avicopter-plc,"Aerospace, Industrial, Industrial Manufacturing","Harbin, Heilongjiang, China, Asia",Post-IPO Equity - AVICOPTER PLC,https://www.crunchbase.com/funding_round/avicopter-plc-post-ipo-equity--713ac63d,14,"Avic Avionics, AviChina, Caitong Fund Management Co., China Structural Reform Fund, Guoji Ziben, Guosheng Group, Guotai Junan Financial Holdings, Heilongjiang Revitalize Advanced Manufacturing Industry Private Equity Fund, Heilongjiang Venture Capital, Hubei Railway Group, Nuode Asset Management, Qianhai CSSC Private Equity Fund Management, UBS, Zhongan Capital",,,Post-IPO Equity,1,2999999973,CNY,414886110,,,,2999999973,CNY,414886110,Yes,,http://avicopter.avic.com,$1B to $10B,IPO,,"53,689",
2024-08-27,Lisifang is a software-based integrated radio frequency product and system service company.,Intelli Cube,https://www.crunchbase.com/organization/intelli-cube,Service Industry,"Chengdu, Sichuan, China, Asia",Seed Round - Intelli Cube,https://www.crunchbase.com/funding_round/intelli-cube-seed--bf91183b,1,Huaxi Securities,Seed,Huaxi Securities,Seed,2,10000000,CNY,1403686,,,,10000000,CNY,1403686,Yes,,https://www.intellicube.tech,,Seed,,"53,730",
2024-11-01,"Luoyang North Glass Technology develops, produces and sells glass post-processing technology and equipment.",Luoyang Northglass Technology,https://www.crunchbase.com/organization/luoyang-northglass-technology,"Machinery Manufacturing, Manufacturing, Product Design","Henan, Henan, China, Asia",Post-IPO Equity - Luoyang Northglass Technology,https://www.crunchbase.com/funding_round/luoyang-northglass-technology-post-ipo-equity--4ff70c0d,1,Zhangjiagang Jinmao Venture Capital,,,Post-IPO Equity,1,493679242,CNY,69311662,,,,493679242,CNY,69311662,Yes,,http://www.northglass.com/,,IPO,,"53,789",
2024-11-14,Audfly Technology provides acoustics innovation and sound environmental protection.,Audfly Technology,https://www.crunchbase.com/organization/audfly-technology,"Audio, Electronics, Hardware","Suzhou, Jiangsu, China, Asia",Private Equity Round - Audfly Technology,https://www.crunchbase.com/funding_round/audfly-technology-private-equity--8543ed52,1,Lenovo Capital and Incubator Group (LCIG),Private Equity,Lenovo Capital and Incubator Group (LCIG),Private Equity,4,,,,,,,115250000,CNY,17068726,Yes,,http://www.audfly.com/,$1M to $10M,Private Equity,1,"53,891",
2024-06-01,NAXEON is a technology company that specializes in the development and manufacturing of two-wheeled new energy vehicles.,NAXEON,https://www.crunchbase.com/organization/naxeon,"Automotive, Electric Vehicle","Yubei, Chongqing, China, Asia",Series A - NAXEON,https://www.crunchbase.com/funding_round/naxeon-series-a--fbafe2c2,2,"Jiuzhi Ziben, Nanning Industrial Investment",Early Stage Venture,,Series A,1,10000000,CNY,1407281,,,,10000000,CNY,1407281,Yes,,https://www.naxeontech.com,,Early Stage Venture,1,"53,942",
2024-09-25,Shengmai Electronics is a manufacturer of automotive MEMS pressure sensors.,Shengmai Electronics,https://www.crunchbase.com/organization/shengmai-electronics,"Application Specific Integrated Circuit (ASIC), Manufacturing, Sensor","Suzhou, Jiangsu, China, Asia",Series B - Shengmai Electronics,https://www.crunchbase.com/funding_round/shengmai-electronics-series-b--5f85f947,3,"Bridge Capital China, Hefei Innovation Investment, Luyang Science and Technology Innovation",Early Stage Venture,,Series B,2,,,,,,,,,,Yes,,http://www.senmol.com/,$10M to $50M,Early Stage Venture,,"54,064",
2024-08-16,Haimai Medical is a platform for tissue engineering and regenerative medicine technology.,Haimai Medical,https://www.crunchbase.com/organization/haimai-medical,"Medical, Therapeutics","Suzhou, Jiangsu, China, Asia",Series A - Haimai Medical,https://www.crunchbase.com/funding_round/haimai-medical-series-a--ed927d8a,3,"Beijing Huafang Investment, IDG Capital, Shanghai Biomedical Industrial Equity Investment Fund",Early Stage Venture,IDG Capital,Series A,4,,,,,,,,,,Yes,,http://www.humatrix-medical.com/,,Early Stage Venture,3,"54,166",
2024-08-26,Tailan New Energy is a solid-state battery company.,Tailan New Energy,https://www.crunchbase.com/organization/tailan-new-energy,"Battery, Energy, Energy Efficiency","Beijing, Beijing, China, Asia",Series B - Tailan New Energy,https://www.crunchbase.com/funding_round/tailan-new-energy-series-b--d166adc2,2,"Changan Automobile, China North Industries Group",Early Stage Venture,"Changan Automobile, China North Industries Group",Series B,3,,,,,,,,,,Yes,,https://www.ctlne.com/,$10M to $50M,Early Stage Venture,,"54,177",
2024-06-12,"Hangmo Ouyi is a manufacturing company that provides research, development, production, and sales of materials and automotive brake pads.",Hangmo Ouyi,https://www.crunchbase.com/organization/hangmo-ouyi,"Automotive, Industrial, Manufacturing, Product Research","Deqing, Zhejiang, China, Asia",Series A - Hangmo Ouyi,https://www.crunchbase.com/funding_round/hangmo-ouyi-series-a--10073e45,1,Trend Investment Group,Early Stage Venture,,Series A,1,,,,,,,,,,Yes,,http://hmoe.net,,Early Stage Venture,,"54,267",
2024-10-08,Aeolus Robotics is a cutting-edge high-tech company that specializes in the design and manufacture of special service robots,Aeolus Robotics,https://www.crunchbase.com/organization/aeolus-robotics-038b,,"Hangzhou, Zhejiang, China, Asia",Seed Round - Aeolus Robotics,https://www.crunchbase.com/funding_round/aeolus-robotics-038b-seed--696c31b1,1,Zhongguancun Science-Tech Leasing,Seed,Zhongguancun Science-Tech Leasing,Seed,1,5000000,CNY,708336,,,,5000000,CNY,708336,Yes,,https://www.iouluo.com,,Seed,1,"54,394",
2024-08-01,Huaan Video is a professional embedded face recognition provider.,Huaan Video,https://www.crunchbase.com/organization/huaan-video,"Facial Recognition, Product Design, Video","Chengdu, Sichuan, China, Asia",Corporate Round - Huaan Video,https://www.crunchbase.com/funding_round/huaan-video-corporate-round--b8f410c6,1,Shenzen Bestex Technology,,Shenzen Bestex Technology,Corporate Round,1,,,,,,,,,,Yes,,http://www.huaanvision.com/,,,,"54,845",
2024-08-16,Jiuzhi Technology is an innovative technology company that offers transformative medical wearable devices and auxiliary diagnosis services.,Jiuzhi Technology,https://www.crunchbase.com/organization/jiuzhi-technology,"Health Diagnostics, Medical, Medical Device, Wearables","Shenzhen, Guangdong, China, Asia",Seed Round - Jiuzhi Technology,https://www.crunchbase.com/funding_round/jiuzhi-technology-seed--847e52c5,4,"Brizan Venture, CWB Capital, Hong Kong X-Tech, Virtu International",Seed,Brizan Venture,Seed,2,,,,,,,,,,Yes,,https://www.gdjztech.com,Less than $1M,Seed,1,"55,092",
2024-09-06,Chengdu Tuyingshixun Technology is a specialized digital image processing solution.,Chengdu Tuyingshixun Technology,https://www.crunchbase.com/organization/chengdu-tuyingshixun-technology,,"Chengdu, Sichuan, China, Asia",Seed Round - Chengdu Tuyingshixun Technology,https://www.crunchbase.com/funding_round/chengdu-tuyingshixun-technology-seed--3753723d,1,Huaxi Yinfeng,Seed,Huaxi Yinfeng,Seed,1,,,,,,,,,,Yes,,,,Seed,,"55,125",
2024-08-18,Travention is a medical equipment manufacturer.,Travention,https://www.crunchbase.com/organization/travention,"Manufacturing, Medical, Medical Device","Guangzhou, Guangdong, China, Asia",Series A - Travention,https://www.crunchbase.com/funding_round/travention-series-a--ac7966cf,1,Winning Ventures,Early Stage Venture,Winning Ventures,Series A,1,10000000,CNY,1395673,,,,10000000,CNY,1395673,Yes,,https://www.travention.cn,,Early Stage Venture,,"55,432",
2024-08-12,Zhuoshi Technology is an artificial intelligence technology company.,Zhuoshi Technology,https://www.crunchbase.com/organization/zhuoshi-future,"Artificial Intelligence (AI), EdTech, Education, Metaverse","Haidian, Beijing, China, Asia",Series B - Zhuoshi Technology,https://www.crunchbase.com/funding_round/zhuoshi-future-series-b--c13cd93a,3,"Cowin Capital, Qingdao Haifa Group, TusStar",Early Stage Venture,Cowin Capital,Series B,3,100000000,CNY,13937282,,,,140000000,CNY,19673529,Yes,,https://www.maas.com.cn/,,Early Stage Venture,,"55,441",
2024-08-26,OSMicro is an automotive millimeter-wave radar SoC and car-grade ultra-wideband (UWB) chip design firm.,OSMicro,https://www.crunchbase.com/organization/osmicro,"Automotive, Electronics","Hefei, Anhui, China, Asia",Seed Round - OSMicro,https://www.crunchbase.com/funding_round/osmicro-seed--a9384207,2,"Jinding Capital, Kangxi Communication Technology",Seed,,Seed,2,,,,,,,100000000,CNY,13944473,Yes,,http://www.osemitech.com,,Seed,1,"55,541",
2024-06-04,"Dezhen Technology provides solutions for medical institutions to help hospitals develop clinical, and scientific research management.",Dezhen Technology,https://www.crunchbase.com/organization/dezhen-technology,"Health Care, Health Diagnostics, Medical","Hongkou, Shanghai, China, Asia",Series C - Dezhen Technology,https://www.crunchbase.com/funding_round/dezhen-technology-series-c--e7b76617,1,Qiming Venture Partners,Late Stage Venture,,Series C,2,30000000,CNY,4227198,,,,30000000,CNY,4227198,Yes,,https://www.dezhentech.com,,Late Stage Venture,1,"55,765",
2024-06-19,HPMicro is committed to the development of high-performance embedded solutions.,HPMicro,https://www.crunchbase.com/organization/hpmicro,"Electronics, Semiconductor","Shanghai, Shanghai, China, Asia",Series B - HPMicro,https://www.crunchbase.com/funding_round/hpmicro-series-b--4e5a2148,4,"Hongchu Private Equity Fund Management, Sanwang Qitong, Tianjin Yongtai Haihe, Zhejiang Paradise",Early Stage Venture,Zhejiang Paradise,Series B,1,100000000,CNY,13779229,,,,100000000,CNY,13779229,Yes,,https://www.hpmicro.com/,,Early Stage Venture,,"56,083",
2024-07-10,Hupper Seeds is a biotech company that specializes in the agricultural scientific research and experimental development on rice breeding.,Hupper Seeds,https://www.crunchbase.com/organization/hupper-seeds,"Agriculture, AgTech, Biotechnology","Wuxi Shi, Jiangsu, China, Asia",Venture Round - Hupper Seeds,https://www.crunchbase.com/funding_round/hupper-seeds-series-unknown--a32f3de8,1,Wuxi Capital,,Wuxi Capital,Venture - Series Unknown,1,,,,,,,,,,Yes,,http://www.hupseeds.com,,,,"56,136",
2024-08-06,Feynman Dynamics is a developer of fuel cell catalysts for the energy sector.,Feynman Dynamics,https://www.crunchbase.com/organization/feynman-dynamics,,"Tianjing, Tianjin, China, Asia",Seed Round - Feynman Dynamics,https://www.crunchbase.com/funding_round/feynman-dynamics-seed--3076d993,4,"Hong Kong X-Tech, Tianchuang Capital, Tsinghua Capital, Yuntai Capital",Seed,,Seed,2,100000000,CNY,14024754,,,,200000000,CNY,28083520,Yes,,http://feynmandynamics.com,,Seed,,"56,153",
2024-11-25,Lingyi Bio is a rare disease animal model functional verification platform and gene therapy developer.,Lingyi Biology,https://www.crunchbase.com/organization/lingyi-biology,"Biotechnology, Genetics, Medical","Shanghai, Shanghai, China, Asia",Series A - Lingyi Biology,https://www.crunchbase.com/funding_round/lingyi-biology-series-a--6c7f2d86,1,Jolly Pharmaceutical,Early Stage Venture,Jolly Pharmaceutical,Series A,3,,,,,,,200000000,CNY,30319892,Yes,,http://www.lingyimed.com/,,Early Stage Venture,,"56,274",
2024-07-29,CG Model Network is a 3D model marketplace that provides 3D content design solutions for all CG design industry users.,CG Model Network,https://www.crunchbase.com/organization/cg-model-network,"3D Technology, Graphic Design, Marketplace","Changsha, Jiangsu, China, Asia",Corporate Round - CG Model Network,https://www.crunchbase.com/funding_round/cg-model-network-corporate-round--4de8d3b8,1,Visual China Group,,Visual China Group,Corporate Round,1,,,,,,,,,,Yes,,https://www.cgmodel.com/,,,,"56,353",
2024-08-13,"Keyang Technology is a manufacturer of semiconductor CIM, photovoltaics, and LEDs, specialising in professional software and solutions.",Keyang Technology,https://www.crunchbase.com/organization/keyang-technology,"Electronics, Manufacturing, Professional Services, Semiconductor","Beijing, Beijing, China, Asia",Series A - Keyang Technology,https://www.crunchbase.com/funding_round/keyang-technology-series-a--2022cf3b,4,"Fuchuang Precision, Haining Aix Optical Valley, Qianhai Ruixing, Tongxin Licheng Touzi",Early Stage Venture,,Series A,2,10000000,CNY,1397839,,,,10000000,CNY,1397839,Yes,,http://www.cowintech.cn/web,,Early Stage Venture,,"56,411",
2024-11-16,Inly Media provides strategy consulting and media agency services.,Inly Media,https://www.crunchbase.com/organization/inly-media,"Advertising, Advertising Platforms, Consulting","Haidian, Beijing, China, Asia",Post-IPO Secondary - Inly Media,https://www.crunchbase.com/funding_round/inly-media-post-ipo-secondary--43bd762a,1,Xiefeng Private Equity Fund,,Xiefeng Private Equity Fund,Post-IPO Secondary,1,,,,,,,,,,No,,http://www.yinlimedia.com,,IPO,,"56,436",
2024-08-30,Hangzhou Jianyexia is a SaaS solutions company that offers one-stop smart restaurant software services for catering companies.,Hangzhou Jianyexia,https://www.crunchbase.com/organization/hangzhou-jianyexia,"Catering, Consumer Software, SaaS","Hangzhou, Zhejiang, China, Asia",Angel Round - Hangzhou Jianyexia,https://www.crunchbase.com/funding_round/hangzhou-jianyexia-angel--6dd63ac1,2,"BAce Network HK, Z&H Investment",Seed,,Angel,1,4220000,USD,4220000,,,,4220000,USD,4220000,Yes,,https://jiesuanxia.com,,Seed,,"56,681",
2024-09-11,Zhangba Wangan is a cyberspace shooting range product developer.,Zhangba Wangan,https://www.crunchbase.com/organization/zhangba-wangan,"Cyber Security, Network Security, Software","Beijing, Beijing, China, Asia",Series B - Zhangba Wangan,https://www.crunchbase.com/funding_round/zhangba-wangan-series-b--96c90336,2,"Baiyun Financial Holdings, Hope Funds",Early Stage Venture,,Series B,2,50000000,CNY,7021979,,,,50000000,CNY,7021979,Yes,,https://www.zbnsec.com/,,Early Stage Venture,2,"56,885",
2024-08-23,"Weijian Technology is a building intelligent robotics product company for the construction industry through robots, IoT, and AI algorithms.",Weijian Technology,https://www.crunchbase.com/organization/weijian-technology,"Artificial Intelligence (AI), Construction, Internet of Things, Robotics","Baoshan, Shanghai, China, Asia",Series A - Weijian Technology,https://www.crunchbase.com/funding_round/weijian-technology-series-a--cccb4106,4,"Linear Venture, RayVC, Unicorn Capital Partners, Xiamen C&D Corporation",Early Stage Venture,"Unicorn Capital Partners, Xiamen C&D Corporation",Series A,3,120000000,CNY,16846598,,,,220000000,CNY,32512722,Yes,,http://www.we-i-build.com/,,Early Stage Venture,1,"57,235",
2024-11-11,Dianxin Technology is a company that manufactures microLED and chiplet process measurement equipment.,Dianxin Technology,https://www.crunchbase.com/organization/dianxin-technology,"Artificial Intelligence (AI), Machine Learning, Manufacturing","Shanghai, Shanghai, China, Asia",Debt Financing - Dianxin Technology,https://www.crunchbase.com/funding_round/dianxin-technology-debt-financing--44a151b1,2,"Bank of Nanjing, China Merchants Bank",,,Debt Financing,2,,,,,,,100000000,CNY,13999524,No,,http://www.dexin.tech,,Early Stage Venture,,"57,363",
2024-09-12,Yantai Haizhichun Aquatic Seed Technology focuses on the whole shellfish breeding and seedling production chain.,Yantai Haizhichun Aquatic Seed Technology,https://www.crunchbase.com/organization/yantai-haizhichun-aquatic-seed-technology,"Agriculture, Animal Feed, Aquaculture, Seafood","Shandong, Fujian, China, Asia",Series A - Yantai Haizhichun Aquatic Seed Technology,https://www.crunchbase.com/funding_round/yantai-haizhichun-aquatic-seed-technology-series-a--a5a2004c,2,"Beijing Shining Investment Management, Huaxin Food",Early Stage Venture,,Series A,1,2810000,USD,2810000,,,,2810000,USD,2810000,Yes,,http://www.hzczy.com/,,Early Stage Venture,,"57,368",
2024-07-08,Baoyu Technology provides intelligent manufacturing equipment for electronic information materials,Baoyu Technology,https://www.crunchbase.com/organization/baoyu-technology,"Electric Vehicle, Industrial Manufacturing, Manufacturing","Xianyang, Shaanxi, China, Asia",Series A - Baoyu Technology,https://www.crunchbase.com/funding_round/baoyu-technology-series-a--efdf51d2,5,"Aerospace Hongyuan, Capitech, Heling Capital, Maipu Capital, Xi'an Jiaotong University 1896 Capital",Early Stage Venture,"Heling Capital, Maipu Capital",Series A,1,,,,,,,,,,Yes,,,,Early Stage Venture,,"57,379",
2024-10-21,"Yunyao Aerospace Technology is a comprehensive service platform that integrates ""Global Space Weather Data Production""+""Space Weather Data.",Yunyao Aerospace Technology,https://www.crunchbase.com/organization/yunyao-aerospace-technology,"Aerospace, Data Integration","Tianjin, Guangdong, China, Asia",Series B - Yunyao Aerospace Technology,https://www.crunchbase.com/funding_round/yunyao-aerospace-technology-series-b--c19ed943,2,"HONGRUNZIBEN, Wuxi Huishan Science and Technology Innovation Industry Group",Early Stage Venture,Wuxi Huishan Science and Technology Innovation Industry Group,Series B,5,,,,,,,29895521,USD,29895521,Yes,,https://tjyyspace.com,,Early Stage Venture,2,"57,815",
2024-07-29,"INMO Glass are Foldable, monocular Augmented Reality (AR) glasses.",INMO Glass,https://www.crunchbase.com/organization/inmo-glasses,Augmented Reality,"Shenzhen, Guangdong, China, Asia",Series B - INMO Glass,https://www.crunchbase.com/funding_round/inmo-glasses-series-b--218fc119,3,"Chenghua Science and Technology Venture Capital, Jiangxi Zhonghuan Investment Group, Sichuan Development Guidance Fund",Early Stage Venture,,Series B,4,100000000,CNY,13775433,,,,23775433,USD,23775433,Yes,,https://www.inmoglass.com,,Early Stage Venture,,"57,840",
2024-08-09,Forest Cabin is a skin care product manufacturer and retailer that focuses on developing offline stores.,Forest Cabin,https://www.crunchbase.com/organization/forest-cabin,"Manufacturing, Personal Health","Putuo, Shanghai, China, Asia",Secondary Market - Forest Cabin,https://www.crunchbase.com/funding_round/forest-cabin-secondary-market--3244a676,1,Youngor Group,,Youngor Group,Secondary Market,1,1129000,CNY,157534,24010167,CNY,3350240,1129000,CNY,157534,No,,https://www.forest-cabin.com/,,,,"57,943",
2024-07-22,Hengtong Submarine Power Cable provides fiber optic communication and energy network system solutions.,Hengtong Submarine Power Cable,https://www.crunchbase.com/organization/hengtong-submarine-power-cable,,"Wujiang, Jiangsu, China, Asia",Private Equity Round - Hengtong Submarine Power Cable,https://www.crunchbase.com/funding_round/hengtong-submarine-power-cable-private-equity--bd57ebd5,4,"BAOSTEEL, Cinda Capital Management Co., Ltd, Suzhou International Development Venture Capital, Zhuhai Hengqin Fengao Investment",Private Equity,BAOSTEEL,Private Equity,2,560000000,CNY,76989703,17500000000,CNY,2405928207,1590000000,CNY,219635153,Yes,,http://www.hengtongmarine.com,,Private Equity,,"58,053",
2024-06-17,"Nephotonics is a provider of 3D TOF chips and visual solutions, with an emphasis on the development and research of technologies.",Nephotonics,https://www.crunchbase.com/organization/nephotonics,"Manufacturing, Sensor","Hefei, Anhui, China, Asia",Venture Round - Nephotonics,https://www.crunchbase.com/funding_round/nephotonics-series-unknown--6891e547,2,"Gaoxin Capital, Inspiration Capital",,Gaoxin Capital,Venture - Series Unknown,1,,,,,,,,,,Yes,,http://www.tof3d.com,,,,"58,552",
2024-07-25,Tipro is a manufacturer and supplier of titanium mill products.,Tipro,https://www.crunchbase.com/organization/tipro-group,"Industrial, Manufacturing, Wholesale","Xian, Hunan, China, Asia",Series B - Tipro,https://www.crunchbase.com/funding_round/tipro-group-series-b--68638c74,1,Capitech,Early Stage Venture,Capitech,Series B,1,,,,,,,,,,Yes,,https://www.tiproti.com,$1M to $10M,Early Stage Venture,,"58,768",
2024-08-09,WOOK is an international mobile B2B platform connecting high quality Chinese manufacture with Indonesia merchandisers.,WOOK,https://www.crunchbase.com/organization/wook,B2B,"Guangdong, Jilin, China, Asia",Series E - WOOK,https://www.crunchbase.com/funding_round/wook-series-e--04efdd00,1,Hongnuo Venture Capital,Late Stage Venture,Hongnuo Venture Capital,Series E,4,,,,,,,108900,CNY,15004,Yes,,http://www.wook.id/,,Late Stage Venture,,"58,953",
2024-11-25,Gejian Semiconductor is a company that designs industrial-grade high-performance real-time controller (DSP) chips.,Gejian Semiconductor,https://www.crunchbase.com/organization/gejian-semiconductor,Manufacturing,"Shanghai, Shanghai, China, Asia",Seed Round - Gejian Semiconductor,https://www.crunchbase.com/funding_round/gejian-semiconductor-seed--6fca63e8,3,"Chaos Investment, Weihe Investment, Zhuzhou CRRC Times Electric",Seed,"Chaos Investment, Weihe Investment",Seed,2,,,,,,,150000000,CNY,20701791,Yes,,http://www.gejian-semi.com,,Early Stage Venture,,"59,233",
2024-08-19,Yinwang Smart Technology operates as an intelligent auto parts firm.,Yinwang Smart Technology,https://www.crunchbase.com/organization/yinwang-smart-technology,Automotive,"Shenzhen, Guangdong, China, Asia",Corporate Round - Yinwang Smart Technology,https://www.crunchbase.com/funding_round/yinwang-smart-technology-corporate-round--3d297ec4,1,Avatr,,Avatr,Corporate Round,2,11500000000,CNY,1611456757,103500000000,CNY,14503110812,23000000000,CNY,3226806796,Yes,,,$1B to $10B,,,"59,693",
2024-06-05,Gazer is a semiconductor equipment and sensor developer.,Gazer,https://www.crunchbase.com/organization/gazer-c6e2,"Advanced Materials, Semiconductor, Sensor, Service Industry","Putuo, Shanghai, China, Asia",Series A - Gazer,https://www.crunchbase.com/funding_round/gazer-c6e2-series-a--ec638ccd,1,Zhuoyuan Capital,Early Stage Venture,Zhuoyuan Capital,Series A,3,,,,,,,,,,Yes,,https://www.gazer.cn,Less than $1M,Early Stage Venture,1,"59,722",
